Title,Media URL,Pinterest board,Thumbnail,Description,Link,Publish date,Keywords,Source URL
Kohler Command Pro: Smoke Secrets,https://res.cloudinary.com/ddxyyzkuq/image/upload/v1745871789/pin_3_4_cdqbbx.webp,small-engine-ideas,,Uncover the hidden reasons behind the smoke coming from your Kohler Command Pro engine. This article reveals the most frequent culprits,https://lawntrend.com/kohler-command-pro-25-blowing-smoke-at-start-up/?utm_source=pinterest&utm_campaign=kohler-command-pro-s,2025-04-28,like excessive oil consumption and cylinder wear.  We provide clear explanations and actionable advice to help you tackle the issue head-on.  Don't be intimidated by engine repair – we've got you covered!  Read the full guide now. #KohlerProblems #EngineRepair #LawnEquipment #Troubleshooting,https://lawntrend.com/kohler-command-pro-25-blowing-smoke-at-start-up/
Kohler Engine: Blue Smoke Explained,https://res.cloudinary.com/ddxyyzkuq/image/upload/v1745871795/pin_3_5_esxbfk.webp,engine-repair-ideas,,"Blue smoke from your Kohler Command Pro engine? That's a sign of burning oil! This post explains why this happens, what parts are likely failing (like piston rings)",https://lawntrend.com/kohler-command-pro-25-blowing-smoke-at-start-up/?utm_source=pinterest&utm_campaign=kohler-engine-blue-s,2025-04-28,and how to address the issue.  Don't ignore blue smoke – it can lead to engine failure.  Learn how to protect your engine and keep it running strong. Read now! #BlueSmoke #KohlerEngineRepair #OilBurning #EngineMaintenance,https://lawntrend.com/kohler-command-pro-25-blowing-smoke-at-start-up/
Kohler Command Pro: White Smoke?,https://res.cloudinary.com/ddxyyzkuq/image/upload/v1745871800/pin_3_6_befbmy.webp,small-engine-ideas,,White smoke from your Kohler Command Pro engine could indicate coolant entering the combustion chamber. This is a serious issue! This guide details the potential causes,https://lawntrend.com/kohler-command-pro-25-blowing-smoke-at-start-up/?utm_source=pinterest&utm_campaign=kohler-command-pro-w,2025-04-28,from a cracked head gasket to a damaged cylinder head.  We'll help you diagnose the problem and determine the best course of action.  Don't delay – read now! #WhiteSmoke #KohlerHeadGasket #EngineCoolant #LawnMowerProblems,https://lawntrend.com/kohler-command-pro-25-blowing-smoke-at-start-up/
Kohler Command Pro: Valve Seals,https://res.cloudinary.com/ddxyyzkuq/image/upload/v1745871806/pin_3_7_ir318o.webp,small-engine-ideas,,"Worn valve seals are a common cause of smoke in Kohler Command Pro engines. This article explains how valve seals work, how to identify if they're failing",https://lawntrend.com/kohler-command-pro-25-blowing-smoke-at-start-up/?utm_source=pinterest&utm_campaign=kohler-command-pro-v,2025-04-28,and how to replace them.  It's a relatively straightforward repair that can save you a lot of money.  Get your engine running smoothly again! Read the guide. #ValveSeals #KohlerRepair #EngineParts #DIYMechanic,https://lawntrend.com/kohler-command-pro-25-blowing-smoke-at-start-up/
Kohler Command Pro: Cylinder Wear,https://res.cloudinary.com/ddxyyzkuq/image/upload/v1745871811/pin_3_8_sxroka.webp,small-engine-ideas,,Cylinder wear is a serious issue that can cause significant smoke in your Kohler Command Pro engine. This article explains how to identify cylinder wear and the options for repair,https://lawntrend.com/kohler-command-pro-25-blowing-smoke-at-start-up/?utm_source=pinterest&utm_campaign=kohler-command-pro-c,2025-04-28,including honing or replacing the cylinder.  We'll help you assess the damage and make the right decision. #CylinderWear #KohlerEngineRepair #EngineDamage #LawnEquipment,https://lawntrend.com/kohler-command-pro-25-blowing-smoke-at-start-up/
Kohler Smoke: Exhaust System Check,https://res.cloudinary.com/ddxyyzkuq/image/upload/v1745871818/pin_3_9_tfpw5n.webp,engine-repair-ideas,,"Sometimes, the smoke you see isn't coming *from* the engine",https://lawntrend.com/kohler-command-pro-25-blowing-smoke-at-start-up/?utm_source=pinterest&utm_campaign=kohler-smoke-exhaust,2025-04-28,but is being accentuated by the exhaust system. This post explores how exhaust leaks or restrictions can affect smoke visibility.  We'll help you inspect your exhaust system and identify potential problems. #ExhaustSystem #KohlerEngine #EngineSmoke #LawnMower,https://lawntrend.com/kohler-command-pro-25-blowing-smoke-at-start-up/
Kohler Command Pro: Oil Type Guide,https://res.cloudinary.com/ddxyyzkuq/image/upload/v1745871824/pin_3_10_aag10l.webp,small-engine-ideas,,Using the wrong oil in your Kohler Command Pro engine can lead to smoking and other problems. This post provides a comprehensive guide to choosing the right oil for your engine,https://lawntrend.com/kohler-command-pro-25-blowing-smoke-at-start-up/?utm_source=pinterest&utm_campaign=kohler-command-pro-o,2025-04-28,including viscosity and API ratings.  Protect your engine with the right lubrication! #KohlerOil #EngineLubrication #OilType #LawnCare,https://lawntrend.com/kohler-command-pro-25-blowing-smoke-at-start-up/
Kohler Engine: Preventative Maintenance,https://res.cloudinary.com/ddxyyzkuq/image/upload/v1745871830/pin_3_11_de7dfu.webp,engine-repair-ideas,,"Don't wait for smoke to appear! This post outlines a preventative maintenance schedule for your Kohler Command Pro engine, including oil changes, air filter replacements",https://lawntrend.com/kohler-command-pro-25-blowing-smoke-at-start-up/?utm_source=pinterest&utm_campaign=kohler-engine-preven,2025-04-28,and spark plug checks.  Keep your engine running smoothly for years to come. #PreventativeMaintenance #KohlerEngine #LawnMowerCare #EngineHealth,https://lawntrend.com/kohler-command-pro-25-blowing-smoke-at-start-up/
Kohler Smoke: When to Call a Pro,https://res.cloudinary.com/ddxyyzkuq/image/upload/v1745871836/pin_3_12_imoxyu.webp,lawn-repair-ideas,,Sometimes,https://lawntrend.com/kohler-command-pro-25-blowing-smoke-at-start-up/?utm_source=pinterest&utm_campaign=kohler-smoke-when-to,2025-04-28,the smoking issue is beyond DIY repair. This post helps you determine when it's time to call a professional mechanic.  We'll discuss complex repairs and the risks of attempting them yourself.  Protect your investment and get expert help. #KohlerRepair #EngineMechanic #DIYvsPro #LawnMower,https://lawntrend.com/kohler-command-pro-25-blowing-smoke-at-start-up/
Kohler Command Pro: Winter Storage,https://res.cloudinary.com/ddxyyzkuq/image/upload/v1745871841/pin_3_13_jwahfp.webp,small-engine-ideas,,Proper winter storage can prevent issues like smoking when you start your Kohler Command Pro engine in the spring. This post outlines the steps to take to prepare your engine for winter,https://lawntrend.com/kohler-command-pro-25-blowing-smoke-at-start-up/?utm_source=pinterest&utm_campaign=kohler-command-pro-w,2025-04-28,including fuel stabilization and oil changes. #WinterStorage #KohlerEngine #LawnMowerPrep #EngineCare,https://lawntrend.com/kohler-command-pro-25-blowing-smoke-at-start-up/
Title,https://res.cloudinary.com/ddxyyzkuq/image/upload/v1745871885/pin_4_1_msdoxe.webp,please-provide-the-title-and-keywords-i-need-that-information-to-suggest-a-board-name-once,,Description,https://lawntrend.com/cub-cadet-efi-engine-problems/?utm_source=pinterest&utm_campaign=title,2025-04-28,Keywords,https://lawntrend.com/cub-cadet-efi-engine-problems/
Cub Cadet EFI Troubleshooting Guide,https://res.cloudinary.com/ddxyyzkuq/image/upload/v1745871891/pin_4_2_tsxzpv.webp,lawn-repair-ideas,,"Is your Cub Cadet EFI engine sputtering, stalling, or refusing to start?  You're not alone! This comprehensive guide breaks down the most frequent EFI problems, offering clear explanations and step-by-step solutions.  We'll help you understand error codes, check fuel systems",https://lawntrend.com/cub-cadet-efi-engine-problems/?utm_source=pinterest&utm_campaign=cub-cadet-efi-troubl,2025-04-28,and identify faulty sensors.  Don't waste time and money on unnecessary repairs – empower yourself with knowledge! Click to read now and reclaim your lawn care freedom! #CubCadetEFI #EngineTroubleshooting #LawnCare #DIY,https://lawntrend.com/cub-cadet-efi-engine-problems/
Fix Cub Cadet EFI: Fuel System Issues,https://res.cloudinary.com/ddxyyzkuq/image/upload/v1745871897/pin_4_3_ybvnlm.webp,lawn-repair-ideas,,"Fuel problems are a common culprit behind Cub Cadet EFI engine failures. This pin focuses on diagnosing and resolving fuel pump, filter, and injector issues.  We'll show you how to check fuel pressure, clean injectors",https://lawntrend.com/cub-cadet-efi-engine-problems/?utm_source=pinterest&utm_campaign=fix-cub-cadet-efi-fu,2025-04-28,and identify potential blockages.  A healthy fuel system means a happy engine!  Don't let a simple fuel issue sideline your mower. Click to learn how to get your Cub Cadet purring again! #FuelSystem #CubCadetRepair #EFIProblems #LawnMower,https://lawntrend.com/cub-cadet-efi-engine-problems/
Cub Cadet EFI: Sensor Problems & Solutions,https://res.cloudinary.com/ddxyyzkuq/image/upload/v1745871903/pin_4_4_ujvb5y.webp,mower-repair-ideas,,"Faulty sensors can wreak havoc on your Cub Cadet EFI engine.  This pin highlights common sensor failures (crankshaft, camshaft",https://lawntrend.com/cub-cadet-efi-engine-problems/?utm_source=pinterest&utm_campaign=cub-cadet-efi-sensor,2025-04-28,temperature) and how to diagnose them.  Learn to use a multimeter to test sensors and understand what the readings mean.  Accurate diagnostics are key to a successful repair!  Don't guess – know! Click to read the full guide and get your mower running right. #Sensors #CubCadet #EngineDiagnostics #EFI,https://lawntrend.com/cub-cadet-efi-engine-problems/
Cub Cadet EFI: Starting Problems? Fix It!,https://res.cloudinary.com/ddxyyzkuq/image/upload/v1745871908/pin_4_5_qspraf.webp,mower-repair-ideas,,Is your Cub Cadet EFI engine refusing to start?  Don't panic! This pin focuses on troubleshooting starting issues,https://lawntrend.com/cub-cadet-efi-engine-problems/?utm_source=pinterest&utm_campaign=cub-cadet-efi-starti,2025-04-28,covering everything from battery problems to starter motor failures.  We'll guide you through a systematic diagnostic process to identify the root cause.  Get your mower started quickly and easily! Click to read the full article. #StartingProblems #CubCadet #EngineRepair #EFI,https://lawntrend.com/cub-cadet-efi-engine-problems/
Cub Cadet EFI Maintenance: Prevent Problems,https://res.cloudinary.com/ddxyyzkuq/image/upload/v1745871915/pin_4_6_goirhi.webp,lawn-care-ideas,,"Preventative maintenance is the best medicine for your Cub Cadet EFI engine! This pin highlights essential maintenance tasks – oil changes, filter replacements",https://lawntrend.com/cub-cadet-efi-engine-problems/?utm_source=pinterest&utm_campaign=cub-cadet-efi-mainte,2025-04-28,spark plug checks – to keep your mower running smoothly for years to come.  Don't wait for a breakdown – be proactive! Click to learn how to extend the life of your Cub Cadet. #Maintenance #CubCadetEFI #LawnMowerCare #PreventativeMaintenance,https://lawntrend.com/cub-cadet-efi-engine-problems/
Cub Cadet EFI: Overheating? Here's What To Do,https://res.cloudinary.com/ddxyyzkuq/image/upload/v1745871921/pin_4_7_ukm7f0.webp,mower-repair-ideas,,Is your Cub Cadet EFI engine overheating? This pin provides a step-by-step guide to diagnosing and resolving overheating issues,https://lawntrend.com/cub-cadet-efi-engine-problems/?utm_source=pinterest&utm_campaign=cub-cadet-efi-overhe,2025-04-28,covering everything from coolant levels to radiator problems.  Don't let your engine burn out! Click to read the full article and prevent costly repairs. #Overheating #CubCadet #EngineCooling #EFI,https://lawntrend.com/cub-cadet-efi-engine-problems/
Cub Cadet EFI: Fuel Injector Cleaning Guide,https://res.cloudinary.com/ddxyyzkuq/image/upload/v1745871927/pin_4_8_jaxnir.webp,mower-repair-ideas,,Dirty fuel injectors can significantly reduce your Cub Cadet EFI engine's performance. This pin provides a detailed guide to cleaning fuel injectors,https://lawntrend.com/cub-cadet-efi-engine-problems/?utm_source=pinterest&utm_campaign=cub-cadet-efi-fuel-i,2025-04-28,improving fuel efficiency and restoring power.  A clean engine is a happy engine! Click to learn how. #FuelInjectors #CubCadet #EngineCleaning #EFI,https://lawntrend.com/cub-cadet-efi-engine-problems/
Cub Cadet EFI: Battery & Electrical Issues,https://res.cloudinary.com/ddxyyzkuq/image/upload/v1745871932/pin_4_9_jco2l7.webp,mower-repair-ideas,,Don't let a dead battery ruin your mowing day! This pin covers common battery and electrical problems with Cub Cadet EFI engines,https://lawntrend.com/cub-cadet-efi-engine-problems/?utm_source=pinterest&utm_campaign=cub-cadet-efi-batter,2025-04-28,including troubleshooting the charging system.  Get your mower powered up and ready to go! Click to read the full guide. #Battery #ElectricalProblems #CubCadet #EFI,https://lawntrend.com/cub-cadet-efi-engine-problems/
Cub Cadet EFI: Diagnosing a No-Start Condition,https://res.cloudinary.com/ddxyyzkuq/image/upload/v1745871937/pin_4_10_h1pqpw.webp,mower-repair-ideas,,Struggling to get your Cub Cadet EFI engine started? This pin provides a systematic approach to diagnosing a no-start condition,https://lawntrend.com/cub-cadet-efi-engine-problems/?utm_source=pinterest&utm_campaign=cub-cadet-efi-diagno,2025-04-28,covering common causes and troubleshooting steps.  Don't give up – we can help! Click to read the full article. #NoStart #CubCadetEFI #EngineTroubleshooting #LawnMower,https://lawntrend.com/cub-cadet-efi-engine-problems/
Cub Cadet EFI: Saving Money on Repairs,https://res.cloudinary.com/ddxyyzkuq/image/upload/v1745871943/pin_4_11_fgd8s7.webp,mower-repair-ideas,,Don't break the bank fixing your Cub Cadet EFI engine! This pin offers tips and tricks for saving money on repairs,https://lawntrend.com/cub-cadet-efi-engine-problems/?utm_source=pinterest&utm_campaign=cub-cadet-efi-saving,2025-04-28,including DIY solutions and finding affordable parts.  Get back to mowing without emptying your wallet! Click to read the full article. #SaveMoney #CubCadetRepair #DIY #EFI,https://lawntrend.com/cub-cadet-efi-engine-problems/
Cub Cadet EFI: When to Call a Pro,https://res.cloudinary.com/ddxyyzkuq/image/upload/v1745871948/pin_4_12_wovxfl.webp,mower-repair-ideas,,Sometimes,https://lawntrend.com/cub-cadet-efi-engine-problems/?utm_source=pinterest&utm_campaign=cub-cadet-efi-when-t,2025-04-28,a repair is best left to the professionals. This pin helps you determine when it's time to call a qualified mechanic for your Cub Cadet EFI engine.  Don't risk further damage – know your limits! Click to learn more. #ProfessionalRepair #CubCadet #EngineProblems #EFI,https://lawntrend.com/cub-cadet-efi-engine-problems/
Title,https://res.cloudinary.com/ddxyyzkuq/image/upload/v1745871996/pin_5_1_buuajm.webp,please-provide-the-title-and-keywords-i-need-that-information-to-suggest-a-board-name-once,,Description,https://lawntrend.com/briggs-and-stratton-lawn-mower-running-rough/?utm_source=pinterest&utm_campaign=title,2025-04-28,Keywords,https://lawntrend.com/briggs-and-stratton-lawn-mower-running-rough/
Rough Running Briggs & Stratton? Fix It!,https://res.cloudinary.com/ddxyyzkuq/image/upload/v1745872002/pin_5_2_qlrshc.webp,lawn-repair-ideas,,"Is your Briggs & Stratton lawn mower sputtering, smoking, or just not running smoothly? Don't resign yourself to a frustrating summer! This guide walks you through diagnosing and fixing common issues",https://lawntrend.com/briggs-and-stratton-lawn-mower-running-rough/?utm_source=pinterest&utm_campaign=rough-running-briggs,2025-04-28,from dirty carburetors to spark plug problems.  We'll help you get back to enjoying a perfectly manicured lawn without expensive repairs.  Learn simple troubleshooting steps and save money! Click to learn how to breathe new life into your mower.  Don't let a rough-running mower ruin your weekend! #lawnmowerrepair #briggsandstratton #lawncare #diyrepair,https://lawntrend.com/briggs-and-stratton-lawn-mower-running-rough/
Fix a Smoking Lawn Mower (Briggs!),https://res.cloudinary.com/ddxyyzkuq/image/upload/v1745872008/pin_5_3_kdog6a.webp,lawn-repair-ideas,,Is your Briggs & Stratton mower billowing smoke?  Don't panic! This guide helps you identify the cause – often a simple fix like an oil leak or a clogged air filter.  We break down the troubleshooting process step-by-step,https://lawntrend.com/briggs-and-stratton-lawn-mower-running-rough/?utm_source=pinterest&utm_campaign=fix-a-smoking-lawn-m,2025-04-28,so even beginners can tackle the repair.  Avoid costly mechanic visits and get back to enjoying your yard. Click to learn how to stop the smoke and get mowing! #smokylawnmower #briggsandstrattonrepair #lawnmowerproblems #diyfix,https://lawntrend.com/briggs-and-stratton-lawn-mower-running-rough/
Briggs & Stratton Carburetor Cleaning,https://res.cloudinary.com/ddxyyzkuq/image/upload/v1745872014/pin_5_4_lqluus.webp,lawn-repair-ideas,,A dirty carburetor is a common cause of rough running in Briggs & Stratton mowers.  This pin links to a detailed guide on how to safely and effectively clean your carburetor,https://lawntrend.com/briggs-and-stratton-lawn-mower-running-rough/?utm_source=pinterest&utm_campaign=briggs-stratton-carb,2025-04-28,restoring your mower's performance.  We provide clear instructions and helpful visuals.  Don't let a clogged carb ruin your summer! Click to learn how to clean it yourself and save money.  A clean carb = a happy mower! #carburetorcleaning #briggsandstratton #lawnmowertroubleshooting #diy,https://lawntrend.com/briggs-and-stratton-lawn-mower-running-rough/
Spark Plug Secrets for a Smooth Run,https://res.cloudinary.com/ddxyyzkuq/image/upload/v1745872021/pin_5_5_gmrpz3.webp,engine-repair-ideas,,"Is your Briggs & Stratton mower struggling to start or running unevenly? A faulty spark plug could be the culprit! This guide shows you how to inspect, test, and replace your spark plug",https://lawntrend.com/briggs-and-stratton-lawn-mower-running-rough/?utm_source=pinterest&utm_campaign=spark-plug-secrets-f,2025-04-28,ensuring optimal engine performance.  Don't ignore this small but crucial component! Click to learn how to keep your engine firing on all cylinders. #sparkplug #briggsandstrattonengine #lawnmowerrepair #diy,https://lawntrend.com/briggs-and-stratton-lawn-mower-running-rough/
Briggs & Stratton: Fuel System Fixes,https://res.cloudinary.com/ddxyyzkuq/image/upload/v1745872028/pin_5_6_cbzyii.webp,lawn-repair-ideas,,"Fuel problems are a frequent cause of rough running in Briggs & Stratton mowers. This pin directs you to a guide covering fuel line checks, fuel filter replacement",https://lawntrend.com/briggs-and-stratton-lawn-mower-running-rough/?utm_source=pinterest&utm_campaign=briggs-stratton-fuel,2025-04-28,and fuel stabilizer usage.  Ensure a clean and consistent fuel supply for a smooth-running engine.  Don't let old fuel ruin your mower! Click to learn how to keep your fuel system in top shape. #fuelsystem #briggsandstratton #lawnmowerfuel #diyrepair,https://lawntrend.com/briggs-and-stratton-lawn-mower-running-rough/
Lawn Mower Won't Start? Check This!,https://res.cloudinary.com/ddxyyzkuq/image/upload/v1745872034/pin_5_7_kuhbte.webp,lawn-care-ideas,,Frustrated by a Briggs & Stratton mower that won't start? This pin leads to a troubleshooting guide covering common starting issues,https://lawntrend.com/briggs-and-stratton-lawn-mower-running-rough/?utm_source=pinterest&utm_campaign=lawn-mower-wont-star,2025-04-28,from low oil to a clogged carburetor.  We'll help you pinpoint the problem and get your mower running again quickly.  Don't waste another sunny day! Click to learn the essential starting checks. #lawnmowerwontstart #briggsandstratton #lawncare #troubleshooting,https://lawntrend.com/briggs-and-stratton-lawn-mower-running-rough/
Briggs & Stratton Air Filter Guide,https://res.cloudinary.com/ddxyyzkuq/image/upload/v1745872040/pin_5_8_frvegb.webp,lawn-repair-ideas,,"A clogged air filter restricts airflow and causes rough running. This pin directs you to a guide on how to inspect, clean",https://lawntrend.com/briggs-and-stratton-lawn-mower-running-rough/?utm_source=pinterest&utm_campaign=briggs-stratton-air-,2025-04-28,and replace your Briggs & Stratton mower's air filter.  Ensure optimal engine performance and fuel efficiency.  Breathe easy knowing your mower is getting clean air! Click to learn more. #airfilter #briggsandstratton #lawnmowerrepair #lawncare,https://lawntrend.com/briggs-and-stratton-lawn-mower-running-rough/
Briggs & Stratton Mower: Preventative Care,https://res.cloudinary.com/ddxyyzkuq/image/upload/v1745872045/pin_5_9_d0msqa.webp,lawn-repair-ideas,,Don't wait for problems to arise! This pin links to a guide on preventative maintenance for your Briggs & Stratton mower,https://lawntrend.com/briggs-and-stratton-lawn-mower-running-rough/?utm_source=pinterest&utm_campaign=briggs-stratton-mowe,2025-04-28,helping you avoid costly repairs down the road.  Keep your mower running smoothly for years to come.  A little effort now saves a lot of headaches later! Click to learn the secrets to long-lasting performance. #lawnmowermaintenance #briggsandstrattonengine #preventativecare #lawncare,https://lawntrend.com/briggs-and-stratton-lawn-mower-running-rough/
Fix a Briggs & Stratton Mower That Sputters,https://res.cloudinary.com/ddxyyzkuq/image/upload/v1745872052/pin_5_10_gxycn6.webp,lawn-repair-ideas,,Is your Briggs & Stratton mower sputtering and losing power? This pin leads to a guide that helps you identify the cause and implement a fix.  We cover common issues like fuel problems and carburetor issues.  Get back to a smooth,https://lawntrend.com/briggs-and-stratton-lawn-mower-running-rough/?utm_source=pinterest&utm_campaign=fix-a-briggs-stratto,2025-04-28,consistent cut! Click to learn how to eliminate the sputtering. #sputteringlawnmower #briggsandstrattonrepair #lawnmowerproblems #diy,https://lawntrend.com/briggs-and-stratton-lawn-mower-running-rough/
Title,https://res.cloudinary.com/ddxyyzkuq/image/upload/v1745872098/pin_6_1_aox6vf.webp,please-provide-the-title-and-keywords-i-need-that-information-to-suggest-a-board-name-once,,Description,https://lawntrend.com/cub-cadet-tank-problems/?utm_source=pinterest&utm_campaign=title,2025-04-28,Keywords,https://lawntrend.com/cub-cadet-tank-problems/
Cub Cadet Tank: Common Issues & Fixes,https://res.cloudinary.com/ddxyyzkuq/image/upload/v1745872105/pin_6_2_bcg5lu.webp,lawn-mower-ideas,,"Is your Cub Cadet Tank mower giving you trouble? Don't let a broken mower ruin your weekend! This guide dives into the most frequent problems owners face – from fuel issues and blade engagement to transmission woes and electrical glitches. We provide clear, step-by-step troubleshooting tips to get you back to mowing quickly and affordably. Learn how to diagnose the problem yourself and save on costly repairs.  Don't stress, we've got you covered! Click to learn more and reclaim your lawn! #CubCadet #TankMower #LawnMowerRepair #DIYRepair,Cub Cadet,Tank Mower,Repair",https://lawntrend.com/cub-cadet-tank-problems/?utm_source=pinterest&utm_campaign=cub-cadet-tank-commo,2025-04-28,Troubleshooting,https://lawntrend.com/cub-cadet-tank-problems/
Cub Cadet Tank Won't Start? Here's Why!,https://res.cloudinary.com/ddxyyzkuq/image/upload/v1745872112/pin_6_3_ky5ibp.webp,lawn-mower-ideas,,"Frustrated with a Cub Cadet Tank that refuses to start? It's a common issue! This pin leads to a detailed blog post exploring the most likely culprits – from a clogged carburetor and faulty spark plug to low oil and a dead battery. We break down the diagnostic process so even beginners can tackle it.  Imagine the satisfaction of fixing it yourself!  Get back to enjoying your yard, not fighting with your mower. Click to read now! #CubCadetTank #NoStart #LawnMowerProblems #FixItYourself,Starting Issues,Cub Cadet,Tank",https://lawntrend.com/cub-cadet-tank-problems/?utm_source=pinterest&utm_campaign=cub-cadet-tank-wont-,2025-04-28,Troubleshooting,https://lawntrend.com/cub-cadet-tank-problems/
Cub Cadet Tank Transmission Problems?,https://res.cloudinary.com/ddxyyzkuq/image/upload/v1745872117/pin_6_4_c6lhft.webp,lawn-mower-ideas,,"Is your Cub Cadet Tank struggling with shifting or losing power? Transmission issues can be a headache. Our guide covers common transmission problems, from broken belts to hydrostatic pump failures. We'll help you identify the issue and explore repair options, including when it's time to call a professional. Don't let a faulty transmission slow you down! Click to learn more and keep your mower running smoothly. #CubCadet #TransmissionRepair #Hydrostatic #LawnCare,Transmission,Hydrostatic,Repair",https://lawntrend.com/cub-cadet-tank-problems/?utm_source=pinterest&utm_campaign=cub-cadet-tank-trans,2025-04-28,Cub Cadet,https://lawntrend.com/cub-cadet-tank-problems/
Fixing a Cub Cadet Tank Fuel Issue,https://res.cloudinary.com/ddxyyzkuq/image/upload/v1745872124/pin_6_5_t41dm7.webp,lawn-mower-ideas,,"Fuel problems plaguing your Cub Cadet Tank?  A clogged fuel filter, stale gas, or a faulty fuel pump can all be to blame. This pin links to a comprehensive guide detailing how to diagnose and fix common fuel system issues.  Don't waste money on gas that won't burn!  Get your mower running efficiently again. Click to read and breathe easy knowing your lawn is in good hands. #CubCadetTank #FuelSystem #LawnMowerFuel #DIY,Fuel System,Fuel Filter,Carburetor",https://lawntrend.com/cub-cadet-tank-problems/?utm_source=pinterest&utm_campaign=fixing-a-cub-cadet-t,2025-04-28,Cub Cadet,https://lawntrend.com/cub-cadet-tank-problems/
