Title,Media URL,Pinterest board,Thumbnail,Description,Link,Publish date,Keywords,Source URL
Troubleshooting: My Duster Still Isn't Clean!,https://res.cloudinary.com/ddxyyzkuq/image/upload/v1746045402/pin_5_21_djloue.webp,cleaning-ideas,,"â€œStill struggling to get your duster clean? ðŸ˜© This post tackles common cleaning challenges & provides solutions for stubborn dirt & grime.  We'll help you diagnose the problem & get your duster back in shape. Click for expert advice! ðŸ’¡ #troubleshooting #carduster #autocare #detailing #carcleaningtips"",troubleshooting,car duster,auto care",https://www.beacleaner.com/how-to-clean-a-car-duster?utm_source=pinterest&utm_campaign=troubleshooting-my-d,2025-04-30,detailing,https://www.beacleaner.com/how-to-clean-a-car-duster
The Ultimate Car Cleaning Checklist (Includes Duster!),https://res.cloudinary.com/ddxyyzkuq/image/upload/v1746045408/pin_5_22_tgczpn.webp,car-cleaning-ideas,,"â€œDon't just clean your duster â€“ clean your *whole* car! ðŸš— This post provides a comprehensive car cleaning checklist, with a special section dedicated to duster care.  Click for a sparkling clean car from top to bottom! âœ¨ #carcleaningchecklist #autocare #detailing #carduster #carcleaning"",car cleaning checklist,auto care,detailing",https://www.beacleaner.com/how-to-clean-a-car-duster?utm_source=pinterest&utm_campaign=the-ultimate-car-cle,2025-04-30,car duster,https://www.beacleaner.com/how-to-clean-a-car-duster
Is Your Duster Leaving Scratches? Here's Why,https://res.cloudinary.com/ddxyyzkuq/image/upload/v1746045415/pin_5_23_z2jgis.webp,cleaning-ideas,,"â€œWorried about scratches? ðŸ˜± This post explains why a dirty duster can scratch your car's paint & how to prevent it.  Learn to identify the signs of a dirty duster & take action. Click to protect your car's finish! ðŸ›¡ï¸ #carscratches #carduster #autocare #detailing #carpaint"",car scratches,car duster,auto care",https://www.beacleaner.com/how-to-clean-a-car-duster?utm_source=pinterest&utm_campaign=is-your-duster-leavi,2025-04-30,detailing,https://www.beacleaner.com/how-to-clean-a-car-duster
Car Duster Cleaning: Before & After Photos!,https://res.cloudinary.com/dbcpfy04c/image/upload/v1618237451/placeholder.jpg,home-inspiration,,"â€œSee the amazing difference a clean car duster can make! ðŸ¤© This post features stunning before & after photos showcasing the power of a thorough cleaning.  Get inspired to clean your duster & enjoy a spotless car. Click to see the results! âœ¨ #beforeandafter #carduster #autocare #detailing #carcleaning"",before and after,car duster,auto care",https://www.beacleaner.com/how-to-clean-a-car-duster?utm_source=pinterest&utm_campaign=car-duster-cleaning-,2025-04-30,detailing,https://www.beacleaner.com/how-to-clean-a-car-duster
The Best Car Duster Cleaning Tools,https://res.cloudinary.com/dbcpfy04c/image/upload/v1618237451/placeholder.jpg,home-inspiration,,"â€œWhat tools do you need to clean your car duster effectively? ðŸ§° This post reviews the best brushes, soaps, & drying racks for duster maintenance.  Click to equip yourself for a professional-level clean! âœ¨ #cleaningtools #carduster #autocare #detailing #carcleaningtips"",cleaning tools,car duster,auto care",https://www.beacleaner.com/how-to-clean-a-car-duster?utm_source=pinterest&utm_campaign=the-best-car-duster-,2025-04-30,detailing,https://www.beacleaner.com/how-to-clean-a-car-duster
Title,https://res.cloudinary.com/ddxyyzkuq/image/upload/v1746045466/pin_6_1_iytrwy.webp,please-provide-the-title-and-keywords-i-need-that-information-to-suggest-a-board-name-once,,Description,https://www.beacleaner.com/how-to-clean-a-carpet-with-a-wet-dry-vac?utm_source=pinterest&utm_campaign=title,2025-04-30,Keywords,https://www.beacleaner.com/how-to-clean-a-carpet-with-a-wet-dry-vac
Bye Bye Carpet Stains!,https://res.cloudinary.com/ddxyyzkuq/image/upload/v1746045473/pin_6_2_rjm21j.webp,cleaning-ideas,,"Tired of looking at dingy carpets? This guide shows you exactly how to deep clean your carpets with a wet/dry vac for a fresh, revitalized home! Learn the simple steps, best solutions, and pro tips to remove dirt, grime, and even stubborn stains. Don't replace your carpet - restore it! Click to learn how to save money and enjoy a cleaner, healthier living space.  A clean carpet = a happy home! #carpetcleaning #wetdryvac #cleaningtips #homemaintenance,carpet cleaning,wet dry vac,DIY cleaning",https://www.beacleaner.com/how-to-clean-a-carpet-with-a-wet-dry-vac?utm_source=pinterest&utm_campaign=bye-bye-carpet-stain,2025-04-30,stain removal,https://www.beacleaner.com/how-to-clean-a-carpet-with-a-wet-dry-vac
Deep Clean Carpets: DIY Guide,https://res.cloudinary.com/dbcpfy04c/image/upload/v1618237451/placeholder.jpg,home-inspiration,,"Is your carpet looking sad and lifeless? Give it a new lease on life with this easy-to-follow wet/dry vac carpet cleaning tutorial! We break down everything from prepping your carpet to choosing the right cleaning solution.  Imagine sinking your toes into a plush, clean carpet again!  Stop living with stains and odors - reclaim your floors today!  Click to read now! #carpetcleaningtips #diyhomedecor #cleaninghacks #homeimprovement,carpet cleaning,wet dry vac,DIY",https://www.beacleaner.com/how-to-clean-a-carpet-with-a-wet-dry-vac?utm_source=pinterest&utm_campaign=deep-clean-carpets-d,2025-04-30,home improvement,https://www.beacleaner.com/how-to-clean-a-carpet-with-a-wet-dry-vac
Wet/Dry Vac Carpet Cleaning 101,https://res.cloudinary.com/dbcpfy04c/image/upload/v1618237451/placeholder.jpg,home-inspiration,,"Unlock the power of your wet/dry vac! This guide reveals how to transform it into a carpet cleaning machine.  We cover essential techniques, safety precautions, and troubleshooting tips.  Don't let a dirty carpet ruin your home's aesthetic.  A sparkling clean carpet is within reach! Click to learn more and breathe easier. #carpetcare #cleaningmotivation #wetdryvacuum #homecleaning,carpet care,wet dry vac,cleaning",https://www.beacleaner.com/how-to-clean-a-carpet-with-a-wet-dry-vac?utm_source=pinterest&utm_campaign=wetdry-vac-carpet-cl,2025-04-30,home,https://www.beacleaner.com/how-to-clean-a-carpet-with-a-wet-dry-vac
Stain Removal Secrets Revealed!,https://res.cloudinary.com/dbcpfy04c/image/upload/v1618237451/placeholder.jpg,home-inspiration,,"Pesky carpet stains got you down?  Discover the secrets to removing even the toughest stains with a wet/dry vac!  This guide provides targeted solutions for pet messes, food spills, and more.  Don't despair - a spotless carpet is possible! Click to learn how to banish stains for good. #stainremoval #carpetstains #cleaninghacks #petowners,stain removal,carpet stains,pet stains",https://www.beacleaner.com/how-to-clean-a-carpet-with-a-wet-dry-vac?utm_source=pinterest&utm_campaign=stain-removal-secret,2025-04-30,cleaning hacks,https://www.beacleaner.com/how-to-clean-a-carpet-with-a-wet-dry-vac
Revive Your Carpets: Wet/Dry Vac,https://res.cloudinary.com/ddxyyzkuq/image/upload/v1746045486/pin_6_6_dh4znz.webp,cleaning-inspiration,,"Give your carpets the deep clean they deserve! This guide shows you how to use a wet/dry vac to remove embedded dirt and allergens, leaving your home feeling fresh and healthy.  Imagine a cleaner, more inviting space for your family. Click to learn how to revitalize your carpets today! #carpetcleaning #allergyrelief #homehealth #cleaningroutine,carpet cleaning,allergy relief,home health",https://www.beacleaner.com/how-to-clean-a-carpet-with-a-wet-dry-vac?utm_source=pinterest&utm_campaign=revive-your-carpets-,2025-04-30,cleaning routine,https://www.beacleaner.com/how-to-clean-a-carpet-with-a-wet-dry-vac
Easy Carpet Cleaning with a Vac,https://res.cloudinary.com/dbcpfy04c/image/upload/v1618237451/placeholder.jpg,home-inspiration,,"Stop scrubbing and start vacuuming! This guide simplifies carpet cleaning with a wet/dry vac.  We provide step-by-step instructions and helpful tips for achieving professional-looking results.  Save time, money, and your back! Click to learn how. #easycleaning #carpetcleaning #wetdryvac #cleaningtips,easy cleaning,carpet cleaning,wet dry vac",https://www.beacleaner.com/how-to-clean-a-carpet-with-a-wet-dry-vac?utm_source=pinterest&utm_campaign=easy-carpet-cleaning,2025-04-30,cleaning tips,https://www.beacleaner.com/how-to-clean-a-carpet-with-a-wet-dry-vac
Wet/Dry Vac: Carpet Cleaning Hero,https://res.cloudinary.com/ddxyyzkuq/image/upload/v1746045496/pin_6_8_htyckv.webp,cleaning-ideas,,"Your wet/dry vac is more than just a shop vac â€“ it's a carpet cleaning hero! Learn how to harness its power to deep clean your carpets and remove stubborn dirt.  Enjoy a fresher, cleaner home without the expense of professional cleaning. Click to discover the secrets! #carpetcleaning #wetdryvac #diycleaning #homehacks,carpet cleaning,wet dry vac,DIY cleaning",https://www.beacleaner.com/how-to-clean-a-carpet-with-a-wet-dry-vac?utm_source=pinterest&utm_campaign=wetdry-vac-carpet-cl,2025-04-30,home hacks,https://www.beacleaner.com/how-to-clean-a-carpet-with-a-wet-dry-vac
Deep Cleaning Carpets on a Budget,https://res.cloudinary.com/dbcpfy04c/image/upload/v1618237451/placeholder.jpg,home-inspiration,,"Don't break the bank to get clean carpets! This guide shows you how to achieve professional results with a wet/dry vac and affordable cleaning solutions.  Enjoy a beautiful, clean home without overspending. Click to learn how to save money and time! #budgetcleaning #carpetcleaning #diy #homeimprovement,budget cleaning,carpet cleaning,DIY",https://www.beacleaner.com/how-to-clean-a-carpet-with-a-wet-dry-vac?utm_source=pinterest&utm_campaign=deep-cleaning-carpet,2025-04-30,home improvement,https://www.beacleaner.com/how-to-clean-a-carpet-with-a-wet-dry-vac
Pet-Friendly Carpet Cleaning Guide,https://res.cloudinary.com/dbcpfy04c/image/upload/v1618237451/placeholder.jpg,home-inspiration,,"Love your pets, but not the messes? This guide provides a safe and effective way to clean carpets with a wet/dry vac, removing pet hair, odors, and stains.  Keep your furry friends happy and your home fresh! Click to learn more. #petfriendlycleaning #carpetcleaning #petowners #cleaningtips,pet friendly cleaning,carpet cleaning,pet owners",https://www.beacleaner.com/how-to-clean-a-carpet-with-a-wet-dry-vac?utm_source=pinterest&utm_campaign=pet-friendly-carpet-,2025-04-30,cleaning tips,https://www.beacleaner.com/how-to-clean-a-carpet-with-a-wet-dry-vac
The Ultimate Carpet Cleaning Checklist,https://res.cloudinary.com/dbcpfy04c/image/upload/v1618237451/placeholder.jpg,home-inspiration,,"Don't miss a step! This comprehensive checklist ensures you deep clean your carpets with a wet/dry vac like a pro.  From prep to finish, we've got you covered.  Enjoy a sparkling clean carpet and a sense of accomplishment! Click to download the checklist. #carpetcleaningchecklist #cleaningtips #wetdryvac #homecleaning,carpet cleaning checklist,cleaning tips,wet dry vac",https://www.beacleaner.com/how-to-clean-a-carpet-with-a-wet-dry-vac?utm_source=pinterest&utm_campaign=the-ultimate-carpet-,2025-04-30,home cleaning,https://www.beacleaner.com/how-to-clean-a-carpet-with-a-wet-dry-vac
Wet/Dry Vac: Before & After Magic,https://res.cloudinary.com/dbcpfy04c/image/upload/v1618237451/placeholder.jpg,home-inspiration,,"See the incredible transformation! This guide showcases the power of a wet/dry vac in cleaning carpets, with stunning before & after photos.  Get inspired to tackle your own carpet cleaning project. Click to see the amazing results! #beforeandafter #carpetcleaning #wetdryvac #cleaningmotivation,before and after,carpet cleaning,wet dry vac",https://www.beacleaner.com/how-to-clean-a-carpet-with-a-wet-dry-vac?utm_source=pinterest&utm_campaign=wetdry-vac-before-af,2025-04-30,cleaning motivation,https://www.beacleaner.com/how-to-clean-a-carpet-with-a-wet-dry-vac
Say Goodbye to Carpet Odors!,https://res.cloudinary.com/dbcpfy04c/image/upload/v1618237451/placeholder.jpg,home-inspiration,,"Don't just mask odors â€“ eliminate them! This guide shows you how to use a wet/dry vac to remove embedded odors from your carpets, leaving your home smelling fresh and clean.  Breathe easy and enjoy a more inviting space. Click to learn how! #odorremoval #carpetcleaning #freshhome #cleaningtips,odor removal,carpet cleaning,fresh home",https://www.beacleaner.com/how-to-clean-a-carpet-with-a-wet-dry-vac?utm_source=pinterest&utm_campaign=say-goodbye-to-carpe,2025-04-30,cleaning tips,https://www.beacleaner.com/how-to-clean-a-carpet-with-a-wet-dry-vac
Carpet Cleaning Mistakes to Avoid,https://res.cloudinary.com/dbcpfy04c/image/upload/v1618237451/placeholder.jpg,home-inspiration,,"Don't ruin your carpet! This guide reveals common carpet cleaning mistakes and how to avoid them when using a wet/dry vac.  Protect your investment and achieve the best possible results. Click to learn from our expert advice! #carpetcare #cleaningmistakes #wetdryvac #homeimprovement,carpet care,cleaning mistakes,wet dry vac",https://www.beacleaner.com/how-to-clean-a-carpet-with-a-wet-dry-vac?utm_source=pinterest&utm_campaign=carpet-cleaning-mist,2025-04-30,home improvement,https://www.beacleaner.com/how-to-clean-a-carpet-with-a-wet-dry-vac
Wet/Dry Vac: Deep Clean in Hours,https://res.cloudinary.com/dbcpfy04c/image/upload/v1618237451/placeholder.jpg,home-inspiration,,"Short on time? This guide shows you how to deep clean your carpets with a wet/dry vac in just a few hours.  Enjoy a clean home without spending all day scrubbing. Click to learn our time-saving tips! #quickcleaning #carpetcleaning #wetdryvac #cleaninghacks,quick cleaning,carpet cleaning,wet dry vac",https://www.beacleaner.com/how-to-clean-a-carpet-with-a-wet-dry-vac?utm_source=pinterest&utm_campaign=wetdry-vac-deep-clea,2025-04-30,cleaning hacks,https://www.beacleaner.com/how-to-clean-a-carpet-with-a-wet-dry-vac
Restore Your Carpet's Beauty,https://res.cloudinary.com/dbcpfy04c/image/upload/v1618237451/placeholder.jpg,home-inspiration,,"Bring back the vibrancy of your carpets! This guide provides a step-by-step process for deep cleaning with a wet/dry vac, restoring their original beauty.  Enjoy a more inviting and comfortable home. Click to learn how! #carpetrestoration #carpetcleaning #homeimprovement #cleaningtips,carpet restoration,carpet cleaning,home improvement",https://www.beacleaner.com/how-to-clean-a-carpet-with-a-wet-dry-vac?utm_source=pinterest&utm_campaign=restore-your-carpets,2025-04-30,cleaning tips,https://www.beacleaner.com/how-to-clean-a-carpet-with-a-wet-dry-vac
Wet/Dry Vac: The Eco-Friendly Choice,https://res.cloudinary.com/dbcpfy04c/image/upload/v1618237451/placeholder.jpg,home-inspiration,,"Clean your carpets without harsh chemicals! This guide shows you how to use a wet/dry vac with eco-friendly cleaning solutions for a healthier home and planet.  Feel good about cleaning! Click to learn more. #ecofriendlycleaning #carpetcleaning #greenliving #sustainablehome,eco friendly cleaning,carpet cleaning,green living",https://www.beacleaner.com/how-to-clean-a-carpet-with-a-wet-dry-vac?utm_source=pinterest&utm_campaign=wetdry-vac-the-eco-f,2025-04-30,sustainable home,https://www.beacleaner.com/how-to-clean-a-carpet-with-a-wet-dry-vac
DIY Carpet Cleaning: Save Money!,https://res.cloudinary.com/dbcpfy04c/image/upload/v1618237451/placeholder.jpg,home-inspiration,,"Stop paying for expensive professional carpet cleaning! This guide empowers you to clean your carpets like a pro with a wet/dry vac and save money.  Enjoy a clean home and a fuller wallet. Click to learn how! #diycarpetcleaning #savemoney #cleaningtips #homeimprovement,DIY carpet cleaning,save money,cleaning tips",https://www.beacleaner.com/how-to-clean-a-carpet-with-a-wet-dry-vac?utm_source=pinterest&utm_campaign=diy-carpet-cleaning-,2025-04-30,home improvement,https://www.beacleaner.com/how-to-clean-a-carpet-with-a-wet-dry-vac
Wet/Dry Vac: Tackle Tough Messes,https://res.cloudinary.com/dbcpfy04c/image/upload/v1618237451/placeholder.jpg,home-inspiration,,"From muddy paw prints to spilled wine, this guide shows you how to tackle even the toughest carpet messes with a wet/dry vac.  Don't let accidents ruin your carpets! Click to learn our stain-fighting secrets. #messyhouse #carpetcleaning #stainremoval #cleaninghacks,messy house,carpet cleaning,stain removal",https://www.beacleaner.com/how-to-clean-a-carpet-with-a-wet-dry-vac?utm_source=pinterest&utm_campaign=wetdry-vac-tackle-to,2025-04-30,cleaning hacks,https://www.beacleaner.com/how-to-clean-a-carpet-with-a-wet-dry-vac
Carpet Cleaning for Allergy Sufferers,https://res.cloudinary.com/dbcpfy04c/image/upload/v1618237451/placeholder.jpg,home-inspiration,,"Breathe easier with a cleaner carpet! This guide shows you how to use a wet/dry vac to remove allergens and dust mites from your carpets, creating a healthier home environment.  Relieve allergy symptoms and enjoy a fresh space. Click to learn more! #allergyrelief #carpetcleaning #homehealth #cleaningtips,allergy relief,carpet cleaning,home health",https://www.beacleaner.com/how-to-clean-a-carpet-with-a-wet-dry-vac?utm_source=pinterest&utm_campaign=carpet-cleaning-for-,2025-04-30,cleaning tips,https://www.beacleaner.com/how-to-clean-a-carpet-with-a-wet-dry-vac
Wet/Dry Vac: Extend Carpet Life,https://res.cloudinary.com/dbcpfy04c/image/upload/v1618237451/placeholder.jpg,home-inspiration,,"Protect your investment! This guide shows you how regular carpet cleaning with a wet/dry vac can extend the life of your carpets, saving you money in the long run.  Enjoy beautiful carpets for years to come. Click to learn how! #carpetcare #carpetcleaning #homemaintenance #savingmoney,carpet care,carpet cleaning,home maintenance",https://www.beacleaner.com/how-to-clean-a-carpet-with-a-wet-dry-vac?utm_source=pinterest&utm_campaign=wetdry-vac-extend-ca,2025-04-30,saving money,https://www.beacleaner.com/how-to-clean-a-carpet-with-a-wet-dry-vac
The Secret to Fluffy Carpets,https://res.cloudinary.com/dbcpfy04c/image/upload/v1618237451/placeholder.jpg,home-inspiration,,"Want carpets that feel amazing underfoot? This guide reveals the secret to achieving fluffy, revitalized carpets with a wet/dry vac.  Enjoy a luxurious and comfortable home. Click to learn how! #fluffycarpets #carpetcleaning #homecomfort #cleaningtips,fluffy carpets,carpet cleaning,home comfort",https://www.beacleaner.com/how-to-clean-a-carpet-with-a-wet-dry-vac?utm_source=pinterest&utm_campaign=the-secret-to-fluffy,2025-04-30,cleaning tips,https://www.beacleaner.com/how-to-clean-a-carpet-with-a-wet-dry-vac
Wet/Dry Vac: Cleaning Beyond Carpets,https://res.cloudinary.com/dbcpfy04c/image/upload/v1618237451/placeholder.jpg,home-inspiration,,"Did you know your wet/dry vac can do more than just carpets? This guide explores other ways to use your vac for a sparkling clean home. Expand your cleaning arsenal! Click to discover more uses. #wetdryvac #cleaninghacks #homecleaning #multipurpose,wet dry vac,cleaning hacks,home cleaning",https://www.beacleaner.com/how-to-clean-a-carpet-with-a-wet-dry-vac?utm_source=pinterest&utm_campaign=wetdry-vac-cleaning-,2025-04-30,multipurpose,https://www.beacleaner.com/how-to-clean-a-carpet-with-a-wet-dry-vac
Carpet Cleaning: A Room-by-Room Guide,https://res.cloudinary.com/dbcpfy04c/image/upload/v1618237451/placeholder.jpg,home-inspiration,,"Conquer your whole house! This guide provides a room-by-room approach to carpet cleaning with a wet/dry vac, ensuring every space is fresh and clean.  Enjoy a consistently clean home. Click to get started! #roombyroomcleaning #carpetcleaning #homecleaning #cleaningroutine,room by room cleaning,carpet cleaning,home cleaning",https://www.beacleaner.com/how-to-clean-a-carpet-with-a-wet-dry-vac?utm_source=pinterest&utm_campaign=carpet-cleaning-a-ro,2025-04-30,cleaning routine,https://www.beacleaner.com/how-to-clean-a-carpet-with-a-wet-dry-vac
Wet/Dry Vac: Pro Cleaning Tips,https://res.cloudinary.com/dbcpfy04c/image/upload/v1618237451/placeholder.jpg,home-inspiration,,"Level up your carpet cleaning game! This guide shares pro tips and tricks for using a wet/dry vac to achieve professional-looking results.  Impress your friends and family with a spotless home. Click to learn the secrets! #procleaningtips #carpetcleaning #wetdryvac #cleaninghacks,pro cleaning tips,carpet cleaning,wet dry vac",https://www.beacleaner.com/how-to-clean-a-carpet-with-a-wet-dry-vac?utm_source=pinterest&utm_campaign=wetdry-vac-pro-clean,2025-04-30,cleaning hacks,https://www.beacleaner.com/how-to-clean-a-carpet-with-a-wet-dry-vac
Title,https://res.cloudinary.com/dbcpfy04c/image/upload/v1618237451/placeholder.jpg,home-inspiration,,Description,https://www.beacleaner.com/how-to-clean-a-chandelier-without-taking-it-down?utm_source=pinterest&utm_campaign=title,2025-04-30,Keywords,https://www.beacleaner.com/how-to-clean-a-chandelier-without-taking-it-down
Sparkling Chandelier: Easy Cleaning!,https://res.cloudinary.com/dbcpfy04c/image/upload/v1618237451/placeholder.jpg,home-inspiration,,"Tired of a dusty, dull chandelier? âœ¨ This guide shows you how to clean your chandelier *without* the hassle of taking it down! Learn simple techniques using household items for a dazzling sparkle. Don't let grime dim your home's beauty â€“ reclaim that brilliance! Click to learn the step-by-step process and enjoy a brighter, more inviting space. It's easier than you think! #chandeliercleaning #homemaintenance #cleaningtips #sparkle,chandelier,cleaning,home decor",https://www.beacleaner.com/how-to-clean-a-chandelier-without-taking-it-down?utm_source=pinterest&utm_campaign=sparkling-chandelier,2025-04-30,sparkling,https://www.beacleaner.com/how-to-clean-a-chandelier-without-taking-it-down
DIY Chandelier Shine - No Ladder!,https://res.cloudinary.com/dbcpfy04c/image/upload/v1618237451/placeholder.jpg,home-inspiration,,"Is your chandelier looking a little lackluster? ðŸ˜© Don't risk a fall! This post reveals a safe & effective method to clean your chandelier *without* a ladder or taking it apart.  We'll cover everything from dusting to polishing, ensuring a stunning result.  Imagine the compliments you'll receive! Click to learn more and brighten your home today. #chandeliercleaning #diycleaning #homedecor #safecleaning,chandelier,DIY,home",https://www.beacleaner.com/how-to-clean-a-chandelier-without-taking-it-down?utm_source=pinterest&utm_campaign=diy-chandelier-shine,2025-04-30,safety,https://www.beacleaner.com/how-to-clean-a-chandelier-without-taking-it-down
Chandelier Cleaning: Quick & Easy!,https://res.cloudinary.com/dbcpfy04c/image/upload/v1618237451/placeholder.jpg,home-inspiration,,"Life's too short to spend hours cleaning! â±ï¸ This guide provides a quick and easy way to clean your chandelier without the stress of disassembly. Discover the best tools and techniques for a sparkling finish.  Restore your chandelier's elegance and enjoy a beautifully lit room. Click to read now! #chandeliercleaning #easycleaning #homemaintenance #quicktips,chandelier,easy,cleaning tips",https://www.beacleaner.com/how-to-clean-a-chandelier-without-taking-it-down?utm_source=pinterest&utm_campaign=chandelier-cleaning-,2025-04-30,maintenance,https://www.beacleaner.com/how-to-clean-a-chandelier-without-taking-it-down
Dust-Free Chandelier: A Simple Guide,https://res.cloudinary.com/dbcpfy04c/image/upload/v1618237451/placeholder.jpg,home-inspiration,,"Say goodbye to dusty chandeliers! ðŸ‘‹ This post offers a simple, step-by-step guide to keeping your chandelier sparkling clean. Learn how to prevent dust buildup and maintain its brilliance with minimal effort.  A clean chandelier adds so much to a room! Click to learn how. #chandeliercleaning #dusting #homedecor #cleaninghacks,chandelier,dusting,home decor",https://www.beacleaner.com/how-to-clean-a-chandelier-without-taking-it-down?utm_source=pinterest&utm_campaign=dust-free-chandelier,2025-04-30,cleaning,https://www.beacleaner.com/how-to-clean-a-chandelier-without-taking-it-down
Chandelier Cleaning: Before & After!,https://res.cloudinary.com/dbcpfy04c/image/upload/v1618237451/placeholder.jpg,home-inspiration,,"Witness the transformation! ðŸ¤© This post showcases stunning before & after photos of chandelier cleaning.  See how a little effort can dramatically improve the look of your home.  We'll guide you through the process, making it easy to achieve similar results. Click to see the magic! #chandeliercleaning #beforeandafter #homedecor #transformation,chandelier,before after,home",https://www.beacleaner.com/how-to-clean-a-chandelier-without-taking-it-down?utm_source=pinterest&utm_campaign=chandelier-cleaning-,2025-04-30,transformation,https://www.beacleaner.com/how-to-clean-a-chandelier-without-taking-it-down
Gentle Chandelier Cleaning Methods,https://res.cloudinary.com/dbcpfy04c/image/upload/v1618237451/placeholder.jpg,home-inspiration,,"Worried about damaging your delicate chandelier? ðŸ¤” This post focuses on gentle cleaning methods that are safe for all types of chandeliers, including crystal.  Protect your investment while achieving a brilliant shine.  Click to learn how to clean with confidence! #chandeliercleaning #crystalchandelier #gentlecleaning #homedecor,chandelier,crystal,gentle",https://www.beacleaner.com/how-to-clean-a-chandelier-without-taking-it-down?utm_source=pinterest&utm_campaign=gentle-chandelier-cl,2025-04-30,cleaning,https://www.beacleaner.com/how-to-clean-a-chandelier-without-taking-it-down
