Title,Media URL,Pinterest board,Thumbnail,Description,Link,Publish date,Keywords,Source URL
Title,https://res.cloudinary.com/ddxyyzkuq/image/upload/v1746051570/pin_1_1_npezpd.webp,please-provide-the-title-and-keywords-i-need-that-information-to-suggest-a-board-name-once,,Description,https://www.beacleaner.com/how-to-clean-a-dirty-window-sill?utm_source=pinterest&utm_campaign=title,2025-04-30,Keywords,https://www.beacleaner.com/how-to-clean-a-dirty-window-sill
Sparkling Window Sills: Your Guide!,https://res.cloudinary.com/dbcpfy04c/image/upload/v1618237451/placeholder.jpg,home-inspiration,,"Tired of grimy window sills ruining your view? This easy guide from BeaCleaner shows you how to tackle dirt, dust, and mildew with simple household items! Reclaim your sunshine and enjoy a spotless home. Learn the best cleaning solutions, tools, and techniques for every type of window sill material. Don't let dirty sills stress you out – a little effort goes a long way! Click to learn more and brighten your day! #windowcleaning #cleaningtips #homehacks #dirtywindowsills,window sills,cleaning,home",https://www.beacleaner.com/how-to-clean-a-dirty-window-sill?utm_source=pinterest&utm_campaign=sparkling-window-sil,2025-04-30,tips,https://www.beacleaner.com/how-to-clean-a-dirty-window-sill
Bye Bye Grime: Window Sill Cleaning,https://res.cloudinary.com/dbcpfy04c/image/upload/v1618237451/placeholder.jpg,home-inspiration,,"Is your window sill a magnet for dust bunnies and grime? Don't despair! BeaCleaner's step-by-step guide will transform your dirty window sills into sparkling surfaces. We cover everything from quick daily maintenance to deep cleaning for stubborn messes. Imagine enjoying a crystal-clear view without distractions! Get the secrets to a cleaner, happier home today. Click to read! #windowcleaningtips #homecleaning #cleanhome #dustremoval,window cleaning,grime,dust",https://www.beacleaner.com/how-to-clean-a-dirty-window-sill?utm_source=pinterest&utm_campaign=bye-bye-grime-window,2025-04-30,maintenance,https://www.beacleaner.com/how-to-clean-a-dirty-window-sill
Window Sill Deep Clean: Step-by-Step,https://res.cloudinary.com/dbcpfy04c/image/upload/v1618237451/placeholder.jpg,home-inspiration,,"Don't underestimate the impact of clean window sills! They contribute to a brighter, fresher-looking home. BeaCleaner's detailed guide breaks down the deep cleaning process, making it manageable for everyone. Learn how to remove mold, mildew, and years of built-up dirt.  A clean home is a happy home – start with your window sills! Click for the full tutorial. #deepcleaning #windowmaintenance #moldremoval #homeimprovement,deep clean,mold,mildew",https://www.beacleaner.com/how-to-clean-a-dirty-window-sill?utm_source=pinterest&utm_campaign=window-sill-deep-cle,2025-04-30,tutorial,https://www.beacleaner.com/how-to-clean-a-dirty-window-sill
The Ultimate Window Sill Cleaning Hack,https://res.cloudinary.com/dbcpfy04c/image/upload/v1618237451/placeholder.jpg,home-inspiration,,"Discover the *one* cleaning hack you need for sparkling window sills! BeaCleaner reveals a surprisingly effective solution that cuts through grime and leaves your sills looking brand new.  Stop scrubbing endlessly and start enjoying a cleaner home with less effort.  This is a game-changer! Click to learn the secret! #cleaninghack #windowcleaning #easycleaning #homecleaningtips,cleaning hack,easy cleaning,tips",https://www.beacleaner.com/how-to-clean-a-dirty-window-sill?utm_source=pinterest&utm_campaign=the-ultimate-window-,2025-04-30,secret,https://www.beacleaner.com/how-to-clean-a-dirty-window-sill
Clean Window Sills = Happy Home!,https://res.cloudinary.com/dbcpfy04c/image/upload/v1618237451/placeholder.jpg,home-inspiration,,"A clean home is a sanctuary, and it all starts with the details. BeaCleaner shows you how to easily clean your window sills, creating a brighter, more inviting space.  Imagine the feeling of satisfaction when you see your windows sparkling!  Don't wait – start cleaning today and enjoy the difference. Click to read the guide! #cleanhome #happyhome #windowcleaning #homedecor,clean,happy,home",https://www.beacleaner.com/how-to-clean-a-dirty-window-sill?utm_source=pinterest&utm_campaign=clean-window-sills-h,2025-04-30,decor,https://www.beacleaner.com/how-to-clean-a-dirty-window-sill
DIY Window Sill Cleaner Recipes,https://res.cloudinary.com/dbcpfy04c/image/upload/v1618237451/placeholder.jpg,home-inspiration,,"Skip the harsh chemicals! BeaCleaner shares DIY window sill cleaner recipes using ingredients you probably already have at home.  Safe for your family, pets, and the environment.  Learn how to create effective cleaning solutions that leave your sills sparkling clean. Click to discover the recipes! #diycleaner #naturalcleaning #windowcleaning #ecofriendly,diy cleaner,natural,eco-friendly",https://www.beacleaner.com/how-to-clean-a-dirty-window-sill?utm_source=pinterest&utm_campaign=diy-window-sill-clea,2025-04-30,recipes,https://www.beacleaner.com/how-to-clean-a-dirty-window-sill
Window Sill Cleaning for Every Material,https://res.cloudinary.com/dbcpfy04c/image/upload/v1618237451/placeholder.jpg,home-inspiration,,"Worried about damaging your window sills? BeaCleaner's guide covers cleaning techniques for *all* materials – wood, vinyl, metal, and more!  Learn the best methods to protect your sills while achieving a sparkling clean.  Don't risk damage – read our guide first! Click to learn more. #windowmaterials #cleaningtips #woodcleaning #vinylcleaning,window materials,wood,vinyl",https://www.beacleaner.com/how-to-clean-a-dirty-window-sill?utm_source=pinterest&utm_campaign=window-sill-cleaning,2025-04-30,metal,https://www.beacleaner.com/how-to-clean-a-dirty-window-sill
Quick Window Sill Cleaning Routine,https://res.cloudinary.com/dbcpfy04c/image/upload/v1618237451/placeholder.jpg,home-inspiration,,"Short on time? BeaCleaner offers a quick and easy window sill cleaning routine that fits into even the busiest schedules.  Maintain sparkling sills with just a few minutes of effort each week.  A little prevention goes a long way! Click to learn the routine. #quickcleaning #cleaningroutine #windowcleaning #busylife,quick,routine,busy",https://www.beacleaner.com/how-to-clean-a-dirty-window-sill?utm_source=pinterest&utm_campaign=quick-window-sill-cl,2025-04-30,schedule,https://www.beacleaner.com/how-to-clean-a-dirty-window-sill
Remove Mold From Window Sills Easily,https://res.cloudinary.com/dbcpfy04c/image/upload/v1618237451/placeholder.jpg,home-inspiration,,"Mold on your window sills? Don't panic! BeaCleaner provides a safe and effective guide to removing mold and preventing it from returning. Protect your home and your health with our expert advice.  Breathe easier with a mold-free home! Click to learn how. #moldremoval #windowcleaning #homehealth #safecleaning,mold,removal,health",https://www.beacleaner.com/how-to-clean-a-dirty-window-sill?utm_source=pinterest&utm_campaign=remove-mold-from-win,2025-04-30,safe,https://www.beacleaner.com/how-to-clean-a-dirty-window-sill
Revive Dull Window Sills: Cleaning Guide,https://res.cloudinary.com/dbcpfy04c/image/upload/v1618237451/placeholder.jpg,home-inspiration,,"Are your window sills looking dull and lifeless? BeaCleaner's guide will revive them, restoring their original beauty. Learn how to remove grime, dirt, and discoloration for a sparkling finish.  Bring back the shine! Click to read the full guide. #windowrevival #cleaningguide #homemaintenance #shine,revival,guide,maintenance",https://www.beacleaner.com/how-to-clean-a-dirty-window-sill?utm_source=pinterest&utm_campaign=revive-dull-window-s,2025-04-30,shine,https://www.beacleaner.com/how-to-clean-a-dirty-window-sill
Window Sill Cleaning: Before & After,https://res.cloudinary.com/dbcpfy04c/image/upload/v1618237451/placeholder.jpg,home-inspiration,,"See the amazing transformation! BeaCleaner showcases stunning before & after photos of dirty window sills transformed into sparkling surfaces.  Get inspired and learn how to achieve similar results in your own home.  Proof that cleaning *works*! Click to see the photos. #beforeandafter #windowcleaning #cleaningresults #homeimprovement,before,after,results",https://www.beacleaner.com/how-to-clean-a-dirty-window-sill?utm_source=pinterest&utm_campaign=window-sill-cleaning,2025-04-30,improvement,https://www.beacleaner.com/how-to-clean-a-dirty-window-sill
Protect Your Window Sills: Cleaning Tips,https://res.cloudinary.com/dbcpfy04c/image/upload/v1618237451/placeholder.jpg,home-inspiration,,"Don't just clean – *protect* your window sills! BeaCleaner shares tips on preventing dirt buildup and maintaining a sparkling clean for longer.  Save time and effort with our preventative measures.  A little care goes a long way! Click to learn more. #windowprotection #cleaningtips #homemaintenance #preventativecare,protection,tips,maintenance",https://www.beacleaner.com/how-to-clean-a-dirty-window-sill?utm_source=pinterest&utm_campaign=protect-your-window-,2025-04-30,care,https://www.beacleaner.com/how-to-clean-a-dirty-window-sill
The Best Tools for Window Sill Cleaning,https://res.cloudinary.com/dbcpfy04c/image/upload/v1618237451/placeholder.jpg,home-inspiration,,"Equip yourself for success! BeaCleaner recommends the best tools for cleaning window sills, making the job easier and more effective. From microfiber cloths to scrub brushes, we've got you covered.  Get the right tools for the job! Click to see our recommendations. #cleaningtools #windowcleaning #homeessentials #cleaninggadgets,tools,essentials,gadgets",https://www.beacleaner.com/how-to-clean-a-dirty-window-sill?utm_source=pinterest&utm_campaign=the-best-tools-for-w,2025-04-30,recommendations,https://www.beacleaner.com/how-to-clean-a-dirty-window-sill
Window Sill Cleaning Checklist: Stay Organized,https://res.cloudinary.com/dbcpfy04c/image/upload/v1618237451/placeholder.jpg,home-inspiration,,"Stay on top of your cleaning with BeaCleaner's printable window sill cleaning checklist!  A simple and effective way to ensure you never miss a spot.  Download the checklist and enjoy a consistently clean home. Click to download! #cleaningchecklist #windowcleaning #organizedhome #printable,checklist,organized,printable",https://www.beacleaner.com/how-to-clean-a-dirty-window-sill?utm_source=pinterest&utm_campaign=window-sill-cleaning,2025-04-30,download,https://www.beacleaner.com/how-to-clean-a-dirty-window-sill
Cleaning Window Sills with Vinegar: A Guide,https://res.cloudinary.com/dbcpfy04c/image/upload/v1618237451/placeholder.jpg,home-inspiration,,"Vinegar is a cleaning powerhouse! BeaCleaner shows you how to use vinegar to effectively clean your window sills, removing dirt and grime naturally.  A safe, affordable, and eco-friendly cleaning solution. Click to learn the vinegar method! #vinegarcleaning #naturalcleaning #windowcleaning #ecofriendlycleaning,vinegar,natural,eco-friendly",https://www.beacleaner.com/how-to-clean-a-dirty-window-sill?utm_source=pinterest&utm_campaign=cleaning-window-sill,2025-04-30,method,https://www.beacleaner.com/how-to-clean-a-dirty-window-sill
Window Sill Cleaning for Pet Owners,https://res.cloudinary.com/dbcpfy04c/image/upload/v1618237451/placeholder.jpg,home-inspiration,,"Pet hair and paw prints on your window sills? BeaCleaner offers specific cleaning tips for pet owners, tackling those extra messes.  Keep your home clean and fresh, even with furry friends! Click to learn more. #petcleaning #windowcleaning #homecleaning #petowners,pet,cleaning,owners",https://www.beacleaner.com/how-to-clean-a-dirty-window-sill?utm_source=pinterest&utm_campaign=window-sill-cleaning,2025-04-30,furry,https://www.beacleaner.com/how-to-clean-a-dirty-window-sill
Deep Cleaning Window Sills: A Weekend Project,https://res.cloudinary.com/dbcpfy04c/image/upload/v1618237451/placeholder.jpg,home-inspiration,,"Turn your weekend cleaning into a satisfying accomplishment! BeaCleaner's guide to deep cleaning window sills will leave your home looking and feeling refreshed.  A little effort can make a big difference. Click to start your project! #weekendcleaning #deepcleaning #windowcleaning #homeproject,weekend,project,accomplishment",https://www.beacleaner.com/how-to-clean-a-dirty-window-sill?utm_source=pinterest&utm_campaign=deep-cleaning-window,2025-04-30,refresh,https://www.beacleaner.com/how-to-clean-a-dirty-window-sill
How to Clean Painted Window Sills,https://res.cloudinary.com/dbcpfy04c/image/upload/v1618237451/placeholder.jpg,home-inspiration,,"Protect your paint job! BeaCleaner provides specific instructions for cleaning painted window sills without damaging the finish.  Keep your sills looking beautiful for years to come. Click to learn the best techniques. #paintedwindowsills #windowcleaning #homeimprovement #paintcare,painted,paint,care",https://www.beacleaner.com/how-to-clean-a-dirty-window-sill?utm_source=pinterest&utm_campaign=how-to-clean-painted,2025-04-30,finish,https://www.beacleaner.com/how-to-clean-a-dirty-window-sill
Window Sill Cleaning: Avoid These Mistakes!,https://res.cloudinary.com/dbcpfy04c/image/upload/v1618237451/placeholder.jpg,home-inspiration,,"Don't make these common window sill cleaning mistakes! BeaCleaner highlights pitfalls to avoid, ensuring you achieve a sparkling clean without damaging your sills.  Learn from our expertise! Click to read the article. #cleaningmistakes #windowcleaning #homecleaning #avoidthese,mistakes,avoid,expertise",https://www.beacleaner.com/how-to-clean-a-dirty-window-sill?utm_source=pinterest&utm_campaign=window-sill-cleaning,2025-04-30,tips,https://www.beacleaner.com/how-to-clean-a-dirty-window-sill
Cleaning Window Sills with Baking Soda,https://res.cloudinary.com/dbcpfy04c/image/upload/v1618237451/placeholder.jpg,home-inspiration,,"Baking soda to the rescue! BeaCleaner shows you how to use baking soda to gently scrub away dirt and grime from your window sills. A natural and effective cleaning solution. Click to learn more! #bakingsoda #naturalcleaning #windowcleaning #gentlecleaning,baking soda,gentle,natural",https://www.beacleaner.com/how-to-clean-a-dirty-window-sill?utm_source=pinterest&utm_campaign=cleaning-window-sill,2025-04-30,solution,https://www.beacleaner.com/how-to-clean-a-dirty-window-sill
Window Sill Cleaning: The Ultimate Guide,https://res.cloudinary.com/dbcpfy04c/image/upload/v1618237451/placeholder.jpg,home-inspiration,,"Everything you need to know about cleaning window sills is right here! BeaCleaner's ultimate guide covers all materials, cleaning solutions, and techniques.  Become a window sill cleaning pro! Click to read the complete guide. #ultimatecleaningguide #windowcleaning #homecleaning #cleaningtips,ultimate guide,complete,pro",https://www.beacleaner.com/how-to-clean-a-dirty-window-sill?utm_source=pinterest&utm_campaign=window-sill-cleaning,2025-04-30,tips,https://www.beacleaner.com/how-to-clean-a-dirty-window-sill
Window Sill Cleaning for Allergy Sufferers,https://res.cloudinary.com/dbcpfy04c/image/upload/v1618237451/placeholder.jpg,home-inspiration,,"Breathe easier! BeaCleaner offers cleaning tips specifically for allergy sufferers, removing dust and allergens from window sills.  Create a healthier home environment. Click to learn more. #allergysufferers #windowcleaning #homehealth #dustremoval,allergies,health,dust",https://www.beacleaner.com/how-to-clean-a-dirty-window-sill?utm_source=pinterest&utm_campaign=window-sill-cleaning,2025-04-30,environment,https://www.beacleaner.com/how-to-clean-a-dirty-window-sill
Easy Window Sill Cleaning for Seniors,https://res.cloudinary.com/dbcpfy04c/image/upload/v1618237451/placeholder.jpg,home-inspiration,,"Cleaning doesn't have to be strenuous! BeaCleaner provides easy and accessible window sill cleaning tips for seniors.  Maintain a clean home without overexerting yourself. Click to read the guide. #seniorcleaning #windowcleaning #easycleaning #accessiblecleaning,senior,easy,accessible",https://www.beacleaner.com/how-to-clean-a-dirty-window-sill?utm_source=pinterest&utm_campaign=easy-window-sill-cle,2025-04-30,cleaning,https://www.beacleaner.com/how-to-clean-a-dirty-window-sill
Sparkling Sills in 15 Minutes or Less!,https://res.cloudinary.com/dbcpfy04c/image/upload/v1618237451/placeholder.jpg,home-inspiration,,"Short on time? BeaCleaner shows you how to get sparkling clean window sills in just 15 minutes! Quick, effective, and satisfying. Click to learn the speedy cleaning method! #15minutecleaning #windowcleaning #quickclean #homehacks,speedy,quick,hacks",https://www.beacleaner.com/how-to-clean-a-dirty-window-sill?utm_source=pinterest&utm_campaign=sparkling-sills-in-1,2025-04-30,minutes,https://www.beacleaner.com/how-to-clean-a-dirty-window-sill
Title,https://res.cloudinary.com/dbcpfy04c/image/upload/v1618237451/placeholder.jpg,home-inspiration,,Description,https://www.beacleaner.com/how-to-clean-a-dooney-and-bourke-leather-purse?utm_source=pinterest&utm_campaign=title,2025-04-30,Keywords,https://www.beacleaner.com/how-to-clean-a-dooney-and-bourke-leather-purse
Dooney & Bourke Rescue! ✨,https://res.cloudinary.com/dbcpfy04c/image/upload/v1618237451/placeholder.jpg,home-inspiration,,"Is your beloved Dooney & Bourke looking a little lackluster? Don't despair! This guide reveals the secrets to restoring its original beauty. From gentle cleaning to conditioning, we cover everything to keep your investment looking fabulous for years to come. Learn how to tackle stains, scuffs",https://www.beacleaner.com/how-to-clean-a-dooney-and-bourke-leather-purse?utm_source=pinterest&utm_campaign=dooney-bourke-rescue,2025-04-30,and everyday grime.  Protect your luxury purse & keep it looking brand new! Click to learn more & revive your Dooney! #dooneyandbourke #leatherpurse #pursecleaning #leathercare,https://www.beacleaner.com/how-to-clean-a-dooney-and-bourke-leather-purse
Dooney & Bourke: Leather Care 101,https://res.cloudinary.com/dbcpfy04c/image/upload/v1618237451/placeholder.jpg,home-inspiration,,Worried about damaging your Dooney & Bourke? You're not alone! This pin leads to a detailed guide on safely cleaning and conditioning your prized possession. We break down the process step-by-step,https://www.beacleaner.com/how-to-clean-a-dooney-and-bourke-leather-purse?utm_source=pinterest&utm_campaign=dooney-bourke-leathe,2025-04-30,so even beginners can achieve professional results.  Don't let dirt and wear diminish its value – give it the TLC it deserves! Click to learn how! #dooneybourke #leathercleaning #handbagcare #luxurybags,https://www.beacleaner.com/how-to-clean-a-dooney-and-bourke-leather-purse
Revive Your Dooney: Step-by-Step,https://res.cloudinary.com/dbcpfy04c/image/upload/v1618237451/placeholder.jpg,home-inspiration,,Bring your Dooney & Bourke back to life! This pin links to a comprehensive,https://www.beacleaner.com/how-to-clean-a-dooney-and-bourke-leather-purse?utm_source=pinterest&utm_campaign=revive-your-dooney-s,2025-04-30,easy-to-follow guide on cleaning and restoring your leather purse.  We cover everything from prepping your bag to applying the right products.  Imagine the joy of carrying a bag that looks as good as new! Click to start! #dooneybourke #leatherrestoration #pursecleaningtips #handbagmakeover,https://www.beacleaner.com/how-to-clean-a-dooney-and-bourke-leather-purse
Dooney & Bourke: Preventative Care,https://res.cloudinary.com/dbcpfy04c/image/upload/v1618237451/placeholder.jpg,home-inspiration,,"Don't wait for damage to happen! This pin leads to a guide on preventative care for your Dooney & Bourke leather purse. Learn how to protect it from the elements, prevent stains",https://www.beacleaner.com/how-to-clean-a-dooney-and-bourke-leather-purse?utm_source=pinterest&utm_campaign=dooney-bourke-preven,2025-04-30,and extend its lifespan. A little effort now saves you headaches (and money!) later. Click to learn more! #dooneyandbourke #leatherprotection #pursemaintenance #handbagtips,https://www.beacleaner.com/how-to-clean-a-dooney-and-bourke-leather-purse
Leather Conditioner Guide - Dooney,https://res.cloudinary.com/dbcpfy04c/image/upload/v1618237451/placeholder.jpg,home-inspiration,,"Is your Dooney & Bourke leather feeling dry and cracked? This pin directs you to a guide on choosing and applying the best leather conditioner.  Keep your bag supple, hydrated",https://www.beacleaner.com/how-to-clean-a-dooney-and-bourke-leather-purse?utm_source=pinterest&utm_campaign=leather-conditioner-,2025-04-30,and looking its best.  A nourished bag is a happy bag! Click to discover the secrets. #dooneybourke #leatherconditioner #leathercare #handbaglove,https://www.beacleaner.com/how-to-clean-a-dooney-and-bourke-leather-purse
Deep Clean Your Dooney & Bourke,https://res.cloudinary.com/dbcpfy04c/image/upload/v1618237451/placeholder.jpg,home-inspiration,,Give your Dooney & Bourke the deep clean it deserves! This pin links to a guide that goes beyond surface cleaning,https://www.beacleaner.com/how-to-clean-a-dooney-and-bourke-leather-purse?utm_source=pinterest&utm_campaign=deep-clean-your-doon,2025-04-30,tackling embedded dirt and grime.  We'll show you how to achieve a thorough clean without damaging the leather.  Feel good about carrying a truly clean bag! Click to learn how. #dooneyandbourke #deepcleaning #leatherpurse #handbagcleaning,https://www.beacleaner.com/how-to-clean-a-dooney-and-bourke-leather-purse
Dooney & Bourke: Storage Secrets,https://res.cloudinary.com/dbcpfy04c/image/upload/v1618237451/placeholder.jpg,home-inspiration,,"Proper storage is key to preserving your Dooney & Bourke! This pin directs you to a guide on the best ways to store your leather purse when not in use.  Prevent dust, damage",https://www.beacleaner.com/how-to-clean-a-dooney-and-bourke-leather-purse?utm_source=pinterest&utm_campaign=dooney-bourke-storag,2025-04-30,and loss of shape.  Keep it safe and sound! Click to learn more. #dooneybourke #pursestorage #leathercare #handbagorganization,https://www.beacleaner.com/how-to-clean-a-dooney-and-bourke-leather-purse
DIY Leather Cleaner for Dooney,https://res.cloudinary.com/dbcpfy04c/image/upload/v1618237451/placeholder.jpg,home-inspiration,,Looking for a natural cleaning solution? This pin links to a guide on making a DIY leather cleaner for your Dooney & Bourke purse.  Gentle yet effective,https://www.beacleaner.com/how-to-clean-a-dooney-and-bourke-leather-purse?utm_source=pinterest&utm_campaign=diy-leather-cleaner-,2025-04-30,it's a great option for sensitive leather.  Save money and care for your bag! Click to learn the recipe. #dooneyandbourke #diycleaner #leathercleaning #naturalcleaning,https://www.beacleaner.com/how-to-clean-a-dooney-and-bourke-leather-purse
Title,https://res.cloudinary.com/dbcpfy04c/image/upload/v1618237451/placeholder.jpg,home-inspiration,,Description,https://www.beacleaner.com/how-to-clean-a-doormat?utm_source=pinterest&utm_campaign=title,2025-04-30,Keywords,https://www.beacleaner.com/how-to-clean-a-doormat
Dirty Doormat? Revive It!,https://res.cloudinary.com/dbcpfy04c/image/upload/v1618237451/placeholder.jpg,home-inspiration,,"Is your doormat looking sad and grimy? Don't replace it! This guide shows you how to deep clean ANY doormat – coir, rubber, indoor, outdoor – and keep it looking fresh. Learn simple DIY methods using things you probably already have! A clean doormat means a cleaner home & happier guests. Click to learn how to banish dirt & grime for good! ✨ #doormatcleaning #cleaninghacks #homecleaning #dirtydoormat,doormat,cleaning,home",https://www.beacleaner.com/how-to-clean-a-doormat?utm_source=pinterest&utm_campaign=dirty-doormat-revive,2025-04-30,DIY,https://www.beacleaner.com/how-to-clean-a-doormat
Quick Doormat Refresh!,https://res.cloudinary.com/dbcpfy04c/image/upload/v1618237451/placeholder.jpg,home-inspiration,,"Life's messy! Keep your entryway welcoming with a sparkling clean doormat. This post breaks down cleaning for all types of mats, from quick daily shakes to deep cleaning for stubborn dirt.  Don't let a dirty doormat ruin your first impression!  Get a spotless welcome in minutes. Click to learn more! 🏡 #cleanhome #entrywaydecor #doormat #cleaningtips,entryway,doormat,cleaning",https://www.beacleaner.com/how-to-clean-a-doormat?utm_source=pinterest&utm_campaign=quick-doormat-refres,2025-04-30,tips,https://www.beacleaner.com/how-to-clean-a-doormat
Coir Doormat Cleaning Guide,https://res.cloudinary.com/dbcpfy04c/image/upload/v1618237451/placeholder.jpg,home-inspiration,,"Love your coir doormat but hate the dirt? This guide is for YOU! Learn the best way to clean coir without damaging it. We cover vacuuming, shaking, and gentle washing techniques.  Protect your investment and keep your entryway looking inviting! Click for a step-by-step tutorial.🌿 #coir doormat #cleaning #homehacks #naturalfiber,coir,doormat,cleaning",https://www.beacleaner.com/how-to-clean-a-doormat?utm_source=pinterest&utm_campaign=coir-doormat-cleanin,2025-04-30,natural,https://www.beacleaner.com/how-to-clean-a-doormat
Rubber Doormat Rescue!,https://res.cloudinary.com/dbcpfy04c/image/upload/v1618237451/placeholder.jpg,home-inspiration,,"Rubber doormats are tough, but they still need love! This post shows you how to effectively clean rubber doormats, removing mud, grime, and even sticky messes.  Keep your floors cleaner and your doormat looking its best. Click to learn the secrets! ☔ #rubberdoormat #cleaningtips #muddyboots #homecleaning,rubber,doormat,cleaning",https://www.beacleaner.com/how-to-clean-a-doormat?utm_source=pinterest&utm_campaign=rubber-doormat-rescu,2025-04-30,mud,https://www.beacleaner.com/how-to-clean-a-doormat
