Title,Media URL,Pinterest board,Thumbnail,Description,Link,Publish date,Keywords,Source URL
2150: Diagnosing a Weak Battery,https://res.cloudinary.com/dbcpfy04c/image/upload/v1618237451/placeholder.jpg,home-inspiration,,"A weak battery can leave you stranded. This pin provides a guide to diagnosing battery problems on your John Deere 2150, including testing voltage, checking connections, and identifying potential causes of battery drain.  Power up your productivity! #JohnDeere #Battery #TractorRepair #Electrical,Battery,John Deere,Tractor",https://lawntrend.com/john-deere-2150-problems/?utm_source=pinterest&utm_campaign=2150-diagnosing-a-we,2025-04-28,Electrical System,https://lawntrend.com/john-deere-2150-problems/
John Deere 2150: Radiator Repair Guide,https://res.cloudinary.com/dbcpfy04c/image/upload/v1618237451/placeholder.jpg,home-inspiration,,"Keep your engine cool with a properly functioning radiator. This pin offers a guide to inspecting, cleaning, and repairing the radiator on your John Deere 2150.  Prevent overheating and extend your tractor's life. #JohnDeere #Radiator #TractorRepair #CoolingSystem,Radiator,John Deere,Tractor",https://lawntrend.com/john-deere-2150-problems/?utm_source=pinterest&utm_campaign=john-deere-2150-radi,2025-04-28,Cooling,https://lawntrend.com/john-deere-2150-problems/
2150: Understanding Your Tractor's Fluids,https://res.cloudinary.com/dbcpfy04c/image/upload/v1618237451/placeholder.jpg,home-inspiration,,"Knowing your tractor's fluids is crucial for proper maintenance. This pin explains the different types of fluids used in the John Deere 2150 (oil, coolant, hydraulic fluid, etc.) and how to check their levels.  Stay informed and keep your tractor healthy! #JohnDeere #Fluids #TractorMaintenance #FarmLife,Fluids,John Deere,Tractor",https://lawntrend.com/john-deere-2150-problems/?utm_source=pinterest&utm_campaign=2150-understanding-y,2025-04-28,Maintenance,https://lawntrend.com/john-deere-2150-problems/
Fixing a Leaky 2150 Hydraulic Cylinder,https://res.cloudinary.com/dbcpfy04c/image/upload/v1618237451/placeholder.jpg,home-inspiration,,"Hydraulic leaks can be messy and costly. This pin provides a guide to identifying and fixing leaky hydraulic cylinders on your John Deere 2150.  Stop the leaks and restore hydraulic power! #JohnDeere2150 #HydraulicLeak #TractorRepair #DIY,Hydraulic Leak,John Deere,Tractor",https://lawntrend.com/john-deere-2150-problems/?utm_source=pinterest&utm_campaign=fixing-a-leaky-2150-,2025-04-28,Hydraulics,https://lawntrend.com/john-deere-2150-problems/
John Deere 2150: Safety First! Repair Tips,https://res.cloudinary.com/dbcpfy04c/image/upload/v1618237451/placeholder.jpg,home-inspiration,,"Safety is paramount when working on your John Deere 2150. This pin highlights essential safety precautions to take before and during any repair work.  Protect yourself and avoid accidents. #JohnDeere #TractorSafety #RepairTips #FarmSafety,Safety,John Deere,Tractor",https://lawntrend.com/john-deere-2150-problems/?utm_source=pinterest&utm_campaign=john-deere-2150-safe,2025-04-28,Repair,https://lawntrend.com/john-deere-2150-problems/
2150: Identifying Worn Tractor Parts,https://res.cloudinary.com/dbcpfy04c/image/upload/v1618237451/placeholder.jpg,home-inspiration,,"Learn to spot the signs of wear and tear on your John Deere 2150. This pin helps you identify worn parts that may need replacement, preventing more serious problems down the road.  Proactive maintenance saves money! #JohnDeere2150 #WornParts #TractorMaintenance #FarmEquipment,Worn Parts,John Deere,Tractor",https://lawntrend.com/john-deere-2150-problems/?utm_source=pinterest&utm_campaign=2150-identifying-wor,2025-04-28,Inspection,https://lawntrend.com/john-deere-2150-problems/
John Deere 2150: The Ultimate Checklist,https://res.cloudinary.com/dbcpfy04c/image/upload/v1618237451/placeholder.jpg,home-inspiration,,"Before you head to the field, use this checklist to ensure your John Deere 2150 is in top working condition. This pin provides a comprehensive list of pre-operation checks and maintenance tasks.  Maximize uptime and minimize breakdowns! #JohnDeere #Checklist #TractorMaintenance #FarmLife,Checklist,John Deere,Tractor",https://lawntrend.com/john-deere-2150-problems/?utm_source=pinterest&utm_campaign=john-deere-2150-the-,2025-04-28,Pre-Operation,https://lawntrend.com/john-deere-2150-problems/
2150: Common Mistakes to Avoid When Repairing,https://res.cloudinary.com/dbcpfy04c/image/upload/v1618237451/placeholder.jpg,home-inspiration,,"Don't make these common mistakes when repairing your John Deere 2150! This pin highlights pitfalls to avoid, helping you save time, money, and frustration.  Learn from the experiences of others. #JohnDeere2150 #RepairMistakes #TractorRepair #DIY,Repair Mistakes,John Deere,Tractor",https://lawntrend.com/john-deere-2150-problems/?utm_source=pinterest&utm_campaign=2150-common-mistakes,2025-04-28,Troubleshooting,https://lawntrend.com/john-deere-2150-problems/
Title,https://res.cloudinary.com/dbcpfy04c/image/upload/v1618237451/placeholder.jpg,home-inspiration,,Description,https://lawntrend.com/cub-cadet-zero-turn-steering-problems/?utm_source=pinterest&utm_campaign=title,2025-04-28,Keywords,https://lawntrend.com/cub-cadet-zero-turn-steering-problems/
Cub Cadet Zero Turn: Steering SOS!,https://res.cloudinary.com/dbcpfy04c/image/upload/v1618237451/placeholder.jpg,home-inspiration,,"Is your Cub Cadet zero turn steering acting up? Don't let a frustrating steering issue ruin your lawn care! This guide dives deep into common problems – from loose linkages to hydraulic woes – and provides clear, step-by-step troubleshooting tips.  We'll help you diagnose the issue",https://lawntrend.com/cub-cadet-zero-turn-steering-problems/?utm_source=pinterest&utm_campaign=cub-cadet-zero-turn-,2025-04-28,potentially saving you hundreds on repair costs.  Get back to enjoying a perfectly manicured lawn! Click to learn how to fix it yourself & keep your machine running smoothly. #CubCadet #ZeroTurn #LawnMowerRepair #SteeringProblems,https://lawntrend.com/cub-cadet-zero-turn-steering-problems/
Cub Cadet Steering Fixes - DIY!,https://res.cloudinary.com/dbcpfy04c/image/upload/v1618237451/placeholder.jpg,home-inspiration,,"Don't stress over a wonky steering wheel! This post breaks down Cub Cadet zero turn steering problems into manageable steps. Learn to identify issues like worn components, low fluid levels",https://lawntrend.com/cub-cadet-zero-turn-steering-problems/?utm_source=pinterest&utm_campaign=cub-cadet-steering-f,2025-04-28,and sensor malfunctions.  We've got solutions for both simple fixes and more complex repairs.  Imagine the satisfaction of tackling this yourself! Click to read now and reclaim your weekend. #ZeroTurnMower #CubCadetRepair #DIYLawnCare #Steering,https://lawntrend.com/cub-cadet-zero-turn-steering-problems/
Hydraulic Steering Issues - Cub Cadet,https://res.cloudinary.com/dbcpfy04c/image/upload/v1618237451/placeholder.jpg,home-inspiration,,"Is your Cub Cadet zero turn struggling to steer smoothly?  Hydraulic problems are a common culprit. This post explains how to diagnose hydraulic leaks, low fluid, and pump failures.  We'll walk you through checking fluid levels, inspecting hoses",https://lawntrend.com/cub-cadet-zero-turn-steering-problems/?utm_source=pinterest&utm_campaign=hydraulic-steering-i,2025-04-28,and understanding the hydraulic system. Don't let a hydraulic issue sideline your mower! Click to learn more. #HydraulicRepair #CubCadetZeroTurn #LawnMowerMaintenance #Steering,https://lawntrend.com/cub-cadet-zero-turn-steering-problems/
Cub Cadet Zero Turn: Steering Tips,https://res.cloudinary.com/dbcpfy04c/image/upload/v1618237451/placeholder.jpg,home-inspiration,,"Keep your Cub Cadet zero turn steering in top condition with these essential maintenance tips!  We cover regular inspections, lubrication",https://lawntrend.com/cub-cadet-zero-turn-steering-problems/?utm_source=pinterest&utm_campaign=cub-cadet-zero-turn-,2025-04-28,and preventative measures to avoid common steering problems.  A little proactive care can save you headaches down the road.  Click to learn how to extend the life of your mower! #CubCadetMaintenance #ZeroTurnTips #LawnCarePrevention #SteeringCare,https://lawntrend.com/cub-cadet-zero-turn-steering-problems/
Fix Cub Cadet Steering Yourself!,https://res.cloudinary.com/dbcpfy04c/image/upload/v1618237451/placeholder.jpg,home-inspiration,,"Don't rely on expensive repair shops! This post empowers you to fix your Cub Cadet zero turn steering problems yourself.  We provide detailed instructions, helpful diagrams",https://lawntrend.com/cub-cadet-zero-turn-steering-problems/?utm_source=pinterest&utm_campaign=fix-cub-cadet-steeri,2025-04-28,and a list of necessary tools.  Save money and gain valuable skills – it's a win-win! Click to start your DIY repair. #DIYRepair #CubCadetFix #ZeroTurnDIY #SteeringTutorial,https://lawntrend.com/cub-cadet-zero-turn-steering-problems/
Cub Cadet Zero Turn: Steering Noise,https://res.cloudinary.com/dbcpfy04c/image/upload/v1618237451/placeholder.jpg,home-inspiration,,Hearing strange noises when you steer your Cub Cadet zero turn? This post helps you diagnose the source of the noise and provides potential solutions.  From loose bolts to worn bearings,https://lawntrend.com/cub-cadet-zero-turn-steering-problems/?utm_source=pinterest&utm_campaign=cub-cadet-zero-turn-,2025-04-28,we cover a range of possibilities.  Silence the noise and get back to mowing! #ZeroTurnNoise #CubCadetSounds #LawnMowerRepair #SteeringDiagnosis,https://lawntrend.com/cub-cadet-zero-turn-steering-problems/
Zero Turn Steering: Emergency Fixes,https://res.cloudinary.com/dbcpfy04c/image/upload/v1618237451/placeholder.jpg,home-inspiration,,Stuck with a steering problem mid-mow? This post offers temporary fixes to get you out of a bind.  While not a permanent solution,https://lawntrend.com/cub-cadet-zero-turn-steering-problems/?utm_source=pinterest&utm_campaign=zero-turn-steering-e,2025-04-28,these tips can help you finish the job safely.  Learn how to handle common steering emergencies. #ZeroTurnEmergency #CubCadetHelp #LawnCareRescue #SteeringFix,https://lawntrend.com/cub-cadet-zero-turn-steering-problems/
Cub Cadet Steering: Before You Start,https://res.cloudinary.com/dbcpfy04c/image/upload/v1618237451/placeholder.jpg,home-inspiration,,Before you dive into fixing your Cub Cadet zero turn steering,https://lawntrend.com/cub-cadet-zero-turn-steering-problems/?utm_source=pinterest&utm_campaign=cub-cadet-steering-b,2025-04-28,read this! We cover essential safety precautions and provide a checklist of tools you'll need.  Prepare properly for a successful repair. #ZeroTurnSafety #CubCadetPrep #LawnMowerTools #SteeringRepair,https://lawntrend.com/cub-cadet-zero-turn-steering-problems/
Zero Turn Steering: Cost of Repair,https://res.cloudinary.com/dbcpfy04c/image/upload/v1618237451/placeholder.jpg,home-inspiration,,Wondering how much it will cost to fix your Cub Cadet zero turn steering? This post provides a breakdown of potential repair costs,https://lawntrend.com/cub-cadet-zero-turn-steering-problems/?utm_source=pinterest&utm_campaign=zero-turn-steering-c,2025-04-28,from DIY fixes to professional services.  Make informed decisions about your repair options. #ZeroTurnCost #CubCadetRepairPrice #LawnMowerExpense #SteeringBudget,https://lawntrend.com/cub-cadet-zero-turn-steering-problems/
Cub Cadet Steering: Professional Help,https://res.cloudinary.com/dbcpfy04c/image/upload/v1618237451/placeholder.jpg,home-inspiration,,Sometimes,https://lawntrend.com/cub-cadet-zero-turn-steering-problems/?utm_source=pinterest&utm_campaign=cub-cadet-steering-p,2025-04-28,a DIY fix isn't enough. This post explains when to seek professional help for your Cub Cadet zero turn steering problems.  We also offer tips for finding a qualified mechanic. #ZeroTurnMechanic #CubCadetService #LawnMowerRepairShop #SteeringProfessional,https://lawntrend.com/cub-cadet-zero-turn-steering-problems/
Zero Turn Steering: Preventative Care,https://res.cloudinary.com/dbcpfy04c/image/upload/v1618237451/placeholder.jpg,home-inspiration,,"Don't wait for steering problems to arise! This post focuses on preventative maintenance to keep your Cub Cadet zero turn steering in top condition.  Simple steps can save you time, money",https://lawntrend.com/cub-cadet-zero-turn-steering-problems/?utm_source=pinterest&utm_campaign=zero-turn-steering-p,2025-04-28,and frustration. #ZeroTurnPrevention #CubCadetCare #LawnMowerTips #SteeringMaintenance,https://lawntrend.com/cub-cadet-zero-turn-steering-problems/
Cub Cadet Zero Turn: Steering Resources,https://res.cloudinary.com/dbcpfy04c/image/upload/v1618237451/placeholder.jpg,home-inspiration,,"Need more help with your Cub Cadet zero turn steering? This post provides a list of helpful resources, including manuals, forums",https://lawntrend.com/cub-cadet-zero-turn-steering-problems/?utm_source=pinterest&utm_campaign=cub-cadet-zero-turn-,2025-04-28,and online communities.  Connect with other owners and find the answers you need. #ZeroTurnResources #CubCadetForum #LawnMowerHelp #SteeringCommunity,https://lawntrend.com/cub-cadet-zero-turn-steering-problems/
Title,https://res.cloudinary.com/dbcpfy04c/image/upload/v1618237451/placeholder.jpg,home-inspiration,,Description,https://lawntrend.com/cub-cadet-volunteer-transmission-problems/?utm_source=pinterest&utm_campaign=title,2025-04-28,Keywords,https://lawntrend.com/cub-cadet-volunteer-transmission-problems/
Cub Cadet Volunteer Transmission: Is It Failing?,https://res.cloudinary.com/dbcpfy04c/image/upload/v1618237451/placeholder.jpg,home-inspiration,,"Don't let a failing Volunteer transmission ruin your lawn care! This pin dives deep into common Cub Cadet Volunteer transmission problems, from slipping gears to complete failure. Learn to diagnose issues yourself & decide if repair or replacement is the best route. We cover symptoms, potential causes",https://lawntrend.com/cub-cadet-volunteer-transmission-problems/?utm_source=pinterest&utm_campaign=cub-cadet-volunteer-,2025-04-28,and cost estimates to help you get back to mowing with confidence.  Avoid expensive surprises – read our guide now!  Is your weekend being stolen by lawnmower troubles? Let's fix it! #CubCadet #VolunteerTransmission #LawnMowerRepair #TransmissionProblems,https://lawntrend.com/cub-cadet-volunteer-transmission-problems/
Cub Cadet Volunteer Transmission Repair Guide,https://res.cloudinary.com/dbcpfy04c/image/upload/v1618237451/placeholder.jpg,home-inspiration,,Is your Cub Cadet Volunteer struggling? This pin links to our comprehensive guide on Volunteer transmission repair. We break down the process step-by-step,https://lawntrend.com/cub-cadet-volunteer-transmission-problems/?utm_source=pinterest&utm_campaign=cub-cadet-volunteer-,2025-04-28,helping you understand what's involved and if it's a DIY project or time to call a pro.  Don't get stuck with a broken mower – empower yourself with knowledge!  Save time & money with our expert advice. #CubCadetRepair #Volunteer #TransmissionFix #DIYLawnCare,https://lawntrend.com/cub-cadet-volunteer-transmission-problems/
Volunteer Transmission Slipping? Find Out Why!,https://res.cloudinary.com/dbcpfy04c/image/upload/v1618237451/placeholder.jpg,home-inspiration,,"Experiencing a slipping transmission on your Cub Cadet Volunteer? It's frustrating, but often fixable! This pin highlights the most common causes of slipping",https://lawntrend.com/cub-cadet-volunteer-transmission-problems/?utm_source=pinterest&utm_campaign=volunteer-transmissi,2025-04-28,from low fluid levels to worn-out components.  We'll help you pinpoint the problem and explore your repair options.  Get your mower running smoothly again!  Don't delay – a small issue can become a big expense. #CubCadetVolunteer #TransmissionSlipping #LawnMowerIssues #RepairTips,https://lawntrend.com/cub-cadet-volunteer-transmission-problems/
Volunteer Transmission: Repair or Replace?,https://res.cloudinary.com/dbcpfy04c/image/upload/v1618237451/placeholder.jpg,home-inspiration,,"Facing a major Volunteer transmission issue? This pin helps you decide whether to repair or replace your transmission. We weigh the pros and cons of each option, considering cost, complexity",https://lawntrend.com/cub-cadet-volunteer-transmission-problems/?utm_source=pinterest&utm_campaign=volunteer-transmissi,2025-04-28,and long-term reliability.  Make an informed decision that's right for your budget and needs.  Don't waste money on a temporary fix! #CubCadetVolunteer #TransmissionReplacement #RepairVsReplace #LawnCare,https://lawntrend.com/cub-cadet-volunteer-transmission-problems/
Diagnosing Cub Cadet Volunteer Transmission Issues,https://res.cloudinary.com/dbcpfy04c/image/upload/v1618237451/placeholder.jpg,home-inspiration,,"Confused about what's wrong with your Volunteer transmission? This pin offers a troubleshooting guide to help you diagnose common problems. We cover symptoms like noise, vibration",https://lawntrend.com/cub-cadet-volunteer-transmission-problems/?utm_source=pinterest&utm_campaign=diagnosing-cub-cadet,2025-04-28,and difficulty shifting.  Get to the root of the issue and find the right solution.  Stop guessing and start fixing! #CubCadetDiagnosis #VolunteerProblems #TransmissionTroubleshooting #LawnMowerHelp,https://lawntrend.com/cub-cadet-volunteer-transmission-problems/
Cub Cadet Volunteer Transmission Cost to Repair,https://res.cloudinary.com/dbcpfy04c/image/upload/v1618237451/placeholder.jpg,home-inspiration,,Wondering how much it will cost to repair your Cub Cadet Volunteer transmission? This pin provides a breakdown of typical repair costs,https://lawntrend.com/cub-cadet-volunteer-transmission-problems/?utm_source=pinterest&utm_campaign=cub-cadet-volunteer-,2025-04-28,including parts and labor.  Get a realistic estimate and avoid unexpected expenses.  Plan your budget and get your mower back in action. #CubCadetRepairCost #VolunteerTransmission #LawnMowerExpenses #RepairEstimate,https://lawntrend.com/cub-cadet-volunteer-transmission-problems/
Volunteer Transmission Noise: What Does It Mean?,https://res.cloudinary.com/dbcpfy04c/image/upload/v1618237451/placeholder.jpg,home-inspiration,,Hearing strange noises from your Volunteer transmission? This pin decodes the sounds and helps you identify potential problems.  From whining to grinding,https://lawntrend.com/cub-cadet-volunteer-transmission-problems/?utm_source=pinterest&utm_campaign=volunteer-transmissi,2025-04-28,we'll explain what each noise could indicate.  Don't ignore unusual sounds – they could signal a serious issue. #CubCadetNoise #TransmissionSounds #VolunteerDiagnosis #LawnMowerProblems,https://lawntrend.com/cub-cadet-volunteer-transmission-problems/
Cub Cadet Volunteer Transmission: Gear Problems,https://res.cloudinary.com/dbcpfy04c/image/upload/v1618237451/placeholder.jpg,home-inspiration,,Experiencing issues with the gears on your Cub Cadet Volunteer? This pin explores common gear-related problems and their solutions.  From stripped gears to difficulty shifting,https://lawntrend.com/cub-cadet-volunteer-transmission-problems/?utm_source=pinterest&utm_campaign=cub-cadet-volunteer-,2025-04-28,we'll help you get back on track.  Don't let gear problems slow you down! #CubCadetGears #VolunteerTransmission #GearProblems #LawnMowerRepair,https://lawntrend.com/cub-cadet-volunteer-transmission-problems/
Volunteer Transmission: Clutch Problems Explained,https://res.cloudinary.com/dbcpfy04c/image/upload/v1618237451/placeholder.jpg,home-inspiration,,Having trouble with the clutch on your Cub Cadet Volunteer? This pin breaks down common clutch problems and offers troubleshooting tips.  From slipping to sticking,https://lawntrend.com/cub-cadet-volunteer-transmission-problems/?utm_source=pinterest&utm_campaign=volunteer-transmissi,2025-04-28,we'll help you diagnose and fix the issue.  Get your clutch working smoothly again! #CubCadetClutch #VolunteerTransmission #ClutchProblems #LawnMowerRepair,https://lawntrend.com/cub-cadet-volunteer-transmission-problems/
Volunteer Transmission: Shifting Problems & Fixes,https://res.cloudinary.com/dbcpfy04c/image/upload/v1618237451/placeholder.jpg,home-inspiration,,Struggling to shift gears on your Cub Cadet Volunteer? This pin provides a guide to diagnosing and fixing shifting problems.  From stiff levers to missed gears,https://lawntrend.com/cub-cadet-volunteer-transmission-problems/?utm_source=pinterest&utm_campaign=volunteer-transmissi,2025-04-28,we'll help you get smooth shifting again.  Enjoy effortless mowing! #CubCadetShifting #VolunteerTransmission #ShiftingProblems #LawnMowerFix,https://lawntrend.com/cub-cadet-volunteer-transmission-problems/
Cub Cadet Volunteer Transmission: Torque Issues,https://res.cloudinary.com/dbcpfy04c/image/upload/v1618237451/placeholder.jpg,home-inspiration,,Experiencing a loss of power or torque? This pin explores potential causes of torque issues in your Cub Cadet Volunteer transmission.  From worn gears to low fluid,https://lawntrend.com/cub-cadet-volunteer-transmission-problems/?utm_source=pinterest&utm_campaign=cub-cadet-volunteer-,2025-04-28,we'll help you identify the problem.  Restore your mower's power! #CubCadetTorque #VolunteerTransmission #TorqueProblems #LawnMowerPower,https://lawntrend.com/cub-cadet-volunteer-transmission-problems/
Title,https://res.cloudinary.com/dbcpfy04c/image/upload/v1618237451/placeholder.jpg,home-inspiration,,Description,https://lawntrend.com/husqvarna-safety-switch-problems/?utm_source=pinterest&utm_campaign=title,2025-04-28,Keywords,https://lawntrend.com/husqvarna-safety-switch-problems/
Husqvarna Safety Switch: Fix It!,https://res.cloudinary.com/dbcpfy04c/image/upload/v1618237451/placeholder.jpg,home-inspiration,,"Is your Husqvarna mower refusing to start? Don't let a faulty safety switch ruin your weekend! This guide walks you through common Husqvarna safety switch problems, troubleshooting steps, and even DIY fixes. Save time & money by diagnosing the issue yourself. We cover blade engagement, operator presence",https://lawntrend.com/husqvarna-safety-switch-problems/?utm_source=pinterest&utm_campaign=husqvarna-safety-swi,2025-04-28,and more.  Frustrated with lawn care headaches? We've got you covered! Click to learn how to get back to enjoying your perfectly manicured lawn. #Husqvarna #LawnMower #SafetySwitch #DIYRepair,https://lawntrend.com/husqvarna-safety-switch-problems/
Husqvarna Won't Start? Check This!,https://res.cloudinary.com/dbcpfy04c/image/upload/v1618237451/placeholder.jpg,home-inspiration,,"Don't panic! A Husqvarna mower that won't start is often a simple safety switch issue. This pin leads to a detailed guide on identifying and resolving common problems.  We break down the troubleshooting process, making it easy even for beginners.  Imagine the satisfaction of fixing it yourself and avoiding costly repairs!  Learn how to test the switch, check wiring",https://lawntrend.com/husqvarna-safety-switch-problems/?utm_source=pinterest&utm_campaign=husqvarna-wont-start,2025-04-28,and restore power to your mower. #HusqvarnaMower #LawnCare #Troubleshooting #FixIt,https://lawntrend.com/husqvarna-safety-switch-problems/
Husqvarna Seat Switch Problems Solved,https://res.cloudinary.com/dbcpfy04c/image/upload/v1618237451/placeholder.jpg,home-inspiration,,"A faulty seat switch can be a major headache. This pin leads to a guide specifically addressing Husqvarna seat switch issues.  Learn how to test the switch, identify wiring problems",https://lawntrend.com/husqvarna-safety-switch-problems/?utm_source=pinterest&utm_campaign=husqvarna-seat-switc,2025-04-28,and restore functionality.  Don't risk injury – ensure your mower only runs when you're safely seated. Click to read and mow with peace of mind! #SeatSwitch #HusqvarnaRepair #MowerProblems #SafetyFirst,https://lawntrend.com/husqvarna-safety-switch-problems/
Husqvarna Safety Switch Replacement,https://res.cloudinary.com/dbcpfy04c/image/upload/v1618237451/placeholder.jpg,home-inspiration,,"When repair isn't enough, replacement is key. This pin directs you to a guide on replacing your Husqvarna safety switch.  We cover finding the right part, installation instructions",https://lawntrend.com/husqvarna-safety-switch-problems/?utm_source=pinterest&utm_campaign=husqvarna-safety-swi,2025-04-28,and safety precautions.  Don't let a broken switch keep you from enjoying your lawn. Click to learn how to get your mower running smoothly again! #SafetySwitchReplacement #HusqvarnaParts #MowerMaintenance #DIY,https://lawntrend.com/husqvarna-safety-switch-problems/
Husqvarna Operator Presence Switch,https://res.cloudinary.com/dbcpfy04c/image/upload/v1618237451/placeholder.jpg,home-inspiration,,"Learn about the crucial role of the operator presence switch on your Husqvarna mower. This pin links to a guide explaining its function, common problems",https://lawntrend.com/husqvarna-safety-switch-problems/?utm_source=pinterest&utm_campaign=husqvarna-operator-p,2025-04-28,and how to fix them.  Safety is paramount! Click to read and ensure your mower operates responsibly. #OperatorPresenceSwitch #HusqvarnaSafety #MowerFeatures #LawnCare,https://lawntrend.com/husqvarna-safety-switch-problems/
Husqvarna Mower Safety: A Guide,https://res.cloudinary.com/dbcpfy04c/image/upload/v1618237451/placeholder.jpg,home-inspiration,,Prioritize safety with your Husqvarna mower! This pin links to a comprehensive guide covering safety features,https://lawntrend.com/husqvarna-safety-switch-problems/?utm_source=pinterest&utm_campaign=husqvarna-mower-safe,2025-04-28,including the safety switch.  Learn how to operate your mower safely and prevent accidents.  Protect yourself and your family. Click to read and mow with confidence! #HusqvarnaSafetyGuide #MowerSafetyTips #LawnCareSafety #ProtectYourself,https://lawntrend.com/husqvarna-safety-switch-problems/
