Title,Media URL,Pinterest board,Thumbnail,Description,Link,Publish date,Keywords,Source URL
Title,https://res.cloudinary.com/ddxyyzkuq/image/upload/v1745965148/pin_1_1_ycniyo.webp,please-provide-the-title-and-keywords-i-need-that-information-to-suggest-a-board-name-once,,Description,https://lawntrend.com/craftsman-hydrostatic-transmission-problems/?utm_source=pinterest&utm_campaign=title,2025-04-29,Keywords,https://lawntrend.com/craftsman-hydrostatic-transmission-problems/
Craftsman Hydrostatic: Is it Failing?,https://res.cloudinary.com/ddxyyzkuq/image/upload/v1745965154/pin_1_2_ftll34.webp,lawn-repair-ideas,,"Don't let a failing Craftsman hydrostatic transmission ruin your lawn care! This pin leads to a comprehensive guide diagnosing common problems like slipping, jerking, and noise. Learn to identify issues early",https://lawntrend.com/craftsman-hydrostatic-transmission-problems/?utm_source=pinterest&utm_campaign=craftsman-hydrostati,2025-04-29,saving you money on costly repairs or replacements. We cover everything from low fluid levels to pump failures.  Is your mower struggling?  Click to learn how to troubleshoot and potentially fix it yourself!  Avoid the frustration of a broken mower and get back to enjoying your beautiful yard. #CraftsmanMower #HydrostaticTransmission #LawnMowerRepair #DIYRepair,https://lawntrend.com/craftsman-hydrostatic-transmission-problems/
Craftsman Mower Slipping? Fix It!,https://res.cloudinary.com/ddxyyzkuq/image/upload/v1745965160/pin_1_3_cmaias.webp,mower-repair-ideas,,Is your Craftsman riding mower slipping instead of smoothly moving? This pin directs you to our detailed article on diagnosing and fixing hydrostatic transmission slippage. We break down the causes,https://lawntrend.com/craftsman-hydrostatic-transmission-problems/?utm_source=pinterest&utm_campaign=craftsman-mower-slip,2025-04-29,from worn belts to internal pump issues.  Don't waste another weekend battling a frustrating mower!  Learn how to restore your mower's power and efficiency.  Click now for a step-by-step guide! #Craftsman #RidingMower #TransmissionRepair #Hydrostatic,https://lawntrend.com/craftsman-hydrostatic-transmission-problems/
Hydrostatic Transmission Noise: Why?,https://res.cloudinary.com/ddxyyzkuq/image/upload/v1745965166/pin_1_4_bvuvuv.webp,lawn-repair-ideas,,That annoying whine or grinding noise from your Craftsman mower? It could be a sign of a serious hydrostatic transmission problem. This pin links to our guide explaining the common causes of noise,https://lawntrend.com/craftsman-hydrostatic-transmission-problems/?utm_source=pinterest&utm_campaign=hydrostatic-transmis,2025-04-29,including worn bearings and gear issues.  Ignoring it can lead to complete failure!  Learn to identify the source of the sound and take action.  Click to protect your investment! #LawnCare #MowerNoise #CraftsmanHydrostatic #RepairGuide,https://lawntrend.com/craftsman-hydrostatic-transmission-problems/
Craftsman Hydrostatic: Fluid Check!,https://res.cloudinary.com/ddxyyzkuq/image/upload/v1745965172/pin_1_5_lr5afi.webp,lawn-repair-ideas,,"Regular maintenance is key! This pin highlights the importance of checking your Craftsman hydrostatic transmission fluid. Our blog post details how to check the fluid level, type",https://lawntrend.com/craftsman-hydrostatic-transmission-problems/?utm_source=pinterest&utm_campaign=craftsman-hydrostati,2025-04-29,and when to change it.  Preventative maintenance can save you hundreds!  Don't let low fluid cause damage. Click to learn the simple steps to keep your mower running smoothly. #HydrostaticFluid #MowerMaintenance #CraftsmanMower #PreventativeCare,https://lawntrend.com/craftsman-hydrostatic-transmission-problems/
Craftsman Mower Jerking & Surging?,https://res.cloudinary.com/ddxyyzkuq/image/upload/v1745965177/pin_1_6_b98ah2.webp,mower-repair-ideas,,"Is your Craftsman mower jerking or surging while you mow? This pin points to our guide on diagnosing and resolving these frustrating issues. We explore potential causes like clogged filters, faulty solenoids, and pump problems.  Get a smooth",https://lawntrend.com/craftsman-hydrostatic-transmission-problems/?utm_source=pinterest&utm_campaign=craftsman-mower-jerk,2025-04-29,even cut again!  Click to learn how to troubleshoot and fix the problem. #MowerProblems #CraftsmanMower #HydrostaticIssues #LawnCareTips,https://lawntrend.com/craftsman-hydrostatic-transmission-problems/
Craftsman Mower Won't Move: Help!,https://res.cloudinary.com/ddxyyzkuq/image/upload/v1745965183/pin_1_7_y8asl1.webp,mower-repair-ideas,,"Your Craftsman mower won't move – now what? This pin links to our article addressing this common problem. We cover potential causes like low fluid, broken belts",https://lawntrend.com/craftsman-hydrostatic-transmission-problems/?utm_source=pinterest&utm_campaign=craftsman-mower-wont,2025-04-29,and pump failures.  Don't panic!  Click for solutions. #MowerWontMove #Craftsman #Hydrostatic #LawnCare,https://lawntrend.com/craftsman-hydrostatic-transmission-problems/
Diagnosing Craftsman Mower Issues,https://res.cloudinary.com/ddxyyzkuq/image/upload/v1745965189/pin_1_8_vayevu.webp,lawn-care-ideas,,"This pin leads to a guide on systematically diagnosing problems with your Craftsman mower, focusing on the hydrostatic transmission.  Don't just guess",https://lawntrend.com/craftsman-hydrostatic-transmission-problems/?utm_source=pinterest&utm_campaign=diagnosing-craftsman,2025-04-29,find the root cause! Click to learn the process. #MowerDiagnosis #Craftsman #Hydrostatic #LawnCare,https://lawntrend.com/craftsman-hydrostatic-transmission-problems/
Title,https://res.cloudinary.com/ddxyyzkuq/image/upload/v1745965229/pin_2_1_vsigrl.webp,please-provide-the-title-and-keywords-i-need-that-information-to-suggest-a-board-name-once,,Description,https://lawntrend.com/craftsman-m220-lawn-mower-wont-start/?utm_source=pinterest&utm_campaign=title,2025-04-29,Keywords,https://lawntrend.com/craftsman-m220-lawn-mower-wont-start/
Craftsman M220: Won't Start? Fix It!,https://res.cloudinary.com/ddxyyzkuq/image/upload/v1745965236/pin_2_2_jcmtt1.webp,lawn-repair-ideas,,"Is your Craftsman M220 lawn mower refusing to start? Don't sweat it! This guide walks you through common issues like a clogged carburetor, faulty spark plug",https://lawntrend.com/craftsman-m220-lawn-mower-wont-start/?utm_source=pinterest&utm_campaign=craftsman-m220-wont-,2025-04-29,or low oil. We'll help you diagnose the problem and get back to enjoying a perfectly manicured lawn.  Save money on repairs and DIY like a pro!  Frustrated with yard work? We've got your back. Click to learn how to revive your mower! #CraftsmanM220 #LawnMowerRepair #DIYRepair #SmallEngineRepair,https://lawntrend.com/craftsman-m220-lawn-mower-wont-start/
Craftsman M220 Starting Issues?,https://res.cloudinary.com/ddxyyzkuq/image/upload/v1745965242/pin_2_3_qutooq.webp,lawn-repair-ideas,,Don't let a stubborn Craftsman M220 ruin your weekend! This post details the most frequent reasons why your mower won't start,https://lawntrend.com/craftsman-m220-lawn-mower-wont-start/?utm_source=pinterest&utm_campaign=craftsman-m220-start,2025-04-29,from simple fixes like checking the gas to more involved troubleshooting.  We break down each step with clear instructions and helpful images.  Imagine the satisfaction of fixing it yourself!  Get your lawn looking great again – click to learn more! #Craftsman #LawnMower #NoStart #FixIt,https://lawntrend.com/craftsman-m220-lawn-mower-wont-start/
M220 Carburetor Cleaning Guide,https://res.cloudinary.com/ddxyyzkuq/image/upload/v1745965248/pin_2_4_xnbdje.webp,lawn-mower-ideas,,"Is a clogged carburetor stopping your Craftsman M220? This guide provides a step-by-step tutorial on how to clean your carburetor and get your mower running smoothly again.  Don't replace it, restore it!  We'll show you exactly what to do",https://lawntrend.com/craftsman-m220-lawn-mower-wont-start/?utm_source=pinterest&utm_campaign=m220-carburetor-clea,2025-04-29,even if you've never worked on a small engine before.  Click to learn and save! #CarburetorClean #CraftsmanM220 #LawnMowerMaintenance #DIY,https://lawntrend.com/craftsman-m220-lawn-mower-wont-start/
Spark Plug Secrets for M220,https://res.cloudinary.com/ddxyyzkuq/image/upload/v1745965254/pin_2_5_iu1koz.webp,lawn-repair-ideas,,A faulty spark plug can be the culprit behind a non-starting Craftsman M220. Learn how to easily test and replace your spark plug with our detailed guide.  A small part,https://lawntrend.com/craftsman-m220-lawn-mower-wont-start/?utm_source=pinterest&utm_campaign=spark-plug-secrets-f,2025-04-29,big impact!  Don't let a simple fix turn into a costly repair.  Get back to mowing with confidence – click now! #SparkPlug #Craftsman #LawnMowerFix #EngineRepair,https://lawntrend.com/craftsman-m220-lawn-mower-wont-start/
Craftsman M220: Fuel System Fix,https://res.cloudinary.com/ddxyyzkuq/image/upload/v1745965260/pin_2_6_ufu2uh.webp,lawn-repair-ideas,,"Troubleshooting your Craftsman M220's fuel system can be daunting. We simplify the process! This guide covers fuel lines, fuel filters",https://lawntrend.com/craftsman-m220-lawn-mower-wont-start/?utm_source=pinterest&utm_campaign=craftsman-m220-fuel-,2025-04-29,and fuel shut-off valves.  Get your mower fueled up and ready to go!  Don't let a fuel issue keep you grounded – click to learn! #FuelSystem #Craftsman #LawnMowerProblems #DIY,https://lawntrend.com/craftsman-m220-lawn-mower-wont-start/
M220 Safety First! Repair Guide,https://res.cloudinary.com/ddxyyzkuq/image/upload/v1745965267/pin_2_7_oujz75.webp,lawn-repair-ideas,,"Safety is paramount when repairing your Craftsman M220. This post emphasizes essential safety precautions to take before, during, and after any repair work.  Protect yourself and your mower!  Work smart",https://lawntrend.com/craftsman-m220-lawn-mower-wont-start/?utm_source=pinterest&utm_campaign=m220-safety-first-re,2025-04-29,not hard – click for safety tips. #LawnMowerSafety #CraftsmanM220 #DIYSafety #RepairTips,https://lawntrend.com/craftsman-m220-lawn-mower-wont-start/
Craftsman M220: Starter Issues?,https://res.cloudinary.com/ddxyyzkuq/image/upload/v1745965273/pin_2_8_lghwze.webp,lawn-repair-ideas,,Is your Craftsman M220 starter failing? This guide explores common starter problems and how to diagnose and potentially fix them.  From solenoid issues to worn gears,https://lawntrend.com/craftsman-m220-lawn-mower-wont-start/?utm_source=pinterest&utm_campaign=craftsman-m220-start,2025-04-29,we've got you covered.  Don't get stuck – click to learn! #StarterMotor #Craftsman #LawnMowerRepair #SmallEngine,https://lawntrend.com/craftsman-m220-lawn-mower-wont-start/
M220: Easy Troubleshooting Steps,https://res.cloudinary.com/ddxyyzkuq/image/upload/v1745965279/pin_2_9_tw5hhf.webp,lawn-repair-ideas,,Feeling overwhelmed? This post breaks down Craftsman M220 troubleshooting into simple,https://lawntrend.com/craftsman-m220-lawn-mower-wont-start/?utm_source=pinterest&utm_campaign=m220-easy-troublesho,2025-04-29,manageable steps.  We'll help you pinpoint the problem quickly and efficiently.  Get your lawn back on track – click to start troubleshooting! #Troubleshooting #CraftsmanM220 #LawnMowerHelp #DIYGuide,https://lawntrend.com/craftsman-m220-lawn-mower-wont-start/
Craftsman M220: Battery Check,https://res.cloudinary.com/ddxyyzkuq/image/upload/v1745965284/pin_2_10_agv5tz.webp,lawn-repair-ideas,,If your M220 has electric start,https://lawntrend.com/craftsman-m220-lawn-mower-wont-start/?utm_source=pinterest&utm_campaign=craftsman-m220-batte,2025-04-29,a dead battery could be the issue. Learn how to test your battery and determine if it needs replacing.  Don't be left stranded!  Get your mower powered up – click to learn more. #LawnMowerBattery #Craftsman #ElectricStart #BatteryTest,https://lawntrend.com/craftsman-m220-lawn-mower-wont-start/
M220: Air Filter Replacement,https://res.cloudinary.com/ddxyyzkuq/image/upload/v1745965291/pin_2_11_qv4ekv.webp,lawn-care-ideas,,A dirty air filter restricts airflow and can cause starting problems. This guide shows you how to easily replace your Craftsman M220's air filter.  Breathe new life into your mower!  Simple maintenance,https://lawntrend.com/craftsman-m220-lawn-mower-wont-start/?utm_source=pinterest&utm_campaign=m220-air-filter-repl,2025-04-29,big results – click to learn. #AirFilter #CraftsmanM220 #LawnMowerMaintenance #DIY,https://lawntrend.com/craftsman-m220-lawn-mower-wont-start/
M220: Recoil Starter Repair,https://res.cloudinary.com/ddxyyzkuq/image/upload/v1745965297/pin_2_12_kclfzt.webp,lawn-repair-ideas,,If your Craftsman M220 has a recoil starter,https://lawntrend.com/craftsman-m220-lawn-mower-wont-start/?utm_source=pinterest&utm_campaign=m220-recoil-starter-,2025-04-29,learn how to repair or replace it.  Don't struggle with a broken pull cord!  Get back to manual starting with ease – click to learn. #RecoilStarter #Craftsman #LawnMowerRepair #PullCord,https://lawntrend.com/craftsman-m220-lawn-mower-wont-start/
Craftsman M220: Fuel Line Guide,https://res.cloudinary.com/ddxyyzkuq/image/upload/v1745965303/pin_2_13_otdtg6.webp,lawn-repair-ideas,,"Cracked or clogged fuel lines can prevent your Craftsman M220 from starting. This guide shows you how to inspect, replace",https://lawntrend.com/craftsman-m220-lawn-mower-wont-start/?utm_source=pinterest&utm_campaign=craftsman-m220-fuel-,2025-04-29,and secure your fuel lines.  Keep the fuel flowing – click to learn! #FuelLine #CraftsmanM220 #LawnMowerFuel #DIY,https://lawntrend.com/craftsman-m220-lawn-mower-wont-start/
M220: Tools You'll Need,https://res.cloudinary.com/ddxyyzkuq/image/upload/v1745965309/pin_2_14_nvgtwf.webp,lawn-repair-ideas,,Before you start,https://lawntrend.com/craftsman-m220-lawn-mower-wont-start/?utm_source=pinterest&utm_campaign=m220-tools-youll-nee,2025-04-29,make sure you have the right tools! This post lists the essential tools for repairing your Craftsman M220.  Be prepared for success – click to see the list! #LawnMowerTools #Craftsman #DIYRepair #ToolList,https://lawntrend.com/craftsman-m220-lawn-mower-wont-start/
M220: Is it Worth Repairing?,https://res.cloudinary.com/ddxyyzkuq/image/upload/v1745965315/pin_2_15_abczr8.webp,lawn-repair-ideas,,Sometimes,https://lawntrend.com/craftsman-m220-lawn-mower-wont-start/?utm_source=pinterest&utm_campaign=m220-is-it-worth-rep,2025-04-29,repair costs can exceed the value of the mower. This post helps you decide if repairing your Craftsman M220 is the right choice.  Make an informed decision – click to learn! #LawnMowerRepair #CraftsmanM220 #CostVsBenefit #DIY,https://lawntrend.com/craftsman-m220-lawn-mower-wont-start/
Craftsman M220: Revive Your Mower!,https://res.cloudinary.com/ddxyyzkuq/image/upload/v1745965322/pin_2_16_kq1dhk.webp,lawn-repair-ideas,,Don't give up on your Craftsman M220! This guide empowers you to diagnose and fix starting problems,https://lawntrend.com/craftsman-m220-lawn-mower-wont-start/?utm_source=pinterest&utm_campaign=craftsman-m220-reviv,2025-04-29,saving you money and frustration.  Get back to enjoying your lawn – click to revive your mower! #Craftsman #LawnMower #DIY #FixItYourself,https://lawntrend.com/craftsman-m220-lawn-mower-wont-start/
Title,https://res.cloudinary.com/ddxyyzkuq/image/upload/v1745965362/pin_3_1_gfmvh1.webp,please-provide-the-title-and-keywords-i-need-that-information-to-suggest-a-board-name-once,,Description,https://lawntrend.com/craftsman-riding-mower-will-go-in-reverse-but-not-forward/?utm_source=pinterest&utm_campaign=title,2025-04-29,Keywords,https://lawntrend.com/craftsman-riding-mower-will-go-in-reverse-but-not-forward/
Craftsman Mower: Forward Gear Issues,https://res.cloudinary.com/ddxyyzkuq/image/upload/v1745965368/pin_3_2_jlfsdi.webp,mower-repair-ideas,,"Frustrated your Craftsman mower won't go forward? This post dives deep into the reasons why, covering everything from the shift linkage to the drive clutch.  We'll show you how to identify the problem and offer practical solutions",https://lawntrend.com/craftsman-riding-mower-will-go-in-reverse-but-not-forward/?utm_source=pinterest&utm_campaign=craftsman-mower-forw,2025-04-29,even for beginners. Don't let a broken mower ruin your weekend! Learn to troubleshoot and repair it yourself. Click to read now! #Craftsman #RidingMower #MowerRepair #LawnCare,https://lawntrend.com/craftsman-riding-mower-will-go-in-reverse-but-not-forward/
Fix a Craftsman Mower - No Forward!,https://res.cloudinary.com/ddxyyzkuq/image/upload/v1745965374/pin_3_3_eukw5b.webp,lawn-repair-ideas,,Don't let a stubborn Craftsman riding mower ruin your summer! This guide tackles the frustrating issue of a mower that goes in reverse but not forward. We break down the potential causes,https://lawntrend.com/craftsman-riding-mower-will-go-in-reverse-but-not-forward/?utm_source=pinterest&utm_campaign=fix-a-craftsman-mowe,2025-04-29,from simple fixes like a loose belt to more complex issues like a damaged transmission.  Get your lawn looking great again – click to learn more! #RidingMowerProblems #CraftsmanFix #LawnMowerMaintenance #DIY,https://lawntrend.com/craftsman-riding-mower-will-go-in-reverse-but-not-forward/
Craftsman Mower Won't Move Forward?,https://res.cloudinary.com/ddxyyzkuq/image/upload/v1745965381/pin_3_4_ejuixa.webp,mower-repair-ideas,,Is your Craftsman riding mower stuck?  This blog post is your lifeline! We'll help you pinpoint why it won't go forward,https://lawntrend.com/craftsman-riding-mower-will-go-in-reverse-but-not-forward/?utm_source=pinterest&utm_campaign=craftsman-mower-wont,2025-04-29,offering clear instructions and helpful diagrams.  Avoid costly mechanic visits and take control of your lawn care.  Click to discover the solution and get mowing! #MowerTroubleshooting #CraftsmanRidingMower #LawnCareTips #FixItYourself,https://lawntrend.com/craftsman-riding-mower-will-go-in-reverse-but-not-forward/
Craftsman Mower: Belt Troubleshooting,https://res.cloudinary.com/ddxyyzkuq/image/upload/v1745965386/pin_3_5_wff58i.webp,mower-repair-ideas,,"A worn or broken belt is a common culprit when a Craftsman mower won't go forward. This post focuses specifically on belt inspection, replacement",https://lawntrend.com/craftsman-riding-mower-will-go-in-reverse-but-not-forward/?utm_source=pinterest&utm_campaign=craftsman-mower-belt,2025-04-29,and tensioning.  Learn how to quickly identify a faulty belt and get your mower back in action. Click for a step-by-step guide! #MowerBelt #CraftsmanRepair #LawnMowerParts #DIYLawnCare,https://lawntrend.com/craftsman-riding-mower-will-go-in-reverse-but-not-forward/
Craftsman Mower Transmission Fix,https://res.cloudinary.com/ddxyyzkuq/image/upload/v1745965392/pin_3_6_n9pcgs.webp,mower-repair-ideas,,Is a faulty transmission preventing your Craftsman mower from going forward? This post explores transmission issues,https://lawntrend.com/craftsman-riding-mower-will-go-in-reverse-but-not-forward/?utm_source=pinterest&utm_campaign=craftsman-mower-tran,2025-04-29,offering diagnostic tips and potential repair solutions.  We'll help you determine if a repair is feasible or if replacement is necessary. Click to learn more! #MowerTransmission #CraftsmanMowerFix #LawnEquipment #RepairGuide,https://lawntrend.com/craftsman-riding-mower-will-go-in-reverse-but-not-forward/
DIY Craftsman Mower Repair Guide,https://res.cloudinary.com/ddxyyzkuq/image/upload/v1745965398/pin_3_7_uxnoct.webp,lawn-repair-ideas,,Save hundreds on repair costs! This guide provides a detailed,https://lawntrend.com/craftsman-riding-mower-will-go-in-reverse-but-not-forward/?utm_source=pinterest&utm_campaign=diy-craftsman-mower-,2025-04-29,step-by-step approach to fixing a Craftsman riding mower that won't go forward.  We cover common problems and offer practical solutions for all skill levels. Click to start your DIY repair! #DIYRepair #CraftsmanMower #LawnMowerFix #SaveMoney,https://lawntrend.com/craftsman-riding-mower-will-go-in-reverse-but-not-forward/
Easy Craftsman Mower Fixes,https://res.cloudinary.com/ddxyyzkuq/image/upload/v1745965406/pin_3_8_mcspoz.webp,lawn-mower-ideas,,Simple fixes can often resolve a Craftsman mower that won't go forward. This post highlights easy-to-implement solutions,https://lawntrend.com/craftsman-riding-mower-will-go-in-reverse-but-not-forward/?utm_source=pinterest&utm_campaign=easy-craftsman-mower,2025-04-29,like checking the safety switches and adjusting the shift cable.  Get your mower running quickly and easily! Click to learn more. #EasyFixes #CraftsmanMower #LawnMower #DIY,https://lawntrend.com/craftsman-riding-mower-will-go-in-reverse-but-not-forward/
Riding Mower Repair: Step-by-Step,https://res.cloudinary.com/ddxyyzkuq/image/upload/v1745965412/pin_3_9_jhwdom.webp,lawn-repair-ideas,,"This post provides a comprehensive, step-by-step guide to repairing a Craftsman riding mower that won't go forward.  We cover everything from diagnosis to repair",https://lawntrend.com/craftsman-riding-mower-will-go-in-reverse-but-not-forward/?utm_source=pinterest&utm_campaign=riding-mower-repair-,2025-04-29,making it easy for anyone to tackle the project. Click to get started! #StepByStepRepair #CraftsmanMower #LawnMowerFix #DIY,https://lawntrend.com/craftsman-riding-mower-will-go-in-reverse-but-not-forward/
Riding Mower: When to Call a Pro,https://res.cloudinary.com/ddxyyzkuq/image/upload/v1745965418/pin_3_10_lrshlw.webp,lawn-care-ideas,,Sometimes,https://lawntrend.com/craftsman-riding-mower-will-go-in-reverse-but-not-forward/?utm_source=pinterest&utm_campaign=riding-mower-when-to,2025-04-29,a repair is best left to the professionals. This post helps you determine when it's time to call a mechanic for your Craftsman riding mower.  Avoid further damage and ensure a safe repair. Click to learn more! #MowerRepair #CraftsmanMower #LawnCare #ProfessionalHelp,https://lawntrend.com/craftsman-riding-mower-will-go-in-reverse-but-not-forward/
Title,https://res.cloudinary.com/ddxyyzkuq/image/upload/v1745965471/pin_4_1_luo7et.webp,please-provide-the-title-and-keywords-i-need-that-information-to-suggest-a-board-name-once,,Description,https://lawntrend.com/craftsman-riding-mower-steering-problems/?utm_source=pinterest&utm_campaign=title,2025-04-29,Keywords,https://lawntrend.com/craftsman-riding-mower-steering-problems/
Craftsman Mower Steering Fix!,https://res.cloudinary.com/ddxyyzkuq/image/upload/v1745965476/pin_4_2_brsoae.webp,mower-repair-ideas,,"Is your Craftsman riding mower steering feeling loose, jerky, or completely unresponsive? Don't let a frustrating steering issue ruin your lawn care! This guide dives deep into common Craftsman riding mower steering problems – from worn tie rods to a faulty steering gearbox. We'll walk you through easy DIY diagnostics and repairs, saving you money on expensive mechanic bills.  Learn how to identify the root cause, find the right parts, and get back to enjoying a smooth, effortless mow.  Don't suffer through another bumpy ride – click to learn more and reclaim your lawn! #CraftsmanMower #RidingMower #SteeringRepair #DIYLawnCare"",Craftsman,Steering,Repair",https://lawntrend.com/craftsman-riding-mower-steering-problems/?utm_source=pinterest&utm_campaign=craftsman-mower-stee,2025-04-29,Mower,https://lawntrend.com/craftsman-riding-mower-steering-problems/
Loose Steering? Easy Fixes!,https://res.cloudinary.com/ddxyyzkuq/image/upload/v1745965483/pin_4_3_jq3bfj.webp,car-repair-ideas,,"That wobbly steering wheel on your Craftsman mower is more than just annoying – it's a safety hazard!  This post breaks down the most frequent causes of loose steering in Craftsman riding mowers, including worn components and linkage issues.  We provide clear, step-by-step instructions and helpful visuals to guide you through the repair process.  Imagine the satisfaction of fixing it yourself and the money you'll save!  Get your mower steering straight again – read now! #Craftsman #RidingMowerRepair #SteeringWheel #LawnMower"",Steering Wheel,Loose Steering,Craftsman",https://lawntrend.com/craftsman-riding-mower-steering-problems/?utm_source=pinterest&utm_campaign=loose-steering-easy-,2025-04-29,Repair,https://lawntrend.com/craftsman-riding-mower-steering-problems/
Steering Gearbox Problems?,https://res.cloudinary.com/ddxyyzkuq/image/upload/v1745965489/pin_4_4_ocmfet.webp,auto-repair-ideas,,"Is your Craftsman riding mower steering feeling stiff or making strange noises? It could be a sign of a failing steering gearbox.  This guide explains how to diagnose a faulty gearbox, understand the symptoms, and determine if replacement is necessary. We cover everything from checking for leaks to inspecting internal components. Don't ignore this issue – a failing gearbox can lead to complete steering failure!  Click to learn how to keep your mower running smoothly. #SteeringGearbox #CraftsmanMower #MowerRepair #DIY"",Steering Gearbox,Mower Repair,Craftsman",https://lawntrend.com/craftsman-riding-mower-steering-problems/?utm_source=pinterest&utm_campaign=steering-gearbox-pro,2025-04-29,Diagnosis,https://lawntrend.com/craftsman-riding-mower-steering-problems/
DIY Craftsman Steering Repair,https://res.cloudinary.com/ddxyyzkuq/image/upload/v1745965497/pin_4_5_ezlxvu.webp,mower-repair-ideas,,"Don't pay a fortune for mower repairs! This blog post empowers you to tackle Craftsman riding mower steering problems yourself. We cover common issues like tie rod ends, drag links, and steering sectors.  With our detailed instructions and helpful photos, you'll be able to confidently diagnose and fix your mower's steering.  Enjoy the freedom of a perfectly steered mower and the pride of a job well done! #DIYRepair #Craftsman #RidingMower #Steering"",DIY,Craftsman,Steering",https://lawntrend.com/craftsman-riding-mower-steering-problems/?utm_source=pinterest&utm_campaign=diy-craftsman-steeri,2025-04-29,Riding Mower,https://lawntrend.com/craftsman-riding-mower-steering-problems/
