Title,Media URL,Pinterest board,Thumbnail,Description,Link,Publish date,Keywords,Source URL
Chandelier Cleaning: Save Time & Money!,https://res.cloudinary.com/dbcpfy04c/image/upload/v1618237451/placeholder.jpg,home-inspiration,,"Stop spending a fortune on professional cleaning! ðŸ’° This post shows you how to clean your chandelier yourself, saving you time and money.  We'll share budget-friendly tips and techniques for a sparkling result. Click to learn how to DIY! #chandeliercleaning #diycleaning #savemoney #homemaintenance,chandelier,DIY,money saving",https://www.beacleaner.com/how-to-clean-a-chandelier-without-taking-it-down?utm_source=pinterest&utm_campaign=chandelier-cleaning-,2025-04-30,maintenance,https://www.beacleaner.com/how-to-clean-a-chandelier-without-taking-it-down
How to Clean a Crystal Chandelier,https://res.cloudinary.com/dbcpfy04c/image/upload/v1618237451/placeholder.jpg,home-inspiration,,"Crystal chandeliers deserve special care!ðŸ’Ž This guide provides specific instructions for cleaning crystal chandeliers without causing damage. Learn how to maintain their sparkle and brilliance for years to come. Click to learn the secrets! #crystalchandelier #chandeliercleaning #homedecor #sparkle,crystal,chandelier,cleaning",https://www.beacleaner.com/how-to-clean-a-chandelier-without-taking-it-down?utm_source=pinterest&utm_campaign=how-to-clean-a-cryst,2025-04-30,sparkle,https://www.beacleaner.com/how-to-clean-a-chandelier-without-taking-it-down
Chandelier Cleaning: The Ultimate Guide,https://res.cloudinary.com/dbcpfy04c/image/upload/v1618237451/placeholder.jpg,home-inspiration,,"Everything you need to know about cleaning your chandelier is right here! ðŸ“š This comprehensive guide covers all aspects of chandelier cleaning, from dusting to polishing.  Get ready for a dazzling transformation! Click to read the ultimate guide. #chandeliercleaning #homemaintenance #cleaningtips #ultimateguide,chandelier,cleaning,maintenance",https://www.beacleaner.com/how-to-clean-a-chandelier-without-taking-it-down?utm_source=pinterest&utm_campaign=chandelier-cleaning-,2025-04-30,guide,https://www.beacleaner.com/how-to-clean-a-chandelier-without-taking-it-down
Chandelier Cleaning: No Streaks!,https://res.cloudinary.com/dbcpfy04c/image/upload/v1618237451/placeholder.jpg,home-inspiration,,"Tired of streaks after cleaning your chandelier? ðŸ˜© This post reveals the secret to a streak-free shine.  Learn the best techniques and products to use for a flawless finish.  Enjoy a beautifully clean chandelier without the frustration! Click to learn more. #chandeliercleaning #nostreaks #homedecor #cleaninghacks,chandelier,streaks,cleaning",https://www.beacleaner.com/how-to-clean-a-chandelier-without-taking-it-down?utm_source=pinterest&utm_campaign=chandelier-cleaning-,2025-04-30,hacks,https://www.beacleaner.com/how-to-clean-a-chandelier-without-taking-it-down
Chandelier Cleaning for High Ceilings,https://res.cloudinary.com/dbcpfy04c/image/upload/v1618237451/placeholder.jpg,home-inspiration,,"High ceilings? No problem! ðŸªœ This post offers solutions for cleaning chandeliers in hard-to-reach places.  Learn how to safely and effectively clean your chandelier without a ladder. Click to discover the techniques! #chandeliercleaning #highceilings #safecleaning #homemaintenance,chandelier,high ceilings,safe",https://www.beacleaner.com/how-to-clean-a-chandelier-without-taking-it-down?utm_source=pinterest&utm_campaign=chandelier-cleaning-,2025-04-30,maintenance,https://www.beacleaner.com/how-to-clean-a-chandelier-without-taking-it-down
Chandelier Cleaning: Preventative Care,https://res.cloudinary.com/dbcpfy04c/image/upload/v1618237451/placeholder.jpg,home-inspiration,,"Don't wait for your chandelier to get dirty! ðŸŒ¿ This post focuses on preventative care to keep your chandelier sparkling clean for longer.  Learn simple habits to minimize dust buildup and maintain its brilliance. Click to learn how to prevent grime! #chandeliercleaning #preventativecare #homemaintenance #cleaningtips,chandelier,preventative,maintenance",https://www.beacleaner.com/how-to-clean-a-chandelier-without-taking-it-down?utm_source=pinterest&utm_campaign=chandelier-cleaning-,2025-04-30,tips,https://www.beacleaner.com/how-to-clean-a-chandelier-without-taking-it-down
Chandelier Cleaning: A Room's Focal Point,https://res.cloudinary.com/dbcpfy04c/image/upload/v1618237451/placeholder.jpg,home-inspiration,,"Your chandelier is a statement piece! âœ¨ This post emphasizes the importance of keeping your chandelier clean to enhance your home's overall aesthetic.  A sparkling chandelier can instantly elevate any room. Click to learn how to make it shine! #chandeliercleaning #homedecor #focalpoint #interiordesign,chandelier,home decor,focal point",https://www.beacleaner.com/how-to-clean-a-chandelier-without-taking-it-down?utm_source=pinterest&utm_campaign=chandelier-cleaning-,2025-04-30,design,https://www.beacleaner.com/how-to-clean-a-chandelier-without-taking-it-down
Chandelier Cleaning: Quick Weekend Task,https://res.cloudinary.com/dbcpfy04c/image/upload/v1618237451/placeholder.jpg,home-inspiration,,"Make chandelier cleaning part of your weekend routine! ðŸ—“ï¸ This post shows you how to clean your chandelier quickly and efficiently, so you can enjoy a sparkling home without spending all day cleaning. Click to learn the quick method! #chandeliercleaning #weekendcleaning #homemaintenance #quicktask,chandelier,weekend,maintenance",https://www.beacleaner.com/how-to-clean-a-chandelier-without-taking-it-down?utm_source=pinterest&utm_campaign=chandelier-cleaning-,2025-04-30,task,https://www.beacleaner.com/how-to-clean-a-chandelier-without-taking-it-down
Chandelier Cleaning: The Secret Weapon,https://res.cloudinary.com/dbcpfy04c/image/upload/v1618237451/placeholder.jpg,home-inspiration,,"Discover the secret weapon for a sparkling chandelier! ðŸ¤« This post reveals a surprising cleaning solution that will leave your chandelier looking brand new.  Click to learn the trick and amaze your guests! #chandeliercleaning #cleaninghack #secretweapon #homedecor,chandelier,cleaning hack,secret",https://www.beacleaner.com/how-to-clean-a-chandelier-without-taking-it-down?utm_source=pinterest&utm_campaign=chandelier-cleaning-,2025-04-30,home,https://www.beacleaner.com/how-to-clean-a-chandelier-without-taking-it-down
Chandelier Cleaning: Restore the Glamour,https://res.cloudinary.com/dbcpfy04c/image/upload/v1618237451/placeholder.jpg,home-inspiration,,"Bring back the glamour to your home! âœ¨ This post guides you through restoring a dull chandelier to its former glory.  Learn how to remove grime and reveal the brilliance beneath. Click to restore the sparkle! #chandeliercleaning #glamour #homedecor #restoration,chandelier,glamour,home",https://www.beacleaner.com/how-to-clean-a-chandelier-without-taking-it-down?utm_source=pinterest&utm_campaign=chandelier-cleaning-,2025-04-30,restoration,https://www.beacleaner.com/how-to-clean-a-chandelier-without-taking-it-down
Chandelier Cleaning: Easy for Beginners,https://res.cloudinary.com/dbcpfy04c/image/upload/v1618237451/placeholder.jpg,home-inspiration,,"New to chandelier cleaning? ðŸ™‹â€â™€ï¸ This post is perfect for beginners! We'll walk you through the process step-by-step, making it easy to achieve a professional-looking result. Click to learn the basics! #chandeliercleaning #beginnercleaning #homemaintenance #easycleaning,chandelier,beginner,maintenance",https://www.beacleaner.com/how-to-clean-a-chandelier-without-taking-it-down?utm_source=pinterest&utm_campaign=chandelier-cleaning-,2025-04-30,easy,https://www.beacleaner.com/how-to-clean-a-chandelier-without-taking-it-down
Chandelier Cleaning: Avoid Common Mistakes,https://res.cloudinary.com/dbcpfy04c/image/upload/v1618237451/placeholder.jpg,home-inspiration,,"Don't make these common chandelier cleaning mistakes! âŒ This post highlights potential pitfalls and how to avoid them, ensuring a safe and effective cleaning process. Click to learn what *not* to do! #chandeliercleaning #cleaningmistakes #homemaintenance #safecleaning,chandelier,mistakes,maintenance",https://www.beacleaner.com/how-to-clean-a-chandelier-without-taking-it-down?utm_source=pinterest&utm_campaign=chandelier-cleaning-,2025-04-30,safe,https://www.beacleaner.com/how-to-clean-a-chandelier-without-taking-it-down
Chandelier Cleaning: A Brighter Home!,https://res.cloudinary.com/dbcpfy04c/image/upload/v1618237451/placeholder.jpg,home-inspiration,,"A clean chandelier = a brighter home! ðŸ’¡ This post demonstrates how cleaning your chandelier can instantly brighten up your space and create a more inviting atmosphere. Click to see the difference! #chandeliercleaning #brighterhome #homedecor #lighting,chandelier,bright,home",https://www.beacleaner.com/how-to-clean-a-chandelier-without-taking-it-down?utm_source=pinterest&utm_campaign=chandelier-cleaning-,2025-04-30,lighting,https://www.beacleaner.com/how-to-clean-a-chandelier-without-taking-it-down
Chandelier Cleaning: Impress Your Guests!,https://res.cloudinary.com/dbcpfy04c/image/upload/v1618237451/placeholder.jpg,home-inspiration,,"Want to impress your guests? âœ¨ A sparkling chandelier is the perfect way to do it! This post shows you how to clean your chandelier quickly and easily, so you can wow your visitors. Click to learn the secret! #chandeliercleaning #impressguests #homedecor #entertaining,chandelier,guests,home",https://www.beacleaner.com/how-to-clean-a-chandelier-without-taking-it-down?utm_source=pinterest&utm_campaign=chandelier-cleaning-,2025-04-30,entertaining,https://www.beacleaner.com/how-to-clean-a-chandelier-without-taking-it-down
Chandelier Cleaning: Long-Lasting Shine,https://res.cloudinary.com/dbcpfy04c/image/upload/v1618237451/placeholder.jpg,home-inspiration,,"Keep your chandelier sparkling for weeks! âœ¨ This post shares tips for maintaining a long-lasting shine after cleaning.  Learn how to prevent dust buildup and keep your chandelier looking its best. Click to learn the secrets to lasting shine! #chandeliercleaning #longlastingshine #homemaintenance #cleaningtips,chandelier,shine,maintenance",https://www.beacleaner.com/how-to-clean-a-chandelier-without-taking-it-down?utm_source=pinterest&utm_campaign=chandelier-cleaning-,2025-04-30,tips,https://www.beacleaner.com/how-to-clean-a-chandelier-without-taking-it-down
Chandelier Cleaning: From Dull to Dazzling,https://res.cloudinary.com/dbcpfy04c/image/upload/v1618237451/placeholder.jpg,home-inspiration,,"Transform your dull chandelier into a dazzling masterpiece! ðŸ¤© This post showcases the incredible results you can achieve with a little effort. Click to see the stunning transformation! #chandeliercleaning #dulltodazzling #homedecor #transformation,chandelier,dazzling,home",https://www.beacleaner.com/how-to-clean-a-chandelier-without-taking-it-down?utm_source=pinterest&utm_campaign=chandelier-cleaning-,2025-04-30,transformation,https://www.beacleaner.com/how-to-clean-a-chandelier-without-taking-it-down
Chandelier Cleaning: The Finishing Touch,https://res.cloudinary.com/dbcpfy04c/image/upload/v1618237451/placeholder.jpg,home-inspiration,,"Your chandelier is the finishing touch to a beautiful room! ðŸ’Ž This post emphasizes the importance of keeping it clean to complete the look. Click to learn how to add the perfect finishing touch! #chandeliercleaning #finishingtouch #homedecor #interiordesign,chandelier,finishing touch,home",https://www.beacleaner.com/how-to-clean-a-chandelier-without-taking-it-down?utm_source=pinterest&utm_campaign=chandelier-cleaning-,2025-04-30,design,https://www.beacleaner.com/how-to-clean-a-chandelier-without-taking-it-down
Chandelier Cleaning: Simple & Effective!,https://res.cloudinary.com/dbcpfy04c/image/upload/v1618237451/placeholder.jpg,home-inspiration,,"Looking for a simple and effective chandelier cleaning solution? âœ… This post provides a straightforward method that delivers amazing results. Click to learn the easy way! #chandeliercleaning #simplecleaning #effectivecleaning #homemaintenance,chandelier,simple,effective",https://www.beacleaner.com/how-to-clean-a-chandelier-without-taking-it-down?utm_source=pinterest&utm_campaign=chandelier-cleaning-,2025-04-30,maintenance,https://www.beacleaner.com/how-to-clean-a-chandelier-without-taking-it-down
Title,https://res.cloudinary.com/dbcpfy04c/image/upload/v1618237451/placeholder.jpg,home-inspiration,,Description,https://www.beacleaner.com/how-to-clean-a-coleman-saluspa?utm_source=pinterest&utm_campaign=title,2025-04-30,Keywords,https://www.beacleaner.com/how-to-clean-a-coleman-saluspa
Coleman Saluspa Cleaning Guide,https://res.cloudinary.com/ddxyyzkuq/image/upload/v1746045668/pin_8_2_ikl9ph.webp,hot-tub-ideas,,"Keep your Saluspa sparkling clean & relaxing! âœ¨ This guide walks you through every step, from filter cleaning to water sanitization. Don't let grime ruin your spa days â€“ learn how to maintain crystal-clear water and extend the life of your investment.  A clean spa is a happy spa! Click to learn more and enjoy endless soaks. ðŸ«§ #Saluspa #HotTubCleaning #ColemanSpa #SpaMaintenance,Saluspa,Hot Tub,Cleaning",https://www.beacleaner.com/how-to-clean-a-coleman-saluspa?utm_source=pinterest&utm_campaign=coleman-saluspa-clea,2025-04-30,Maintenance,https://www.beacleaner.com/how-to-clean-a-coleman-saluspa
Saluspa Filter Cleaning 101,https://res.cloudinary.com/dbcpfy04c/image/upload/v1618237451/placeholder.jpg,home-inspiration,,"Is your Saluspa filter lookingâ€¦less than fresh? ðŸ¤¢ Don't ignore it! A dirty filter impacts water quality & spa performance. This pin shows you how to easily clean or replace your filter for a healthier, more enjoyable spa experience.  Protect your investment & your relaxation! ðŸ’§ Click for a step-by-step guide! #SaluspaFilter #HotTubFilter #SpaCare #CleanWater,Filter,Cleaning,Saluspa",https://www.beacleaner.com/how-to-clean-a-coleman-saluspa?utm_source=pinterest&utm_campaign=saluspa-filter-clean,2025-04-30,Maintenance,https://www.beacleaner.com/how-to-clean-a-coleman-saluspa
Sparkling Saluspa: Easy Steps,https://res.cloudinary.com/dbcpfy04c/image/upload/v1618237451/placeholder.jpg,home-inspiration,,"Dreaming of a relaxing soak? ðŸ’­  A clean Saluspa is essential for a worry-free experience. This pin highlights the quickest & easiest ways to keep your spa water pristine.  Say goodbye to cloudy water & hello to blissful relaxation!  Click to learn how! ðŸ› #SaluspaCleaning #HotTubLife #SpaDay #Relaxation,Saluspa,Cleaning,Relaxation",https://www.beacleaner.com/how-to-clean-a-coleman-saluspa?utm_source=pinterest&utm_campaign=sparkling-saluspa-ea,2025-04-30,Hot Tub,https://www.beacleaner.com/how-to-clean-a-coleman-saluspa
Saluspa Water Chemistry Basics,https://res.cloudinary.com/dbcpfy04c/image/upload/v1618237451/placeholder.jpg,home-inspiration,,"Confused about Saluspa water chemistry? ðŸ§ª Don't be!  Maintaining the right balance is crucial for safe & enjoyable soaks. This pin breaks down the essentials â€“ pH, alkalinity, sanitizer â€“ in a simple, easy-to-understand way.  Enjoy peace of mind knowing your water is perfectly balanced! ðŸ’§ Click to learn more! #SaluspaWater #HotTubChemistry #SpaWater #WaterBalance,Water Chemistry,Saluspa,Hot Tub",https://www.beacleaner.com/how-to-clean-a-coleman-saluspa?utm_source=pinterest&utm_campaign=saluspa-water-chemis,2025-04-30,Balance,https://www.beacleaner.com/how-to-clean-a-coleman-saluspa
Extend Your Saluspa's Life,https://res.cloudinary.com/dbcpfy04c/image/upload/v1618237451/placeholder.jpg,home-inspiration,,"Want to keep your Coleman Saluspa running smoothly for years to come? â³  Regular cleaning & maintenance are key! This pin shares essential tips to prevent damage, extend the lifespan of your spa, and save money on repairs.  Invest in your relaxation! âœ¨ Click to learn how! #SaluspaMaintenance #HotTubCare #SpaTips #Longevity,Maintenance,Saluspa,Hot Tub",https://www.beacleaner.com/how-to-clean-a-coleman-saluspa?utm_source=pinterest&utm_campaign=extend-your-saluspas,2025-04-30,Longevity,https://www.beacleaner.com/how-to-clean-a-coleman-saluspa
Saluspa Cleaning Checklist (Free!),https://res.cloudinary.com/dbcpfy04c/image/upload/v1618237451/placeholder.jpg,home-inspiration,,"Don't let Saluspa cleaning overwhelm you! ðŸ“ This pin links to a FREE printable checklist to help you stay on top of your spa maintenance routine.  A little effort goes a long way towards a sparkling clean & relaxing spa experience.  Download yours now! ðŸ«§ #SaluspaChecklist #HotTubRoutine #SpaCleaning #FreePrintable,Checklist,Saluspa,Cleaning",https://www.beacleaner.com/how-to-clean-a-coleman-saluspa?utm_source=pinterest&utm_campaign=saluspa-cleaning-che,2025-04-30,Routine,https://www.beacleaner.com/how-to-clean-a-coleman-saluspa
Saluspa: Before Your First Soak,https://res.cloudinary.com/dbcpfy04c/image/upload/v1618237451/placeholder.jpg,home-inspiration,,"New Saluspa owner? ðŸŽ‰ Congratulations!  Before you dive in, make sure you properly clean & prepare your spa for the ultimate relaxation experience. This pin guides you through the essential first-time cleaning steps.  Start your spa journey right! ðŸ’§ Click to learn more! #SaluspaSetup #HotTubFirstTime #SpaPreparation #NewSpa,Setup,Saluspa,First Time",https://www.beacleaner.com/how-to-clean-a-coleman-saluspa?utm_source=pinterest&utm_campaign=saluspa-before-your-,2025-04-30,Preparation,https://www.beacleaner.com/how-to-clean-a-coleman-saluspa
Saluspa: Dealing with Cloudy Water,https://res.cloudinary.com/dbcpfy04c/image/upload/v1618237451/placeholder.jpg,home-inspiration,,"Cloudy Saluspa water ruining your vibe? ðŸ˜© Don't panic! This pin identifies common causes of cloudy water & provides effective solutions to restore clarity.  Get back to enjoying crystal-clear soaks! ðŸ«§ Click to learn how to troubleshoot! #CloudyWater #SaluspaTroubleshooting #HotTubProblems #ClearWater,Cloudy Water,Saluspa,Troubleshooting",https://www.beacleaner.com/how-to-clean-a-coleman-saluspa?utm_source=pinterest&utm_campaign=saluspa-dealing-with,2025-04-30,Hot Tub,https://www.beacleaner.com/how-to-clean-a-coleman-saluspa
Saluspa: Removing Scale & Buildup,https://res.cloudinary.com/dbcpfy04c/image/upload/v1618237451/placeholder.jpg,home-inspiration,,"Is scale building up in your Saluspa? ðŸ§± This pin shows you how to effectively remove scale & buildup to maintain optimal spa performance & water quality.  Protect your heater & jets! âœ¨ Click to learn the best cleaning methods. #ScaleRemoval #SaluspaCleaning #HotTubMaintenance #Buildup,Scale,Saluspa,Cleaning",https://www.beacleaner.com/how-to-clean-a-coleman-saluspa?utm_source=pinterest&utm_campaign=saluspa-removing-sca,2025-04-30,Maintenance,https://www.beacleaner.com/how-to-clean-a-coleman-saluspa
Saluspa: Winterizing Your Spa,https://res.cloudinary.com/dbcpfy04c/image/upload/v1618237451/placeholder.jpg,home-inspiration,,"Protect your Saluspa from freezing temperatures! â„ï¸ This pin provides a comprehensive guide to winterizing your spa, ensuring it's ready to go when warmer weather returns.  Don't let winter damage your investment! ðŸ’§ Click to learn how! #SaluspaWinterizing #HotTubWinterCare #SpaProtection #WinterPrep,Winterizing,Saluspa,Hot Tub",https://www.beacleaner.com/how-to-clean-a-coleman-saluspa?utm_source=pinterest&utm_campaign=saluspa-winterizing-,2025-04-30,Protection,https://www.beacleaner.com/how-to-clean-a-coleman-saluspa
Saluspa Jet Cleaning Secrets,https://res.cloudinary.com/ddxyyzkuq/image/upload/v1746045693/pin_8_12_nxsinc.webp,massage-ideas,,"Dirty Saluspa jets impacting your massage? ðŸ˜« This pin reveals the secrets to cleaning your jets for optimal performance & a truly relaxing spa experience.  Enjoy powerful, invigorating jets again! âœ¨ Click to learn how! #SaluspaJets #HotTubJets #SpaMassage #JetCleaning,Jets,Saluspa,Cleaning",https://www.beacleaner.com/how-to-clean-a-coleman-saluspa?utm_source=pinterest&utm_campaign=saluspa-jet-cleaning,2025-04-30,Massage,https://www.beacleaner.com/how-to-clean-a-coleman-saluspa
Saluspa: Sanitizer Options Explained,https://res.cloudinary.com/dbcpfy04c/image/upload/v1618237451/placeholder.jpg,home-inspiration,,"Choosing the right sanitizer for your Saluspa? ðŸ¤” This pin breaks down the different sanitizer options â€“ chlorine, bromine, etc. â€“ helping you make the best choice for your needs & preferences.  Enjoy safe & healthy soaks! ðŸ’§ Click to learn more! #SaluspaSanitizer #HotTubSanitizer #SpaWaterCare #WaterTreatment,Sanitizer,Saluspa,Water Care",https://www.beacleaner.com/how-to-clean-a-coleman-saluspa?utm_source=pinterest&utm_campaign=saluspa-sanitizer-op,2025-04-30,Treatment,https://www.beacleaner.com/how-to-clean-a-coleman-saluspa
Saluspa: Cleaning the Cover,https://res.cloudinary.com/dbcpfy04c/image/upload/v1618237451/placeholder.jpg,home-inspiration,,"Don't forget the Saluspa cover! ðŸ›¡ï¸ This pin shows you how to properly clean & protect your spa cover, extending its lifespan & keeping it looking its best.  A clean cover is a happy cover! âœ¨ Click to learn the best cleaning methods. #SaluspaCover #HotTubCover #SpaCoverCleaning #Protection,Cover,Saluspa,Cleaning",https://www.beacleaner.com/how-to-clean-a-coleman-saluspa?utm_source=pinterest&utm_campaign=saluspa-cleaning-the,2025-04-30,Protection,https://www.beacleaner.com/how-to-clean-a-coleman-saluspa
Saluspa: Quick Daily Maintenance,https://res.cloudinary.com/dbcpfy04c/image/upload/v1618237451/placeholder.jpg,home-inspiration,,"Just a few minutes a day can make a HUGE difference! â±ï¸ This pin shares quick & easy daily maintenance tips to keep your Saluspa sparkling clean & ready for relaxation.  Make spa care a habit! ðŸ«§ Click to learn more! #SaluspaDailyCare #HotTubRoutine #SpaMaintenance #QuickTips,Daily Care,Saluspa,Maintenance",https://www.beacleaner.com/how-to-clean-a-coleman-saluspa?utm_source=pinterest&utm_campaign=saluspa-quick-daily-,2025-04-30,Routine,https://www.beacleaner.com/how-to-clean-a-coleman-saluspa
Saluspa: Troubleshooting Common Issues,https://res.cloudinary.com/dbcpfy04c/image/upload/v1618237451/placeholder.jpg,home-inspiration,,"Facing a Saluspa problem? ðŸ˜© This pin provides a helpful guide to troubleshooting common issues, from low heat to error codes.  Get your spa back up & running quickly! âœ¨ Click to learn more! #SaluspaTroubleshooting #HotTubRepair #SpaProblems #FixIt,Troubleshooting,Saluspa,Repair",https://www.beacleaner.com/how-to-clean-a-coleman-saluspa?utm_source=pinterest&utm_campaign=saluspa-troubleshoot,2025-04-30,Problems,https://www.beacleaner.com/how-to-clean-a-coleman-saluspa
Saluspa: The Ultimate Cleaning Guide,https://res.cloudinary.com/dbcpfy04c/image/upload/v1618237451/placeholder.jpg,home-inspiration,,"Your complete guide to a sparkling Saluspa! âœ¨ This pin links to the ultimate blog post, covering every aspect of Saluspa cleaning & maintenance.  From filters to water chemistry, we've got you covered! ðŸ’§ Click to learn everything you need to know! #SaluspaCleaning #HotTubGuide #SpaMaintenance #UltimateGuide,Cleaning,Saluspa,Maintenance",https://www.beacleaner.com/how-to-clean-a-coleman-saluspa?utm_source=pinterest&utm_campaign=saluspa-the-ultimate,2025-04-30,Guide,https://www.beacleaner.com/how-to-clean-a-coleman-saluspa
Saluspa: DIY Cleaning Solutions,https://res.cloudinary.com/dbcpfy04c/image/upload/v1618237451/placeholder.jpg,home-inspiration,,"Save money & use natural ingredients! ðŸŒ¿ This pin shares DIY cleaning solutions for your Saluspa, helping you keep it clean without harsh chemicals.  Enjoy a healthy & eco-friendly spa experience! ðŸ’§ Click to learn more! #DIYCleaning #SaluspaNatural #HotTubEcoFriendly #NaturalSpa,DIY,Saluspa,Natural",https://www.beacleaner.com/how-to-clean-a-coleman-saluspa?utm_source=pinterest&utm_campaign=saluspa-diy-cleaning,2025-04-30,Eco-Friendly,https://www.beacleaner.com/how-to-clean-a-coleman-saluspa
Saluspa: Preventing Algae Growth,https://res.cloudinary.com/dbcpfy04c/image/upload/v1618237451/placeholder.jpg,home-inspiration,,"Don't let algae ruin your Saluspa fun! ðŸ¦  This pin provides tips to prevent algae growth, ensuring crystal-clear water & a healthy spa environment.  Enjoy worry-free soaks! âœ¨ Click to learn more! #SaluspaAlgae #HotTubAlgae #SpaWaterCare #AlgaePrevention,Algae,Saluspa,Water Care",https://www.beacleaner.com/how-to-clean-a-coleman-saluspa?utm_source=pinterest&utm_campaign=saluspa-preventing-a,2025-04-30,Prevention,https://www.beacleaner.com/how-to-clean-a-coleman-saluspa
Saluspa: Cleaning After Heavy Use,https://res.cloudinary.com/dbcpfy04c/image/upload/v1618237451/placeholder.jpg,home-inspiration,,"Just had a spa party? ðŸŽ‰ This pin provides a guide to cleaning your Saluspa after heavy use, ensuring it's fresh & ready for your next soak.  Keep the relaxation going! ðŸ«§ Click to learn more! #SaluspaAfterParty #HotTubCleaning #SpaRefresh #HeavyUse,After Party,Saluspa,Cleaning",https://www.beacleaner.com/how-to-clean-a-coleman-saluspa?utm_source=pinterest&utm_campaign=saluspa-cleaning-aft,2025-04-30,Refresh,https://www.beacleaner.com/how-to-clean-a-coleman-saluspa
