Title,Media URL,Pinterest board,Thumbnail,Description,Link,Publish date,Keywords,Source URL
Tie Rod End Replacement Guide,https://res.cloudinary.com/ddxyyzkuq/image/upload/v1745965503/pin_4_6_o2ze0w.webp,mower-repair-ideas,,"Worn tie rod ends are a common culprit behind steering problems in Craftsman riding mowers. This guide provides a comprehensive, step-by-step tutorial on how to replace your tie rod ends.  We'll show you the tools you need, the proper techniques, and important safety precautions.  Restore your mower's precise steering and enjoy a smoother, more controlled ride.  Click to learn how! #TieRodEnds #CraftsmanMower #MowerParts #SteeringRepair"",Tie Rod Ends,Craftsman,Steering Repair",https://lawntrend.com/craftsman-riding-mower-steering-problems/?utm_source=pinterest&utm_campaign=tie-rod-end-replacem,2025-04-29,Mower Parts,https://lawntrend.com/craftsman-riding-mower-steering-problems/
Craftsman Mower Steering Linkage,https://res.cloudinary.com/ddxyyzkuq/image/upload/v1745965509/pin_4_7_bk9z2i.webp,mower-repair-ideas,,"Understanding your Craftsman riding mower's steering linkage is key to diagnosing and fixing steering issues. This post provides a detailed overview of the steering linkage system, including all the components and how they work together.  We'll help you identify worn or damaged parts and understand how to properly adjust the linkage for optimal performance.  Get the knowledge you need to keep your mower steering true! #SteeringLinkage #Craftsman #MowerMaintenance #LawnCare"",Steering Linkage,Craftsman,Mower Maintenance",https://lawntrend.com/craftsman-riding-mower-steering-problems/?utm_source=pinterest&utm_campaign=craftsman-mower-stee,2025-04-29,Lawn Care,https://lawntrend.com/craftsman-riding-mower-steering-problems/
Fix Jerky Steering - Craftsman,https://res.cloudinary.com/ddxyyzkuq/image/upload/v1745965515/pin_4_8_jumvfa.webp,car-repair-ideas,,"Is your Craftsman mower steering feeling jerky and unpredictable? This could be caused by a variety of issues, from loose connections to worn components.  This guide helps you pinpoint the cause of jerky steering and provides practical solutions to get your mower steering smoothly again.  Don't let jerky steering ruin your mowing experience – click to learn how to fix it! #JerkySteering #CraftsmanMower #MowerProblems #DIYFix"",Jerky Steering,Craftsman,Mower Problems",https://lawntrend.com/craftsman-riding-mower-steering-problems/?utm_source=pinterest&utm_campaign=fix-jerky-steering-c,2025-04-29,DIY Fix,https://lawntrend.com/craftsman-riding-mower-steering-problems/
Steering Sector Troubleshooting,https://res.cloudinary.com/ddxyyzkuq/image/upload/v1745965522/pin_4_9_r2xplg.webp,auto-repair-ideas,,"The steering sector is a critical component of your Craftsman riding mower's steering system.  This post provides a detailed guide to troubleshooting steering sector problems, including identifying symptoms, diagnosing the issue, and determining if repair or replacement is necessary.  Keep your mower steering reliably – read now! #SteeringSector #Craftsman #MowerRepair #Troubleshooting"",Steering Sector,Craftsman,Mower Repair",https://lawntrend.com/craftsman-riding-mower-steering-problems/?utm_source=pinterest&utm_campaign=steering-sector-trou,2025-04-29,Troubleshooting,https://lawntrend.com/craftsman-riding-mower-steering-problems/
Craftsman Mower Steering Noise?,https://res.cloudinary.com/ddxyyzkuq/image/upload/v1745965529/pin_4_10_j8uymw.webp,mower-repair-ideas,,"Hearing strange noises when you steer your Craftsman riding mower?  This post explores the common causes of steering noise, from worn bearings to loose components.  We'll help you identify the source of the noise and provide solutions to quiet your mower and restore smooth steering.  Don't ignore those noises – they could indicate a serious problem! #SteeringNoise #CraftsmanMower #MowerSounds #RepairGuide"",Steering Noise,Craftsman,Mower Sounds",https://lawntrend.com/craftsman-riding-mower-steering-problems/?utm_source=pinterest&utm_campaign=craftsman-mower-stee,2025-04-29,Repair Guide,https://lawntrend.com/craftsman-riding-mower-steering-problems/
Easy Steering Adjustment Tips,https://res.cloudinary.com/ddxyyzkuq/image/upload/v1745965535/pin_4_11_qfsag6.webp,lawn-care-ideas,,"A simple steering adjustment can often resolve minor steering issues in your Craftsman riding mower. This post provides easy-to-follow tips on how to adjust your mower's steering for optimal performance.  We'll show you how to check for proper alignment and make adjustments to improve steering responsiveness.  Get the most out of your mower – read now! #SteeringAdjustment #Craftsman #MowerTips #LawnCare"",Steering Adjustment,Craftsman,Mower Tips",https://lawntrend.com/craftsman-riding-mower-steering-problems/?utm_source=pinterest&utm_campaign=easy-steering-adjust,2025-04-29,Lawn Care,https://lawntrend.com/craftsman-riding-mower-steering-problems/
Craftsman Mower Steering Parts,https://res.cloudinary.com/ddxyyzkuq/image/upload/v1745965541/pin_4_12_uqxork.webp,mower-repair-ideas,,"Need to replace steering parts on your Craftsman riding mower? This post provides a comprehensive guide to finding the right parts, including tie rod ends, drag links, and steering gearboxes.  We'll help you identify the correct parts for your specific mower model and provide links to reputable suppliers.  Get the parts you need to get your mower back in top shape! #MowerParts #Craftsman #SteeringParts #ReplacementParts"",Mower Parts,Craftsman,Steering Parts",https://lawntrend.com/craftsman-riding-mower-steering-problems/?utm_source=pinterest&utm_campaign=craftsman-mower-stee,2025-04-29,Replacement Parts,https://lawntrend.com/craftsman-riding-mower-steering-problems/
Diagnose Steering Play - Craftsman,https://res.cloudinary.com/ddxyyzkuq/image/upload/v1745965547/pin_4_13_zyivdc.webp,mower-repair-ideas,,"Excessive steering play can make your Craftsman riding mower difficult to control. This post explains how to diagnose steering play and identify the worn components that are causing it.  We'll show you how to check for play in the tie rod ends, steering gearbox, and other critical components.  Improve your mower's handling – read now! #SteeringPlay #CraftsmanMower #Diagnosis #MowerControl"",Steering Play,Craftsman,Diagnosis",https://lawntrend.com/craftsman-riding-mower-steering-problems/?utm_source=pinterest&utm_campaign=diagnose-steering-pl,2025-04-29,Mower Control,https://lawntrend.com/craftsman-riding-mower-steering-problems/
Preventative Steering Maintenance,https://res.cloudinary.com/ddxyyzkuq/image/upload/v1745965554/pin_4_14_dajmbx.webp,car-maintenance-ideas,,"Don't wait for steering problems to develop! This post provides a guide to preventative steering maintenance for your Craftsman riding mower.  We'll show you how to inspect your steering components regularly, lubricate moving parts, and identify potential problems before they become serious.  Keep your mower steering smoothly for years to come! #MowerMaintenance #Craftsman #Steering #PreventativeCare"",Mower Maintenance,Craftsman,Steering",https://lawntrend.com/craftsman-riding-mower-steering-problems/?utm_source=pinterest&utm_campaign=preventative-steerin,2025-04-29,Preventative Care,https://lawntrend.com/craftsman-riding-mower-steering-problems/
Craftsman Steering: Safety First!,https://res.cloudinary.com/ddxyyzkuq/image/upload/v1745965560/pin_4_15_t6zmya.webp,auto-safety-ideas,,"Steering problems can be dangerous! This post emphasizes the importance of safety when diagnosing and repairing Craftsman riding mower steering issues.  We'll provide important safety precautions to follow and warn you about potential hazards.  Your safety is our priority – read now! #MowerSafety #Craftsman #SteeringRepair #SafetyFirst"",Mower Safety,Craftsman,Steering Repair",https://lawntrend.com/craftsman-riding-mower-steering-problems/?utm_source=pinterest&utm_campaign=craftsman-steering-s,2025-04-29,Safety First,https://lawntrend.com/craftsman-riding-mower-steering-problems/
Replacing Drag Links - Craftsman,https://res.cloudinary.com/ddxyyzkuq/image/upload/v1745965567/pin_4_16_debzwk.webp,auto-repair-ideas,,"A worn drag link can cause loose or unresponsive steering in your Craftsman riding mower. This guide provides a step-by-step tutorial on how to replace your drag link.  We'll show you the tools you need, the proper techniques, and important safety precautions.  Restore your mower's precise steering – click to learn how! #DragLink #CraftsmanMower #MowerParts #Steering"",Drag Link,Craftsman,Mower Parts",https://lawntrend.com/craftsman-riding-mower-steering-problems/?utm_source=pinterest&utm_campaign=replacing-drag-links,2025-04-29,Steering,https://lawntrend.com/craftsman-riding-mower-steering-problems/
Understanding Steering Geometry,https://res.cloudinary.com/ddxyyzkuq/image/upload/v1745965573/pin_4_17_vqycks.webp,lawn-care-ideas,,"Dive deeper into how your Craftsman mower steers! This post explains the principles of steering geometry and how it affects your mower's handling.  Understanding these concepts can help you diagnose and fix steering problems more effectively.  Become a mower steering expert – read now! #SteeringGeometry #Craftsman #MowerTech #LawnCare"",Steering Geometry,Craftsman,Mower Tech",https://lawntrend.com/craftsman-riding-mower-steering-problems/?utm_source=pinterest&utm_campaign=understanding-steeri,2025-04-29,Lawn Care,https://lawntrend.com/craftsman-riding-mower-steering-problems/
Craftsman Mower Steering Upgrade?,https://res.cloudinary.com/ddxyyzkuq/image/upload/v1745965578/pin_4_18_svxwc4.webp,mower-repair-ideas,,"Considering an upgrade to your Craftsman riding mower's steering system? This post explores the options available, from aftermarket steering kits to individual component upgrades.  We'll help you weigh the pros and cons of each option and choose the best upgrade for your needs.  Improve your mower's performance – read now! #MowerUpgrade #Craftsman #Steering #Performance"",Mower Upgrade,Craftsman,Steering",https://lawntrend.com/craftsman-riding-mower-steering-problems/?utm_source=pinterest&utm_campaign=craftsman-mower-stee,2025-04-29,Performance,https://lawntrend.com/craftsman-riding-mower-steering-problems/
Fixing a Stuck Steering Wheel,https://res.cloudinary.com/ddxyyzkuq/image/upload/v1745965585/pin_4_19_din2rp.webp,car-repair-ideas,,"Can't turn your Craftsman mower's steering wheel? This post tackles the frustrating problem of a stuck steering wheel, exploring common causes and providing solutions. From corrosion to internal linkage issues, we'll help you get your mower moving again. Don't struggle – find the fix here! #StuckSteeringWheel #CraftsmanMower #MowerProblems #DIY"",Stuck Steering Wheel,Craftsman,Mower Problems",https://lawntrend.com/craftsman-riding-mower-steering-problems/?utm_source=pinterest&utm_campaign=fixing-a-stuck-steer,2025-04-29,DIY,https://lawntrend.com/craftsman-riding-mower-steering-problems/
Craftsman Steering: Common Mistakes,https://res.cloudinary.com/ddxyyzkuq/image/upload/v1745965590/pin_4_20_t58z0y.webp,auto-safety-ideas,,"Avoid costly mistakes when repairing your Craftsman mower's steering! This post highlights common errors made during steering repairs and provides tips on how to avoid them.  Learn from the mistakes of others and ensure a successful repair.  Save time and money – read now! #MowerRepair #Craftsman #Steering #CommonMistakes"",Mower Repair,Craftsman,Steering",https://lawntrend.com/craftsman-riding-mower-steering-problems/?utm_source=pinterest&utm_campaign=craftsman-steering-c,2025-04-29,Common Mistakes,https://lawntrend.com/craftsman-riding-mower-steering-problems/
Steering System Inspection Checklist,https://res.cloudinary.com/ddxyyzkuq/image/upload/v1745965596/pin_4_21_bmg4r7.webp,car-maintenance-ideas,,"Keep your Craftsman mower steering in top condition with our comprehensive inspection checklist! This post provides a detailed list of items to inspect regularly, helping you identify potential problems before they become serious.  Proactive maintenance is key – download the checklist now! #MowerInspection #Craftsman #Steering #MaintenanceChecklist"",Mower Inspection,Craftsman,Steering",https://lawntrend.com/craftsman-riding-mower-steering-problems/?utm_source=pinterest&utm_campaign=steering-system-insp,2025-04-29,Maintenance Checklist,https://lawntrend.com/craftsman-riding-mower-steering-problems/
Craftsman Mower Steering & Tires,https://res.cloudinary.com/ddxyyzkuq/image/upload/v1745965602/pin_4_22_p9cnub.webp,mower-repair-ideas,,"Did you know your tires impact steering? This post explores the connection between tire pressure, tire wear, and steering performance on your Craftsman riding mower. Learn how to optimize your tires for a smoother, more controlled ride. #MowerTires #Craftsman #Steering #TirePressure"",Mower Tires,Craftsman,Steering",https://lawntrend.com/craftsman-riding-mower-steering-problems/?utm_source=pinterest&utm_campaign=craftsman-mower-stee,2025-04-29,Tire Pressure,https://lawntrend.com/craftsman-riding-mower-steering-problems/
Troubleshooting Power Steering (If Applicable),https://res.cloudinary.com/ddxyyzkuq/image/upload/v1745965608/pin_4_23_z5pbun.webp,auto-repair-ideas,,"Does your Craftsman mower have power steering? This post focuses on troubleshooting issues specific to power steering systems, including pump problems, fluid leaks, and hose failures. Get expert advice on keeping your power steering running smoothly. #PowerSteering #CraftsmanMower #MowerRepair #Hydraulics"",Power Steering,Craftsman,Mower Repair",https://lawntrend.com/craftsman-riding-mower-steering-problems/?utm_source=pinterest&utm_campaign=troubleshooting-powe,2025-04-29,Hydraulics,https://lawntrend.com/craftsman-riding-mower-steering-problems/
Craftsman Steering: When to Call a Pro,https://res.cloudinary.com/ddxyyzkuq/image/upload/v1745965613/pin_4_24_equx6h.webp,auto-safety-ideas,,"Sometimes, DIY isn't enough. This post helps you determine when a steering problem is beyond your skill level and when it's time to call a professional mechanic. Don't risk further damage or injury – know when to seek expert help. #MowerRepair #Craftsman #Steering #ProfessionalHelp"",Mower Repair,Craftsman,Steering",https://lawntrend.com/craftsman-riding-mower-steering-problems/?utm_source=pinterest&utm_campaign=craftsman-steering-w,2025-04-29,Professional Help,https://lawntrend.com/craftsman-riding-mower-steering-problems/
Steering Component Diagrams - Craftsman,https://res.cloudinary.com/ddxyyzkuq/image/upload/v1745965619/pin_4_25_ogxsye.webp,auto-parts-ideas,,"Confused about the parts? This post features detailed diagrams of the Craftsman riding mower steering system, helping you identify each component and understand how they fit together. Visual learning made easy! #MowerDiagrams #Craftsman #Steering #PartsIdentification"",Mower Diagrams,Craftsman,Steering",https://lawntrend.com/craftsman-riding-mower-steering-problems/?utm_source=pinterest&utm_campaign=steering-component-d,2025-04-29,Parts Identification,https://lawntrend.com/craftsman-riding-mower-steering-problems/
Title,https://res.cloudinary.com/ddxyyzkuq/image/upload/v1745965658/pin_5_1_nwnujq.webp,please-provide-the-title-and-keywords-i-need-that-information-to-suggest-a-board-name-once,,Description,https://lawntrend.com/briggs-and-stratton-lawn-mower-starts-then-dies/?utm_source=pinterest&utm_campaign=title,2025-04-29,Keywords,https://lawntrend.com/briggs-and-stratton-lawn-mower-starts-then-dies/
Briggs & Stratton: Won't Stay Running?,https://res.cloudinary.com/ddxyyzkuq/image/upload/v1745965664/pin_5_2_nvnoau.webp,lawn-repair-ideas,,"Don't let a dying lawn mower ruin your summer! This post dives deep into why your Briggs & Stratton engine might start, then stall. We cover carburetor problems, spark plug issues",https://lawntrend.com/briggs-and-stratton-lawn-mower-starts-then-dies/?utm_source=pinterest&utm_campaign=briggs-stratton-wont,2025-04-29,and more.  Imagine a perfectly manicured lawn without the stress of equipment failure.  Learn to diagnose and fix it yourself! Click to read now and reclaim your weekends! #lawnmower #smallengine #repairtips #diy,https://lawntrend.com/briggs-and-stratton-lawn-mower-starts-then-dies/
Fix a Dying Lawn Mower - Easy Steps,https://res.cloudinary.com/ddxyyzkuq/image/upload/v1745965669/pin_5_3_jz6r2g.webp,diy-repair-ideas,,Is your lawn mower giving up before you do?  This guide simplifies Briggs & Stratton lawn mower troubleshooting. We break down complex issues into manageable steps,https://lawntrend.com/briggs-and-stratton-lawn-mower-starts-then-dies/?utm_source=pinterest&utm_campaign=fix-a-dying-lawn-mow,2025-04-29,even for beginners.  Don't feel helpless!  Empower yourself with the knowledge to fix it. Click to learn how to get back to enjoying your yard! #lawnmowertips #briggsandstrattonrepair #homemaintenance #diyprojects,https://lawntrend.com/briggs-and-stratton-lawn-mower-starts-then-dies/
Fuel Filter Fix: Mower Starts,https://res.cloudinary.com/ddxyyzkuq/image/upload/v1745965676/pin_5_4_xdbsjb.webp,lawn-care-ideas,,"Then Stalls"",Dirty fuel is a major cause of lawn mower issues.  Learn how to check and replace your Briggs & Stratton fuel filter in this easy-to-follow guide.  Protect your engine and ensure a smooth",https://lawntrend.com/briggs-and-stratton-lawn-mower-starts-then-dies/?utm_source=pinterest&utm_campaign=fuel-filter-fix-mowe,2025-04-29,reliable performance. Click to read and keep your mower running strong! #fuelfilter #lawnmowermaintenance #smallengine #diy,https://lawntrend.com/briggs-and-stratton-lawn-mower-starts-then-dies/
Air Filter Check: Mower Dying?,https://res.cloudinary.com/ddxyyzkuq/image/upload/v1745965682/pin_5_5_wxqixm.webp,lawn-care-ideas,,A clogged air filter can starve your Briggs & Stratton engine.  This post shows you how to easily check and replace your air filter,https://lawntrend.com/briggs-and-stratton-lawn-mower-starts-then-dies/?utm_source=pinterest&utm_campaign=air-filter-check-mow,2025-04-29,improving performance and preventing future problems.  Breathe new life into your mower! Click to learn more. #airfilter #lawnmowercare #engineperformance #diy,https://lawntrend.com/briggs-and-stratton-lawn-mower-starts-then-dies/
Lawn Mower Safety First! Troubleshooting,https://res.cloudinary.com/ddxyyzkuq/image/upload/v1745965688/pin_5_6_hxtkas.webp,lawn-repair-ideas,,Before you start any repairs,https://lawntrend.com/briggs-and-stratton-lawn-mower-starts-then-dies/?utm_source=pinterest&utm_campaign=lawn-mower-safety-fi,2025-04-29,safety is key! This post includes essential safety tips for working on your Briggs & Stratton lawn mower.  Protect yourself and your equipment.  Click to read our safety guide and tackle your repairs with confidence! #lawnmowersafety #repairtips #diy #safetyfirst,https://lawntrend.com/briggs-and-stratton-lawn-mower-starts-then-dies/
Mower Dying Under Load? Here's Why,https://res.cloudinary.com/ddxyyzkuq/image/upload/v1745965695/pin_5_7_vjcqan.webp,lawn-repair-ideas,,Is your lawn mower dying when you start cutting thick grass? This post explores potential causes,https://lawntrend.com/briggs-and-stratton-lawn-mower-starts-then-dies/?utm_source=pinterest&utm_campaign=mower-dying-under-lo,2025-04-29,like a clogged carburetor or weak spark.  Get the power back! Click to learn how to diagnose and fix the issue. #lawnmowerproblems #thickgrass #enginepower #diy,https://lawntrend.com/briggs-and-stratton-lawn-mower-starts-then-dies/
Troubleshooting a Briggs & Stratton 725,https://res.cloudinary.com/ddxyyzkuq/image/upload/v1745965701/pin_5_8_sp5tl8.webp,auto-repair-ideas,,Specifically for the popular Briggs & Stratton 725 engine,https://lawntrend.com/briggs-and-stratton-lawn-mower-starts-then-dies/?utm_source=pinterest&utm_campaign=troubleshooting-a-br,2025-04-29,this guide addresses common starting and stalling issues.  Get targeted advice for your model! Click to read and get your mower running smoothly. #briggsandstratton725 #lawnmowerrepair #smallengine #diy,https://lawntrend.com/briggs-and-stratton-lawn-mower-starts-then-dies/
Lawn Mower Dying? Check the Choke!,https://res.cloudinary.com/ddxyyzkuq/image/upload/v1745965708/pin_5_9_wejyci.webp,lawn-repair-ideas,,Is the choke functioning properly on your Briggs & Stratton mower? A faulty choke can cause starting and stalling issues.  Simple fix,https://lawntrend.com/briggs-and-stratton-lawn-mower-starts-then-dies/?utm_source=pinterest&utm_campaign=lawn-mower-dying-che,2025-04-29,big impact! Click to learn how to check it. #choke #lawnmowerrepair #smallengine #diy,https://lawntrend.com/briggs-and-stratton-lawn-mower-starts-then-dies/
Lawn Mower Repair Tools You Need,https://res.cloudinary.com/ddxyyzkuq/image/upload/v1745965714/pin_5_10_ydw9sb.webp,lawn-repair-ideas,,Before you start,https://lawntrend.com/briggs-and-stratton-lawn-mower-starts-then-dies/?utm_source=pinterest&utm_campaign=lawn-mower-repair-to,2025-04-29,make sure you have the right tools! This post lists the essential tools for repairing your Briggs & Stratton lawn mower.  Be prepared! Click to see the list. #lawnmowertools #repairtools #diy #essentialtools,https://lawntrend.com/briggs-and-stratton-lawn-mower-starts-then-dies/
Replacing the Mower Blade Safely,https://res.cloudinary.com/ddxyyzkuq/image/upload/v1745965722/pin_5_11_lmdbjx.webp,lawn-care-ideas,,While not directly related to starting/dying,https://lawntrend.com/briggs-and-stratton-lawn-mower-starts-then-dies/?utm_source=pinterest&utm_campaign=replacing-the-mower-,2025-04-29,a dull blade strains the engine. Learn how to safely replace your Briggs & Stratton mower blade.  Improve performance! Click to learn more. #lawnmowerblade #safetymaintenance #diy #lawncare,https://lawntrend.com/briggs-and-stratton-lawn-mower-starts-then-dies/
Title,https://res.cloudinary.com/ddxyyzkuq/image/upload/v1745965773/pin_6_1_otyjwz.webp,please-provide-the-title-and-keywords-i-need-that-information-to-suggest-a-board-name-once,,Description,https://lawntrend.com/briggs-and-stratton-lawn-mower-wont-turn-off/?utm_source=pinterest&utm_campaign=title,2025-04-29,Keywords,https://lawntrend.com/briggs-and-stratton-lawn-mower-wont-turn-off/
Briggs & Stratton Mower Won't Stop?!,https://res.cloudinary.com/ddxyyzkuq/image/upload/v1745965779/pin_6_2_lzrrrr.webp,lawn-repair-ideas,,"Is your Briggs & Stratton lawn mower running endlessly? Don't panic! This guide walks you through common causes – from a dirty carburetor to a faulty safety switch – and provides easy troubleshooting steps to get it safely shut down.  Avoid frustration and potential damage! Learn how to diagnose and fix the issue yourself, saving you money on repair bills.  Click to read now and reclaim your weekend!  We'll cover everything from basic checks to more advanced solutions. Don't let a runaway mower ruin your day! #lawnmowerrepair #briggsandstratton #lawncare #diyrepair,lawn mower,Briggs & Stratton,won't turn off",https://lawntrend.com/briggs-and-stratton-lawn-mower-wont-turn-off/?utm_source=pinterest&utm_campaign=briggs-stratton-mowe,2025-04-29,troubleshooting,https://lawntrend.com/briggs-and-stratton-lawn-mower-wont-turn-off/
Mower Running Wild? Quick Fixes!,https://res.cloudinary.com/ddxyyzkuq/image/upload/v1745965786/pin_6_3_hjndmq.webp,lawn-repair-ideas,,"Feeling stressed because your Briggs & Stratton mower won't turn off? You're not alone! This post offers a clear, step-by-step approach to identifying the problem. We'll help you understand the safety mechanisms and how to reset them.  Plus, we'll show you how to clean crucial components.  Get back to enjoying your perfectly manicured lawn!  Click to learn how to safely stop your mower and prevent this from happening again.  Don't delay, fix it today! #lawnmowerproblems #lawnmowerfix #diy #homeimprovement,lawn mower,safety switch,carburetor",https://lawntrend.com/briggs-and-stratton-lawn-mower-wont-turn-off/?utm_source=pinterest&utm_campaign=mower-running-wild-q,2025-04-29,repair guide,https://lawntrend.com/briggs-and-stratton-lawn-mower-wont-turn-off/
Stop Your Mower: Easy Guide!,https://res.cloudinary.com/ddxyyzkuq/image/upload/v1745965794/pin_6_4_gfh9al.webp,lawn-care-ideas,,"Don't let a stubborn lawn mower ruin your Saturday! This guide tackles the frustrating issue of a Briggs & Stratton mower that won't shut off. We break down the most common culprits, like a stuck choke or a malfunctioning ignition.  We provide clear instructions and helpful visuals.  Imagine the peace of mind knowing you can quickly and safely resolve this issue. Click to read and get your lawn back on track! #lawncaretips #mowerrepair #briggsandstrattonengine #diyprojects,lawn care,mower repair,Briggs & Stratton",https://lawntrend.com/briggs-and-stratton-lawn-mower-wont-turn-off/?utm_source=pinterest&utm_campaign=stop-your-mower-easy,2025-04-29,ignition,https://lawntrend.com/briggs-and-stratton-lawn-mower-wont-turn-off/
Briggs & Stratton: Safety First!,https://res.cloudinary.com/ddxyyzkuq/image/upload/v1745965800/pin_6_5_vnwsem.webp,lawn-repair-ideas,,"A lawn mower that won't turn off is a serious safety concern. This article prioritizes your well-being while guiding you through the troubleshooting process for your Briggs & Stratton mower.  We emphasize safe handling and disconnection procedures.  Protect yourself and your family!  Learn how to identify and address the root cause of the problem. Click to read and ensure a safe mowing experience. #lawnmowersafety #diyrepair #lawncare #safetyfirst,lawn mower safety,safety,troubleshooting",https://lawntrend.com/briggs-and-stratton-lawn-mower-wont-turn-off/?utm_source=pinterest&utm_campaign=briggs-stratton-safe,2025-04-29,Briggs & Stratton,https://lawntrend.com/briggs-and-stratton-lawn-mower-wont-turn-off/
