Title,Media URL,Pinterest board,Thumbnail,Description,Link,Publish date,Keywords,Source URL
Kawasaki Mower: Compression Test,https://res.cloudinary.com/dbcpfy04c/image/upload/v1618237451/placeholder.jpg,home-inspiration,,"Low compression can cause hard starting.  This guide explains how to perform a compression test on your Kawasaki mower.  Diagnose engine wear and determine if a rebuild is necessary. #CompressionTest #KawasakiEngine #EngineDiagnosis #MowerRepair,Compression Test,Kawasaki Engine,Engine Diagnosis",https://lawntrend.com/kawasaki-lawn-mower-engine-hard-to-start-when-hot/?utm_source=pinterest&utm_campaign=kawasaki-mower-compr,2025-04-28,Mower Repair,https://lawntrend.com/kawasaki-lawn-mower-engine-hard-to-start-when-hot/
Kawasaki Mower: Oil Level & Type,https://res.cloudinary.com/dbcpfy04c/image/upload/v1618237451/placeholder.jpg,home-inspiration,,"Using the wrong oil or having a low oil level can affect starting.  This post reminds you of the importance of proper oil maintenance for your Kawasaki mower.  Keep your engine lubricated and running smoothly! #OilChange #KawasakiMower #EngineMaintenance #LawnCare,Oil Change,Kawasaki Mower,Engine Maintenance",https://lawntrend.com/kawasaki-lawn-mower-engine-hard-to-start-when-hot/?utm_source=pinterest&utm_campaign=kawasaki-mower-oil-l,2025-04-28,Lawn Care,https://lawntrend.com/kawasaki-lawn-mower-engine-hard-to-start-when-hot/
Kawasaki Mower: Winter Storage Prep,https://res.cloudinary.com/dbcpfy04c/image/upload/v1618237451/placeholder.jpg,home-inspiration,,"Proper winter storage can prevent starting problems in the spring.  Learn how to prepare your Kawasaki mower for winter storage.  Ensure a smooth start when the mowing season begins again! #WinterStorage #KawasakiMower #LawnMowerPrep #OffSeason,Winter Storage,Kawasaki Mower,Lawn Mower Prep",https://lawntrend.com/kawasaki-lawn-mower-engine-hard-to-start-when-hot/?utm_source=pinterest&utm_campaign=kawasaki-mower-winte,2025-04-28,Off Season,https://lawntrend.com/kawasaki-lawn-mower-engine-hard-to-start-when-hot/
Kawasaki Mower: Diagnostic Tools,https://res.cloudinary.com/dbcpfy04c/image/upload/v1618237451/placeholder.jpg,home-inspiration,,"What tools do you need to diagnose a Kawasaki mower that won't start? This post lists essential diagnostic tools for small engine repair.  Be prepared to tackle any starting problem! #DiagnosticTools #KawasakiRepair #LawnMowerTools #DIY,Diagnostic Tools,Kawasaki Repair,Lawn Mower Tools",https://lawntrend.com/kawasaki-lawn-mower-engine-hard-to-start-when-hot/?utm_source=pinterest&utm_campaign=kawasaki-mower-diagn,2025-04-28,DIY,https://lawntrend.com/kawasaki-lawn-mower-engine-hard-to-start-when-hot/
Kawasaki Mower: Safety First!,https://res.cloudinary.com/dbcpfy04c/image/upload/v1618237451/placeholder.jpg,home-inspiration,,"Always prioritize safety when working on your Kawasaki mower.  This post provides important safety tips for small engine repair.  Protect yourself from injury and work with confidence! #SafetyTips #KawasakiMower #LawnMowerRepair #SafeRepair,Safety Tips,Kawasaki Mower,Lawn Mower Repair",https://lawntrend.com/kawasaki-lawn-mower-engine-hard-to-start-when-hot/?utm_source=pinterest&utm_campaign=kawasaki-mower-safet,2025-04-28,Safe Repair,https://lawntrend.com/kawasaki-lawn-mower-engine-hard-to-start-when-hot/
Kawasaki Mower: When to Call a Pro,https://res.cloudinary.com/dbcpfy04c/image/upload/v1618237451/placeholder.jpg,home-inspiration,,"Sometimes, a repair is best left to the professionals.  This article helps you determine when to call a qualified mechanic for your Kawasaki mower.  Don't risk making the problem worse! #ProfessionalRepair #KawasakiMower #LawnMowerService #ExpertHelp,Professional Repair,Kawasaki Mower,Lawn Mower Service",https://lawntrend.com/kawasaki-lawn-mower-engine-hard-to-start-when-hot/?utm_source=pinterest&utm_campaign=kawasaki-mower-when-,2025-04-28,Expert Help,https://lawntrend.com/kawasaki-lawn-mower-engine-hard-to-start-when-hot/
Kawasaki Mower: Preventative Maintenance,https://res.cloudinary.com/dbcpfy04c/image/upload/v1618237451/placeholder.jpg,home-inspiration,,"Don't wait for problems to arise! This post outlines a preventative maintenance schedule for your Kawasaki mower.  Keep your mower running smoothly for years to come! #PreventativeMaintenance #KawasakiMower #LawnCareSchedule #MowerLife,Preventative Maintenance,Kawasaki Mower,Lawn Care Schedule",https://lawntrend.com/kawasaki-lawn-mower-engine-hard-to-start-when-hot/?utm_source=pinterest&utm_campaign=kawasaki-mower-preve,2025-04-28,Mower Life,https://lawntrend.com/kawasaki-lawn-mower-engine-hard-to-start-when-hot/
Kawasaki Mower: Troubleshooting Flowchart,https://res.cloudinary.com/dbcpfy04c/image/upload/v1618237451/placeholder.jpg,home-inspiration,,"Confused about where to start? This pin links to a helpful troubleshooting flowchart within the article to guide you through diagnosing your Kawasaki mower's hard starting issue. #Troubleshooting #KawasakiMower #Flowchart #DIYGuide,Troubleshooting,Kawasaki Mower,Flowchart",https://lawntrend.com/kawasaki-lawn-mower-engine-hard-to-start-when-hot/?utm_source=pinterest&utm_campaign=kawasaki-mower-troub,2025-04-28,DIY Guide,https://lawntrend.com/kawasaki-lawn-mower-engine-hard-to-start-when-hot/
Title,https://res.cloudinary.com/dbcpfy04c/image/upload/v1618237451/placeholder.jpg,home-inspiration,,Description,https://lawntrend.com/cub-cadet-1040lxt-oil-leak-problems/?utm_source=pinterest&utm_campaign=title,2025-04-28,Keywords,https://lawntrend.com/cub-cadet-1040lxt-oil-leak-problems/
Cub Cadet 1040LXT Oil Leak? Fix It!,https://res.cloudinary.com/dbcpfy04c/image/upload/v1618237451/placeholder.jpg,home-inspiration,,"Is your Cub Cadet 1040LXT leaking oil and ruining your lawn care dreams? Don't let a simple fix turn into a costly repair! This guide dives deep into the common causes of oil leaks in this popular model – from valve cover gaskets to oil filters. We'll walk you through troubleshooting steps, DIY repair options",https://lawntrend.com/cub-cadet-1040lxt-oil-leak-problems/?utm_source=pinterest&utm_campaign=cub-cadet-1040lxt-oi,2025-04-28,and when it's time to call a professional.  Protect your investment and get back to enjoying a perfectly manicured lawn. Click to learn how to stop the leak and save money! #CubCadet #OilLeak #LawnMowerRepair #DIYRepair,https://lawntrend.com/cub-cadet-1040lxt-oil-leak-problems/
Cub Cadet 1040LXT: Leak SOS!,https://res.cloudinary.com/dbcpfy04c/image/upload/v1618237451/placeholder.jpg,home-inspiration,,"Frustrated with oil spots under your Cub Cadet 1040LXT? You're not alone! Oil leaks can be a headache, but this post breaks down the problem into manageable steps. We cover everything from identifying the source of the leak to choosing the right replacement parts.  Don't ignore it – a small leak can lead to engine damage!  Learn how to diagnose and fix it yourself",https://lawntrend.com/cub-cadet-1040lxt-oil-leak-problems/?utm_source=pinterest&utm_campaign=cub-cadet-1040lxt-le,2025-04-28,or find a trusted mechanic.  Get your lawnmower running smoothly again! #CubCadet1040LXT #OilLeaks #LawnCare #MowerMaintenance,https://lawntrend.com/cub-cadet-1040lxt-oil-leak-problems/
Stop the Leak: 1040LXT Guide,https://res.cloudinary.com/dbcpfy04c/image/upload/v1618237451/placeholder.jpg,home-inspiration,,"Don't let an oil leak sideline your Cub Cadet 1040LXT this season! This comprehensive guide provides a detailed look at the most frequent oil leak culprits in this model.  We'll show you how to inspect critical areas like the oil pan gasket, crankshaft seal",https://lawntrend.com/cub-cadet-1040lxt-oil-leak-problems/?utm_source=pinterest&utm_campaign=stop-the-leak-1040lx,2025-04-28,and oil filter.  Clear photos and step-by-step instructions make DIY repair accessible.  Keep your mower healthy and your lawn looking its best! Click to read now! #CubCadet #LawnMower #OilChange #RepairGuide,https://lawntrend.com/cub-cadet-1040lxt-oil-leak-problems/
Cub Cadet Oil Leak? Don't Panic!,https://res.cloudinary.com/dbcpfy04c/image/upload/v1618237451/placeholder.jpg,home-inspiration,,"Seeing oil under your Cub Cadet 1040LXT can be alarming, but often the fix is simpler than you think. This article provides a calm, methodical approach to diagnosing and resolving oil leaks. We cover common issues, tool requirements",https://lawntrend.com/cub-cadet-1040lxt-oil-leak-problems/?utm_source=pinterest&utm_campaign=cub-cadet-oil-leak-d,2025-04-28,and safety precautions.  Avoid expensive shop bills and keep your lawnmower in top condition.  Read our guide and get back to mowing! #CubCadet1040LXT #OilLeakRepair #DIY #LawnEquipment,https://lawntrend.com/cub-cadet-1040lxt-oil-leak-problems/
1040LXT Oil Leak: Easy Fixes,https://res.cloudinary.com/dbcpfy04c/image/upload/v1618237451/placeholder.jpg,home-inspiration,,"Is your Cub Cadet 1040LXT dripping oil?  Don't let it ruin your weekend! This post focuses on the easiest, most common oil leak fixes you can tackle yourself.  We'll show you how to tighten connections, replace gaskets, and ensure proper oil filter installation.  Save time, money",https://lawntrend.com/cub-cadet-1040lxt-oil-leak-problems/?utm_source=pinterest&utm_campaign=1040lxt-oil-leak-eas,2025-04-28,and frustration with our practical advice.  Click to learn more and get mowing! #CubCadet #LawnMowerTips #OilLeakFix #HomeRepair,https://lawntrend.com/cub-cadet-1040lxt-oil-leak-problems/
Cub Cadet 1040LXT: Oil Leak Causes,https://res.cloudinary.com/dbcpfy04c/image/upload/v1618237451/placeholder.jpg,home-inspiration,,Understanding *why* your Cub Cadet 1040LXT is leaking oil is the first step to fixing it. This article explores the underlying causes of oil leaks,https://lawntrend.com/cub-cadet-1040lxt-oil-leak-problems/?utm_source=pinterest&utm_campaign=cub-cadet-1040lxt-oi,2025-04-28,from wear and tear to improper maintenance.  We'll help you pinpoint the source of the problem and choose the right solution.  Prevent future leaks with our proactive maintenance tips.  Read now and protect your investment! #CubCadet1040LXT #OilLeakCauses #LawnMowerProblems #MaintenanceTips,https://lawntrend.com/cub-cadet-1040lxt-oil-leak-problems/
DIY Cub Cadet Oil Leak Repair,https://res.cloudinary.com/dbcpfy04c/image/upload/v1618237451/placeholder.jpg,home-inspiration,,"Empower yourself to fix your Cub Cadet 1040LXT oil leak! This guide provides a detailed, step-by-step walkthrough of common DIY repairs.  We include photos, tool lists, and safety reminders.  Don't be intimidated – with a little effort",https://lawntrend.com/cub-cadet-1040lxt-oil-leak-problems/?utm_source=pinterest&utm_campaign=diy-cub-cadet-oil-le,2025-04-28,you can save money and keep your lawnmower running smoothly.  Click to start your repair! #CubCadet #DIYRepair #OilLeak #LawnMower,https://lawntrend.com/cub-cadet-1040lxt-oil-leak-problems/
Oil Filter Leak? 1040LXT Help,https://res.cloudinary.com/dbcpfy04c/image/upload/v1618237451/placeholder.jpg,home-inspiration,,Is your Cub Cadet 1040LXT leaking oil around the oil filter? This post specifically addresses this common issue,https://lawntrend.com/cub-cadet-1040lxt-oil-leak-problems/?utm_source=pinterest&utm_campaign=oil-filter-leak-1040,2025-04-28,providing troubleshooting tips and replacement instructions.  Ensure a proper seal and prevent future leaks with our expert advice.  Don't let a simple oil filter cause big problems!  Read now and get back to work. #CubCadet1040LXT #OilFilter #OilLeak #LawnCare,https://lawntrend.com/cub-cadet-1040lxt-oil-leak-problems/
Cub Cadet 1040LXT: Valve Cover Leak,https://res.cloudinary.com/dbcpfy04c/image/upload/v1618237451/placeholder.jpg,home-inspiration,,"A leaking valve cover gasket can cause a messy oil leak on your Cub Cadet 1040LXT. This article focuses on diagnosing and replacing the valve cover gasket.  We'll show you how to access the valve cover, remove the old gasket",https://lawntrend.com/cub-cadet-1040lxt-oil-leak-problems/?utm_source=pinterest&utm_campaign=cub-cadet-1040lxt-va,2025-04-28,and install a new one.  Keep your engine clean and running efficiently.  Click to learn more! #CubCadet #ValveCoverGasket #OilLeakRepair #LawnMowerMaintenance,https://lawntrend.com/cub-cadet-1040lxt-oil-leak-problems/
Save Money: Fix Your Oil Leak!,https://res.cloudinary.com/dbcpfy04c/image/upload/v1618237451/placeholder.jpg,home-inspiration,,"Don't throw money away on expensive repairs! This post shows you how to diagnose and fix common oil leaks on your Cub Cadet 1040LXT yourself.  We provide clear instructions, helpful photos",https://lawntrend.com/cub-cadet-1040lxt-oil-leak-problems/?utm_source=pinterest&utm_campaign=save-money-fix-your-,2025-04-28,and a list of necessary tools.  Protect your wallet and your lawnmower.  Click to read now and start saving! #CubCadet1040LXT #OilLeak #DIY #SaveMoney,https://lawntrend.com/cub-cadet-1040lxt-oil-leak-problems/
Cub Cadet 1040LXT: Oil Leak Guide,https://res.cloudinary.com/dbcpfy04c/image/upload/v1618237451/placeholder.jpg,home-inspiration,,Confused about your Cub Cadet 1040LXT oil leak? This comprehensive guide covers everything you need to know,https://lawntrend.com/cub-cadet-1040lxt-oil-leak-problems/?utm_source=pinterest&utm_campaign=cub-cadet-1040lxt-oi,2025-04-28,from identifying the source of the leak to choosing the right repair method.  We'll help you understand the different types of leaks and the best way to address them.  Get the information you need to get your mower back in action! #CubCadet #LawnMowerGuide #OilLeak #Repair,https://lawntrend.com/cub-cadet-1040lxt-oil-leak-problems/
Oil Leak Prevention: 1040LXT Tips,https://res.cloudinary.com/dbcpfy04c/image/upload/v1618237451/placeholder.jpg,home-inspiration,,"Prevent oil leaks on your Cub Cadet 1040LXT with these proactive maintenance tips! This article focuses on preventing leaks before they start, covering oil change intervals, gasket care",https://lawntrend.com/cub-cadet-1040lxt-oil-leak-problems/?utm_source=pinterest&utm_campaign=oil-leak-prevention-,2025-04-28,and proper storage.  Keep your lawnmower running smoothly for years to come.  Read now and protect your investment! #CubCadet1040LXT #PreventativeMaintenance #OilChange #LawnCare,https://lawntrend.com/cub-cadet-1040lxt-oil-leak-problems/
Cub Cadet 1040LXT: Oil Pan Leak,https://res.cloudinary.com/dbcpfy04c/image/upload/v1618237451/placeholder.jpg,home-inspiration,,"Is oil leaking from the oil pan on your Cub Cadet 1040LXT? This post provides a detailed guide to diagnosing and repairing oil pan leaks.  We'll cover gasket replacement, bolt tightening",https://lawntrend.com/cub-cadet-1040lxt-oil-leak-problems/?utm_source=pinterest&utm_campaign=cub-cadet-1040lxt-oi,2025-04-28,and potential damage assessment.  Don't ignore this issue – it can lead to serious engine problems.  Click to learn more! #CubCadet #OilPanGasket #OilLeakRepair #LawnMower,https://lawntrend.com/cub-cadet-1040lxt-oil-leak-problems/
Cub Cadet Oil Leak: When to Call a Pro,https://res.cloudinary.com/dbcpfy04c/image/upload/v1618237451/placeholder.jpg,home-inspiration,,"Sometimes an oil leak is beyond DIY repair. This post helps you determine when it's time to call a professional mechanic for your Cub Cadet 1040LXT.  We'll cover complex leaks, engine damage",https://lawntrend.com/cub-cadet-1040lxt-oil-leak-problems/?utm_source=pinterest&utm_campaign=cub-cadet-oil-leak-w,2025-04-28,and safety concerns.  Don't risk further damage – know when to seek expert help. #CubCadet #OilLeak #LawnMowerRepair #ProfessionalHelp,https://lawntrend.com/cub-cadet-1040lxt-oil-leak-problems/
1040LXT Oil Leak: Parts You Need,https://res.cloudinary.com/dbcpfy04c/image/upload/v1618237451/placeholder.jpg,home-inspiration,,"Ready to tackle your Cub Cadet 1040LXT oil leak? This post provides a comprehensive list of the parts you'll need for common repairs.  We'll help you find the right gaskets, seals",https://lawntrend.com/cub-cadet-1040lxt-oil-leak-problems/?utm_source=pinterest&utm_campaign=1040lxt-oil-leak-par,2025-04-28,and filters.  Get prepared and make your repair go smoothly.  Click to see the parts list! #CubCadet1040LXT #OilLeakParts #LawnMowerRepair #ReplacementParts,https://lawntrend.com/cub-cadet-1040lxt-oil-leak-problems/
Cub Cadet 1040LXT: Oil Leak Safety,https://res.cloudinary.com/dbcpfy04c/image/upload/v1618237451/placeholder.jpg,home-inspiration,,"Safety first! This article emphasizes the importance of safety precautions when working on your Cub Cadet 1040LXT oil leak.  We'll cover proper handling of oil, tool safety",https://lawntrend.com/cub-cadet-1040lxt-oil-leak-problems/?utm_source=pinterest&utm_campaign=cub-cadet-1040lxt-oi,2025-04-28,and engine shutdown procedures.  Protect yourself and avoid accidents.  Read now and stay safe! #CubCadet #OilLeakSafety #LawnMowerRepair #SafetyTips,https://lawntrend.com/cub-cadet-1040lxt-oil-leak-problems/
Cub Cadet 1040LXT: Oil Leak FAQ,https://res.cloudinary.com/dbcpfy04c/image/upload/v1618237451/placeholder.jpg,home-inspiration,,"Got questions about your Cub Cadet 1040LXT oil leak? This post answers frequently asked questions, providing clear and concise information.  We'll cover common causes, repair options",https://lawntrend.com/cub-cadet-1040lxt-oil-leak-problems/?utm_source=pinterest&utm_campaign=cub-cadet-1040lxt-oi,2025-04-28,and preventative measures.  Get the answers you need to get your mower back in action! #CubCadet #OilLeakFAQ #LawnMowerQuestions #RepairHelp,https://lawntrend.com/cub-cadet-1040lxt-oil-leak-problems/
Fix It Yourself: 1040LXT Oil Leak,https://res.cloudinary.com/ddxyyzkuq/image/upload/v1745872369/pin_8_19_vlebdm.webp,lawn-repair-ideas,,"Take control of your lawnmower repair! This post empowers you to fix your Cub Cadet 1040LXT oil leak yourself.  We provide detailed instructions, helpful photos",https://lawntrend.com/cub-cadet-1040lxt-oil-leak-problems/?utm_source=pinterest&utm_campaign=fix-it-yourself-1040,2025-04-28,and a supportive tone.  Don't be afraid to get your hands dirty – you can do it! #CubCadet1040LXT #DIYRepair #OilLeak #LawnMower,https://lawntrend.com/cub-cadet-1040lxt-oil-leak-problems/
Cub Cadet 1040LXT: Oil Leak Resources,https://res.cloudinary.com/dbcpfy04c/image/upload/v1618237451/placeholder.jpg,home-inspiration,,"Need more help with your Cub Cadet 1040LXT oil leak? This post provides a list of helpful resources, including parts diagrams, repair manuals",https://lawntrend.com/cub-cadet-1040lxt-oil-leak-problems/?utm_source=pinterest&utm_campaign=cub-cadet-1040lxt-oi,2025-04-28,and online forums.  Get the support you need to succeed.  Click to access the resources! #CubCadet1040LXT #OilLeakResources #LawnMowerHelp #RepairLinks,https://lawntrend.com/cub-cadet-1040lxt-oil-leak-problems/
Cub Cadet 1040LXT: Oil Leak Checklist,https://res.cloudinary.com/ddxyyzkuq/image/upload/v1745872378/pin_8_21_ujjhdf.webp,lawn-repair-ideas,,"Before you start repairing your Cub Cadet 1040LXT oil leak, use this handy checklist to ensure you have everything you need. We'll cover tools, parts",https://lawntrend.com/cub-cadet-1040lxt-oil-leak-problems/?utm_source=pinterest&utm_campaign=cub-cadet-1040lxt-oi,2025-04-28,and safety precautions. Get organized and make your repair a success! #CubCadet1040LXT #OilLeakChecklist #LawnMowerRepair #DIYTools,https://lawntrend.com/cub-cadet-1040lxt-oil-leak-problems/
Title,https://res.cloudinary.com/dbcpfy04c/image/upload/v1618237451/placeholder.jpg,home-inspiration,,Description,https://lawntrend.com/cub-cadet-rzt-50-pto-clutch-problems/?utm_source=pinterest&utm_campaign=title,2025-04-28,Keywords,https://lawntrend.com/cub-cadet-rzt-50-pto-clutch-problems/
Cub Cadet RZT 50 PTO Clutch: Fix It!,https://res.cloudinary.com/dbcpfy04c/image/upload/v1618237451/placeholder.jpg,home-inspiration,,"Is your Cub Cadet RZT 50 riding mower refusing to engage? Don't let a faulty PTO clutch ruin your weekend! This guide dives deep into common problems, troubleshooting steps, and even DIY repair options. We'll help you diagnose if it's a simple fix or time to call a pro. Save money & get back to enjoying a perfectly manicured lawn! Click to learn more and reclaim your yard work freedom. #CubCadet #RZT50 #PTOClutch #LawnMowerRepair,Cub Cadet,RZT 50,PTO Clutch",https://lawntrend.com/cub-cadet-rzt-50-pto-clutch-problems/?utm_source=pinterest&utm_campaign=cub-cadet-rzt-50-pto,2025-04-28,Lawn Mower,https://lawntrend.com/cub-cadet-rzt-50-pto-clutch-problems/
RZT 50 PTO Clutch: Is It Broken?,https://res.cloudinary.com/dbcpfy04c/image/upload/v1618237451/placeholder.jpg,home-inspiration,,"Frustrated with a Cub Cadet RZT 50 that won't mow? A failing PTO clutch is a common culprit. This pin leads to a comprehensive guide covering everything from symptoms of a bad clutch to detailed repair instructions. Don't waste another sunny day – get your mower running smoothly again! Learn how to identify the issue and decide if you can tackle the repair yourself. #CubCadetRZT50 #PTOProblems #DIYRepair #LawnCare,PTO,RZT 50,Repair",https://lawntrend.com/cub-cadet-rzt-50-pto-clutch-problems/?utm_source=pinterest&utm_campaign=rzt-50-pto-clutch-is,2025-04-28,Cub Cadet,https://lawntrend.com/cub-cadet-rzt-50-pto-clutch-problems/
DIY RZT 50 PTO Clutch Repair?,https://res.cloudinary.com/dbcpfy04c/image/upload/v1618237451/placeholder.jpg,home-inspiration,,"Don't pay a fortune for mower repairs! This pin links to a step-by-step guide on fixing your Cub Cadet RZT 50 PTO clutch yourself. We break down the process into manageable steps, with clear explanations and helpful tips. Empower yourself to save money and keep your lawn looking its best. Click to learn more! #CubCadet #RZT50Repair #PTOClutchFix #DIY,DIY,PTO Clutch,RZT 50",https://lawntrend.com/cub-cadet-rzt-50-pto-clutch-problems/?utm_source=pinterest&utm_campaign=diy-rzt-50-pto-clutc,2025-04-28,Cub Cadet,https://lawntrend.com/cub-cadet-rzt-50-pto-clutch-problems/
Cub Cadet PTO Clutch Troubleshooting,https://res.cloudinary.com/dbcpfy04c/image/upload/v1618237451/placeholder.jpg,home-inspiration,,"Struggling to diagnose your Cub Cadet RZT 50's PTO clutch issue? This pin directs you to a detailed troubleshooting guide. We cover common symptoms, potential causes, and how to pinpoint the exact problem. Stop guessing and start fixing! Get back to enjoying your yard, not fighting with your mower. #LawnMowerTroubleshooting #PTOClutch #CubCadetRZT50 #YardWork,Troubleshooting,PTO,RZT 50",https://lawntrend.com/cub-cadet-rzt-50-pto-clutch-problems/?utm_source=pinterest&utm_campaign=cub-cadet-pto-clutch,2025-04-28,Cub Cadet,https://lawntrend.com/cub-cadet-rzt-50-pto-clutch-problems/
RZT 50: PTO Not Engaging? Help!,https://res.cloudinary.com/dbcpfy04c/image/upload/v1618237451/placeholder.jpg,home-inspiration,,"Is your Cub Cadet RZT 50's PTO clutch refusing to engage? You're not alone! This pin leads to a guide that explains why this happens and how to fix it. We'll walk you through the process, so you can get back to mowing in no time. Don't let a broken clutch ruin your summer! #CubCadet #RZT50 #PTO #LawnMower,PTO,RZT 50,Cub Cadet",https://lawntrend.com/cub-cadet-rzt-50-pto-clutch-problems/?utm_source=pinterest&utm_campaign=rzt-50-pto-not-engag,2025-04-28,Lawn Mower,https://lawntrend.com/cub-cadet-rzt-50-pto-clutch-problems/
Save Money: RZT 50 PTO Fix,https://res.cloudinary.com/dbcpfy04c/image/upload/v1618237451/placeholder.jpg,home-inspiration,,"Tired of expensive lawn mower repairs? Learn how to fix your Cub Cadet RZT 50 PTO clutch yourself and save a bundle! This pin links to a detailed guide with step-by-step instructions and helpful tips. Take control of your lawn care budget and get back to enjoying your outdoor space. #DIYLawnCare #CubCadetRepair #PTOClutch #SaveMoney,DIY,PTO,RZT 50",https://lawntrend.com/cub-cadet-rzt-50-pto-clutch-problems/?utm_source=pinterest&utm_campaign=save-money-rzt-50-pt,2025-04-28,Cub Cadet,https://lawntrend.com/cub-cadet-rzt-50-pto-clutch-problems/
Cub Cadet RZT 50 Clutch Guide,https://res.cloudinary.com/dbcpfy04c/image/upload/v1618237451/placeholder.jpg,home-inspiration,,"Everything you need to know about your Cub Cadet RZT 50 PTO clutch is right here! This pin leads to a comprehensive guide covering common problems, troubleshooting, and repair options. Don't let a faulty clutch slow you down – get your mower running smoothly again. #CubCadet #RZT50 #PTOClutch #LawnCareTips,PTO,RZT 50,Cub Cadet",https://lawntrend.com/cub-cadet-rzt-50-pto-clutch-problems/?utm_source=pinterest&utm_campaign=cub-cadet-rzt-50-clu,2025-04-28,Lawn Care,https://lawntrend.com/cub-cadet-rzt-50-pto-clutch-problems/
RZT 50 PTO: Common Problems,https://res.cloudinary.com/dbcpfy04c/image/upload/v1618237451/placeholder.jpg,home-inspiration,,"Discover the most common problems with the Cub Cadet RZT 50 PTO clutch. This pin links to a guide that details the symptoms, causes, and solutions for each issue. Arm yourself with knowledge and keep your mower running like new! Don't let a small problem turn into a big expense. #CubCadetRZT50 #PTOProblems #LawnMowerMaintenance #DIY,PTO,RZT 50,Cub Cadet",https://lawntrend.com/cub-cadet-rzt-50-pto-clutch-problems/?utm_source=pinterest&utm_campaign=rzt-50-pto-common-pr,2025-04-28,Maintenance,https://lawntrend.com/cub-cadet-rzt-50-pto-clutch-problems/
