Title,Media URL,Pinterest board,Thumbnail,Description,Link,Publish date,Keywords,Source URL
The Ultimate Black Trailer Wash,https://res.cloudinary.com/ddxyyzkuq/image/upload/v1746045123/pin_4_9_jndxzo.webp,trailer-detailing-ideas,,"Learn the ultimate black trailer washing technique! This pin details a comprehensive washing process, from pre-rinse to final polish.  We cover everything you need to know to achieve a professional-quality clean.  Don't settle for less â€“ give your trailer the treatment it deserves! #trailerwash #blacktrailer #rvcleaning #detailing,trailer wash,black trailer,rv cleaning",https://www.beacleaner.com/how-to-clean-a-black-trailer?utm_source=pinterest&utm_campaign=the-ultimate-black-t,2025-04-30,detailing,https://www.beacleaner.com/how-to-clean-a-black-trailer
Black Trailer: Bug Splatter Removal,https://res.cloudinary.com/ddxyyzkuq/image/upload/v1746045129/pin_4_10_elnuyr.webp,rv-restoration-ideas,,"Pesky bug splatter ruining your trailer's look? This pin focuses specifically on removing bug splatter without damaging the paint.  We share our favorite products and techniques for a spotless finish.  Say goodbye to those unsightly splatters and hello to a clean, beautiful trailer! #bugremoval #trailercleaning #blacktrailer #rvlife,bug removal,trailer cleaning,black trailer",https://www.beacleaner.com/how-to-clean-a-black-trailer?utm_source=pinterest&utm_campaign=black-trailer-bug-sp,2025-04-30,rv life,https://www.beacleaner.com/how-to-clean-a-black-trailer
Black Trailer: Oxidation Removal Tips,https://res.cloudinary.com/ddxyyzkuq/image/upload/v1746045134/pin_4_11_m3xhlh.webp,rv-restoration-ideas,,"Is your black trailer looking faded and oxidized? This pin provides expert tips on removing oxidation and restoring the original color.  We'll show you how to choose the right products and techniques for a flawless finish.  Bring back the shine and protect your investment! #oxidationremoval #trailercleaning #blacktrailer #rvmaintenance,oxidation removal,trailer cleaning,black trailer",https://www.beacleaner.com/how-to-clean-a-black-trailer?utm_source=pinterest&utm_campaign=black-trailer-oxidat,2025-04-30,rv maintenance,https://www.beacleaner.com/how-to-clean-a-black-trailer
DIY Black Trailer Detailing Guide,https://res.cloudinary.com/ddxyyzkuq/image/upload/v1746045140/pin_4_12_rpmpny.webp,rv-life-ideas,,"Become a trailer detailing pro! This pin offers a step-by-step guide to detailing your black trailer like a professional.  We cover everything from washing and waxing to polishing and protecting.  Save money and enjoy the satisfaction of a job well done! #trailerdetailing #blacktrailer #diy #rvlife,trailer detailing,black trailer,diy",https://www.beacleaner.com/how-to-clean-a-black-trailer?utm_source=pinterest&utm_campaign=diy-black-trailer-de,2025-04-30,rv life,https://www.beacleaner.com/how-to-clean-a-black-trailer
Black Trailer: Wheel Well Cleaning,https://res.cloudinary.com/ddxyyzkuq/image/upload/v1746045146/pin_4_13_n3yluj.webp,rv-restoration-ideas,,"Don't forget the wheel wells! This pin focuses on cleaning those often-overlooked areas of your black trailer.  We share tips on removing dirt, grime, and brake dust for a complete clean.  A clean trailer is a happy trailer! #wheelwellcleaning #trailercleaning #blacktrailer #rvmaintenance,wheel well cleaning,trailer cleaning,black trailer",https://www.beacleaner.com/how-to-clean-a-black-trailer?utm_source=pinterest&utm_campaign=black-trailer-wheel-,2025-04-30,rv maintenance,https://www.beacleaner.com/how-to-clean-a-black-trailer
Black Trailer: Roof Cleaning Secrets,https://res.cloudinary.com/ddxyyzkuq/image/upload/v1746045152/pin_4_14_dca3cr.webp,rv-restoration-ideas,,"Keep your trailer's roof clean and protected! This pin reveals our secrets for safely and effectively cleaning your black trailer's roof.  We cover everything from choosing the right cleaning solution to preventing leaks.  Protect your investment and enjoy peace of mind! #roofcleaning #trailercleaning #blacktrailer #rvlife,roof cleaning,trailer cleaning,black trailer",https://www.beacleaner.com/how-to-clean-a-black-trailer?utm_source=pinterest&utm_campaign=black-trailer-roof-c,2025-04-30,rv life,https://www.beacleaner.com/how-to-clean-a-black-trailer
Black Trailer: Choosing the Right Soap,https://res.cloudinary.com/ddxyyzkuq/image/upload/v1746045159/pin_4_15_tzjz59.webp,rv-restoration-ideas,,"Choosing the right soap is crucial! This pin explains the importance of using a pH-balanced soap specifically designed for black trailers.  We'll help you avoid harsh chemicals that can damage the finish.  Protect your investment and achieve a spotless clean! #trailercleaning #blacktrailer #soap #rvcleaning,trailer cleaning,black trailer,soap",https://www.beacleaner.com/how-to-clean-a-black-trailer?utm_source=pinterest&utm_campaign=black-trailer-choosi,2025-04-30,rv cleaning,https://www.beacleaner.com/how-to-clean-a-black-trailer
Black Trailer: Drying Techniques,https://res.cloudinary.com/ddxyyzkuq/image/upload/v1746045164/pin_4_16_jessko.webp,rv-restoration-ideas,,"Avoid water spots! This pin demonstrates the best drying techniques for your black trailer, ensuring a streak-free shine.  We cover everything from microfiber towels to air drying.  Get a professional-quality finish every time! #dryingtechniques #trailercleaning #blacktrailer #rvlife,drying techniques,trailer cleaning,black trailer",https://www.beacleaner.com/how-to-clean-a-black-trailer?utm_source=pinterest&utm_campaign=black-trailer-drying,2025-04-30,rv life,https://www.beacleaner.com/how-to-clean-a-black-trailer
Black Trailer: Waxing & Polishing,https://res.cloudinary.com/ddxyyzkuq/image/upload/v1746045170/pin_4_17_wauwnl.webp,rv-restoration-ideas,,"Take your trailer's shine to the next level! This pin guides you through the process of waxing and polishing your black trailer.  We'll show you how to choose the right products and techniques for a long-lasting shine.  Protect your investment and turn heads! #waxing #polishing #trailercleaning #blacktrailer,waxing,polishing,trailer cleaning",https://www.beacleaner.com/how-to-clean-a-black-trailer?utm_source=pinterest&utm_campaign=black-trailer-waxing,2025-04-30,black trailer,https://www.beacleaner.com/how-to-clean-a-black-trailer
Black Trailer: Preventing Future Dirt,https://res.cloudinary.com/ddxyyzkuq/image/upload/v1746045175/pin_4_18_valg2b.webp,rv-restoration-ideas,,"Keep your trailer cleaner for longer! This pin offers tips on preventing dirt and grime from building up on your black trailer.  We cover everything from protective coatings to regular maintenance.  Spend less time cleaning and more time enjoying your adventures! #trailerprotection #blacktrailer #rvlife #cleaningtips,trailer protection,black trailer,rv life",https://www.beacleaner.com/how-to-clean-a-black-trailer?utm_source=pinterest&utm_campaign=black-trailer-preven,2025-04-30,cleaning tips,https://www.beacleaner.com/how-to-clean-a-black-trailer
Black Trailer: Dealing with Road Grime,https://res.cloudinary.com/ddxyyzkuq/image/upload/v1746045181/pin_4_19_cyinfa.webp,rv-restoration-ideas,,"Road grime got you down? This pin tackles the toughest road grime on your black trailer.  We share our favorite products and techniques for a deep clean.  Restore your trailer's shine and enjoy the open road! #roadgrime #trailercleaning #blacktrailer #rvlife,road grime,trailer cleaning,black trailer",https://www.beacleaner.com/how-to-clean-a-black-trailer?utm_source=pinterest&utm_campaign=black-trailer-dealin,2025-04-30,rv life,https://www.beacleaner.com/how-to-clean-a-black-trailer
Black Trailer: The Power of Microfiber,https://res.cloudinary.com/ddxyyzkuq/image/upload/v1746045186/pin_4_20_r19bqz.webp,rv-restoration-ideas,,"Unlock the power of microfiber! This pin explains why microfiber cloths are essential for cleaning your black trailer.  We'll show you how to use them effectively to avoid scratches and achieve a spotless finish. #microfiber #trailercleaning #blacktrailer #cleaninghacks,microfiber,trailer cleaning,black trailer",https://www.beacleaner.com/how-to-clean-a-black-trailer?utm_source=pinterest&utm_campaign=black-trailer-the-po,2025-04-30,cleaning hacks,https://www.beacleaner.com/how-to-clean-a-black-trailer
Black Trailer: Long-Term Protection,https://res.cloudinary.com/ddxyyzkuq/image/upload/v1746045192/pin_4_21_ccq480.webp,rv-restoration-ideas,,"Invest in long-term protection! This pin focuses on protecting your black trailer's finish from the elements.  We cover everything from UV protection to rust prevention.  Keep your trailer looking new for years to come! #trailerprotection #blacktrailer #rvmaintenance #longtermcare,trailer protection,black trailer,rv maintenance",https://www.beacleaner.com/how-to-clean-a-black-trailer?utm_source=pinterest&utm_campaign=black-trailer-long-t,2025-04-30,long term care,https://www.beacleaner.com/how-to-clean-a-black-trailer
Black Trailer: Easy Maintenance Routine,https://res.cloudinary.com/ddxyyzkuq/image/upload/v1746045197/pin_4_22_wssqxc.webp,rv-restoration-ideas,,"Simplify your life with an easy maintenance routine! This pin provides a simple schedule for keeping your black trailer clean and protected.  Spend just a few minutes each week, and you'll avoid major cleaning projects down the road. #trailermaintenance #blacktrailer #rvlife #easycleaning,trailer maintenance,black trailer,rv life",https://www.beacleaner.com/how-to-clean-a-black-trailer?utm_source=pinterest&utm_campaign=black-trailer-easy-m,2025-04-30,easy cleaning,https://www.beacleaner.com/how-to-clean-a-black-trailer
Black Trailer: Common Cleaning Mistakes,https://res.cloudinary.com/ddxyyzkuq/image/upload/v1746045203/pin_4_23_lwavga.webp,rv-restoration-ideas,,"Avoid these common cleaning mistakes! This pin highlights the errors people often make when cleaning their black trailers.  Learn from our mistakes and achieve a flawless finish. #trailercleaning #blacktrailer #cleaningmistakes #rvtips,trailer cleaning,black trailer,cleaning mistakes",https://www.beacleaner.com/how-to-clean-a-black-trailer?utm_source=pinterest&utm_campaign=black-trailer-common,2025-04-30,rv tips,https://www.beacleaner.com/how-to-clean-a-black-trailer
Black Trailer: Professional Results at Home,https://res.cloudinary.com/ddxyyzkuq/image/upload/v1746045209/pin_4_24_mnwmcc.webp,rv-restoration-ideas,,"Get professional results without the price tag! This pin empowers you to clean your black trailer like a pro, saving you money and time.  Follow our step-by-step guide and enjoy a stunning finish. #trailerdetailing #blacktrailer #diy #rvlife,trailer detailing,black trailer,diy",https://www.beacleaner.com/how-to-clean-a-black-trailer?utm_source=pinterest&utm_campaign=black-trailer-profes,2025-04-30,rv life,https://www.beacleaner.com/how-to-clean-a-black-trailer
Black Trailer: The Shine You Deserve,https://res.cloudinary.com/ddxyyzkuq/image/upload/v1746045215/pin_4_25_ed8kxy.webp,rv-restoration-ideas,,"You deserve a sparkling clean trailer! This pin appeals to the emotional desire for a beautiful and well-maintained trailer.  We show you how to achieve the shine you deserve and enjoy your adventures to the fullest. #trailercleaning #blacktrailer #rvlife #shine,trailer cleaning,black trailer,rv life",https://www.beacleaner.com/how-to-clean-a-black-trailer?utm_source=pinterest&utm_campaign=black-trailer-the-sh,2025-04-30,shine,https://www.beacleaner.com/how-to-clean-a-black-trailer
Title,https://res.cloudinary.com/ddxyyzkuq/image/upload/v1746045267/pin_5_1_vaotvl.webp,please-provide-the-title-and-keywords-i-need-that-information-to-suggest-a-board-name-once,,Description,https://www.beacleaner.com/how-to-clean-a-car-duster?utm_source=pinterest&utm_campaign=title,2025-04-30,Keywords,https://www.beacleaner.com/how-to-clean-a-car-duster
Dust-Free Ride: Clean Your Car Duster!,https://res.cloudinary.com/ddxyyzkuq/image/upload/v1746045273/pin_5_2_kx0u61.webp,auto-care-ideas,,"â€œIs your car duster lookingâ€¦less than fresh? Don't replace it! This guide shows you how to easily clean your car duster & restore its dust-grabbing power. A clean duster means a cleaner car, saving you time & money. Learn simple techniques for removing built-up grime & keeping your car sparkling.  Don't let dust ruin your car's shine â€“ get cleaning today! Click to learn how! âœ¨ #cardetailing #carcleaning #carduster #autocleaning #detailingtips"",car duster,car cleaning,detailing",https://www.beacleaner.com/how-to-clean-a-car-duster?utm_source=pinterest&utm_campaign=dust-free-ride-clean,2025-04-30,auto care,https://www.beacleaner.com/how-to-clean-a-car-duster
Revive Your Duster: Easy Cleaning Steps,https://res.cloudinary.com/ddxyyzkuq/image/upload/v1746045280/pin_5_3_ag6nyp.webp,car-care-ideas,,"â€œTired of a duster that just *spreads* dust? ðŸ˜© This post reveals the secrets to a truly clean car duster! We'll walk you through quick & effective methods to remove dust, dirt, and even those pesky fingerprints.  A clean duster protects your car's paint & keeps it looking its best.  Stop wasting money on replacements â€“ learn to clean it! Click for a spotless finish! ðŸš— #cardustercleaning #carcare #autodetailing #cleaninghacks #carhacks"",car duster,cleaning hacks,auto detailing",https://www.beacleaner.com/how-to-clean-a-car-duster?utm_source=pinterest&utm_campaign=revive-your-duster-e,2025-04-30,car care,https://www.beacleaner.com/how-to-clean-a-car-duster
Extend Your Duster's Life: A Simple Guide,https://res.cloudinary.com/ddxyyzkuq/image/upload/v1746045286/pin_5_4_kulogp.webp,cleaning-ideas,,"â€œDon't throw away your car duster just yet! â™»ï¸ This guide shows you how to clean and maintain your duster for long-lasting performance.  We cover everything from shaking it out to gentle washing techniques.  Protect your investment & keep your car looking showroom-ready.  Click to learn how to make your duster last! âœ¨ #carduster #carcleaningtips #autocare #detailinglife #savemoney"",car duster,car cleaning tips,auto care",https://www.beacleaner.com/how-to-clean-a-car-duster?utm_source=pinterest&utm_campaign=extend-your-dusters-,2025-04-30,detailing,https://www.beacleaner.com/how-to-clean-a-car-duster
The Ultimate Car Duster Cleaning Hack,https://res.cloudinary.com/ddxyyzkuq/image/upload/v1746045293/pin_5_5_c9y4ui.webp,car-cleaning-ideas,,"â€œDiscover the *one* trick professional detailers use to keep their car dusters in perfect condition! ðŸ¤« This post reveals a simple, yet powerful cleaning method that will leave your duster looking and performing like new.  Say goodbye to dusty streaks and hello to a sparkling clean car! Click to unlock the secret! ðŸ¤© #cardusterhack #cardetailingtips #autocleaning #carcleaning #detailing"",car duster,detailing tips,auto cleaning",https://www.beacleaner.com/how-to-clean-a-car-duster?utm_source=pinterest&utm_campaign=the-ultimate-car-dus,2025-04-30,car cleaning,https://www.beacleaner.com/how-to-clean-a-car-duster
Is Your Car Duster Dirty? Find Out Now!,https://res.cloudinary.com/ddxyyzkuq/image/upload/v1746045300/pin_5_6_dubzdd.webp,car-detailing-ideas,,"â€œIs your car duster actually making things *worse*? ðŸ˜± A dirty duster can scratch your paint! This post helps you identify when it's time for a clean & provides easy steps to restore it.  Protect your car's finish & enjoy a truly clean ride. Click to learn how to avoid damage! ðŸ›¡ï¸ #carduster #carpaint #autocare #detailing #carcleaningtips"",car duster,car paint,auto care",https://www.beacleaner.com/how-to-clean-a-car-duster?utm_source=pinterest&utm_campaign=is-your-car-duster-d,2025-04-30,detailing,https://www.beacleaner.com/how-to-clean-a-car-duster
Quick & Easy: Clean Your Duster in Minutes,https://res.cloudinary.com/ddxyyzkuq/image/upload/v1746045307/pin_5_7_ch3xww.webp,car-cleaning-ideas,,"â€œShort on time? â° This post shows you how to clean your car duster in just a few minutes!  We've broken down the process into simple, easy-to-follow steps.  Get back to enjoying a clean car without spending hours on maintenance. Click for a quick clean! âœ¨ #cardustercleaning #quickcleaning #carcare #autodetailing #cleaningtips"",car duster,quick cleaning,car care",https://www.beacleaner.com/how-to-clean-a-car-duster?utm_source=pinterest&utm_campaign=quick-easy-clean-you,2025-04-30,auto detailing,https://www.beacleaner.com/how-to-clean-a-car-duster
Protect Your Car's Paint: Clean Duster Guide,https://res.cloudinary.com/ddxyyzkuq/image/upload/v1746045314/pin_5_8_crwtbt.webp,car-detailing-ideas,,"â€œYour car's paint is an investment! ðŸ’Ž Protect it by keeping your car duster clean. This guide explains why a dirty duster can cause scratches & how to prevent them.  Learn the best cleaning methods for a flawless finish. Click to safeguard your car's shine! âœ¨ #carpaintprotection #carduster #autocare #detailing #carcleaning"",car paint protection,car duster,auto care",https://www.beacleaner.com/how-to-clean-a-car-duster?utm_source=pinterest&utm_campaign=protect-your-cars-pa,2025-04-30,detailing,https://www.beacleaner.com/how-to-clean-a-car-duster
From Dusty to Dazzling: Duster Transformation,https://res.cloudinary.com/ddxyyzkuq/image/upload/v1746045321/pin_5_9_l9qhws.webp,auto-detailing-ideas,,"â€œWatch your car duster go from looking sad & dusty to sparkling clean! âœ¨ This post features step-by-step photos & instructions for a complete duster cleaning.  Enjoy the satisfaction of a perfectly clean car & a duster that works like new. Click to see the transformation! ðŸ¤© #cardustercleaning #beforeandafter #carcleaning #autodetailing #cleaningmotivation"",car duster,before and after,car cleaning",https://www.beacleaner.com/how-to-clean-a-car-duster?utm_source=pinterest&utm_campaign=from-dusty-to-dazzli,2025-04-30,auto detailing,https://www.beacleaner.com/how-to-clean-a-car-duster
DIY Car Duster Cleaning: Save Money!,https://res.cloudinary.com/ddxyyzkuq/image/upload/v1746045328/pin_5_10_mstvb0.webp,car-detailing-ideas,,"â€œStop buying new car dusters! ðŸ’° This DIY guide shows you how to clean your existing duster & save money.  We'll share simple techniques using everyday household items.  Get a professional-level clean without breaking the bank. Click to start saving! ðŸ’¸ #diycleaning #carduster #carcare #autodetailing #savemoneytips"",diy cleaning,car duster,car care",https://www.beacleaner.com/how-to-clean-a-car-duster?utm_source=pinterest&utm_campaign=diy-car-duster-clean,2025-04-30,auto detailing,https://www.beacleaner.com/how-to-clean-a-car-duster
The Secret to a Streak-Free Car Finish,https://res.cloudinary.com/ddxyyzkuq/image/upload/v1746045334/pin_5_11_nzf5lz.webp,car-detailing-ideas,,"â€œWant a truly streak-free car finish? ðŸ¤© It all starts with a clean car duster! This post reveals how to properly clean your duster to avoid streaks & scratches.  Enjoy a showroom-worthy shine every time. Click to learn the secret! âœ¨ #streakfreecar #carduster #autocare #detailing #carcleaningtips"",streak free car,car duster,auto care",https://www.beacleaner.com/how-to-clean-a-car-duster?utm_source=pinterest&utm_campaign=the-secret-to-a-stre,2025-04-30,detailing,https://www.beacleaner.com/how-to-clean-a-car-duster
Gentle Cleaning for Delicate Car Dusting,https://res.cloudinary.com/ddxyyzkuq/image/upload/v1746045341/pin_5_12_ctoeac.webp,car-detailing-ideas,,"â€œWorried about damaging your car duster? ðŸ¤” This post focuses on gentle cleaning methods that won't harm the delicate fibers.  We'll show you how to remove dust & grime without causing wear & tear.  Keep your duster in top condition for years to come. Click for gentle care! ðŸŒ¸ #gentlecleaning #carduster #autocare #detailing #carcleaning"",gentle cleaning,car duster,auto care",https://www.beacleaner.com/how-to-clean-a-car-duster?utm_source=pinterest&utm_campaign=gentle-cleaning-for-,2025-04-30,detailing,https://www.beacleaner.com/how-to-clean-a-car-duster
Deep Clean Your Car Duster: Step-by-Step,https://res.cloudinary.com/ddxyyzkuq/image/upload/v1746045347/pin_5_13_mrr34s.webp,bag-care-ideas,,"â€œGive your car duster the deep clean it deserves! ðŸ§¼ This post provides a detailed, step-by-step guide to removing even the most stubborn dirt & grime.  Enjoy a duster that performs like new & protects your car's finish. Click for a thorough clean! âœ¨ #deepcleaning #carduster #autocare #detailing #carcleaningtips"",deep cleaning,car duster,auto care",https://www.beacleaner.com/how-to-clean-a-car-duster?utm_source=pinterest&utm_campaign=deep-clean-your-car-,2025-04-30,detailing,https://www.beacleaner.com/how-to-clean-a-car-duster
Car Duster Cleaning: Common Mistakes to Avoid,https://res.cloudinary.com/ddxyyzkuq/image/upload/v1746045354/pin_5_14_dr2zys.webp,car-detailing-ideas,,"â€œAre you making these common car duster cleaning mistakes? ðŸ˜¬ This post highlights errors that can damage your duster & compromise its performance.  Learn how to avoid them & keep your duster in top shape. Click to clean smarter, not harder! ðŸ’¡ #carduster #cleaningmistakes #autocare #detailing #carcleaningtips"",car duster,cleaning mistakes,auto care",https://www.beacleaner.com/how-to-clean-a-car-duster?utm_source=pinterest&utm_campaign=car-duster-cleaning-,2025-04-30,detailing,https://www.beacleaner.com/how-to-clean-a-car-duster
Beyond Shaking: Advanced Duster Cleaning,https://res.cloudinary.com/ddxyyzkuq/image/upload/v1746045361/pin_5_15_ttlvs5.webp,cleaning-ideas,,"â€œShaking your duster isn't enough! ðŸ™…â€â™€ï¸ This post explores advanced cleaning techniques for a truly thorough clean.  We'll cover washing, drying, & storage tips to maximize your duster's lifespan. Click to level up your cleaning game! ðŸš€ #advancedcleaning #carduster #autocare #detailing #carcleaning"",advanced cleaning,car duster,auto care",https://www.beacleaner.com/how-to-clean-a-car-duster?utm_source=pinterest&utm_campaign=beyond-shaking-advan,2025-04-30,detailing,https://www.beacleaner.com/how-to-clean-a-car-duster
The Best Way to Dry Your Cleaned Car Duster,https://res.cloudinary.com/ddxyyzkuq/image/upload/v1746045368/pin_5_16_uckuao.webp,car-detailing-ideas,,"â€œProper drying is crucial after cleaning your car duster! ðŸŒ¬ï¸ This post explains the best methods to dry your duster quickly & effectively, preventing mildew & maintaining its shape.  Click to ensure a long-lasting, high-performing duster! âœ¨ #dryingtips #carduster #autocare #detailing #carcleaning"",drying tips,car duster,auto care",https://www.beacleaner.com/how-to-clean-a-car-duster?utm_source=pinterest&utm_campaign=the-best-way-to-dry-,2025-04-30,detailing,https://www.beacleaner.com/how-to-clean-a-car-duster
Car Duster Storage: Keep It Clean & Ready,https://res.cloudinary.com/ddxyyzkuq/image/upload/v1746045375/pin_5_17_sbmhuc.webp,car-detailing-ideas,,"â€œDon't let your freshly cleaned duster get dirty again! ðŸ“¦ This post shares smart storage solutions to keep your duster clean, protected, & ready for its next use.  Click to maintain a spotless car with ease! âœ¨ #storageideas #carduster #autocare #detailing #carcleaningtips"",storage ideas,car duster,auto care",https://www.beacleaner.com/how-to-clean-a-car-duster?utm_source=pinterest&utm_campaign=car-duster-storage-k,2025-04-30,detailing,https://www.beacleaner.com/how-to-clean-a-car-duster
Natural Car Duster Cleaning Solutions,https://res.cloudinary.com/ddxyyzkuq/image/upload/v1746045381/pin_5_18_mowwod.webp,auto-care-ideas,,"â€œLooking for eco-friendly cleaning options? ðŸŒ¿ This post explores natural solutions for cleaning your car duster, avoiding harsh chemicals.  Protect your car & the environment with these gentle yet effective methods. Click for a green clean! ðŸŒŽ #naturalcleaning #carduster #ecofriendly #autocare #detailing"",natural cleaning,car duster,eco-friendly",https://www.beacleaner.com/how-to-clean-a-car-duster?utm_source=pinterest&utm_campaign=natural-car-duster-c,2025-04-30,auto care,https://www.beacleaner.com/how-to-clean-a-car-duster
Car Duster Cleaning for Allergy Sufferers,https://res.cloudinary.com/ddxyyzkuq/image/upload/v1746045388/pin_5_19_kenzdx.webp,car-detailing-ideas,,"â€œAllergies got you down? ðŸ¤§ A clean car duster can help! This post explains how to clean your duster to remove allergens & dust mites, creating a healthier car environment. Click to breathe easier! ðŸ’¨ #allergies #carduster #carcleaning #autocare #healthyliving"",allergies,car duster,car cleaning",https://www.beacleaner.com/how-to-clean-a-car-duster?utm_source=pinterest&utm_campaign=car-duster-cleaning-,2025-04-30,auto care,https://www.beacleaner.com/how-to-clean-a-car-duster
Extend the Life of Your Microfiber Duster,https://res.cloudinary.com/ddxyyzkuq/image/upload/v1746045396/pin_5_20_iljotx.webp,cleaning-ideas,,"â€œMicrofiber dusters need special care! âœ¨ This post focuses on cleaning & maintaining microfiber car dusters for optimal performance & longevity.  Learn the do's & don'ts of microfiber care. Click to keep your duster fluffy & effective! â˜ï¸ #microfiber #carduster #autocare #detailing #carcleaning"",microfiber,car duster,auto care",https://www.beacleaner.com/how-to-clean-a-car-duster?utm_source=pinterest&utm_campaign=extend-the-life-of-y,2025-04-30,detailing,https://www.beacleaner.com/how-to-clean-a-car-duster
