Title,Media URL,Pinterest board,Thumbnail,Description,Link,Publish date,Keywords,Source URL
Toro Mower Won't Start? Check This!,https://res.cloudinary.com/ddxyyzkuq/image/upload/v1745868307/pin_6_3_exqr0c.webp,lawn-repair-ideas,,Don't panic! A Toro mower that won't start is often a simple safety switch issue. This post provides a step-by-step guide to identifying if the switch is the culprit and how to replace it yourself.  Avoid expensive repair bills and get your lawn looking its best.  We'll show you exactly what to do,https://lawntrend.com/toro-safety-switch-problem/?utm_source=pinterest&utm_campaign=toro-mower-wont-star,2025-04-28,even if you're not a mechanic. Click to read now! #Toromowerrepair #Lawnmower #DIY #FixIt,https://lawntrend.com/toro-safety-switch-problem/
Troubleshooting Toro Safety Switches,https://res.cloudinary.com/ddxyyzkuq/image/upload/v1745868313/pin_6_4_k11dxj.webp,lawn-care-ideas,,Confused by your Toro's safety switch? This guide breaks down the common problems,https://lawntrend.com/toro-safety-switch-problem/?utm_source=pinterest&utm_campaign=troubleshooting-toro,2025-04-28,from loose connections to complete failures.  We'll help you understand how these switches work and how to safely test them.  Don't risk injury – learn the proper procedures.  Get your Toro running smoothly again! Click for the full tutorial. #Torosafety #Mowerrepair #Lawnmaintenance #DIYprojects,https://lawntrend.com/toro-safety-switch-problem/
DIY Toro Safety Switch Replacement,https://res.cloudinary.com/ddxyyzkuq/image/upload/v1745868320/pin_6_5_rlascb.webp,lawn-repair-ideas,,Save money and the hassle of a repair shop! This guide provides a detailed,https://lawntrend.com/toro-safety-switch-problem/?utm_source=pinterest&utm_campaign=diy-toro-safety-swit,2025-04-28,illustrated walkthrough of replacing a Toro safety switch.  We cover everything from finding the right part to installing it correctly.  Empower yourself to tackle this repair and enjoy a perfectly cut lawn. Click to learn how! #Tororepair #Mowersafety #DIYlawncare #Homeimprovement,https://lawntrend.com/toro-safety-switch-problem/
Toro Mower Safety Switch Guide,https://res.cloudinary.com/ddxyyzkuq/image/upload/v1745868327/pin_6_6_onydtp.webp,lawn-care-ideas,,"Is your Toro mower's safety switch a mystery?  We demystify it! This comprehensive guide explains the function of the safety switch, common failure points",https://lawntrend.com/toro-safety-switch-problem/?utm_source=pinterest&utm_campaign=toro-mower-safety-sw,2025-04-28,and how to diagnose issues.  Protect yourself and your mower with this essential knowledge.  Click to read and become a Toro expert! #Toroguide #Mowersafety #Lawncaretips #DIYhelp,https://lawntrend.com/toro-safety-switch-problem/
Easy Toro Safety Switch Test,https://res.cloudinary.com/ddxyyzkuq/image/upload/v1745868333/pin_6_7_e3bufs.webp,lawn-care-ideas,,Wondering if your Toro's safety switch is working?  We show you a simple,https://lawntrend.com/toro-safety-switch-problem/?utm_source=pinterest&utm_campaign=easy-toro-safety-swi,2025-04-28,step-by-step test you can perform yourself.  No special tools required!  Avoid unnecessary repairs and get peace of mind. Click to learn the test. #Torotest #Mowersafetycheck #DIYmaintenance #Lawncarehacks,https://lawntrend.com/toro-safety-switch-problem/
Replacing a Toro Safety Switch: Step-by-Step,https://res.cloudinary.com/ddxyyzkuq/image/upload/v1745868340/pin_6_8_t2dzrx.webp,lawn-repair-ideas,,"Follow along with our detailed, step-by-step guide to replacing a Toro safety switch.  We've included photos and clear instructions to make the process easy",https://lawntrend.com/toro-safety-switch-problem/?utm_source=pinterest&utm_campaign=replacing-a-toro-saf,2025-04-28,even for beginners.  Save money and get your mower running smoothly. Click to start the repair! #Tororeplacement #Mowerswitch #DIYrepairguide #Lawncareproject,https://lawntrend.com/toro-safety-switch-problem/
Toro Safety Switch: Common Mistakes,https://res.cloudinary.com/ddxyyzkuq/image/upload/v1745868347/pin_6_9_wzmcdn.webp,lawn-repair-ideas,,"Avoid common pitfalls when troubleshooting or replacing your Toro's safety switch.  This post highlights the mistakes people often make and how to avoid them.  Save time, money",https://lawntrend.com/toro-safety-switch-problem/?utm_source=pinterest&utm_campaign=toro-safety-switch-c,2025-04-28,and frustration! Click to learn from our experience. #Toromistakes #Mowerrepairtips #DIYadvice #Lawncareknowledge,https://lawntrend.com/toro-safety-switch-problem/
Toro Safety Switch: What You Need to Know,https://res.cloudinary.com/ddxyyzkuq/image/upload/v1745868354/pin_6_10_e5mrps.webp,lawn-repair-ideas,,"Everything you need to know about Toro safety switches in one place!  This post covers their function, common problems, troubleshooting",https://lawntrend.com/toro-safety-switch-problem/?utm_source=pinterest&utm_campaign=toro-safety-switch-w,2025-04-28,and replacement.  Become a Toro mower expert and keep your lawn looking great. Click to expand your knowledge! #Toroswitchinfo #Mowerknowledge #Lawncareeducation #DIYlearning,https://lawntrend.com/toro-safety-switch-problem/
Save Money: DIY Toro Safety Switch Fix,https://res.cloudinary.com/ddxyyzkuq/image/upload/v1745868361/pin_6_11_viuemi.webp,lawn-care-ideas,,"Skip the expensive repair shop and fix your Toro's safety switch yourself! This guide provides all the information you need to diagnose, repair",https://lawntrend.com/toro-safety-switch-problem/?utm_source=pinterest&utm_campaign=save-money-diy-toro-,2025-04-28,and replace the switch.  A beautiful lawn doesn't have to break the bank. Click to save! #Torosavingmoney #MowerDIY #Lawncarebudget #DIYrepair,https://lawntrend.com/toro-safety-switch-problem/
Toro Safety Switch: Avoid These Mistakes!,https://res.cloudinary.com/ddxyyzkuq/image/upload/v1745868368/pin_6_12_nyd0gt.webp,lawn-repair-ideas,,"Don't make these common mistakes when working with your Toro's safety switch! This post highlights the errors to avoid and how to ensure a successful repair.  Save yourself time, money",https://lawntrend.com/toro-safety-switch-problem/?utm_source=pinterest&utm_campaign=toro-safety-switch-a,2025-04-28,and frustration. Click to avoid mistakes! #Toromistakeavoidance #Mowerrepaircaution #Lawncarewarnings #DIYtips,https://lawntrend.com/toro-safety-switch-problem/
Title,https://res.cloudinary.com/ddxyyzkuq/image/upload/v1745868422/pin_7_1_jarnez.webp,please-provide-the-title-and-keywords-i-need-that-information-to-suggest-a-board-name-once,,Description,https://lawntrend.com/cub-cadet-i1046-hydrostatic-problems/?utm_source=pinterest&utm_campaign=title,2025-04-28,Keywords,https://lawntrend.com/cub-cadet-i1046-hydrostatic-problems/
Cub Cadet I1046 Hydrostatic Fixes,https://res.cloudinary.com/ddxyyzkuq/image/upload/v1745868428/pin_7_2_yz4qfq.webp,lawn-tractor-ideas,,"Is your Cub Cadet I1046 losing power or acting strangely? Don't let a hydrostatic issue ruin your lawn care! This guide dives deep into common problems, from low fluid levels to pump failures, and provides clear, step-by-step solutions. Save money on expensive repairs and get back to enjoying a perfectly manicured lawn. We'll help you diagnose the issue and get your mower running smoothly again. Click to learn more and reclaim your weekends! #CubCadet #HydrostaticTransmission #LawnMowerRepair #DIYRepair,Cub Cadet,Hydrostatic,Repair",https://lawntrend.com/cub-cadet-i1046-hydrostatic-problems/?utm_source=pinterest&utm_campaign=cub-cadet-i1046-hydr,2025-04-28,I1046,https://lawntrend.com/cub-cadet-i1046-hydrostatic-problems/
I1046 Hydrostatic: Is it the Pump?,https://res.cloudinary.com/ddxyyzkuq/image/upload/v1745868435/pin_7_3_lh1pak.webp,equipment-repair-ideas,,"Worried about a failing hydrostatic pump on your Cub Cadet I1046? This pin highlights the telltale signs of pump problems – noise, slow movement, or complete failure. We break down how to test your pump and determine if replacement is necessary. Don't get stranded mid-mow!  Learn how to avoid costly mistakes and keep your lawn looking its best.  Click to read our comprehensive guide and get back to mowing with confidence! #CubCadetI1046 #HydroPump #LawnMowerProblems #FixItYourself,Pump,Hydrostatic,Cub Cadet",https://lawntrend.com/cub-cadet-i1046-hydrostatic-problems/?utm_source=pinterest&utm_campaign=i1046-hydrostatic-is,2025-04-28,Diagnosis,https://lawntrend.com/cub-cadet-i1046-hydrostatic-problems/
Cub Cadet I1046: Fluid Level Check,https://res.cloudinary.com/ddxyyzkuq/image/upload/v1745868440/pin_7_4_dhzrds.webp,lawn-tractor-ideas,,"Simple maintenance can prevent big problems! This pin focuses on the importance of checking and maintaining the correct hydrostatic fluid level in your Cub Cadet I1046.  Low fluid is a common culprit for performance issues.  We show you exactly where to find the fill point and how to top it off.  Don't ignore this easy step – it could save you hundreds! Click to learn how to keep your mower happy and healthy. #CubCadetMaintenance #HydrostaticFluid #LawnCareTips #PreventativeMaintenance,Fluid Level,Maintenance,Cub Cadet",https://lawntrend.com/cub-cadet-i1046-hydrostatic-problems/?utm_source=pinterest&utm_campaign=cub-cadet-i1046-flui,2025-04-28,Hydrostatic,https://lawntrend.com/cub-cadet-i1046-hydrostatic-problems/
Troubleshooting I1046 Slow Movement,https://res.cloudinary.com/ddxyyzkuq/image/upload/v1745868446/pin_7_5_jmvc7h.webp,lawn-care-ideas,,"Is your Cub Cadet I1046 moving slower than usual?  Don't despair! This pin addresses the frustrating issue of reduced speed, covering potential causes like clogged filters, worn belts, and hydrostatic issues.  We provide a clear troubleshooting guide to help you pinpoint the problem and get your mower back up to speed.  Click to read the full article and enjoy a faster, more efficient mow! #CubCadetProblems #SlowMower #HydrostaticIssues #LawnMowerHelp,Slow Movement,Troubleshooting,Cub Cadet",https://lawntrend.com/cub-cadet-i1046-hydrostatic-problems/?utm_source=pinterest&utm_campaign=troubleshooting-i104,2025-04-28,Hydrostatic,https://lawntrend.com/cub-cadet-i1046-hydrostatic-problems/
Cub Cadet I1046: Belt Issues Explained,https://res.cloudinary.com/ddxyyzkuq/image/upload/v1745868452/pin_7_6_fgyssz.webp,lawn-tractor-ideas,,"A worn or broken belt can wreak havoc on your Cub Cadet I1046's hydrostatic system. This pin illustrates common belt problems and how to inspect and replace them.  We provide visual guides and step-by-step instructions to make the process easy, even for beginners.  Don't let a simple belt replacement turn into a costly repair! Click to learn more and keep your mower running smoothly. #CubCadetBelt #LawnMowerBelt #HydrostaticBelt #DIYLawnCare,Belt,Replacement,Cub Cadet",https://lawntrend.com/cub-cadet-i1046-hydrostatic-problems/?utm_source=pinterest&utm_campaign=cub-cadet-i1046-belt,2025-04-28,Hydrostatic,https://lawntrend.com/cub-cadet-i1046-hydrostatic-problems/
I1046 Hydrostatic: Noise Diagnosis,https://res.cloudinary.com/ddxyyzkuq/image/upload/v1745868457/pin_7_7_sptugx.webp,equipment-repair-ideas,,"Hearing strange noises from your Cub Cadet I1046? This pin focuses on diagnosing unusual sounds coming from the hydrostatic transmission. We cover potential causes like worn bearings, low fluid, or pump issues.  Don't ignore these warning signs – they could indicate a serious problem. Click to read our guide and get to the root of the noise! #CubCadetNoise #HydrostaticNoise #LawnMowerSounds #RepairGuide,Noise,Diagnosis,Cub Cadet",https://lawntrend.com/cub-cadet-i1046-hydrostatic-problems/?utm_source=pinterest&utm_campaign=i1046-hydrostatic-no,2025-04-28,Hydrostatic,https://lawntrend.com/cub-cadet-i1046-hydrostatic-problems/
Cub Cadet I1046: Filter Replacement,https://res.cloudinary.com/ddxyyzkuq/image/upload/v1745868463/pin_7_8_utn8sx.webp,lawn-tractor-ideas,,"Keep your hydrostatic system clean and efficient! This pin highlights the importance of regularly replacing the filters in your Cub Cadet I1046.  Clogged filters can restrict fluid flow and cause performance issues.  We provide a simple guide to filter replacement, ensuring optimal mower performance. Click to learn how to protect your investment! #CubCadetFilter #HydrostaticFilter #LawnMowerMaintenance #CleanMower,Filter,Replacement,Cub Cadet",https://lawntrend.com/cub-cadet-i1046-hydrostatic-problems/?utm_source=pinterest&utm_campaign=cub-cadet-i1046-filt,2025-04-28,Maintenance,https://lawntrend.com/cub-cadet-i1046-hydrostatic-problems/
Hydrostatic Fluid: Choosing the Right Type,https://res.cloudinary.com/ddxyyzkuq/image/upload/v1745868469/pin_7_9_ooubq1.webp,equipment-maintenance-ideas,,"Using the wrong hydrostatic fluid can damage your Cub Cadet I1046's transmission. This pin explains the importance of selecting the correct fluid type and provides recommendations.  Protect your mower from costly repairs by using the right product. Click to learn more and ensure optimal performance! #HydrostaticFluidType #CubCadetFluid #LawnMowerOil #CorrectFluid,Fluid Type,Hydrostatic,Cub Cadet",https://lawntrend.com/cub-cadet-i1046-hydrostatic-problems/?utm_source=pinterest&utm_campaign=hydrostatic-fluid-ch,2025-04-28,Maintenance,https://lawntrend.com/cub-cadet-i1046-hydrostatic-problems/
I1046 Hydrostatic: Common Mistakes,https://res.cloudinary.com/ddxyyzkuq/image/upload/v1745868476/pin_7_10_x4ptyz.webp,equipment-repair-ideas,,"Avoid these common mistakes when working on your Cub Cadet I1046's hydrostatic system! This pin highlights pitfalls to avoid, such as overfilling the fluid reservoir or using the wrong tools.  Save yourself time, money, and frustration by learning from our expert advice. Click to read the full article and mow with confidence! #CubCadetMistakes #HydrostaticErrors #LawnMowerTips #AvoidThese,Mistakes,Troubleshooting,Cub Cadet",https://lawntrend.com/cub-cadet-i1046-hydrostatic-problems/?utm_source=pinterest&utm_campaign=i1046-hydrostatic-co,2025-04-28,Hydrostatic,https://lawntrend.com/cub-cadet-i1046-hydrostatic-problems/
Cub Cadet I1046: Hydrostatic System Overview,https://res.cloudinary.com/ddxyyzkuq/image/upload/v1745868481/pin_7_11_gk74va.webp,lawn-tractor-ideas,,"Understanding how your Cub Cadet I1046's hydrostatic system works is the first step to successful repair. This pin provides a clear overview of the key components and their functions.  Empower yourself with knowledge and tackle your mower repairs with confidence! Click to learn more and become a lawn care pro. #CubCadetSystem #HydrostaticOverview #LawnMowerParts #LearnToRepair,System Overview,Hydrostatic,Cub Cadet",https://lawntrend.com/cub-cadet-i1046-hydrostatic-problems/?utm_source=pinterest&utm_campaign=cub-cadet-i1046-hydr,2025-04-28,Education,https://lawntrend.com/cub-cadet-i1046-hydrostatic-problems/
I1046: Hydrostatic Leaks - What to Do?,https://res.cloudinary.com/ddxyyzkuq/image/upload/v1745868488/pin_7_12_t5y1n9.webp,home-repair-ideas,,"Spotting a leak in your Cub Cadet I1046's hydrostatic system? This pin details how to identify the source of the leak and provides guidance on repair options. Ignoring leaks can lead to serious damage. Click to learn how to stop the leak and protect your mower! #CubCadetLeak #HydrostaticLeak #LawnMowerRepair #LeakFix,Leaks,Repair,Cub Cadet",https://lawntrend.com/cub-cadet-i1046-hydrostatic-problems/?utm_source=pinterest&utm_campaign=i1046-hydrostatic-le,2025-04-28,Hydrostatic,https://lawntrend.com/cub-cadet-i1046-hydrostatic-problems/
Hydrostatic Pedal Adjustment - I1046,https://res.cloudinary.com/dbcpfy04c/image/upload/v1618237451/placeholder.jpg,home-inspiration,,"Is your Cub Cadet I1046's pedal feeling unresponsive? This pin shows you how to properly adjust the hydrostatic pedal for optimal control and responsiveness.  Enjoy a smoother, more precise mowing experience. Click to learn the simple adjustment process! #CubCadetPedal #HydrostaticAdjustment #LawnMowerControl #SmoothMowing,Pedal Adjustment,Hydrostatic,Cub Cadet",https://lawntrend.com/cub-cadet-i1046-hydrostatic-problems/?utm_source=pinterest&utm_campaign=hydrostatic-pedal-ad,2025-04-28,Maintenance,https://lawntrend.com/cub-cadet-i1046-hydrostatic-problems/
Cub Cadet I1046: Hydrostatic Safety Tips,https://res.cloudinary.com/ddxyyzkuq/image/upload/v1745868495/pin_7_14_zoxnoj.webp,lawn-tractor-ideas,,"Working on your mower's hydrostatic system? Safety first! This pin provides essential safety precautions to follow, protecting you from injury.  Always disconnect the spark plug and wear appropriate safety gear. Click to read our safety guide and work with peace of mind! #CubCadetSafety #HydrostaticSafety #LawnMowerSafety #SafeRepair,Safety,Hydrostatic,Cub Cadet",https://lawntrend.com/cub-cadet-i1046-hydrostatic-problems/?utm_source=pinterest&utm_campaign=cub-cadet-i1046-hydr,2025-04-28,Repair,https://lawntrend.com/cub-cadet-i1046-hydrostatic-problems/
Diagnosing I1046: No Forward Motion,https://res.cloudinary.com/ddxyyzkuq/image/upload/v1745868504/pin_7_15_asjazw.webp,hydrostatic-ideas,,"Your Cub Cadet I1046 won't move forward? This pin focuses on troubleshooting this common issue, covering potential causes like a broken drive belt or hydrostatic pump failure.  Don't let a lack of forward motion stop you from getting the job done. Click to read our guide and get moving again! #NoForwardMotion #CubCadetProblems #HydrostaticIssues #LawnMowerFix,No Forward Motion,Troubleshooting,Cub Cadet",https://lawntrend.com/cub-cadet-i1046-hydrostatic-problems/?utm_source=pinterest&utm_campaign=diagnosing-i1046-no-,2025-04-28,Hydrostatic,https://lawntrend.com/cub-cadet-i1046-hydrostatic-problems/
I1046: Hydrostatic Fluid Change Guide,https://res.cloudinary.com/ddxyyzkuq/image/upload/v1745868510/pin_7_16_hb7pz5.webp,home-repair-ideas,,"Give your Cub Cadet I1046's hydrostatic system a fresh start! This pin provides a step-by-step guide to changing the hydrostatic fluid, ensuring optimal performance and longevity.  Regular fluid changes are essential for maintaining a healthy transmission. Click to learn how to do it yourself! #HydrostaticFluidChange #CubCadetMaintenance #LawnMowerService #FluidFlush,Fluid Change,Maintenance,Cub Cadet",https://lawntrend.com/cub-cadet-i1046-hydrostatic-problems/?utm_source=pinterest&utm_campaign=i1046-hydrostatic-fl,2025-04-28,Hydrostatic,https://lawntrend.com/cub-cadet-i1046-hydrostatic-problems/
Cub Cadet I1046: Hydrostatic Linkage Check,https://res.cloudinary.com/ddxyyzkuq/image/upload/v1745868516/pin_7_17_oveqp9.webp,lawn-tractor-ideas,,"Loose or damaged linkage can affect your Cub Cadet I1046's hydrostatic performance. This pin shows you how to inspect and adjust the linkage for smooth operation.  Ensure precise control and a comfortable mowing experience. Click to learn more! #CubCadetLinkage #HydrostaticLinkage #LawnMowerControl #SmoothOperation,Linkage,Adjustment,Cub Cadet",https://lawntrend.com/cub-cadet-i1046-hydrostatic-problems/?utm_source=pinterest&utm_campaign=cub-cadet-i1046-hydr,2025-04-28,Hydrostatic,https://lawntrend.com/cub-cadet-i1046-hydrostatic-problems/
I1046: Hydrostatic System - Preventative Care,https://res.cloudinary.com/ddxyyzkuq/image/upload/v1745868522/pin_7_18_addhnh.webp,home-repair-ideas,,"Don't wait for problems to arise! This pin emphasizes the importance of preventative maintenance for your Cub Cadet I1046's hydrostatic system.  Regular inspections and fluid checks can save you time and money in the long run. Click to learn our top preventative care tips! #PreventativeCare #CubCadetMaintenance #HydrostaticCare #LawnMowerTips,Preventative Care,Maintenance,Cub Cadet",https://lawntrend.com/cub-cadet-i1046-hydrostatic-problems/?utm_source=pinterest&utm_campaign=i1046-hydrostatic-sy,2025-04-28,Hydrostatic,https://lawntrend.com/cub-cadet-i1046-hydrostatic-problems/
Hydrostatic Cooler Inspection - I1046,https://res.cloudinary.com/ddxyyzkuq/image/upload/v1745868529/pin_7_19_zhqngi.webp,equipment-inspection-ideas,,"Overheating can damage your Cub Cadet I1046's hydrostatic system. This pin highlights the importance of inspecting the hydrostatic cooler for blockages and ensuring proper airflow.  Keep your mower running cool and efficiently. Click to learn more! #HydrostaticCooler #CubCadetCooling #LawnMowerOverheat #CoolingSystem,Cooler,Maintenance,Cub Cadet",https://lawntrend.com/cub-cadet-i1046-hydrostatic-problems/?utm_source=pinterest&utm_campaign=hydrostatic-cooler-i,2025-04-28,Hydrostatic,https://lawntrend.com/cub-cadet-i1046-hydrostatic-problems/
I1046: Hydrostatic - When to Call a Pro,https://res.cloudinary.com/ddxyyzkuq/image/upload/v1745868535/pin_7_20_nerbb4.webp,home-repair-ideas,,"Sometimes, DIY isn't enough. This pin helps you determine when a hydrostatic problem on your Cub Cadet I1046 requires professional attention.  Don't risk further damage – know when to seek expert help. Click to read our guide and make the right decision! #CallAPro #CubCadetRepair #HydrostaticHelp #ProfessionalService,Professional Repair,Hydrostatic,Cub Cadet",https://lawntrend.com/cub-cadet-i1046-hydrostatic-problems/?utm_source=pinterest&utm_campaign=i1046-hydrostatic-wh,2025-04-28,Troubleshooting,https://lawntrend.com/cub-cadet-i1046-hydrostatic-problems/
Cub Cadet I1046: Hydrostatic Pump Testing,https://res.cloudinary.com/ddxyyzkuq/image/upload/v1745868541/pin_7_21_owhrrg.webp,lawn-tractor-ideas,,"Accurately testing your hydrostatic pump is crucial for diagnosing problems. This pin outlines the steps involved in testing the pump, helping you determine if it's functioning correctly.  Get a clear understanding of your mower's performance. Click to learn more! #HydrostaticPumpTest #CubCadetDiagnosis #LawnMowerTesting #PumpPerformance,Pump Testing,Diagnosis,Cub Cadet",https://lawntrend.com/cub-cadet-i1046-hydrostatic-problems/?utm_source=pinterest&utm_campaign=cub-cadet-i1046-hydr,2025-04-28,Hydrostatic,https://lawntrend.com/cub-cadet-i1046-hydrostatic-problems/
I1046: Hydrostatic - Understanding the Reservoir,https://res.cloudinary.com/ddxyyzkuq/image/upload/v1745868546/pin_7_22_v0pecn.webp,home-repair-ideas,,"The hydrostatic reservoir is the heart of the system. This pin explains the function of the reservoir and how to inspect it for contamination or damage.  Keep your fluid clean and your system running smoothly. Click to learn more! #HydrostaticReservoir #CubCadetFluid #LawnMowerParts #FluidStorage,Reservoir,Hydrostatic,Cub Cadet",https://lawntrend.com/cub-cadet-i1046-hydrostatic-problems/?utm_source=pinterest&utm_campaign=i1046-hydrostatic-un,2025-04-28,Maintenance,https://lawntrend.com/cub-cadet-i1046-hydrostatic-problems/
Hydrostatic Drive Shaft Inspection - I1046,https://res.cloudinary.com/ddxyyzkuq/image/upload/v1745868552/pin_7_23_ixbbyu.webp,tractor-repair-ideas,,"A damaged drive shaft can cause serious hydrostatic problems. This pin shows you how to inspect the drive shaft for wear and tear, ensuring safe and efficient operation.  Don't ignore this critical component! Click to learn more. #DriveShaft #CubCadetInspection #HydrostaticDrive #LawnMowerSafety,Drive Shaft,Inspection,Cub Cadet",https://lawntrend.com/cub-cadet-i1046-hydrostatic-problems/?utm_source=pinterest&utm_campaign=hydrostatic-drive-sh,2025-04-28,Hydrostatic,https://lawntrend.com/cub-cadet-i1046-hydrostatic-problems/
Cub Cadet I1046: Hydrostatic - Winter Storage,https://res.cloudinary.com/ddxyyzkuq/image/upload/v1745868559/pin_7_24_s42lwj.webp,lawn-tractor-ideas,,"Preparing your Cub Cadet I1046 for winter storage? This pin provides essential tips for protecting the hydrostatic system from damage during the off-season.  Ensure a smooth start-up next spring. Click to learn our winterization guide! #WinterStorage #CubCadetPrep #HydrostaticWinter #LawnMowerStorage,Winter Storage,Maintenance,Cub Cadet",https://lawntrend.com/cub-cadet-i1046-hydrostatic-problems/?utm_source=pinterest&utm_campaign=cub-cadet-i1046-hydr,2025-04-28,Hydrostatic,https://lawntrend.com/cub-cadet-i1046-hydrostatic-problems/
I1046: Hydrostatic - Troubleshooting Jerky Movement,https://res.cloudinary.com/ddxyyzkuq/image/upload/v1745868566/pin_7_25_ufxrux.webp,home-repair-ideas,,"Experiencing jerky movement with your Cub Cadet I1046? This pin dives into the causes of this frustrating issue and provides troubleshooting steps.  Enjoy a smoother, more controlled mowing experience. Click to read the full article! #JerkyMovement #CubCadetProblems #HydrostaticIssues #SmoothMowing,Jerky Movement,Troubleshooting,Cub Cadet",https://lawntrend.com/cub-cadet-i1046-hydrostatic-problems/?utm_source=pinterest&utm_campaign=i1046-hydrostatic-tr,2025-04-28,Hydrostatic,https://lawntrend.com/cub-cadet-i1046-hydrostatic-problems/
Title,https://res.cloudinary.com/ddxyyzkuq/image/upload/v1745868618/pin_8_1_jmchts.webp,please-provide-the-title-and-keywords-i-need-that-information-to-suggest-a-board-name-once,,Description,https://lawntrend.com/cub-cadet-super-lt-1554-problems/?utm_source=pinterest&utm_campaign=title,2025-04-28,Keywords,https://lawntrend.com/cub-cadet-super-lt-1554-problems/
Cub Cadet 1554: Is Yours Having Issues?,https://res.cloudinary.com/ddxyyzkuq/image/upload/v1745868624/pin_8_2_tgj7ls.webp,lawn-mower-ideas,,"Don't let a broken Cub Cadet Super LT 1554 ruin your weekend! This guide dives deep into common problems – from engine troubles to blade issues – and provides DIY fixes to get you back to mowing.  We cover everything from diagnosing the issue to finding parts.  Save money & time by tackling repairs yourself!  Frustrated with lawn care? We've got you covered. Click to learn more and reclaim your yard! #CubCadet #LawnMowerRepair #DIYRepair #LawnCare,Cub Cadet,Lawn Mower,Repair",https://lawntrend.com/cub-cadet-super-lt-1554-problems/?utm_source=pinterest&utm_campaign=cub-cadet-1554-is-yo,2025-04-28,Troubleshooting,https://lawntrend.com/cub-cadet-super-lt-1554-problems/
