Title,Media URL,Pinterest board,Thumbnail,Description,Link,Publish date,Keywords,Source URL
Flower Bed Cleaning Checklist 🌸,https://res.cloudinary.com/dbcpfy04c/image/upload/v1618237451/placeholder.jpg,home-inspiration,,"Dreaming of a gorgeous garden but dreading the cleanup? This checklist breaks down how to clean a flower bed, from removing weeds & debris to prepping for fresh blooms! Learn easy steps to revitalize your space & enjoy a vibrant, healthy garden. Don't let overgrown beds steal your joy – reclaim your outdoor oasis today! Click to learn more & get your garden glowing! ✨ #flowerbed #gardencleaning #springcleaning #gardeningtips"",flower bed,garden cleanup,weeding",https://www.beacleaner.com/how-to-clean-a-flower-bed?utm_source=pinterest&utm_campaign=flower-bed-cleaning-,2025-04-30,gardening,https://www.beacleaner.com/how-to-clean-a-flower-bed
Weed-Free Flower Beds: A Guide 🌱,https://res.cloudinary.com/dbcpfy04c/image/upload/v1618237451/placeholder.jpg,home-inspiration,,"Tired of battling weeds in your flower beds? This guide reveals the secrets to effective weed control, saving you time & backache! Discover natural methods, preventative strategies, and the right tools for a pristine garden. Imagine a beautiful, flourishing flower bed without constant weeding! Click to learn how! 🌿 #weedcontrol #flowerbedcare #gardeninghacks #organicgardening"",weed control,flower bed,gardening tips",https://www.beacleaner.com/how-to-clean-a-flower-bed?utm_source=pinterest&utm_campaign=weed-free-flower-bed,2025-04-30,organic gardening,https://www.beacleaner.com/how-to-clean-a-flower-bed
Revive Your Flower Beds This Weekend!,https://res.cloudinary.com/dbcpfy04c/image/upload/v1618237451/placeholder.jpg,home-inspiration,,"Is your flower bed looking a little sad? Give it a weekend makeover! This post shows you how to clean, prep, and refresh your flower beds for stunning blooms.  From removing old plants to enriching the soil, we've got you covered.  A little effort goes a long way! Click to learn how to create the garden of your dreams! 🌷 #flowerbedmakeover #gardening #weekendproject #gardeninspiration"",flower bed,garden makeover,gardening project",https://www.beacleaner.com/how-to-clean-a-flower-bed?utm_source=pinterest&utm_campaign=revive-your-flower-b,2025-04-30,garden inspiration,https://www.beacleaner.com/how-to-clean-a-flower-bed
Flower Bed Cleanup: Before & After 🤩,https://res.cloudinary.com/dbcpfy04c/image/upload/v1618237451/placeholder.jpg,home-inspiration,,"Witness the amazing transformation! This post details how to clean a flower bed, with stunning before & after photos to inspire you. Learn the simple steps to go from messy to magnificent.  Don't just dream of a beautiful garden, *create* one! Click to see the full transformation & get started! ✨ #beforeandafter #flowerbedcleaning #gardentransformation #gardenideas"",flower bed,garden cleanup,before and after",https://www.beacleaner.com/how-to-clean-a-flower-bed?utm_source=pinterest&utm_campaign=flower-bed-cleanup-b,2025-04-30,garden ideas,https://www.beacleaner.com/how-to-clean-a-flower-bed
Easy Flower Bed Maintenance Tips 🌼,https://res.cloudinary.com/dbcpfy04c/image/upload/v1618237451/placeholder.jpg,home-inspiration,,"Keep your flower beds looking their best with these easy maintenance tips! Learn how to prevent weeds, maintain healthy soil, and encourage abundant blooms.  A little regular care saves you a lot of work in the long run.  Enjoy a beautiful garden without the stress! Click for simple, effective tips! 🌸 #flowermaintenance #gardeningtips #easygardening #flowerbedcare"",flower bed,garden maintenance,gardening tips",https://www.beacleaner.com/how-to-clean-a-flower-bed?utm_source=pinterest&utm_campaign=easy-flower-bed-main,2025-04-30,easy gardening,https://www.beacleaner.com/how-to-clean-a-flower-bed
DIY Flower Bed Edging Ideas 🧱,https://res.cloudinary.com/dbcpfy04c/image/upload/v1618237451/placeholder.jpg,home-inspiration,,"Give your flower beds a polished look with these DIY edging ideas! From natural stone to recycled materials, find the perfect edging to complement your garden style.  Edging not only looks great but also helps contain mulch & prevent weeds. Click to explore creative edging options! 🌿 #floweredging #diygarden #gardenideas #flowerbeddesign"",flower bed,garden edging,diy garden",https://www.beacleaner.com/how-to-clean-a-flower-bed?utm_source=pinterest&utm_campaign=diy-flower-bed-edgin,2025-04-30,garden design,https://www.beacleaner.com/how-to-clean-a-flower-bed
Best Tools for Cleaning Flower Beds 🛠️,https://res.cloudinary.com/dbcpfy04c/image/upload/v1618237451/placeholder.jpg,home-inspiration,,"Don't struggle with the wrong tools! This post reveals the best tools for cleaning a flower bed, making the job easier & more efficient. From weeding tools to garden forks, we've got you covered. Invest in the right tools & enjoy gardening more! Click to see our top picks! 🌷 #gardentools #flowercleaning #gardeninghacks #gardeningequipment"",flower bed,garden tools,gardening hacks",https://www.beacleaner.com/how-to-clean-a-flower-bed?utm_source=pinterest&utm_campaign=best-tools-for-clean,2025-04-30,gardening equipment,https://www.beacleaner.com/how-to-clean-a-flower-bed
How to Prep Flower Beds for Planting 🌱,https://res.cloudinary.com/dbcpfy04c/image/upload/v1618237451/placeholder.jpg,home-inspiration,,"Get your flower beds ready for planting success! This guide shows you how to clean, amend the soil, and create the perfect environment for healthy growth.  Proper preparation is key to a thriving garden. Click to learn the secrets to a bountiful harvest! 🌸 #flowerbedprep #planting #gardeningtips #soilpreparation"",flower bed,planting,gardening tips",https://www.beacleaner.com/how-to-clean-a-flower-bed?utm_source=pinterest&utm_campaign=how-to-prep-flower-b,2025-04-30,soil preparation,https://www.beacleaner.com/how-to-clean-a-flower-bed
Natural Weed Control for Flower Beds 🌿,https://res.cloudinary.com/dbcpfy04c/image/upload/v1618237451/placeholder.jpg,home-inspiration,,"Say goodbye to harsh chemicals! This post shares natural weed control methods for flower beds, keeping your garden healthy & eco-friendly.  Protect your plants & the environment with these simple solutions. Click to learn more! 🌼 #naturalweedcontrol #organicgardening #flowerbedcare #ecofriendlygardening"",flower bed,weed control,organic gardening",https://www.beacleaner.com/how-to-clean-a-flower-bed?utm_source=pinterest&utm_campaign=natural-weed-control,2025-04-30,eco-friendly gardening,https://www.beacleaner.com/how-to-clean-a-flower-bed
Flower Bed Soil: What You Need to Know 🌍,https://res.cloudinary.com/dbcpfy04c/image/upload/v1618237451/placeholder.jpg,home-inspiration,,"Unlock the secrets to healthy flower bed soil! This post explains the importance of soil composition, pH levels, and amendments.  Give your plants the nutrients they need to thrive. Click to learn how to create the perfect soil mix! 🌷 #flowersoil #soilhealth #gardeningtips #soilamendments"",flower bed,soil health,gardening tips",https://www.beacleaner.com/how-to-clean-a-flower-bed?utm_source=pinterest&utm_campaign=flower-bed-soil-what,2025-04-30,soil amendments,https://www.beacleaner.com/how-to-clean-a-flower-bed
Cleaning Flower Beds After Winter ❄️,https://res.cloudinary.com/dbcpfy04c/image/upload/v1618237451/placeholder.jpg,home-inspiration,,"Wake up your flower beds after winter! This guide shows you how to remove debris, prune plants, and prepare for spring blooms.  Give your garden a fresh start! Click to learn how to revive your flower beds! 🌸 #springcleaning #flowerbedcleanup #gardening #wintergarden"",flower bed,spring cleaning,gardening",https://www.beacleaner.com/how-to-clean-a-flower-bed?utm_source=pinterest&utm_campaign=cleaning-flower-beds,2025-04-30,winter garden,https://www.beacleaner.com/how-to-clean-a-flower-bed
Mulch Magic: Flower Bed Benefits 🪵,https://res.cloudinary.com/dbcpfy04c/image/upload/v1618237451/placeholder.jpg,home-inspiration,,"Discover the amazing benefits of mulching your flower beds! From weed suppression to moisture retention, mulch is a gardener's best friend. Learn which mulch is right for your garden. Click to learn more! 🌿 #mulch #flowerbedcare #gardeningtips #gardenmaintenance"",flower bed,mulch,gardening tips",https://www.beacleaner.com/how-to-clean-a-flower-bed?utm_source=pinterest&utm_campaign=mulch-magic-flower-b,2025-04-30,garden maintenance,https://www.beacleaner.com/how-to-clean-a-flower-bed
Flower Bed Design Ideas on a Budget 💰,https://res.cloudinary.com/dbcpfy04c/image/upload/v1618237451/placeholder.jpg,home-inspiration,,"Create a stunning flower bed without breaking the bank! This post shares budget-friendly design ideas & tips for maximizing your garden's beauty.  A beautiful garden is within reach! Click to get inspired! 🌷 #floweredesign #budgetgardening #gardenideas #flowerbeddesign"",flower bed,garden design,budget gardening",https://www.beacleaner.com/how-to-clean-a-flower-bed?utm_source=pinterest&utm_campaign=flower-bed-design-id,2025-04-30,garden ideas,https://www.beacleaner.com/how-to-clean-a-flower-bed
Protect Your Flowers: Bed Cleaning Tips 🛡️,https://res.cloudinary.com/dbcpfy04c/image/upload/v1618237451/placeholder.jpg,home-inspiration,,"Keep your precious flowers safe & healthy! This post details how cleaning your flower bed protects plants from pests & diseases.  A clean garden is a happy garden! Click to learn how to safeguard your blooms! 🌸 #flowerprotection #gardencare #pestcontrol #flowerbedcleaning"",flower bed,garden care,pest control",https://www.beacleaner.com/how-to-clean-a-flower-bed?utm_source=pinterest&utm_campaign=protect-your-flowers,2025-04-30,flowerbed cleaning,https://www.beacleaner.com/how-to-clean-a-flower-bed
Flower Bed Cleaning: Step-by-Step Guide 🪜,https://res.cloudinary.com/dbcpfy04c/image/upload/v1618237451/placeholder.jpg,home-inspiration,,"Need a clear plan? This step-by-step guide makes cleaning your flower bed a breeze! From start to finish, we'll walk you through each task.  No more overwhelm! Click to get started! 🌷 #stepbystepguide #flowercleaning #gardening #gardenproject"",flower bed,garden cleaning,gardening",https://www.beacleaner.com/how-to-clean-a-flower-bed?utm_source=pinterest&utm_campaign=flower-bed-cleaning-,2025-04-30,garden project,https://www.beacleaner.com/how-to-clean-a-flower-bed
Dealing with Overgrown Flower Beds 🌿,https://res.cloudinary.com/dbcpfy04c/image/upload/v1618237451/placeholder.jpg,home-inspiration,,"Don't be intimidated! This post tackles overgrown flower beds, offering solutions for reclaiming your space. Learn how to prune, weed, and restore order.  You can do it! Click to learn how! 🌸 #overgrown garden #flowerbedrescue #gardeningtips #gardenmakeover"",flower bed,garden rescue,gardening tips",https://www.beacleaner.com/how-to-clean-a-flower-bed?utm_source=pinterest&utm_campaign=dealing-with-overgro,2025-04-30,garden makeover,https://www.beacleaner.com/how-to-clean-a-flower-bed
Flower Bed Cleaning for Beginners 👩‍🌾,https://res.cloudinary.com/dbcpfy04c/image/upload/v1618237451/placeholder.jpg,home-inspiration,,"New to gardening? No problem! This post is a beginner-friendly guide to cleaning flower beds.  We'll cover everything you need to know to get started. Click to learn the basics! 🌷 #beginner gardening #flowercleaning #gardeningtips #easygardening"",flower bed,beginner gardening,gardening tips",https://www.beacleaner.com/how-to-clean-a-flower-bed?utm_source=pinterest&utm_campaign=flower-bed-cleaning-,2025-04-30,easy gardening,https://www.beacleaner.com/how-to-clean-a-flower-bed
The Ultimate Flower Bed Cleaning Schedule🗓️,https://res.cloudinary.com/dbcpfy04c/image/upload/v1618237451/placeholder.jpg,home-inspiration,,"Stay on top of your garden with this ultimate cleaning schedule! Learn when to weed, prune, and mulch for a consistently beautiful flower bed.  Organization is key! Click to download the schedule! 🌸 #gardenschedule #flowercleaning #gardeningtips #gardenmaintenance"",flower bed,garden schedule,gardening tips",https://www.beacleaner.com/how-to-clean-a-flower-bed?utm_source=pinterest&utm_campaign=the-ultimate-flower-,2025-04-30,garden maintenance,https://www.beacleaner.com/how-to-clean-a-flower-bed
Flower Bed Cleaning & Composting ♻️,https://res.cloudinary.com/dbcpfy04c/image/upload/v1618237451/placeholder.jpg,home-inspiration,,"Turn your flower bed cleanup into a composting opportunity! This post shows you how to compost weeds & debris, enriching your soil naturally.  Reduce waste & boost your garden! Click to learn more! 🌿 #composting #flowerbedcleaning #organicgardening #gardeningtips"",flower bed,composting,organic gardening",https://www.beacleaner.com/how-to-clean-a-flower-bed?utm_source=pinterest&utm_campaign=flower-bed-cleaning-,2025-04-30,gardening tips,https://www.beacleaner.com/how-to-clean-a-flower-bed
Flower Bed Cleaning: Common Mistakes ❌,https://res.cloudinary.com/dbcpfy04c/image/upload/v1618237451/placeholder.jpg,home-inspiration,,"Avoid these common mistakes when cleaning your flower bed! Learn what *not* to do to protect your plants & ensure a healthy garden.  Save time & effort by avoiding these pitfalls! Click to learn more! 🌷 #gardeningmistakes #flowercleaning #gardeningtips #gardenadvice"",flower bed,gardening mistakes,gardening tips",https://www.beacleaner.com/how-to-clean-a-flower-bed?utm_source=pinterest&utm_campaign=flower-bed-cleaning-,2025-04-30,garden advice,https://www.beacleaner.com/how-to-clean-a-flower-bed
Flower Bed Cleaning: Time-Saving Hacks ⏱️,https://res.cloudinary.com/dbcpfy04c/image/upload/v1618237451/placeholder.jpg,home-inspiration,,"Short on time? These time-saving hacks will help you clean your flower bed quickly & efficiently.  Get a beautiful garden without spending all day in the dirt! Click to learn our secrets! 🌸 #gardeninghacks #flowercleaning #timesavingtips #gardeningtips"",flower bed,gardening hacks,time saving tips",https://www.beacleaner.com/how-to-clean-a-flower-bed?utm_source=pinterest&utm_campaign=flower-bed-cleaning-,2025-04-30,gardening tips,https://www.beacleaner.com/how-to-clean-a-flower-bed
Flower Bed Cleaning: Safety First! ⚠️,https://res.cloudinary.com/dbcpfy04c/image/upload/v1618237451/placeholder.jpg,home-inspiration,,"Gardening safely is important! This post covers essential safety tips for cleaning your flower bed, protecting you from injuries & irritants.  Enjoy gardening responsibly! Click to learn more! 🌿 #gardensafety #flowercleaning #gardeningtips #safetyfirst"",flower bed,garden safety,gardening tips",https://www.beacleaner.com/how-to-clean-a-flower-bed?utm_source=pinterest&utm_campaign=flower-bed-cleaning-,2025-04-30,safety first,https://www.beacleaner.com/how-to-clean-a-flower-bed
Beautiful Flower Bed Inspiration 🌺,https://res.cloudinary.com/dbcpfy04c/image/upload/v1618237451/placeholder.jpg,home-inspiration,,"Need a little inspiration? Browse these stunning flower bed designs & get ideas for your own garden.  Dream big & create a garden you love! Click to see more! 🌷 #flowerbedinspiration #gardendesign #gardenideas #flowergarden"",flower bed,garden design,garden ideas",https://www.beacleaner.com/how-to-clean-a-flower-bed?utm_source=pinterest&utm_campaign=beautiful-flower-bed,2025-04-30,flower garden,https://www.beacleaner.com/how-to-clean-a-flower-bed
Flower Bed Cleaning: Tools vs. No Tools 💪,https://res.cloudinary.com/dbcpfy04c/image/upload/v1618237451/placeholder.jpg,home-inspiration,,"Can you clean a flower bed without tools? This post compares using tools versus hand-weeding, helping you choose the best method for your needs.  Find what works for you! Click to learn more! 🌸 #handweeding #gardentools #flowercleaning #gardeningtips"",flower bed,hand weeding,garden tools",https://www.beacleaner.com/how-to-clean-a-flower-bed?utm_source=pinterest&utm_campaign=flower-bed-cleaning-,2025-04-30,gardening tips,https://www.beacleaner.com/how-to-clean-a-flower-bed
Title,https://res.cloudinary.com/dbcpfy04c/image/upload/v1618237451/placeholder.jpg,home-inspiration,,Description,https://www.beacleaner.com/how-to-clean-a-fridge-that-has-been-unplugged?utm_source=pinterest&utm_campaign=title,2025-04-30,Keywords,https://www.beacleaner.com/how-to-clean-a-fridge-that-has-been-unplugged
Fridge Cleaning SOS! (Unplugged!),https://res.cloudinary.com/dbcpfy04c/image/upload/v1618237451/placeholder.jpg,home-inspiration,,"Don't panic! A fridge left unplugged can be a breeding ground for odors & bacteria. This guide walks you through a deep clean, step-by-step, ensuring a fresh & safe food storage space. Learn how to tackle spills, remove lingering smells",https://www.beacleaner.com/how-to-clean-a-fridge-that-has-been-unplugged?utm_source=pinterest&utm_campaign=fridge-cleaning-sos-,2025-04-30,and sanitize every nook & cranny. Reclaim your fridge & enjoy peace of mind knowing your food is stored safely! Click to learn more & get a sparkling clean fridge today! #FridgeCleaning #DeepCleaning #KitchenCleaning #FoodSafety,https://www.beacleaner.com/how-to-clean-a-fridge-that-has-been-unplugged
Fridge Cleaned & Ready!,https://res.cloudinary.com/dbcpfy04c/image/upload/v1618237451/placeholder.jpg,home-inspiration,,"Is your fridge a disaster after being without power? This pin shows a beautifully clean fridge, inspiring you to tackle the task! Our blog post provides a complete guide to cleaning an unplugged fridge, from defrosting to sanitizing. Say goodbye to funky smells and hello to a fresh",https://www.beacleaner.com/how-to-clean-a-fridge-that-has-been-unplugged?utm_source=pinterest&utm_campaign=fridge-cleaned-ready,2025-04-30,organized fridge. You deserve a clean kitchen! Click to read the full guide. #CleanFridge #KitchenOrganization #HomeCleaning #Refrigerator,https://www.beacleaner.com/how-to-clean-a-fridge-that-has-been-unplugged
Natural Cleaning Power!,https://res.cloudinary.com/dbcpfy04c/image/upload/v1618237451/placeholder.jpg,home-inspiration,,"Skip the harsh chemicals! This pin highlights natural cleaning solutions for your unplugged fridge. Baking soda, vinegar",https://www.beacleaner.com/how-to-clean-a-fridge-that-has-been-unplugged?utm_source=pinterest&utm_campaign=natural-cleaning-pow,2025-04-30,and lemon are your new best friends. Safe for your family & the environment. Click to discover our natural cleaning recipes! #NaturalCleaning #EcoFriendlyCleaning #FridgeCleaning #NonToxicCleaning,https://www.beacleaner.com/how-to-clean-a-fridge-that-has-been-unplugged
Step-by-Step Fridge Clean!,https://res.cloudinary.com/dbcpfy04c/image/upload/v1618237451/placeholder.jpg,home-inspiration,,Need a clear plan? This pin offers a visual step-by-step guide to cleaning an unplugged fridge. From defrosting to sanitizing,https://www.beacleaner.com/how-to-clean-a-fridge-that-has-been-unplugged?utm_source=pinterest&utm_campaign=step-by-step-fridge-,2025-04-30,we've got you covered. No more guesswork! Click to follow our easy-to-follow instructions. #StepByStepCleaning #FridgeCleaning #CleaningChecklist #KitchenCleaning,https://www.beacleaner.com/how-to-clean-a-fridge-that-has-been-unplugged
The Ultimate Fridge Guide!,https://res.cloudinary.com/dbcpfy04c/image/upload/v1618237451/placeholder.jpg,home-inspiration,,Everything you need to know about cleaning an unplugged fridge in one place! This pin links to our comprehensive blog post,https://www.beacleaner.com/how-to-clean-a-fridge-that-has-been-unplugged?utm_source=pinterest&utm_campaign=the-ultimate-fridge-,2025-04-30,covering all aspects of fridge cleaning. Become a fridge cleaning expert! Click to read the full guide. #FridgeCleaning #KitchenCleaning #CleaningGuide #HomeCleaning,https://www.beacleaner.com/how-to-clean-a-fridge-that-has-been-unplugged
Inside the Fridge Deep Dive!,https://res.cloudinary.com/dbcpfy04c/image/upload/v1618237451/placeholder.jpg,home-inspiration,,"A close-up look at cleaning the interior of an unplugged fridge. This pin highlights often-overlooked areas like shelves, drawers",https://www.beacleaner.com/how-to-clean-a-fridge-that-has-been-unplugged?utm_source=pinterest&utm_campaign=inside-the-fridge-de,2025-04-30,& door seals. Don't miss a single spot! Click to learn our deep cleaning secrets. #DeepCleaning #FridgeCleaning #KitchenDetails #CleaningHacks,https://www.beacleaner.com/how-to-clean-a-fridge-that-has-been-unplugged
The Secret to a Fresh Fridge!,https://res.cloudinary.com/dbcpfy04c/image/upload/v1618237451/placeholder.jpg,home-inspiration,,Discover the secret to a consistently fresh fridge! This pin links to our blog post,https://www.beacleaner.com/how-to-clean-a-fridge-that-has-been-unplugged?utm_source=pinterest&utm_campaign=the-secret-to-a-fres,2025-04-30,revealing all our fridge cleaning tips & tricks. Enjoy a fridge you'll love to open! Click to learn the secret. #FreshFridge #FridgeCleaning #KitchenCleaning #CleaningSecrets,https://www.beacleaner.com/how-to-clean-a-fridge-that-has-been-unplugged
Don't Forget the Door Seals!,https://res.cloudinary.com/dbcpfy04c/image/upload/v1618237451/placeholder.jpg,home-inspiration,,Often overlooked,https://www.beacleaner.com/how-to-clean-a-fridge-that-has-been-unplugged?utm_source=pinterest&utm_campaign=dont-forget-the-door,2025-04-30,but crucial! This pin highlights the importance of cleaning fridge door seals. Prevent mold & maintain a tight seal. Click to learn how to clean your door seals. #DoorSeals #FridgeCleaning #KitchenCleaning #CleaningDetails,https://www.beacleaner.com/how-to-clean-a-fridge-that-has-been-unplugged
Title,https://res.cloudinary.com/dbcpfy04c/image/upload/v1618237451/placeholder.jpg,home-inspiration,,Description,https://www.beacleaner.com/how-to-clean-a-futon-mattress-of-urine?utm_source=pinterest&utm_campaign=title,2025-04-30,Keywords,https://www.beacleaner.com/how-to-clean-a-futon-mattress-of-urine
Urine on Futon? Don't Panic!,https://res.cloudinary.com/dbcpfy04c/image/upload/v1618237451/placeholder.jpg,home-inspiration,,Accidents happen! Don't let a urine stain ruin your futon. This guide breaks down exactly how to clean a futon mattress of urine,https://www.beacleaner.com/how-to-clean-a-futon-mattress-of-urine?utm_source=pinterest&utm_campaign=urine-on-futon-dont-,2025-04-30,from blotting to deep cleaning. We cover everything from DIY solutions to when to call a pro. Save your futon & your sanity! Click to learn the best methods for odor removal and stain fighting. A clean futon means a happy home! #futoncleaning #urineodor #stainremoval #cleaningtips,https://www.beacleaner.com/how-to-clean-a-futon-mattress-of-urine
Futon Urine Cleanup: Quick Guide,https://res.cloudinary.com/dbcpfy04c/image/upload/v1618237451/placeholder.jpg,home-inspiration,,"Is your futon smelling less than fresh? Discover a fast & effective method to tackle urine stains and odors on your futon mattress. This pin highlights the initial steps – blotting, enzyme cleaners, and preventing the spread. Don't suffer through embarrassing smells! Get a fresh",https://www.beacleaner.com/how-to-clean-a-futon-mattress-of-urine?utm_source=pinterest&utm_campaign=futon-urine-cleanup-,2025-04-30,clean futon today. Read the full guide for detailed instructions. #futon #urine #cleaninghacks #homemaintenance,https://www.beacleaner.com/how-to-clean-a-futon-mattress-of-urine
DIY Futon Urine Stain Remover,https://res.cloudinary.com/dbcpfy04c/image/upload/v1618237451/placeholder.jpg,home-inspiration,,"Skip expensive cleaners! Learn how to make a powerful, yet gentle, DIY urine stain remover for your futon mattress. This pin focuses on natural cleaning solutions like vinegar and baking soda. Protect your family & your futon with safe",https://www.beacleaner.com/how-to-clean-a-futon-mattress-of-urine?utm_source=pinterest&utm_campaign=diy-futon-urine-stai,2025-04-30,effective cleaning. Click to learn the recipe & application! #diycleaning #futonstain #naturalcleaning #urinecleanup,https://www.beacleaner.com/how-to-clean-a-futon-mattress-of-urine
Enzyme Cleaners: Futon's Best Friend,https://res.cloudinary.com/dbcpfy04c/image/upload/v1618237451/placeholder.jpg,home-inspiration,,"Enzyme cleaners are a game-changer for urine stains! This pin explains *why* enzyme cleaners work so well on futon mattresses, breaking down the urine at a molecular level. Don't just mask the smell",https://www.beacleaner.com/how-to-clean-a-futon-mattress-of-urine?utm_source=pinterest&utm_campaign=enzyme-cleaners-futo,2025-04-30,eliminate it! Learn how to choose the right enzyme cleaner & use it effectively. Click for a stain-free futon! #enzymecleaner #futoncare #urineodorremoval #cleaningproducts,https://www.beacleaner.com/how-to-clean-a-futon-mattress-of-urine
Deep Cleaning Your Futon Mattress,https://res.cloudinary.com/dbcpfy04c/image/upload/v1618237451/placeholder.jpg,home-inspiration,,Give your futon the deep clean it deserves! This pin showcases the full process,https://www.beacleaner.com/how-to-clean-a-futon-mattress-of-urine?utm_source=pinterest&utm_campaign=deep-cleaning-your-f,2025-04-30,from vacuuming to applying cleaning solutions and drying. A deep clean revitalizes your futon and eliminates lingering odors. Don't let urine damage your investment! Click to learn the step-by-step guide. #deepcleaning #futonmattress #urinecleaning #homedecor,https://www.beacleaner.com/how-to-clean-a-futon-mattress-of-urine
