Title,Media URL,Pinterest board,Thumbnail,Description,Link,Publish date,Keywords,Source URL
Cub Cadet 1554: Engine Not Starting?,https://res.cloudinary.com/ddxyyzkuq/image/upload/v1745868629/pin_8_3_gmpnbk.webp,lawn-mower-ideas,,"Is your Cub Cadet Super LT 1554 refusing to start?  It's a common headache! This pin links to a detailed blog post that walks you through potential causes – fuel issues, spark plugs, and more.  Don't spend a fortune on a mechanic!  We offer step-by-step instructions and helpful diagrams.  Get your mower running smoothly again and enjoy a perfectly manicured lawn. Click to diagnose & fix it! #CubCadet1554 #EngineRepair #LawnMowerProblems #DIY,Engine,Starting Issues,Cub Cadet",https://lawntrend.com/cub-cadet-super-lt-1554-problems/?utm_source=pinterest&utm_campaign=cub-cadet-1554-engin,2025-04-28,Troubleshooting,https://lawntrend.com/cub-cadet-super-lt-1554-problems/
Fix Blade Problems on Your Cub Cadet 1554,https://res.cloudinary.com/ddxyyzkuq/image/upload/v1745868635/pin_8_4_jb57cc.webp,lawn-repair-ideas,,"Dull or damaged blades on your Cub Cadet Super LT 1554?  Don't settle for a ragged cut!  Our guide shows you how to safely remove, sharpen, and replace blades.  A sharp blade means a healthier lawn and a more professional look.  We'll help you avoid costly repairs and keep your yard looking its best. Click to learn the proper techniques! #LawnMowerBlades #CubCadetRepair #LawnCareTips #DIY,Blades,Sharpening,Cub Cadet",https://lawntrend.com/cub-cadet-super-lt-1554-problems/?utm_source=pinterest&utm_campaign=fix-blade-problems-o,2025-04-28,Lawn Care,https://lawntrend.com/cub-cadet-super-lt-1554-problems/
Cub Cadet 1554: Fuel System Issues Solved,https://res.cloudinary.com/ddxyyzkuq/image/upload/v1745868641/pin_8_5_yyne6y.webp,lawn-mower-ideas,,"Is your Cub Cadet Super LT 1554 sputtering or running rough?  A clogged fuel filter or carburetor could be the culprit.  This pin leads to a comprehensive guide on diagnosing and fixing fuel system problems.  Don't let a simple issue turn into a major repair!  We provide clear instructions and helpful tips. Click to breathe new life into your mower! #FuelSystem #CubCadetProblems #LawnMowerMaintenance #DIY,Fuel System,Carburetor,Cub Cadet",https://lawntrend.com/cub-cadet-super-lt-1554-problems/?utm_source=pinterest&utm_campaign=cub-cadet-1554-fuel-,2025-04-28,Maintenance,https://lawntrend.com/cub-cadet-super-lt-1554-problems/
Troubleshooting Cub Cadet 1554 Drive Belt,https://res.cloudinary.com/ddxyyzkuq/image/upload/v1745868647/pin_8_6_chdnx7.webp,lawn-care-ideas,,"A broken drive belt on your Cub Cadet Super LT 1554 can stop you in your tracks.  Our blog post details how to identify a worn or broken belt and how to replace it yourself.  Save money on repair costs and get back to mowing quickly!  We'll show you exactly what to do. Click for a step-by-step guide! #DriveBelt #CubCadetRepair #LawnMowerFix #DIY,Drive Belt,Replacement,Cub Cadet",https://lawntrend.com/cub-cadet-super-lt-1554-problems/?utm_source=pinterest&utm_campaign=troubleshooting-cub-,2025-04-28,Repair,https://lawntrend.com/cub-cadet-super-lt-1554-problems/
Cub Cadet 1554: Steering Problems? We Can Help!,https://res.cloudinary.com/ddxyyzkuq/image/upload/v1745868653/pin_8_7_r0gbvu.webp,lawn-mower-ideas,,"Is your Cub Cadet Super LT 1554 steering feeling loose or unresponsive?  Don't ignore it!  Our guide covers common steering issues and provides solutions.  From checking linkages to adjusting the steering box, we've got you covered.  Enjoy smooth, effortless mowing again. Click to learn more! #SteeringRepair #CubCadetProblems #LawnMowerFix #DIY,Steering,Linkage,Cub Cadet",https://lawntrend.com/cub-cadet-super-lt-1554-problems/?utm_source=pinterest&utm_campaign=cub-cadet-1554-steer,2025-04-28,Troubleshooting,https://lawntrend.com/cub-cadet-super-lt-1554-problems/
Cub Cadet 1554: Battery Issues & Solutions,https://res.cloudinary.com/ddxyyzkuq/image/upload/v1745868659/pin_8_8_ghpxxv.webp,lawn-mower-ideas,,"A dead battery can ruin your mowing plans.  This pin links to a guide on diagnosing and fixing battery problems on your Cub Cadet Super LT 1554.  We cover charging, testing, and replacement.  Don't get stuck with a powerless mower! Click to keep your mower charged and ready to go. #BatteryRepair #CubCadetMaintenance #LawnMowerTips #DIY,Battery,Charging,Cub Cadet",https://lawntrend.com/cub-cadet-super-lt-1554-problems/?utm_source=pinterest&utm_campaign=cub-cadet-1554-batte,2025-04-28,Maintenance,https://lawntrend.com/cub-cadet-super-lt-1554-problems/
Cub Cadet 1554: Overheating? Find the Cause!,https://res.cloudinary.com/ddxyyzkuq/image/upload/v1745868665/pin_8_9_f05foc.webp,lawn-mower-ideas,,"Is your Cub Cadet Super LT 1554 overheating?  It's a serious issue that needs to be addressed.  Our blog post explores potential causes – from clogged cooling fins to low oil levels – and provides solutions.  Protect your engine and keep your mower running cool. Click to learn how to prevent damage! #Overheating #CubCadetProblems #EngineCare #DIY,Overheating,Cooling,Cub Cadet",https://lawntrend.com/cub-cadet-super-lt-1554-problems/?utm_source=pinterest&utm_campaign=cub-cadet-1554-overh,2025-04-28,Engine,https://lawntrend.com/cub-cadet-super-lt-1554-problems/
Cub Cadet 1554: Deck Problems & Repairs,https://res.cloudinary.com/dbcpfy04c/image/upload/v1618237451/placeholder.jpg,home-inspiration,,"A damaged mower deck can affect your cut quality.  This pin leads to a guide on repairing common deck issues on your Cub Cadet Super LT 1554.  We cover everything from patching holes to replacing sections.  Get a professional-looking cut every time. Click to restore your deck! #MowerDeck #CubCadetRepair #LawnCare #DIY,Mower Deck,Repair,Cub Cadet",https://lawntrend.com/cub-cadet-super-lt-1554-problems/?utm_source=pinterest&utm_campaign=cub-cadet-1554-deck-,2025-04-28,Lawn Care,https://lawntrend.com/cub-cadet-super-lt-1554-problems/
Cub Cadet 1554: Electrical System Troubleshooting,https://res.cloudinary.com/dbcpfy04c/image/upload/v1618237451/placeholder.jpg,home-inspiration,,"Electrical problems can be tricky.  Our blog post provides a step-by-step guide to troubleshooting the electrical system on your Cub Cadet Super LT 1554.  From fuses to wiring, we'll help you diagnose and fix the issue.  Don't let electrical gremlins stop you! Click to get powered up! #ElectricalRepair #CubCadetProblems #LawnMowerFix #DIY,Electrical,Wiring,Cub Cadet",https://lawntrend.com/cub-cadet-super-lt-1554-problems/?utm_source=pinterest&utm_campaign=cub-cadet-1554-elect,2025-04-28,Troubleshooting,https://lawntrend.com/cub-cadet-super-lt-1554-problems/
Save Money: DIY Cub Cadet 1554 Repairs,https://res.cloudinary.com/dbcpfy04c/image/upload/v1618237451/placeholder.jpg,home-inspiration,,"Stop paying expensive mechanic bills! This pin highlights the cost savings of DIY repairs on your Cub Cadet Super LT 1554. Our blog post provides the knowledge and confidence to tackle common problems yourself. Reclaim your budget and your lawn! Click to start saving! #DIYRepair #CubCadet #SaveMoney #LawnCare,DIY,Repair,Cub Cadet",https://lawntrend.com/cub-cadet-super-lt-1554-problems/?utm_source=pinterest&utm_campaign=save-money-diy-cub-c,2025-04-28,Cost Savings,https://lawntrend.com/cub-cadet-super-lt-1554-problems/
Cub Cadet 1554: Common Issues & Quick Fixes,https://res.cloudinary.com/ddxyyzkuq/image/upload/v1745868676/pin_8_13_mudwfz.webp,lawn-mower-ideas,,"Short on time? This pin points to a quick-reference guide of common problems and fast fixes for your Cub Cadet Super LT 1554. Get back to mowing with minimal downtime!  Don't let small issues become big headaches. Click for instant solutions! #QuickFixes #CubCadetProblems #LawnMowerTips #DIY,Quick Fixes,Troubleshooting,Cub Cadet",https://lawntrend.com/cub-cadet-super-lt-1554-problems/?utm_source=pinterest&utm_campaign=cub-cadet-1554-commo,2025-04-28,Lawn Care,https://lawntrend.com/cub-cadet-super-lt-1554-problems/
Extend the Life of Your Cub Cadet 1554,https://res.cloudinary.com/ddxyyzkuq/image/upload/v1745868682/pin_8_14_fuxcsm.webp,lawn-mower-ideas,,"Want to keep your Cub Cadet Super LT 1554 running for years to come?  Our blog post offers essential maintenance tips to prevent problems and extend its lifespan.  Protect your investment and enjoy a reliable mower. Click to learn how! #LawnMowerMaintenance #CubCadetCare #PreventativeMaintenance #DIY,Maintenance,Preventative,Cub Cadet",https://lawntrend.com/cub-cadet-super-lt-1554-problems/?utm_source=pinterest&utm_campaign=extend-the-life-of-y,2025-04-28,Lifespan,https://lawntrend.com/cub-cadet-super-lt-1554-problems/
Cub Cadet 1554: Finding Replacement Parts,https://res.cloudinary.com/ddxyyzkuq/image/upload/v1745868689/pin_8_15_gb8op3.webp,lawn-mower-ideas,,"Need parts for your Cub Cadet Super LT 1554?  Our guide provides resources for finding genuine replacement parts and compatible alternatives.  Don't settle for inferior quality!  Get the right parts for a lasting repair. Click to find what you need! #ReplacementParts #CubCadetParts #LawnMowerRepair #DIY,Parts,Replacement,Cub Cadet",https://lawntrend.com/cub-cadet-super-lt-1554-problems/?utm_source=pinterest&utm_campaign=cub-cadet-1554-findi,2025-04-28,Repair,https://lawntrend.com/cub-cadet-super-lt-1554-problems/
Diagnose Your Cub Cadet 1554: A Step-by-Step Guide,https://res.cloudinary.com/ddxyyzkuq/image/upload/v1745868695/pin_8_16_swqt9p.webp,tractor-repair-ideas,,"Feeling overwhelmed by your Cub Cadet Super LT 1554's problems?  Our blog post offers a clear, step-by-step diagnostic process to pinpoint the issue.  Don't guess – know!  Click to become a lawn mower detective! #Diagnosis #CubCadetProblems #Troubleshooting #DIY,Diagnosis,Troubleshooting,Cub Cadet",https://lawntrend.com/cub-cadet-super-lt-1554-problems/?utm_source=pinterest&utm_campaign=diagnose-your-cub-ca,2025-04-28,Repair,https://lawntrend.com/cub-cadet-super-lt-1554-problems/
Cub Cadet 1554: Is It Worth Repairing?,https://res.cloudinary.com/ddxyyzkuq/image/upload/v1745868701/pin_8_17_urb3fl.webp,lawn-mower-ideas,,"Facing a major repair on your Cub Cadet Super LT 1554?  This pin links to a guide that helps you assess whether it's worth fixing or time to replace.  Make an informed decision and avoid wasting money. Click to evaluate your options! #RepairOrReplace #CubCadet #LawnMowerDecision #DIY,Repair,Replace,Cub Cadet",https://lawntrend.com/cub-cadet-super-lt-1554-problems/?utm_source=pinterest&utm_campaign=cub-cadet-1554-is-it,2025-04-28,Decision,https://lawntrend.com/cub-cadet-super-lt-1554-problems/
Cub Cadet 1554: Safety First! Repair Tips,https://res.cloudinary.com/ddxyyzkuq/image/upload/v1745868706/pin_8_18_nbftnc.webp,lawn-mower-ideas,,"Safety is paramount when working on your Cub Cadet Super LT 1554.  This pin highlights essential safety precautions to follow during repairs.  Protect yourself and avoid accidents. Click for a safe repair experience! #SafetyFirst #CubCadetRepair #LawnMowerSafety #DIY,Safety,Repair,Cub Cadet",https://lawntrend.com/cub-cadet-super-lt-1554-problems/?utm_source=pinterest&utm_campaign=cub-cadet-1554-safet,2025-04-28,Precautions,https://lawntrend.com/cub-cadet-super-lt-1554-problems/
Cub Cadet 1554: Winter Storage Checklist,https://res.cloudinary.com/ddxyyzkuq/image/upload/v1745868711/pin_8_19_goiwcq.webp,lawn-mower-ideas,,"Preparing your Cub Cadet Super LT 1554 for winter storage?  Our guide provides a comprehensive checklist to protect it from the elements and ensure it's ready to go in the spring.  Don't let winter damage ruin your mower! Click to winterize it now! #WinterStorage #CubCadetMaintenance #LawnMowerPrep #DIY,Winter Storage,Maintenance,Cub Cadet",https://lawntrend.com/cub-cadet-super-lt-1554-problems/?utm_source=pinterest&utm_campaign=cub-cadet-1554-winte,2025-04-28,Preparation,https://lawntrend.com/cub-cadet-super-lt-1554-problems/
Cub Cadet 1554: Common Mistakes to Avoid,https://res.cloudinary.com/ddxyyzkuq/image/upload/v1745868716/pin_8_20_ejp8po.webp,lawn-mower-ideas,,"Don't make these common mistakes when repairing your Cub Cadet Super LT 1554!  Our blog post highlights pitfalls to avoid and ensures a successful repair.  Learn from our experience and save yourself time and frustration. Click to avoid costly errors! #RepairMistakes #CubCadetProblems #LawnMowerTips #DIY,Mistakes,Troubleshooting,Cub Cadet",https://lawntrend.com/cub-cadet-super-lt-1554-problems/?utm_source=pinterest&utm_campaign=cub-cadet-1554-commo,2025-04-28,Repair,https://lawntrend.com/cub-cadet-super-lt-1554-problems/
Cub Cadet 1554: Understanding Your Owner's Manual,https://res.cloudinary.com/ddxyyzkuq/image/upload/v1745868722/pin_8_21_i5nfid.webp,lawn-mower-ideas,,"Unlock the secrets of your Cub Cadet Super LT 1554 owner's manual!  Our guide explains how to use it effectively for maintenance and repairs.  Don't underestimate this valuable resource! Click to become a manual master! #OwnersManual #CubCadet #LawnMowerTips #DIY,Owners Manual,Maintenance,Cub Cadet",https://lawntrend.com/cub-cadet-super-lt-1554-problems/?utm_source=pinterest&utm_campaign=cub-cadet-1554-under,2025-04-28,Resources,https://lawntrend.com/cub-cadet-super-lt-1554-problems/
Cub Cadet 1554: The Ultimate Repair Resource,https://res.cloudinary.com/ddxyyzkuq/image/upload/v1745868729/pin_8_22_ismejj.webp,lawn-mower-ideas,,"Need a one-stop shop for all your Cub Cadet Super LT 1554 repair needs?  This pin links to our comprehensive blog post, covering everything from engine issues to blade problems.  Your go-to resource for a perfectly maintained lawn! Click to explore! #CubCadetRepair #LawnMowerResource #DIY #UltimateGuide,Repair,Resource,Cub Cadet",https://lawntrend.com/cub-cadet-super-lt-1554-problems/?utm_source=pinterest&utm_campaign=cub-cadet-1554-the-u,2025-04-28,Guide,https://lawntrend.com/cub-cadet-super-lt-1554-problems/
Cub Cadet 1554: Don't Let This Happen To You!,https://res.cloudinary.com/ddxyyzkuq/image/upload/v1745868734/pin_8_23_zregme.webp,lawn-mower-ideas,,"[Image of a visibly broken/damaged Cub Cadet 1554 part] Prevent costly repairs! Learn to identify and fix common issues with your Cub Cadet Super LT 1554 *before* they become major problems. Click to protect your investment! #PreventativeMaintenance #CubCadet #LawnCare #DIY,Preventative,Maintenance,Cub Cadet",https://lawntrend.com/cub-cadet-super-lt-1554-problems/?utm_source=pinterest&utm_campaign=cub-cadet-1554-dont-,2025-04-28,Repair,https://lawntrend.com/cub-cadet-super-lt-1554-problems/
Cub Cadet 1554: Get Back to Mowing Today!,https://res.cloudinary.com/ddxyyzkuq/image/upload/v1745868739/pin_8_24_puamns.webp,lawn-mower-ideas,,"[Image of someone happily mowing their lawn with a Cub Cadet] Don't let a broken mower keep you from enjoying your beautiful lawn! Our guide provides the solutions you need to get your Cub Cadet Super LT 1554 back in action. Click to reclaim your weekend! #LawnCare #CubCadet #DIYRepair #GetMowing,Mowing,Repair,Cub Cadet",https://lawntrend.com/cub-cadet-super-lt-1554-problems/?utm_source=pinterest&utm_campaign=cub-cadet-1554-get-b,2025-04-28,Lawn Care,https://lawntrend.com/cub-cadet-super-lt-1554-problems/
Cub Cadet 1554: Is Your Mower Speaking to You?,https://res.cloudinary.com/ddxyyzkuq/image/upload/v1745868746/pin_8_25_ky0ti0.webp,lawn-mower-ideas,,"[Image of a Cub Cadet with speech bubble showing a problem] Is your Cub Cadet Super LT 1554 making strange noises or acting up?  We can help you decipher the signals and diagnose the problem. Click to understand your mower! #Troubleshooting #CubCadetProblems #LawnMowerFix #DIY,Troubleshooting,Diagnosis,Cub Cadet",https://lawntrend.com/cub-cadet-super-lt-1554-problems/?utm_source=pinterest&utm_campaign=cub-cadet-1554-is-yo,2025-04-28,Repair,https://lawntrend.com/cub-cadet-super-lt-1554-problems/
Title,https://res.cloudinary.com/ddxyyzkuq/image/upload/v1745868795/pin_9_1_wlu297.webp,please-provide-the-title-and-keywords-i-need-that-information-to-suggest-a-board-name-once,,Description,https://lawntrend.com/cub-cadet-cc-760-es-problems/?utm_source=pinterest&utm_campaign=title,2025-04-28,Keywords,https://lawntrend.com/cub-cadet-cc-760-es-problems/
Cub Cadet CC-760 ES: Is Yours Having Issues?,https://res.cloudinary.com/ddxyyzkuq/image/upload/v1745868803/pin_9_2_e6tyxm.webp,lawn-repair-ideas,,"Don't let a broken Cub Cadet CC-760 ES ruin your weekend! This guide dives deep into common problems – from starting issues to blade engagement failures. We'll help you diagnose and potentially fix it yourself, saving you time & money.  Frustrated with lawn care? We've got you covered. Learn about carburetor problems, belt replacements, and more. Click to troubleshoot & get back to enjoying your yard! #CubCadet #LawnMowerRepair #CC760ES #DIYRepair,Cub Cadet,Lawn Mower,CC760ES",https://lawntrend.com/cub-cadet-cc-760-es-problems/?utm_source=pinterest&utm_campaign=cub-cadet-cc-760-es-,2025-04-28,Repair,https://lawntrend.com/cub-cadet-cc-760-es-problems/
CC-760 ES Starting Problems? Fix It Now!,https://res.cloudinary.com/ddxyyzkuq/image/upload/v1745868810/pin_9_3_jq0nte.webp,small-engine-ideas,,"Is your Cub Cadet CC-760 ES refusing to start? It's a common headache! This pin leads to a detailed guide covering everything from fuel issues to spark plug problems.  Don't waste another sunny day struggling! We break down the troubleshooting steps so even beginners can tackle the repair.  Get your mower running smoothly again – click to learn how! #CubCadetProblems #StartingIssues #LawnCare #DIY,Starting Issues,Cub Cadet,CC760ES",https://lawntrend.com/cub-cadet-cc-760-es-problems/?utm_source=pinterest&utm_campaign=cc-760-es-starting-p,2025-04-28,Troubleshooting,https://lawntrend.com/cub-cadet-cc-760-es-problems/
Cub Cadet CC-760 ES: Blade Engagement Fix,https://res.cloudinary.com/ddxyyzkuq/image/upload/v1745868815/pin_9_4_gtrdlm.webp,lawn-repair-ideas,,"Struggling with blade engagement on your CC-760 ES?  A non-spinning blade means wasted time and an unfinished lawn. This pin links to a comprehensive guide detailing the causes – from broken belts to faulty spindles.  Don't let a simple fix keep you from a beautiful lawn!  Click to diagnose and repair it yourself. #BladeEngagement #CubCadetRepair #LawnMowerFix #DIY,Blade Engagement,Cub Cadet,CC760ES",https://lawntrend.com/cub-cadet-cc-760-es-problems/?utm_source=pinterest&utm_campaign=cub-cadet-cc-760-es-,2025-04-28,Repair Guide,https://lawntrend.com/cub-cadet-cc-760-es-problems/
CC-760 ES Carburetor Issues: Solved!,https://res.cloudinary.com/ddxyyzkuq/image/upload/v1745868822/pin_9_5_y6g2g6.webp,small-engine-ideas,,"Is your Cub Cadet CC-760 ES running rough? A dirty or faulty carburetor is often the culprit. This pin directs you to a step-by-step guide on cleaning and potentially replacing your carburetor.  Restore your mower's power and efficiency!  Don't let a small part cause big problems. Click to learn more! #CarburetorRepair #CubCadet #LawnMowerMaintenance #DIY,Carburetor,Cub Cadet,CC760ES",https://lawntrend.com/cub-cadet-cc-760-es-problems/?utm_source=pinterest&utm_campaign=cc-760-es-carburetor,2025-04-28,Maintenance,https://lawntrend.com/cub-cadet-cc-760-es-problems/
Cub Cadet CC-760 ES Belt Replacement Guide,https://res.cloudinary.com/ddxyyzkuq/image/upload/v1745868828/pin_9_6_naioj8.webp,lawn-repair-ideas,,"A worn or broken belt can bring your CC-760 ES to a halt. This pin leads to a detailed guide with photos and instructions on how to replace the drive belt and blade belts.  Save money on repair costs and get back to mowing!  Don't get stuck with a broken mower – click to learn how! #BeltReplacement #CubCadetRepair #LawnMowerBelt #DIY,Belt Replacement,Cub Cadet,CC760ES",https://lawntrend.com/cub-cadet-cc-760-es-problems/?utm_source=pinterest&utm_campaign=cub-cadet-cc-760-es-,2025-04-28,Drive Belt,https://lawntrend.com/cub-cadet-cc-760-es-problems/
CC-760 ES: Fuel System Problems & Fixes,https://res.cloudinary.com/ddxyyzkuq/image/upload/v1745868834/pin_9_7_i9tmjz.webp,auto-repair-ideas,,"Fuel issues plaguing your Cub Cadet CC-760 ES?  This pin links to a guide covering fuel lines, fuel filters, and fuel pumps.  Don't let a clogged fuel system ruin your lawn care routine!  We'll help you diagnose and fix the problem. Click to learn more and get mowing! #FuelSystem #CubCadetProblems #LawnMowerRepair #DIY,Fuel System,Cub Cadet,CC760ES",https://lawntrend.com/cub-cadet-cc-760-es-problems/?utm_source=pinterest&utm_campaign=cc-760-es-fuel-syste,2025-04-28,Fuel Filter,https://lawntrend.com/cub-cadet-cc-760-es-problems/
Diagnose Your CC-760 ES: A Quick Checklist,https://res.cloudinary.com/ddxyyzkuq/image/upload/v1745868840/pin_9_8_e19prm.webp,tractor-repair-ideas,,"Feeling overwhelmed by your Cub Cadet CC-760 ES problems? This pin provides a quick checklist to help you narrow down the issue.  From checking the oil to inspecting the spark plug, we'll guide you through the initial troubleshooting steps.  Get a faster diagnosis – click to learn more! #Troubleshooting #CubCadet #LawnMowerProblems #DIY,Troubleshooting,Cub Cadet,CC760ES",https://lawntrend.com/cub-cadet-cc-760-es-problems/?utm_source=pinterest&utm_campaign=diagnose-your-cc-760,2025-04-28,Checklist,https://lawntrend.com/cub-cadet-cc-760-es-problems/
CC-760 ES: Electrical System Troubleshooting,https://res.cloudinary.com/ddxyyzkuq/image/upload/v1745868846/pin_9_9_muxknz.webp,auto-repair-ideas,,"Electrical issues can be tricky! This pin leads to a guide on diagnosing problems with the ignition system, wiring, and safety switches on your Cub Cadet CC-760 ES.  Don't risk electrical shocks – learn how to safely troubleshoot. Click to get started! #ElectricalRepair #CubCadet #LawnMowerFix #DIY,Electrical System,Cub Cadet,CC760ES",https://lawntrend.com/cub-cadet-cc-760-es-problems/?utm_source=pinterest&utm_campaign=cc-760-es-electrical,2025-04-28,Ignition,https://lawntrend.com/cub-cadet-cc-760-es-problems/
Is Your CC-760 ES Overheating? Find Out Why!,https://res.cloudinary.com/ddxyyzkuq/image/upload/v1745868853/pin_9_10_zyg7gw.webp,cooling-ideas,,"Overheating can cause serious damage to your Cub Cadet CC-760 ES. This pin links to a guide on identifying the causes of overheating and how to prevent it.  Protect your investment and keep your mower running cool! Click to learn more. #Overheating #CubCadetProblems #LawnMowerMaintenance #DIY,Overheating,Cub Cadet,CC760ES",https://lawntrend.com/cub-cadet-cc-760-es-problems/?utm_source=pinterest&utm_campaign=is-your-cc-760-es-ov,2025-04-28,Cooling System,https://lawntrend.com/cub-cadet-cc-760-es-problems/
CC-760 ES: Spindle Problems & Solutions,https://res.cloudinary.com/ddxyyzkuq/image/upload/v1745868859/pin_9_11_kvrhsc.webp,woodworking-ideas,,"A faulty spindle can cause vibrations and uneven cutting. This pin directs you to a guide on diagnosing and repairing spindle issues on your Cub Cadet CC-760 ES.  Get a smoother, cleaner cut! Click to learn how. #SpindleRepair #CubCadet #LawnMowerFix #DIY,Spindle,Cub Cadet,CC760ES",https://lawntrend.com/cub-cadet-cc-760-es-problems/?utm_source=pinterest&utm_campaign=cc-760-es-spindle-pr,2025-04-28,Blade Spindle,https://lawntrend.com/cub-cadet-cc-760-es-problems/
CC-760 ES: Common Safety Switch Issues,https://res.cloudinary.com/ddxyyzkuq/image/upload/v1745868865/pin_9_12_gqg7dh.webp,electrical-safety-ideas,,"Safety first! This pin links to a guide on troubleshooting common safety switch problems on your Cub Cadet CC-760 ES.  Ensure your mower is operating safely and efficiently. Click to learn more. #SafetySwitches #CubCadet #LawnMowerSafety #DIY,Safety Switch,Cub Cadet,CC760ES",https://lawntrend.com/cub-cadet-cc-760-es-problems/?utm_source=pinterest&utm_campaign=cc-760-es-common-saf,2025-04-28,Safety,https://lawntrend.com/cub-cadet-cc-760-es-problems/
Extend the Life of Your CC-760 ES!,https://res.cloudinary.com/ddxyyzkuq/image/upload/v1745868871/pin_9_13_wedbev.webp,lawn-mower-ideas,,"Want to keep your Cub Cadet CC-760 ES running for years to come? This pin leads to a guide on preventative maintenance tips.  Save money on repairs and enjoy a reliable mower. Click to learn more! #PreventativeMaintenance #CubCadet #LawnMowerCare #DIY,Maintenance,Cub Cadet,CC760ES",https://lawntrend.com/cub-cadet-cc-760-es-problems/?utm_source=pinterest&utm_campaign=extend-the-life-of-y,2025-04-28,Preventative Care,https://lawntrend.com/cub-cadet-cc-760-es-problems/
CC-760 ES: Oil Change Guide - Step-by-Step,https://res.cloudinary.com/ddxyyzkuq/image/upload/v1745868876/pin_9_14_gkxhh8.webp,car-maintenance-ideas,,"Regular oil changes are crucial for your CC-760 ES's longevity. This pin provides a step-by-step guide on how to change the oil yourself.  Save money and keep your engine running smoothly! Click to learn more. #OilChange #CubCadet #LawnMowerMaintenance #DIY,Oil Change,Cub Cadet,CC760ES",https://lawntrend.com/cub-cadet-cc-760-es-problems/?utm_source=pinterest&utm_campaign=cc-760-es-oil-change,2025-04-28,Engine Oil,https://lawntrend.com/cub-cadet-cc-760-es-problems/
CC-760 ES: Understanding the Engine,https://res.cloudinary.com/ddxyyzkuq/image/upload/v1745868883/pin_9_15_w1iui3.webp,engine-inspiration,,"Demystify your Cub Cadet CC-760 ES engine! This pin links to a guide explaining the key components and how they work.  Gain a better understanding of your mower and its inner workings. Click to learn more! #EngineRepair #CubCadet #LawnMowerEngine #DIY,Engine,Cub Cadet,CC760ES",https://lawntrend.com/cub-cadet-cc-760-es-problems/?utm_source=pinterest&utm_campaign=cc-760-es-understand,2025-04-28,Engine Components,https://lawntrend.com/cub-cadet-cc-760-es-problems/
