Title,Media URL,Pinterest board,Thumbnail,Description,Link,Publish date,Keywords,Source URL
Title,https://res.cloudinary.com/ddxyyzkuq/image/upload/v1746044530/pin_1_1_nhhxtp.webp,please-provide-the-title-and-keywords-i-need-that-information-to-suggest-a-board-name-once,,Description,https://www.beacleaner.com/how-to-clean-a-backpack-sprayer?utm_source=pinterest&utm_campaign=title,2025-04-30,Keywords,https://www.beacleaner.com/how-to-clean-a-backpack-sprayer
Backpack Sprayer Cleaning: Easy Guide,https://res.cloudinary.com/ddxyyzkuq/image/upload/v1746044537/pin_1_2_mjgubp.webp,garden-ideas,,"Don't let a clogged sprayer ruin your gardening or pest control! This easy guide shows you how to clean your backpack sprayer like a pro, extending its life and ensuring optimal performance. Learn step-by-step instructions, from rinsing to nozzle cleaning, and avoid common mistakes. A clean sprayer means a healthier garden & less frustration! Click to learn more and keep spraying with confidence! #backpacksprayer #cleaningtips #gardeninghacks #pestcontrol,backpack sprayer,cleaning,gardening",https://www.beacleaner.com/how-to-clean-a-backpack-sprayer?utm_source=pinterest&utm_campaign=backpack-sprayer-cle,2025-04-30,pest control,https://www.beacleaner.com/how-to-clean-a-backpack-sprayer
Extend Your Sprayer's Life!,https://res.cloudinary.com/ddxyyzkuq/image/upload/v1746044543/pin_1_3_dhzj0j.webp,garden-tools-ideas,,"Is your backpack sprayer looking a little worse for wear? Don't replace it, revive it! This post details a simple cleaning routine that will keep your sprayer functioning flawlessly for years. We cover everything from tank cleaning to filter maintenance. Save money and protect your investment â€“ a little care goes a long way! Click to read now and enjoy a perfectly working sprayer! #sprayercleaning #gardentools #diycleaning #maintenance,sprayer maintenance,tool care,DIY cleaning",https://www.beacleaner.com/how-to-clean-a-backpack-sprayer?utm_source=pinterest&utm_campaign=extend-your-sprayers,2025-04-30,garden tools,https://www.beacleaner.com/how-to-clean-a-backpack-sprayer
No More Clogs! Sprayer Cleaning,https://res.cloudinary.com/ddxyyzkuq/image/upload/v1746044550/pin_1_4_cbabms.webp,cleaning-hacks-ideas,,"Tired of battling clogged nozzles? This guide is your solution! Learn how to effectively clean your backpack sprayer to prevent frustrating blockages and ensure even spray coverage. We'll show you the best cleaning solutions and techniques for a spotless sprayer. Get back to enjoying your garden, not fighting with your equipment! Click to learn more! #cloggedsprayer #sprayernozzle #gardeningtips #cleaninghacks,sprayer nozzle,clog removal,gardening tips",https://www.beacleaner.com/how-to-clean-a-backpack-sprayer?utm_source=pinterest&utm_campaign=no-more-clogs-spraye,2025-04-30,cleaning hacks,https://www.beacleaner.com/how-to-clean-a-backpack-sprayer
Backpack Sprayer Deep Clean,https://res.cloudinary.com/ddxyyzkuq/image/upload/v1746044556/pin_1_5_xl7a0x.webp,garden-ideas,,"Give your backpack sprayer the deep clean it deserves! This comprehensive guide covers every aspect of sprayer maintenance, from tank sanitation to pump lubrication. Protect your plants and yourself by ensuring your sprayer is free of harmful residue. A clean sprayer is a happy sprayer (and a happy gardener!). Click to read the full guide! #sprayerdeepclean #gardeningmaintenance #pestcontroltips #cleaningsolutions,deep cleaning,sprayer maintenance,pest control",https://www.beacleaner.com/how-to-clean-a-backpack-sprayer?utm_source=pinterest&utm_campaign=backpack-sprayer-dee,2025-04-30,cleaning solutions,https://www.beacleaner.com/how-to-clean-a-backpack-sprayer
Quick Sprayer Rinse: 5-Minute Guide,https://res.cloudinary.com/ddxyyzkuq/image/upload/v1746044562/pin_1_6_y4wl6r.webp,cleaning-hacks-ideas,,"Short on time? No problem! This quick guide shows you how to rinse your backpack sprayer after each use, preventing buildup and extending its lifespan. It's a simple habit that makes a huge difference. Don't let residue ruin your next application! Click to learn the easy steps. #sprayerflush #quickcleaning #gardeningroutine #easyhacks,sprayer flush,quick cleaning,gardening routine",https://www.beacleaner.com/how-to-clean-a-backpack-sprayer?utm_source=pinterest&utm_campaign=quick-sprayer-rinse-,2025-04-30,easy hacks,https://www.beacleaner.com/how-to-clean-a-backpack-sprayer
Protect Your Plants: Clean Sprayer,https://res.cloudinary.com/ddxyyzkuq/image/upload/v1746044569/pin_1_7_aqxrqk.webp,plant-care-ideas,,"Did you know a dirty sprayer can harm your plants? This post explains why regular cleaning is crucial for plant health and optimal spray effectiveness. Learn how to remove chemical residue and prevent contamination. Give your plants the best chance to thrive! Click to read now. #planthealth #sprayertips #gardeningadvice #chemicalresidue,plant health,sprayer tips,gardening advice",https://www.beacleaner.com/how-to-clean-a-backpack-sprayer?utm_source=pinterest&utm_campaign=protect-your-plants-,2025-04-30,chemical residue,https://www.beacleaner.com/how-to-clean-a-backpack-sprayer
DIY Sprayer Cleaning Solution,https://res.cloudinary.com/ddxyyzkuq/image/upload/v1746044576/pin_1_8_t03khk.webp,cleaning-ideas,,"Skip the expensive cleaners! This post reveals a simple, effective DIY cleaning solution for your backpack sprayer using common household ingredients. Save money and reduce your environmental impact. A clean sprayer doesn't have to break the bank! Click to learn the recipe. #diycleaner #naturalcleaning #gardeninghacks #ecofriendly,DIY cleaner,natural cleaning,gardening hacks",https://www.beacleaner.com/how-to-clean-a-backpack-sprayer?utm_source=pinterest&utm_campaign=diy-sprayer-cleaning,2025-04-30,eco-friendly,https://www.beacleaner.com/how-to-clean-a-backpack-sprayer
Backpack Sprayer: Before & After,https://res.cloudinary.com/ddxyyzkuq/image/upload/v1746044581/pin_1_9_dgrm7h.webp,garden-ideas,,"See the amazing difference a good cleaning can make! This post features before-and-after photos of a dirty backpack sprayer transformed into a sparkling clean machine. It's proof that a little effort goes a long way. Get inspired to tackle your own sprayer cleaning! Click to see the transformation. #beforeandafter #cleaningmotivation #gardeningtools #sprayercleaning,before and after,cleaning motivation,gardening tools",https://www.beacleaner.com/how-to-clean-a-backpack-sprayer?utm_source=pinterest&utm_campaign=backpack-sprayer-bef,2025-04-30,sprayer cleaning,https://www.beacleaner.com/how-to-clean-a-backpack-sprayer
Sprayer Cleaning Checklist: Print It!,https://res.cloudinary.com/dbcpfy04c/image/upload/v1618237451/placeholder.jpg,home-inspiration,,"Stay organized with our printable backpack sprayer cleaning checklist! This handy resource ensures you never miss a step in your maintenance routine. Download it now and keep your sprayer in top condition. A clean sprayer is just a checklist away! #cleaningchecklist #gardeningorganization #sprayerroutine #printable,cleaning checklist,gardening organization,sprayer routine",https://www.beacleaner.com/how-to-clean-a-backpack-sprayer?utm_source=pinterest&utm_campaign=sprayer-cleaning-che,2025-04-30,printable,https://www.beacleaner.com/how-to-clean-a-backpack-sprayer
Troubleshooting: Sprayer Not Spraying?,https://res.cloudinary.com/dbcpfy04c/image/upload/v1618237451/placeholder.jpg,home-inspiration,,"Is your backpack sprayer refusing to spray? This post helps you diagnose the problem and provides solutions, starting with a thorough cleaning. Don't give up on your sprayer â€“ we'll help you get it working again! Click to troubleshoot now. #sprayertroubleshooting #fixmysprayer #gardeningproblems #cleaninghelp,sprayer troubleshooting,fix my sprayer,gardening problems",https://www.beacleaner.com/how-to-clean-a-backpack-sprayer?utm_source=pinterest&utm_campaign=troubleshooting-spra,2025-04-30,cleaning help,https://www.beacleaner.com/how-to-clean-a-backpack-sprayer
Sprayer Cleaning for Pest Control,https://res.cloudinary.com/ddxyyzkuq/image/upload/v1746044592/pin_1_12_pubvlu.webp,garden-inspiration,,"Using your backpack sprayer for pest control? Cleaning is *essential* to prevent cross-contamination and ensure effective treatment. This post details the specific cleaning steps for pest control applications. Protect your home and garden! Click to learn more. #pestcontrolcleaning #sprayertips #pesticidesafety #gardening,pest control cleaning,sprayer tips,pesticide safety",https://www.beacleaner.com/how-to-clean-a-backpack-sprayer?utm_source=pinterest&utm_campaign=sprayer-cleaning-for,2025-04-30,gardening,https://www.beacleaner.com/how-to-clean-a-backpack-sprayer
Backpack Sprayer: Winter Storage,https://res.cloudinary.com/ddxyyzkuq/image/upload/v1746044598/pin_1_13_whbipp.webp,garden-ideas,,"Preparing your backpack sprayer for winter storage? This post provides a step-by-step guide to cleaning, lubricating, and storing your sprayer to prevent damage during the off-season. Protect your investment and ensure it's ready to go next spring! Click to learn more. #winterstorage #gardentoolstorage #sprayerprep #gardeningtips,winter storage,garden tool storage,sprayer prep",https://www.beacleaner.com/how-to-clean-a-backpack-sprayer?utm_source=pinterest&utm_campaign=backpack-sprayer-win,2025-04-30,gardening tips,https://www.beacleaner.com/how-to-clean-a-backpack-sprayer
The Ultimate Sprayer Cleaning Guide,https://res.cloudinary.com/ddxyyzkuq/image/upload/v1746044605/pin_1_14_phdv8y.webp,cleaning-hacks-ideas,,"Everything you need to know about cleaning your backpack sprayer in one place! This comprehensive guide covers all aspects of maintenance, from daily rinsing to deep cleaning. Become a sprayer cleaning expert! Click to read the ultimate guide. #ultimatecleaningguide #sprayercare #gardeningresources #maintenance,ultimate cleaning guide,sprayer care,gardening resources",https://www.beacleaner.com/how-to-clean-a-backpack-sprayer?utm_source=pinterest&utm_campaign=the-ultimate-sprayer,2025-04-30,maintenance,https://www.beacleaner.com/how-to-clean-a-backpack-sprayer
Sprayer Cleaning: Save Time & Money,https://res.cloudinary.com/ddxyyzkuq/image/upload/v1746044610/pin_1_15_xx4c62.webp,garden-inspiration,,"Don't waste money on replacements! Regular sprayer cleaning saves you time, money, and frustration. This post shows you how to keep your sprayer in top condition with minimal effort. Invest in your tools and enjoy a thriving garden! Click to learn how. #savemoney #gardeningtips #sprayerlife #cleaningbenefits,save money,gardening tips,sprayer life",https://www.beacleaner.com/how-to-clean-a-backpack-sprayer?utm_source=pinterest&utm_campaign=sprayer-cleaning-sav,2025-04-30,cleaning benefits,https://www.beacleaner.com/how-to-clean-a-backpack-sprayer
Backpack Sprayer Nozzle Cleaning,https://res.cloudinary.com/ddxyyzkuq/image/upload/v1746044616/pin_1_16_orvc1r.webp,garden-ideas,,"Clogged nozzles are a thing of the past! This post focuses specifically on cleaning your backpack sprayer nozzles, ensuring a consistent and even spray pattern. Learn the best techniques and tools for a spotless nozzle. Click to learn more! #nozzlecleaning #sprayernozzle #gardeninghacks #cleaningtips,nozzle cleaning,sprayernozzle,gardening hacks",https://www.beacleaner.com/how-to-clean-a-backpack-sprayer?utm_source=pinterest&utm_campaign=backpack-sprayer-noz,2025-04-30,cleaning tips,https://www.beacleaner.com/how-to-clean-a-backpack-sprayer
Sprayer Cleaning: Prevent Corrosion,https://res.cloudinary.com/ddxyyzkuq/image/upload/v1746044621/pin_1_17_tjvysw.webp,garden-inspiration,,"Protect your backpack sprayer from corrosion with this simple cleaning routine. This post explains how to remove corrosive chemicals and prevent rust, extending the life of your sprayer. A little prevention goes a long way! Click to learn more. #corrosionprevention #sprayerprotection #gardeningmaintenance #rustremoval,corrosion prevention,sprayer protection,gardening maintenance",https://www.beacleaner.com/how-to-clean-a-backpack-sprayer?utm_source=pinterest&utm_campaign=sprayer-cleaning-pre,2025-04-30,rust removal,https://www.beacleaner.com/how-to-clean-a-backpack-sprayer
Backpack Sprayer: Cleaning Mistakes,https://res.cloudinary.com/ddxyyzkuq/image/upload/v1746044627/pin_1_18_pl4x5z.webp,garden-ideas,,"Avoid these common sprayer cleaning mistakes! This post highlights the errors that can damage your sprayer and reduce its effectiveness. Learn from our mistakes and keep your sprayer in top shape. Click to read now. #cleaningmistakes #sprayerproblems #gardeningadvice #avoidthese,cleaning mistakes,sprayer problems,gardening advice",https://www.beacleaner.com/how-to-clean-a-backpack-sprayer?utm_source=pinterest&utm_campaign=backpack-sprayer-cle,2025-04-30,avoid these,https://www.beacleaner.com/how-to-clean-a-backpack-sprayer
Sprayer Cleaning: Chemical Compatibility,https://res.cloudinary.com/ddxyyzkuq/image/upload/v1746044633/pin_1_19_iyjzdi.webp,garden-inspiration,,"Are your cleaning solutions compatible with your sprayer materials? This post explains how to choose the right cleaning agents to avoid damage and ensure optimal performance. Protect your investment! Click to learn more. #chemicalcompatibility #sprayercleaning #gardeningtips #materialsafety,chemical compatibility,sprayer cleaning,gardening tips",https://www.beacleaner.com/how-to-clean-a-backpack-sprayer?utm_source=pinterest&utm_campaign=sprayer-cleaning-che,2025-04-30,material safety,https://www.beacleaner.com/how-to-clean-a-backpack-sprayer
Sprayer Cleaning: Filter Maintenance,https://res.cloudinary.com/ddxyyzkuq/image/upload/v1746044639/pin_1_20_h9ytmt.webp,garden-inspiration,,"Don't forget the filter! This post details how to clean and maintain your backpack sprayer filter, preventing clogs and ensuring smooth operation. A clean filter is a happy filter (and a happy sprayer!). Click to learn more. #filtermaintenance #sprayercleaning #gardeningtips #clogprevention,filter maintenance,sprayer cleaning,gardening tips",https://www.beacleaner.com/how-to-clean-a-backpack-sprayer?utm_source=pinterest&utm_campaign=sprayer-cleaning-fil,2025-04-30,clog prevention,https://www.beacleaner.com/how-to-clean-a-backpack-sprayer
Backpack Sprayer: Cleaning Frequency,https://res.cloudinary.com/ddxyyzkuq/image/upload/v1746044645/pin_1_21_lxzidh.webp,garden-ideas,,"How often should you clean your backpack sprayer? This post provides a guide to cleaning frequency based on usage and the types of chemicals used. Keep your sprayer in top condition with our expert advice! Click to learn more. #cleaningfrequency #sprayerroutine #gardeningtips #maintenance,cleaning frequency,sprayer routine,gardening tips",https://www.beacleaner.com/how-to-clean-a-backpack-sprayer?utm_source=pinterest&utm_campaign=backpack-sprayer-cle,2025-04-30,maintenance,https://www.beacleaner.com/how-to-clean-a-backpack-sprayer
Sprayer Cleaning: Pump Lubrication,https://res.cloudinary.com/ddxyyzkuq/image/upload/v1746044651/pin_1_22_z2psjw.webp,garden-inspiration,,"Keep your sprayer pump working smoothly with proper lubrication! This post explains how to lubricate your backpack sprayer pump, preventing wear and tear and extending its lifespan. Click to learn more. #pumplubrication #sprayercare #gardeningmaintenance #toolcare,pump lubrication,sprayer care,gardening maintenance",https://www.beacleaner.com/how-to-clean-a-backpack-sprayer?utm_source=pinterest&utm_campaign=sprayer-cleaning-pum,2025-04-30,tool care,https://www.beacleaner.com/how-to-clean-a-backpack-sprayer
Sprayer Cleaning: Safety First!,https://res.cloudinary.com/ddxyyzkuq/image/upload/v1746044657/pin_1_23_y8fczh.webp,garden-inspiration,,"Cleaning your backpack sprayer safely is paramount. This post outlines essential safety precautions to protect yourself from harmful chemicals and ensure a safe cleaning process. Your health is our priority! Click to learn more. #safetyfirst #sprayercleaning #gardeningtips #chemicalsafety,safety first,sprayer cleaning,gardening tips",https://www.beacleaner.com/how-to-clean-a-backpack-sprayer?utm_source=pinterest&utm_campaign=sprayer-cleaning-saf,2025-04-30,chemical safety,https://www.beacleaner.com/how-to-clean-a-backpack-sprayer
Backpack Sprayer: Cleaning Tools,https://res.cloudinary.com/ddxyyzkuq/image/upload/v1746044663/pin_1_24_cjkvlu.webp,garden-ideas,,"What tools do you need to clean your backpack sprayer effectively? This post lists the essential cleaning tools and supplies, making the process easier and more efficient. Get prepared! Click to learn more. #cleaningtools #sprayercleaning #gardeninghacks #supplies,cleaning tools,sprayer cleaning,gardening hacks",https://www.beacleaner.com/how-to-clean-a-backpack-sprayer?utm_source=pinterest&utm_campaign=backpack-sprayer-cle,2025-04-30,supplies,https://www.beacleaner.com/how-to-clean-a-backpack-sprayer
Sprayer Cleaning: Long-Term Storage,https://res.cloudinary.com/ddxyyzkuq/image/upload/v1746044669/pin_1_25_jyxpi8.webp,garden-inspiration,,"Storing your sprayer for an extended period? This post provides a detailed guide to long-term storage, ensuring your sprayer is ready to go when you need it. Protect your investment! Click to learn more. #longtermstorage #sprayercare #gardeningtips #toolstorage,long-term storage,sprayer care,gardening tips",https://www.beacleaner.com/how-to-clean-a-backpack-sprayer?utm_source=pinterest&utm_campaign=sprayer-cleaning-lon,2025-04-30,tool storage,https://www.beacleaner.com/how-to-clean-a-backpack-sprayer
Title,https://res.cloudinary.com/ddxyyzkuq/image/upload/v1746044739/pin_2_1_e0ddiy.webp,please-provide-the-title-and-keywords-i-need-that-information-to-suggest-a-board-name-once,,Description,https://www.beacleaner.com/how-to-clean-a-baggallini-purse?utm_source=pinterest&utm_campaign=title,2025-04-30,Keywords,https://www.beacleaner.com/how-to-clean-a-baggallini-purse
Baggallini Cleaning Guide: Keep it Fresh!,https://res.cloudinary.com/ddxyyzkuq/image/upload/v1746044746/pin_2_2_qq8kcw.webp,bag-care-ideas,,"Is your beloved Baggallini purse looking a little dull? Don't replace it, revive it! This guide walks you through a simple, step-by-step process to clean your Baggallini bag, restoring its original beauty. Learn how to tackle stains, dirt",https://www.beacleaner.com/how-to-clean-a-baggallini-purse?utm_source=pinterest&utm_campaign=baggallini-cleaning-,2025-04-30,and everyday wear & tear with gentle methods.  Protect your investment and keep your favorite travel companion looking its best for years to come. Click to learn the secrets to a sparkling clean Baggallini! #Baggallini #PurseCleaning #BagCare #CleaningTips,https://www.beacleaner.com/how-to-clean-a-baggallini-purse
Baggallini Stain Removal Secrets,https://res.cloudinary.com/ddxyyzkuq/image/upload/v1746044752/pin_2_3_muknqp.webp,purse-care-ideas,,Spilled coffee? Lipstick mishap? Don't panic! This pin reveals the best stain removal techniques for your Baggallini purse. We cover everything from water-based stains to more stubborn marks,https://www.beacleaner.com/how-to-clean-a-baggallini-purse?utm_source=pinterest&utm_campaign=baggallini-stain-rem,2025-04-30,using safe and effective methods.  A clean bag boosts your confidence!  Learn how to quickly and easily restore your Baggallini to its pristine condition. Click for the full guide! #StainRemoval #BaggalliniPurse #CleaningHacks #PurseCare,https://www.beacleaner.com/how-to-clean-a-baggallini-purse
Deep Clean Your Baggallini - Easy Steps,https://res.cloudinary.com/ddxyyzkuq/image/upload/v1746044759/pin_2_4_mkymhy.webp,bag-care-ideas,,"Feeling overwhelmed by a dirty Baggallini? This pin breaks down the deep cleaning process into manageable steps. From prepping your bag to rinsing and drying, we've got you covered.  Imagine how good it will *feel* to have a fresh",https://www.beacleaner.com/how-to-clean-a-baggallini-purse?utm_source=pinterest&utm_campaign=deep-clean-your-bagg,2025-04-30,clean purse ready for your next adventure! Click to read the full tutorial. #DeepCleaning #Baggallini #PurseMaintenance #CleanBag,https://www.beacleaner.com/how-to-clean-a-baggallini-purse
Baggallini Interior Cleaning Tips,https://res.cloudinary.com/ddxyyzkuq/image/upload/v1746044766/pin_2_5_wrosbj.webp,bag-organization-ideas,,"Don't forget the inside! This pin focuses on cleaning the interior of your Baggallini purse, tackling crumbs, dust",https://www.beacleaner.com/how-to-clean-a-baggallini-purse?utm_source=pinterest&utm_campaign=baggallini-interior-,2025-04-30,and hidden messes. A clean interior is just as important as a clean exterior.  Feel organized and refreshed! Click to read the full guide. #InteriorCleaning #BaggalliniPurse #BagOrganization #PurseCleaning,https://www.beacleaner.com/how-to-clean-a-baggallini-purse
Baggallini Leather Trim Care,https://res.cloudinary.com/ddxyyzkuq/image/upload/v1746044772/pin_2_6_yf0fvj.webp,leather-care-ideas,,Does your Baggallini have leather trim? This pin offers specific care instructions for leather accents,https://www.beacleaner.com/how-to-clean-a-baggallini-purse?utm_source=pinterest&utm_campaign=baggallini-leather-t,2025-04-30,ensuring they stay supple and beautiful.  Protect your bag's details! Click to read the full guide. #LeatherCare #Baggallini #PurseDetails #CleaningLeather,https://www.beacleaner.com/how-to-clean-a-baggallini-purse
Baggallini Cleaning: What *Not* To Do,https://res.cloudinary.com/ddxyyzkuq/image/upload/v1746044778/pin_2_7_tmdcth.webp,bag-care-ideas,,Avoid these common cleaning mistakes! This pin highlights what *not* to do when cleaning your Baggallini purse,https://www.beacleaner.com/how-to-clean-a-baggallini-purse?utm_source=pinterest&utm_campaign=baggallini-cleaning-,2025-04-30,preventing damage and ensuring a successful clean.  Protect your investment! Click to read the full guide. #CleaningMistakes #Baggallini #PurseCare #AvoidThese,https://www.beacleaner.com/how-to-clean-a-baggallini-purse
Baggallini: Cleaning for Travel Bags,https://res.cloudinary.com/ddxyyzkuq/image/upload/v1746044785/pin_2_8_aj4pqc.webp,travel-hacks-ideas,,Keep your travel companion clean! This pin focuses on cleaning Baggallini travel bags,https://www.beacleaner.com/how-to-clean-a-baggallini-purse?utm_source=pinterest&utm_campaign=baggallini-cleaning-,2025-04-30,removing germs and odors after your adventures.  Travel with confidence knowing your bag is fresh and clean. Click to learn more. #TravelBag #Baggallini #PurseCleaning #TravelTips,https://www.beacleaner.com/how-to-clean-a-baggallini-purse
Baggallini Cleaning: Drying Methods,https://res.cloudinary.com/ddxyyzkuq/image/upload/v1746044791/pin_2_9_uecfsm.webp,bag-care-ideas,,Proper drying is crucial! This pin explains the best drying methods for your Baggallini purse,https://www.beacleaner.com/how-to-clean-a-baggallini-purse?utm_source=pinterest&utm_campaign=baggallini-cleaning-,2025-04-30,preventing mildew and maintaining its shape.  Ensure a thorough and safe drying process. Click to read the full guide. #PurseDrying #Baggallini #CleaningTips #DryingMethods,https://www.beacleaner.com/how-to-clean-a-baggallini-purse
Baggallini: Cleaning for Light Colors,https://res.cloudinary.com/ddxyyzkuq/image/upload/v1746044796/pin_2_10_zteptd.webp,travel-hacks-ideas,,Light-colored Baggallini bags require extra care! This pin offers specific cleaning tips for white or pastel bags,https://www.beacleaner.com/how-to-clean-a-baggallini-purse?utm_source=pinterest&utm_campaign=baggallini-cleaning-,2025-04-30,preventing discoloration and stains.  Keep your light bag looking bright and fresh. Click to learn more. #LightColorCleaning #Baggallini #PurseCare #WhiteBag,https://www.beacleaner.com/how-to-clean-a-baggallini-purse
Baggallini: Cleaning for Dark Colors,https://res.cloudinary.com/ddxyyzkuq/image/upload/v1746044801/pin_2_11_qcwuaa.webp,travel-hacks-ideas,,Dark-colored Baggallini bags can show dust easily! This pin offers specific cleaning tips for black or navy bags,https://www.beacleaner.com/how-to-clean-a-baggallini-purse?utm_source=pinterest&utm_campaign=baggallini-cleaning-,2025-04-30,preventing fading and maintaining their rich color.  Keep your dark bag looking sleek and stylish. Click to learn more. #DarkColorCleaning #Baggallini #PurseCare #BlackBag,https://www.beacleaner.com/how-to-clean-a-baggallini-purse
Baggallini: Cleaning Hardware & Zippers,https://res.cloudinary.com/ddxyyzkuq/image/upload/v1746044808/pin_2_12_atm0nb.webp,travel-hacks-ideas,,Don't forget the hardware! This pin focuses on cleaning the zippers and metal hardware on your Baggallini purse,https://www.beacleaner.com/how-to-clean-a-baggallini-purse?utm_source=pinterest&utm_campaign=baggallini-cleaning-,2025-04-30,keeping them functioning smoothly and looking shiny.  A little detail makes a big difference! Click to learn more. #HardwareCleaning #Baggallini #PurseDetails #ZipperCare,https://www.beacleaner.com/how-to-clean-a-baggallini-purse
Baggallini: Cleaning for Everyday Use,https://res.cloudinary.com/ddxyyzkuq/image/upload/v1746044814/pin_2_13_yecy9k.webp,travel-hacks-ideas,,Your everyday bag needs regular attention! This pin provides a cleaning routine for Baggallini purses used daily,https://www.beacleaner.com/how-to-clean-a-baggallini-purse?utm_source=pinterest&utm_campaign=baggallini-cleaning-,2025-04-30,keeping them fresh and hygienic.  Enjoy a clean and stylish bag every day. Click to learn more. #EverydayCleaning #Baggallini #PurseCare #DailyRoutine,https://www.beacleaner.com/how-to-clean-a-baggallini-purse
