Title,Media URL,Pinterest board,Thumbnail,Description,Link,Publish date,Keywords,Source URL
Title,https://res.cloudinary.com/ddxyyzkuq/image/upload/v1745871494/pin_1_1_zlgimy.webp,please-provide-the-title-and-keywords-i-need-that-information-to-suggest-a-board-name-once,,Description,https://lawntrend.com/cub-cadet-reverse-problems/?utm_source=pinterest&utm_campaign=title,2025-04-28,Keywords,https://lawntrend.com/cub-cadet-reverse-problems/
Cub Cadet Reverse Not Working? Fix It!,https://res.cloudinary.com/ddxyyzkuq/image/upload/v1745871500/pin_1_2_iq6gpx.webp,mower-repair-ideas,,"Is your Cub Cadet riding mower refusing to go in reverse? Don't let a broken reverse ruin your weekend! This guide dives deep into the common causes – from simple fixes like a stuck linkage to more complex issues like a faulty solenoid or transmission. We'll walk you through troubleshooting steps, potential repair costs",https://lawntrend.com/cub-cadet-reverse-problems/?utm_source=pinterest&utm_campaign=cub-cadet-reverse-no,2025-04-28,and when it's time to call a professional.  Get back to enjoying your lawn! Click to learn how to diagnose and fix your Cub Cadet's reverse problem and save money! #CubCadet #RidingMower #ReverseProblem #LawnMowerRepair,https://lawntrend.com/cub-cadet-reverse-problems/
Fix Cub Cadet Reverse: Easy Steps,https://res.cloudinary.com/ddxyyzkuq/image/upload/v1745871506/pin_1_3_dcfmxo.webp,lawn-care-ideas,,Don't let a reverse gear issue stop you! This pin highlights the easiest fixes for a Cub Cadet mower that won't go in reverse. We'll show you quick checks you can do yourself,https://lawntrend.com/cub-cadet-reverse-problems/?utm_source=pinterest&utm_campaign=fix-cub-cadet-revers,2025-04-28,saving you time and money.  Imagine effortlessly maneuvering around obstacles again! Click to learn how to get your Cub Cadet reversing smoothly. #CubCadetProblems #MowerMaintenance #ReverseSwitch #LawnCare,https://lawntrend.com/cub-cadet-reverse-problems/
Cub Cadet Reverse Won't Engage?,https://res.cloudinary.com/ddxyyzkuq/image/upload/v1745871512/pin_1_4_hroljv.webp,mower-repair-ideas,,"Is your Cub Cadet's reverse pedal feeling unresponsive?  This pin focuses on diagnosing why your reverse won't engage. We explore common culprits like the drive belt, linkage",https://lawntrend.com/cub-cadet-reverse-problems/?utm_source=pinterest&utm_campaign=cub-cadet-reverse-wo,2025-04-28,and safety switches.  Don't let a small issue become a big headache! Click to read our detailed guide and get your mower back in action. #CubCadet #RidingMowerRepair #ReverseIssue #MowerTroubleshooting,https://lawntrend.com/cub-cadet-reverse-problems/
Cub Cadet Reverse: Safety Switch Check,https://res.cloudinary.com/ddxyyzkuq/image/upload/v1745871517/pin_1_5_dchax7.webp,mower-repair-ideas,,Before you dig deep,https://lawntrend.com/cub-cadet-reverse-problems/?utm_source=pinterest&utm_campaign=cub-cadet-reverse-sa,2025-04-28,check the safety switches! This pin emphasizes the importance of safety switch functionality in relation to the reverse gear.  A simple adjustment could be all you need! Click to learn how to inspect and test your Cub Cadet's safety switches. #CubCadetSafety #MowerSafety #ReverseSwitch #LawnMowerTips,https://lawntrend.com/cub-cadet-reverse-problems/
Cub Cadet Reverse: Cost of Repair?,https://res.cloudinary.com/ddxyyzkuq/image/upload/v1745871522/pin_1_6_g3vjuy.webp,mower-repair-ideas,,Worried about the cost of fixing your Cub Cadet's reverse? This pin breaks down the potential repair costs for different issues,https://lawntrend.com/cub-cadet-reverse-problems/?utm_source=pinterest&utm_campaign=cub-cadet-reverse-co,2025-04-28,from simple fixes to transmission replacement.  Plan your budget and make informed decisions! Click to read the full article. #CubCadetRepairCost #MowerRepair #ReverseGear #LawnMowerBudget,https://lawntrend.com/cub-cadet-reverse-problems/
Cub Cadet Reverse: Detailed Diagram,https://res.cloudinary.com/ddxyyzkuq/image/upload/v1745871546/pin_1_7_tkwmpm.webp,mower-repair-ideas,,Need a visual aid? This pin features a detailed diagram of the Cub Cadet reverse mechanism,https://lawntrend.com/cub-cadet-reverse-problems/?utm_source=pinterest&utm_campaign=cub-cadet-reverse-de,2025-04-28,helping you understand the components and their functions.  See how it all works! Click to view the full diagram in our article. #CubCadetDiagram #MowerParts #ReverseGear #LawnMowerSchematic,https://lawntrend.com/cub-cadet-reverse-problems/
Cub Cadet Reverse: Resources & Support,https://res.cloudinary.com/ddxyyzkuq/image/upload/v1745871551/pin_1_8_ekopke.webp,mower-repair-ideas,,Need further assistance? This pin provides links to helpful resources,https://lawntrend.com/cub-cadet-reverse-problems/?utm_source=pinterest&utm_campaign=cub-cadet-reverse-re,2025-04-28,including Cub Cadet's support website and online forums.  Get the help you need! Click to access the resources. #CubCadetSupport #MowerHelp #ReverseProblem #LawnMowerResources,https://lawntrend.com/cub-cadet-reverse-problems/
Title,https://res.cloudinary.com/ddxyyzkuq/image/upload/v1745871605/pin_2_1_uba61c.webp,please-provide-the-title-and-keywords-i-need-that-information-to-suggest-a-board-name-once,,Description,https://lawntrend.com/toro-lawn-mower-wont-stay-running/?utm_source=pinterest&utm_campaign=title,2025-04-28,Keywords,https://lawntrend.com/toro-lawn-mower-wont-stay-running/
Toro Mower Dying? Quick Fixes!,https://res.cloudinary.com/dbcpfy04c/image/upload/v1618237451/placeholder.jpg,home-inspiration,,"Is your Toro lawn mower constantly stalling? Don't sweat it! This guide dives into the most common reasons why your Toro won't stay running – from simple fixes like a dirty air filter to more complex issues like carburetor problems. We'll walk you through troubleshooting steps, saving you time and money on expensive repairs.  Imagine a perfectly manicured lawn without the frustration! Click to learn how to get your Toro back in action and enjoy your weekends.  Don't let a faulty mower ruin your summer! #Torolawnmower #lawnmowerrepair #diyrepair #lawncare,Toro,lawnmower,repair",https://lawntrend.com/toro-lawn-mower-wont-stay-running/?utm_source=pinterest&utm_campaign=toro-mower-dying-qui,2025-04-28,troubleshooting,https://lawntrend.com/toro-lawn-mower-wont-stay-running/
Fix a Stalling Toro Mower NOW!,https://res.cloudinary.com/ddxyyzkuq/image/upload/v1745871613/pin_2_3_hdvxvg.webp,lawn-mower-ideas,,"Frustrated with a Toro mower that keeps shutting off? You're not alone! This post breaks down the most frequent culprits behind a Toro that won't run consistently. We cover everything from fuel issues and spark plugs to safety switches and more.  We'll help you diagnose the problem quickly and provide clear, step-by-step instructions for a successful repair.  Get back to enjoying a beautiful lawn – click to learn more!  Don't waste another sunny day! #Toromower #lawnmowerproblems #fixit #homeimprovement,Toro mower,stalling,repair",https://lawntrend.com/toro-lawn-mower-wont-stay-running/?utm_source=pinterest&utm_campaign=fix-a-stalling-toro-,2025-04-28,fuel,https://lawntrend.com/toro-lawn-mower-wont-stay-running/
Toro Mower Won't Start? Help!,https://res.cloudinary.com/ddxyyzkuq/image/upload/v1745871622/pin_2_4_jseejd.webp,lawn-mower-ideas,,"Don't panic if your Toro lawn mower refuses to stay running! This comprehensive guide is your lifeline. We explore common issues like clogged fuel lines, a faulty carburetor, and a weak spark.  We'll show you how to identify the problem and provide easy-to-follow solutions.  A healthy lawn is within reach! Click to read the full article and get your Toro mowing again.  Save money and the hassle of a repair shop! #Torolawncare #lawnmowerfix #diy #gardening,Toro,lawnmower,starting",https://lawntrend.com/toro-lawn-mower-wont-stay-running/?utm_source=pinterest&utm_campaign=toro-mower-wont-star,2025-04-28,carburetor,https://lawntrend.com/toro-lawn-mower-wont-stay-running/
Easy Toro Mower Troubleshooting,https://res.cloudinary.com/ddxyyzkuq/image/upload/v1745871629/pin_2_5_kswzg8.webp,lawn-care-ideas,,"Is your Toro mower giving you grief? This post simplifies troubleshooting, even if you're not a mechanic! We cover the most common reasons a Toro won't stay running, with clear explanations and helpful images.  Learn how to check your spark plug, air filter, and fuel system.  Enjoy a stress-free lawn care experience! Click to read the full guide and reclaim your weekends.  Don't let mower problems get you down! #Tororepair #lawncaretips #mowerhelp #homeowner,Troubleshooting,Toro,lawnmower",https://lawntrend.com/toro-lawn-mower-wont-stay-running/?utm_source=pinterest&utm_campaign=easy-toro-mower-trou,2025-04-28,easyfix,https://lawntrend.com/toro-lawn-mower-wont-stay-running/
Toro Mower Dying Under Load?,https://res.cloudinary.com/ddxyyzkuq/image/upload/v1745871636/pin_2_6_y9fkl8.webp,lawn-mower-ideas,,"Experiencing a Toro mower that stalls when cutting thick grass? This is a common issue! We pinpoint the causes – often related to fuel delivery or carburetor settings.  This guide provides detailed instructions on how to adjust your Toro for optimal performance.  Imagine effortlessly mowing your lawn, even the toughest areas! Click to learn how to fix this frustrating problem.  Get a professional cut without the professional price! #Torolawnmower #lawnmowerrepair #carburetor #grasscutting,Load,Toro,mower",https://lawntrend.com/toro-lawn-mower-wont-stay-running/?utm_source=pinterest&utm_campaign=toro-mower-dying-und,2025-04-28,carburetor,https://lawntrend.com/toro-lawn-mower-wont-stay-running/
Save Money: Fix Your Toro!,https://res.cloudinary.com/ddxyyzkuq/image/upload/v1745871642/pin_2_7_dnkvnr.webp,diy-repairs-ideas,,"Don't throw away a perfectly good Toro mower! This post shows you how to diagnose and fix common problems that cause it to stop running, saving you hundreds on repair bills.  We cover everything from simple maintenance to more complex repairs.  Take control of your lawn care budget! Click to read the full article and learn how to keep your Toro running smoothly.  Empower yourself with DIY skills! #Torolawncare #diyrepair #lawnmowerservice #moneysavingtips,Repair,Toro,mower",https://lawntrend.com/toro-lawn-mower-wont-stay-running/?utm_source=pinterest&utm_campaign=save-money-fix-your-,2025-04-28,DIY,https://lawntrend.com/toro-lawn-mower-wont-stay-running/
Toro Mower Fuel Problems Solved!,https://res.cloudinary.com/ddxyyzkuq/image/upload/v1745871648/pin_2_8_zsugt0.webp,lawn-mower-ideas,,"Is your Toro mower struggling with fuel? A clogged fuel filter or stale gas could be the culprit. This guide provides a step-by-step solution to diagnose and fix fuel-related issues that cause your Toro to stall.  Breathe new life into your mower! Click to read the full article and enjoy a reliable, fuel-efficient machine.  Don't let bad fuel ruin your day! #Torofuel #lawnmowerfuel #fuelfilter #lawncare,Fuel,Toro,mower",https://lawntrend.com/toro-lawn-mower-wont-stay-running/?utm_source=pinterest&utm_campaign=toro-mower-fuel-prob,2025-04-28,filter,https://lawntrend.com/toro-lawn-mower-wont-stay-running/
Toro Spark Plug Guide: Stay Running!,https://res.cloudinary.com/ddxyyzkuq/image/upload/v1745871654/pin_2_9_cgqmmb.webp,small-engine-ideas,,"A faulty spark plug can cause your Toro mower to die. This post explains how to check, clean, and replace your spark plug, ensuring a strong ignition and a smoothly running engine.  Keep your Toro firing on all cylinders! Click to read the full article and learn this essential maintenance task.  A simple fix for a big difference! #Torosparkplug #lawnmowersparkplug #ignition #lawncaremaintenance,Sparkplug,Toro,mower",https://lawntrend.com/toro-lawn-mower-wont-stay-running/?utm_source=pinterest&utm_campaign=toro-spark-plug-guid,2025-04-28,ignition,https://lawntrend.com/toro-lawn-mower-wont-stay-running/
Toro Air Filter: Easy Maintenance!,https://res.cloudinary.com/dbcpfy04c/image/upload/v1618237451/placeholder.jpg,home-inspiration,,"A dirty air filter restricts airflow and can cause your Toro mower to stall. This guide shows you how to easily clean or replace your air filter, improving engine performance and extending the life of your mower.  Breathe easy knowing your Toro is running efficiently! Click to read the full article and learn this simple maintenance task.  Keep your engine happy! #Toroairfilter #lawnmowerairfilter #airfilter #lawncare,Airfilter,Toro,mower",https://lawntrend.com/toro-lawn-mower-wont-stay-running/?utm_source=pinterest&utm_campaign=toro-air-filter-easy,2025-04-28,maintenance,https://lawntrend.com/toro-lawn-mower-wont-stay-running/
Toro Mower Safety Switch Issues?,https://res.cloudinary.com/dbcpfy04c/image/upload/v1618237451/placeholder.jpg,home-inspiration,,"Is your Toro mower shutting off unexpectedly? A faulty safety switch could be the problem. This post explains how to identify and troubleshoot safety switch issues, ensuring safe and reliable operation.  Prioritize safety and get your Toro running smoothly! Click to read the full article and learn how to fix this common issue.  Mow with confidence! #Torosafetyswitch #lawnmowersafety #safetyswitch #lawncare,Safetyswitch,Toro,mower",https://lawntrend.com/toro-lawn-mower-wont-stay-running/?utm_source=pinterest&utm_campaign=toro-mower-safety-sw,2025-04-28,safety,https://lawntrend.com/toro-lawn-mower-wont-stay-running/
Toro Carburetor Cleaning Guide!,https://res.cloudinary.com/dbcpfy04c/image/upload/v1618237451/placeholder.jpg,home-inspiration,,"A dirty carburetor can cause your Toro mower to stall or run poorly. This post provides a detailed guide on how to clean your carburetor, restoring optimal performance.  Unlock your Toro's full potential! Click to read the full article and learn this essential repair skill.  Don't settle for a sluggish mower! #Torocarburetor #lawnmowercarburetor #carburetorclean #lawncare,Carburetor,Toro,mower",https://lawntrend.com/toro-lawn-mower-wont-stay-running/?utm_source=pinterest&utm_campaign=toro-carburetor-clea,2025-04-28,cleaning,https://lawntrend.com/toro-lawn-mower-wont-stay-running/
Diagnose Your Toro Mower Quickly!,https://res.cloudinary.com/dbcpfy04c/image/upload/v1618237451/placeholder.jpg,home-inspiration,,"Spending hours trying to figure out why your Toro won't stay running? This post offers a quick and easy diagnostic guide, helping you pinpoint the problem and get your mower fixed fast.  Stop guessing and start mowing! Click to read the full article and get back to enjoying your lawn.  Time is precious – fix it now! #Torodiagnostics #lawnmowerdiagnostics #quickfix #lawncare,Diagnostics,Toro,mower",https://lawntrend.com/toro-lawn-mower-wont-stay-running/?utm_source=pinterest&utm_campaign=diagnose-your-toro-m,2025-04-28,quickfix,https://lawntrend.com/toro-lawn-mower-wont-stay-running/
Toro Mower Stalling in Reverse?,https://res.cloudinary.com/dbcpfy04c/image/upload/v1618237451/placeholder.jpg,home-inspiration,,"Is your Toro mower stalling only when in reverse? This is often a specific issue with the reverse safety switch. This post details how to diagnose and fix this problem.  Get full functionality back in your Toro! Click to read the full article and learn how to resolve this frustrating issue.  Don't limit your mowing options! #Tororeverse #lawnmowerreverse #reverseswitch #lawncare,Reverse,Toro,mower",https://lawntrend.com/toro-lawn-mower-wont-stay-running/?utm_source=pinterest&utm_campaign=toro-mower-stalling-,2025-04-28,switch,https://lawntrend.com/toro-lawn-mower-wont-stay-running/
Toro Mower Running Rough? Fix It!,https://res.cloudinary.com/dbcpfy04c/image/upload/v1618237451/placeholder.jpg,home-inspiration,,"Is your Toro mower running rough and sputtering? This post covers common causes like dirty fuel, a clogged air filter, or a faulty spark plug.  Smooth out your Toro's performance! Click to read the full article and learn how to restore a clean, powerful engine.  Enjoy a quiet and efficient mow! #Tororunningrough #lawnmowerrough #engineperformance #lawncare,Roughrunning,Toro,mower",https://lawntrend.com/toro-lawn-mower-wont-stay-running/?utm_source=pinterest&utm_campaign=toro-mower-running-r,2025-04-28,performance,https://lawntrend.com/toro-lawn-mower-wont-stay-running/
Toro Mower: Preventative Maintenance!,https://res.cloudinary.com/dbcpfy04c/image/upload/v1618237451/placeholder.jpg,home-inspiration,,"Don't wait for your Toro mower to break down! This post outlines essential preventative maintenance tasks that will keep your mower running smoothly for years to come.  Protect your investment and enjoy a beautiful lawn! Click to read the full article and learn how to extend the life of your Toro.  A little maintenance goes a long way! #Toropmaintenance #lawnmowermaintenance #preventativecare #lawncare,Maintenance,Toro,mower",https://lawntrend.com/toro-lawn-mower-wont-stay-running/?utm_source=pinterest&utm_campaign=toro-mower-preventat,2025-04-28,preventative,https://lawntrend.com/toro-lawn-mower-wont-stay-running/
Toro Mower: Fuel Line Repair!,https://res.cloudinary.com/ddxyyzkuq/image/upload/v1745871675/pin_2_17_d0jzqm.webp,lawn-repair-ideas,,"A cracked or clogged fuel line can cause your Toro mower to stall. This post provides a step-by-step guide on how to inspect, repair, or replace your fuel line.  Keep the fuel flowing and your Toro mowing! Click to read the full article and learn this essential repair skill.  Don't let a fuel line stop you! #Torofueline #lawnmowerfueline #fuellinerepair #lawncare,Fuel line,Toro,mower",https://lawntrend.com/toro-lawn-mower-wont-stay-running/?utm_source=pinterest&utm_campaign=toro-mower-fuel-line,2025-04-28,repair,https://lawntrend.com/toro-lawn-mower-wont-stay-running/
Toro Mower: Blade Engagement Issues?,https://res.cloudinary.com/ddxyyzkuq/image/upload/v1745871681/pin_2_18_sxv8yh.webp,lawn-mower-ideas,,"Is your Toro mower blade not engaging properly? This can cause stalling or poor cutting performance. This post details how to troubleshoot and fix blade engagement problems.  Get a clean, even cut every time! Click to read the full article and learn how to restore your Toro's cutting power.  Don't struggle with uneven grass! #Toroblade #lawnmowerblade #bladeengagement #lawncare,Blade,Toro,mower",https://lawntrend.com/toro-lawn-mower-wont-stay-running/?utm_source=pinterest&utm_campaign=toro-mower-blade-eng,2025-04-28,engagement,https://lawntrend.com/toro-lawn-mower-wont-stay-running/
Toro Mower: Governor Problems?,https://res.cloudinary.com/ddxyyzkuq/image/upload/v1745871688/pin_2_19_ferreb.webp,lawn-mower-ideas,,"A malfunctioning governor can cause your Toro mower to surge or stall. This post explains how the governor works and how to diagnose and fix common problems.  Maintain consistent engine speed! Click to read the full article and learn how to restore your Toro's governor function.  Enjoy a smooth and controlled mow! #Torogovernor #lawnmowergovernor #governorswitch #lawncare,Governor,Toro,mower",https://lawntrend.com/toro-lawn-mower-wont-stay-running/?utm_source=pinterest&utm_campaign=toro-mower-governor-,2025-04-28,surge,https://lawntrend.com/toro-lawn-mower-wont-stay-running/
Toro Mower: Exhaust Issues?,https://res.cloudinary.com/ddxyyzkuq/image/upload/v1745871695/pin_2_20_phvjil.webp,lawn-mower-ideas,,"A blocked exhaust can cause your Toro mower to stall or run poorly. This post explains how to inspect and clear your Toro's exhaust system.  Let your engine breathe! Click to read the full article and learn how to improve your Toro's performance.  Don't let exhaust fumes slow you down! #Toroexhaust #lawnmowerexhaust #exhaustsystem #lawncare,Exhaust,Toro,mower",https://lawntrend.com/toro-lawn-mower-wont-stay-running/?utm_source=pinterest&utm_campaign=toro-mower-exhaust-i,2025-04-28,blockage,https://lawntrend.com/toro-lawn-mower-wont-stay-running/
Toro Mower: Oil Level Check!,https://res.cloudinary.com/ddxyyzkuq/image/upload/v1745871702/pin_2_21_jocacz.webp,lawn-care-ideas,,"Low oil can cause serious damage to your Toro mower engine. This post reminds you how to check your oil level and top it off, ensuring long-lasting performance.  Protect your engine! Click to read the full article and learn this simple but crucial maintenance task.  Keep your Toro running smoothly! #Torooil #lawnmoweroil #oilcheck #lawncare,Oil,Toro,mower",https://lawntrend.com/toro-lawn-mower-wont-stay-running/?utm_source=pinterest&utm_campaign=toro-mower-oil-level,2025-04-28,level,https://lawntrend.com/toro-lawn-mower-wont-stay-running/
Toro Mower: Winter Storage Tips!,https://res.cloudinary.com/ddxyyzkuq/image/upload/v1745871708/pin_2_22_saspxs.webp,lawn-care-ideas,,"Preparing your Toro mower for winter storage? This post provides a comprehensive guide to winterizing your mower, ensuring it's ready to go when spring arrives.  Protect your investment during the off-season! Click to read the full article and learn how to store your Toro properly.  Start next season strong! #Torowinterizing #lawnmowerwinter #winterstorage #lawncare,Winterizing,Toro,mower",https://lawntrend.com/toro-lawn-mower-wont-stay-running/?utm_source=pinterest&utm_campaign=toro-mower-winter-st,2025-04-28,storage,https://lawntrend.com/toro-lawn-mower-wont-stay-running/
Toro Mower: Common Mistakes!,https://res.cloudinary.com/ddxyyzkuq/image/upload/v1745871714/pin_2_23_jljmhz.webp,lawn-care-ideas,,"Avoid these common mistakes that can cause your Toro mower to stall or run poorly. This post highlights pitfalls to avoid and best practices for maintaining your mower.  Learn from others' mistakes! Click to read the full article and keep your Toro running its best.  Mow smarter, not harder! #Toromistakes #lawnmowermistakes #lawncaretips #lawncare,Mistakes,Toro,mower",https://lawntrend.com/toro-lawn-mower-wont-stay-running/?utm_source=pinterest&utm_campaign=toro-mower-common-mi,2025-04-28,tips,https://lawntrend.com/toro-lawn-mower-wont-stay-running/
Toro Mower: When to Call a Pro!,https://res.cloudinary.com/ddxyyzkuq/image/upload/v1745871721/pin_2_24_hfxzbc.webp,lawn-care-ideas,,"Sometimes, a Toro mower repair is best left to the professionals. This post helps you determine when it's time to call a qualified mechanic.  Don't risk further damage! Click to read the full article and learn when to seek expert help.  Get the job done right! #Toroprorepair #lawnmowerrepair #mechanic #lawncare,Professional,Toro,mower",https://lawntrend.com/toro-lawn-mower-wont-stay-running/?utm_source=pinterest&utm_campaign=toro-mower-when-to-c,2025-04-28,repair,https://lawntrend.com/toro-lawn-mower-wont-stay-running/
Toro Mower: Parts Guide!,https://res.cloudinary.com/ddxyyzkuq/image/upload/v1745871727/pin_2_25_bgkcku.webp,lawn-mower-ideas,,"Need to replace a part on your Toro mower? This post provides a guide to finding the right parts for your specific model.  Get the right parts, the first time! Click to read the full article and learn where to source Toro mower parts.  Keep your Toro running like new! #Toroparts #lawnmowerparts #replacementparts #lawncare,Parts,Toro,mower",https://lawntrend.com/toro-lawn-mower-wont-stay-running/?utm_source=pinterest&utm_campaign=toro-mower-parts-gui,2025-04-28,replacement,https://lawntrend.com/toro-lawn-mower-wont-stay-running/
Title,https://res.cloudinary.com/ddxyyzkuq/image/upload/v1745871770/pin_3_1_gqcf2d.webp,please-provide-the-title-and-keywords-i-need-that-information-to-suggest-a-board-name-once,,Description,https://lawntrend.com/kohler-command-pro-25-blowing-smoke-at-start-up/?utm_source=pinterest&utm_campaign=title,2025-04-28,Keywords,https://lawntrend.com/kohler-command-pro-25-blowing-smoke-at-start-up/
Kohler Command Pro: Smoke Fix!,https://res.cloudinary.com/ddxyyzkuq/image/upload/v1745871777/pin_3_2_wwiv4h.webp,small-engine-ideas,,"Is your Kohler Command Pro engine puffing smoke at startup? Don't panic! This guide dives deep into the common causes – from oil-filled cylinders to worn piston rings – and provides practical troubleshooting steps you can take yourself. Save money on expensive repairs and get back to enjoying your lawn! Learn how to diagnose the issue, simple fixes",https://lawntrend.com/kohler-command-pro-25-blowing-smoke-at-start-up/?utm_source=pinterest&utm_campaign=kohler-command-pro-s,2025-04-28,and when it's time to call a pro. Don't let a little smoke ruin your day! Click to learn more and breathe easy. #KohlerCommandPro #SmallEngineRepair #LawnMowerFix #EngineTroubleshooting,https://lawntrend.com/kohler-command-pro-25-blowing-smoke-at-start-up/
Kohler Engine Smoking? Diagnose It!,https://res.cloudinary.com/ddxyyzkuq/image/upload/v1745871783/pin_3_3_nc5lqi.webp,lawn-repair-ideas,,"Worried about smoke coming from your Kohler Command Pro? It's a common issue, but ignoring it can lead to serious engine damage. This post breaks down the reasons why your engine might be smoking",https://lawntrend.com/kohler-command-pro-25-blowing-smoke-at-start-up/?utm_source=pinterest&utm_campaign=kohler-engine-smokin,2025-04-28,including valve seal problems and carburetor issues. We'll help you understand the severity and guide you through the repair process. Protect your investment and keep your lawn equipment running smoothly! Read now for a detailed fix. #KohlerEngine #SmokingEngine #DIYRepair #LawnCare,https://lawntrend.com/kohler-command-pro-25-blowing-smoke-at-start-up/
