Title,Media URL,Pinterest board,Thumbnail,Description,Link,Publish date,Keywords,Source URL
Title,https://res.cloudinary.com/ddxyyzkuq/image/upload/v1745867620/pin_1_1_eq2dwm.webp,please-provide-the-title-and-keywords-i-need-that-information-to-suggest-a-board-name-once,,Description,https://lawntrend.com/husqvarna-self-propelled-not-working-2/?utm_source=pinterest&utm_campaign=title,2025-04-28,Keywords,https://lawntrend.com/husqvarna-self-propelled-not-working-2/
Husqvarna Self-Propelled: Fix It!,https://res.cloudinary.com/ddxyyzkuq/image/upload/v1745867626/pin_1_2_lnzcay.webp,lawn-repair-ideas,,"Is your Husqvarna self-propelled mower refusing to move? Don't sweat it! This guide walks you through common issues like drive belt problems, wheel lock issues",https://lawntrend.com/husqvarna-self-propelled-not-working-2/?utm_source=pinterest&utm_campaign=husqvarna-self-prope,2025-04-28,and more. Save money on repairs and get back to enjoying your perfectly manicured lawn. We'll help you diagnose the problem quickly and offer easy-to-follow solutions.  Frustrated with a broken mower? We've got your back! Click to learn how to get your Husqvarna moving again! #Husqvarna #SelfPropelledMower #LawnMowerRepair #DIYRepair,https://lawntrend.com/husqvarna-self-propelled-not-working-2/
Husqvarna Mower Not Moving? 5 Fixes,https://res.cloudinary.com/ddxyyzkuq/image/upload/v1745867633/pin_1_3_vmmsxa.webp,lawn-care-ideas,,Don't let a stalled Husqvarna ruin your weekend! This pin highlights 5 quick fixes for a self-propelled mower that won't drive. From checking the blade brake to inspecting the transmission,https://lawntrend.com/husqvarna-self-propelled-not-working-2/?utm_source=pinterest&utm_campaign=husqvarna-mower-not-,2025-04-28,we cover the essentials.  Imagine the satisfaction of fixing it yourself and avoiding costly service calls.  Get your lawn looking its best with a functioning mower! Click to read the full guide and reclaim your free time. #HusqvarnaMower #MowerRepair #SelfPropelled #LawnCare,https://lawntrend.com/husqvarna-self-propelled-not-working-2/
Husqvarna Self-Propelled: Easy Checks,https://res.cloudinary.com/ddxyyzkuq/image/upload/v1745867638/pin_1_4_axfcdn.webp,lawn-repair-ideas,,"Before you call a repair shop, try these simple checks! This pin highlights quick diagnostic steps for a Husqvarna mower that won't self-propel.  Check the cable, the handle",https://lawntrend.com/husqvarna-self-propelled-not-working-2/?utm_source=pinterest&utm_campaign=husqvarna-self-prope,2025-04-28,and the drive system.  You might be surprised how easy it is to fix!  Don't give up – a little troubleshooting can go a long way. Click to learn more! #HusqvarnaMower #Troubleshooting #LawnCareTips #DIY,https://lawntrend.com/husqvarna-self-propelled-not-working-2/
Husqvarna Mower: Common Mistakes,https://res.cloudinary.com/ddxyyzkuq/image/upload/v1745867644/pin_1_5_sdhcjt.webp,lawn-care-ideas,,Avoid these common mistakes when repairing your Husqvarna self-propelled mower! This pin outlines pitfalls to avoid,https://lawntrend.com/husqvarna-self-propelled-not-working-2/?utm_source=pinterest&utm_campaign=husqvarna-mower-comm,2025-04-28,ensuring a successful repair.  Learn from our experience and save yourself time and frustration. Click to read the full guide! #MowerRepairMistakes #Husqvarna #DIYTips #LawnCare,https://lawntrend.com/husqvarna-self-propelled-not-working-2/
Husqvarna Self-Propelled: Safety First!,https://res.cloudinary.com/ddxyyzkuq/image/upload/v1745867651/pin_1_6_zynufv.webp,lawn-repair-ideas,,"Safety is paramount! This pin emphasizes safety precautions when working on your Husqvarna mower.  Disconnect the spark plug, wear gloves",https://lawntrend.com/husqvarna-self-propelled-not-working-2/?utm_source=pinterest&utm_campaign=husqvarna-self-prope,2025-04-28,and follow all safety guidelines.  Protect yourself and avoid accidents. Click for important safety tips! #MowerSafety #Husqvarna #DIYRepair #LawnCareSafety,https://lawntrend.com/husqvarna-self-propelled-not-working-2/
Husqvarna Mower: Parts You'll Need,https://res.cloudinary.com/ddxyyzkuq/image/upload/v1745867656/pin_1_7_kqrjhh.webp,lawn-care-ideas,,Planning a repair? This pin lists essential parts you might need for common Husqvarna self-propelled mower fixes.  From drive belts to cables,https://lawntrend.com/husqvarna-self-propelled-not-working-2/?utm_source=pinterest&utm_campaign=husqvarna-mower-part,2025-04-28,we've got you covered.  Be prepared and save time on your repair. Click to see the list! #HusqvarnaParts #MowerRepair #DIY #LawnMower,https://lawntrend.com/husqvarna-self-propelled-not-working-2/
Husqvarna Mower: Cleaning Tips,https://res.cloudinary.com/ddxyyzkuq/image/upload/v1745867662/pin_1_8_obq5c5.webp,lawn-care-ideas,,A dirty mower can lead to problems. This pin provides cleaning tips for your Husqvarna self-propelled mower.  Remove debris and keep the mower running smoothly. Click for a cleaner,https://lawntrend.com/husqvarna-self-propelled-not-working-2/?utm_source=pinterest&utm_campaign=husqvarna-mower-clea,2025-04-28,better-performing mower! #MowerCleaning #Husqvarna #LawnCare #Maintenance,https://lawntrend.com/husqvarna-self-propelled-not-working-2/
Title,https://res.cloudinary.com/ddxyyzkuq/image/upload/v1745867706/pin_2_1_dol8lf.webp,please-provide-the-title-and-keywords-i-need-that-information-to-suggest-a-board-name-once,,Description,https://lawntrend.com/lawn-mower-not-cutting-low-enough/?utm_source=pinterest&utm_campaign=title,2025-04-28,Keywords,https://lawntrend.com/lawn-mower-not-cutting-low-enough/
Lawn Mower Too High? Fix It!,https://res.cloudinary.com/ddxyyzkuq/image/upload/v1745867713/pin_2_2_nhu1uk.webp,lawn-repair-ideas,,"Is your lawn looking shaggy despite mowing? Don't settle for a less-than-perfect cut! This guide dives into why your lawn mower isn't cutting low enough, from simple height adjustments to blade sharpening and deck leveling. We'll troubleshoot common issues and get your grass looking pristine.  Frustrated with uneven results?  Learn how to achieve that golf-course quality lawn you've always dreamed of! Click to read now and reclaim your weekend! #lawncare #lawnmower #lawnmaintenance #grasscutting,lawn mower,cutting height,blade sharpening",https://lawntrend.com/lawn-mower-not-cutting-low-enough/?utm_source=pinterest&utm_campaign=lawn-mower-too-high-,2025-04-28,lawn repair,https://lawntrend.com/lawn-mower-not-cutting-low-enough/
Fix Low Lawn Cuts: Easy Guide,https://res.cloudinary.com/ddxyyzkuq/image/upload/v1745867719/pin_2_3_fhijej.webp,lawn-care-ideas,,"Dreaming of a beautifully manicured lawn? A mower that won't cut low enough can ruin everything! This post reveals the secrets to getting a consistently low cut, covering everything from adjusting the cutting height to checking for debris buildup.  Don't let a frustrating mower steal your summer joy!  We'll help you diagnose the problem and get back to enjoying a gorgeous yard. Read now for a step-by-step solution! #lawnmowing #lawnproblems #gardeningtips #homeimprovement,lawn care,mower height,deck leveling",https://lawntrend.com/lawn-mower-not-cutting-low-enough/?utm_source=pinterest&utm_campaign=fix-low-lawn-cuts-ea,2025-04-28,grass length,https://lawntrend.com/lawn-mower-not-cutting-low-enough/
Mower Not Cutting Low? 7 Reasons,https://res.cloudinary.com/ddxyyzkuq/image/upload/v1745867726/pin_2_4_tlzlnr.webp,lawn-care-ideas,,"Stop staring at uneven grass! Discover the 7 most common reasons why your lawn mower isn't cutting low enough. From dull blades to a clogged deck, we break down each issue with clear explanations and easy-to-follow fixes.  Imagine the satisfaction of a perfectly striped lawn!  Don't waste another minute – get your mower working like new. Click to learn more! #lawncare101 #mowerrepair #diy #yardwork,mower issues,low cut,blade dullness",https://lawntrend.com/lawn-mower-not-cutting-low-enough/?utm_source=pinterest&utm_campaign=mower-not-cutting-lo,2025-04-28,deck cleaning,https://lawntrend.com/lawn-mower-not-cutting-low-enough/
Sharpen Blades for a Lower Cut,https://res.cloudinary.com/ddxyyzkuq/image/upload/v1745867734/pin_2_5_slupq6.webp,lawn-care-ideas,,"Dull blades = a bad cut. Learn how sharpening your lawn mower blades can dramatically improve your cutting height and overall lawn health. This guide provides a simple, step-by-step tutorial (or when to call a pro!).  A sharp blade is a happy blade (and a happy lawn!).  Invest a little time and effort for a HUGE impact. Read now! #bladesharpening #lawnmowertips #gardening #yardmaintenance,blade sharpening,mower maintenance,cutting quality",https://lawntrend.com/lawn-mower-not-cutting-low-enough/?utm_source=pinterest&utm_campaign=sharpen-blades-for-a,2025-04-28,lawn health,https://lawntrend.com/lawn-mower-not-cutting-low-enough/
Level Your Deck for Even Cuts,https://res.cloudinary.com/ddxyyzkuq/image/upload/v1745867742/pin_2_6_z9ohze.webp,lawn-care-ideas,,"Is your lawn mower cutting unevenly? A leveled deck is crucial for a consistent cut. This post explains how to level your mower deck for a professional-looking lawn.  Say goodbye to scalped spots and hello to a lush, uniform yard!  Don't let an unleveled deck ruin your hard work. Click to learn how! #mowerdeck #lawncaretips #evenlawn #yardgoals,mower deck,leveling,uneven cut",https://lawntrend.com/lawn-mower-not-cutting-low-enough/?utm_source=pinterest&utm_campaign=level-your-deck-for-,2025-04-28,lawn stripes,https://lawntrend.com/lawn-mower-not-cutting-low-enough/
Adjusting Mower Height: A Guide,https://res.cloudinary.com/ddxyyzkuq/image/upload/v1745867749/pin_2_7_ut7m1x.webp,lawn-care-ideas,,"Confused about your mower's height adjustment settings? This guide simplifies the process, showing you exactly how to adjust the cutting height for your desired grass length.  Get the perfect cut every time!  Stop guessing and start mowing with confidence. Read now and take control of your lawn! #mowerheight #lawnmowingtips #gardeningguide #homeowner,mower height,adjustment,grass length",https://lawntrend.com/lawn-mower-not-cutting-low-enough/?utm_source=pinterest&utm_campaign=adjusting-mower-heig,2025-04-28,cutting settings,https://lawntrend.com/lawn-mower-not-cutting-low-enough/
Clogged Mower Deck? Clear It!,https://res.cloudinary.com/ddxyyzkuq/image/upload/v1745867755/pin_2_8_smdcwr.webp,lawn-care-ideas,,"A clogged mower deck can prevent a low cut and damage your mower. Learn how to safely and effectively clear debris from your mower deck for optimal performance.  Protect your investment and keep your lawn looking its best!  Don't ignore the signs – a clean deck is a happy deck. Click to learn more! #mowerdeckcleaning #lawncare #mowermaintenance #yardcleanup,mower deck,clogged deck,debris removal",https://lawntrend.com/lawn-mower-not-cutting-low-enough/?utm_source=pinterest&utm_campaign=clogged-mower-deck-c,2025-04-28,mower performance,https://lawntrend.com/lawn-mower-not-cutting-low-enough/
Low Cut & Scalping: What's the Diff?,https://res.cloudinary.com/ddxyyzkuq/image/upload/v1745867762/pin_2_9_lvemos.webp,lawn-care-ideas,,"Are you scalping your lawn instead of getting a low cut? Understand the difference and learn how to avoid damaging your grass. This post explains the signs of scalping and how to adjust your mowing technique.  Protect your lawn and achieve a healthy, vibrant yard! #scalping #lawncare #mowingtips #grasshealth,scalping,low cut,mowing technique",https://lawntrend.com/lawn-mower-not-cutting-low-enough/?utm_source=pinterest&utm_campaign=low-cut-scalping-wha,2025-04-28,grass damage,https://lawntrend.com/lawn-mower-not-cutting-low-enough/
Mower Tire Pressure & Cutting,https://res.cloudinary.com/ddxyyzkuq/image/upload/v1745867769/pin_2_10_ddejd6.webp,lawn-care-ideas,,"Did you know tire pressure affects your cut? Learn how proper tire pressure can contribute to a more even and lower cut.  Small adjustments can make a BIG difference!  Don't overlook this often-forgotten aspect of lawn care. Read now to optimize your mower's performance! #tirepressure #lawnmower #lawncare #yardwork,tire pressure,mower performance,even cut",https://lawntrend.com/lawn-mower-not-cutting-low-enough/?utm_source=pinterest&utm_campaign=mower-tire-pressure-,2025-04-28,lawn maintenance,https://lawntrend.com/lawn-mower-not-cutting-low-enough/
Belt Tension & Low Cutting,https://res.cloudinary.com/ddxyyzkuq/image/upload/v1745867776/pin_2_11_m20e6i.webp,mower-repair-ideas,,"Is your mower belt loose?  Loose belts can cause inconsistent cutting and prevent you from achieving a low cut. This post explains how to check and adjust your mower belt tension.  Keep your mower running smoothly and efficiently! #mowerbelt #lawnmowerrepair #diy #yardmaintenance,mower belt,belt tension,cutting issues",https://lawntrend.com/lawn-mower-not-cutting-low-enough/?utm_source=pinterest&utm_campaign=belt-tension-low-cut,2025-04-28,mower repair,https://lawntrend.com/lawn-mower-not-cutting-low-enough/
Mower Wheel Adjustment Guide,https://res.cloudinary.com/ddxyyzkuq/image/upload/v1745867784/pin_2_12_sjsyd4.webp,lawn-care-ideas,,"Uneven wheels = uneven cut. Learn how to adjust your mower wheels for a level and consistent cut.  Achieve a professional-looking lawn with this simple adjustment!  Don't let wobbly wheels ruin your hard work. Click to learn more! #mowerwheels #lawncare #yardwork #homeimprovement,mower wheels,wheel adjustment,even cut",https://lawntrend.com/lawn-mower-not-cutting-low-enough/?utm_source=pinterest&utm_campaign=mower-wheel-adjustme,2025-04-28,lawn stripes,https://lawntrend.com/lawn-mower-not-cutting-low-enough/
Diagnose a High Cut: Checklist,https://res.cloudinary.com/ddxyyzkuq/image/upload/v1745867790/pin_2_13_ezypui.webp,lawn-care-ideas,,"Struggling with a high cut? Use our handy checklist to diagnose the problem and find the right solution. From blade height to deck leveling, we cover all the essential checks.  Get your lawn looking its best with this quick and easy guide! #lawncarechecklist #mowerproblems #diy #gardening,lawn care,diagnosis,checklist",https://lawntrend.com/lawn-mower-not-cutting-low-enough/?utm_source=pinterest&utm_campaign=diagnose-a-high-cut-,2025-04-28,mower troubleshooting,https://lawntrend.com/lawn-mower-not-cutting-low-enough/
Best Blades for a Low Cut,https://res.cloudinary.com/ddxyyzkuq/image/upload/v1745867797/pin_2_14_tre6ri.webp,hair-cuts-ideas,,"Not all blades are created equal! Discover the best types of lawn mower blades for achieving a low, clean cut.  Upgrade your blades and experience a noticeable difference in your lawn's appearance! #lawnmowerblades #lawncare #gardeningtips #yardgoals,mower blades,blade type,low cut",https://lawntrend.com/lawn-mower-not-cutting-low-enough/?utm_source=pinterest&utm_campaign=best-blades-for-a-lo,2025-04-28,cutting quality,https://lawntrend.com/lawn-mower-not-cutting-low-enough/
Mower Maintenance for Low Cuts,https://res.cloudinary.com/ddxyyzkuq/image/upload/v1745867804/pin_2_15_knfc72.webp,lawn-care-ideas,,"Regular maintenance is key to a consistently low cut. This post outlines the essential maintenance tasks to keep your mower in top condition.  Protect your investment and enjoy a beautiful lawn all season long! #lawnmowermaintenance #lawncare #yardwork #homeimprovement,mower maintenance,preventative care,low cut",https://lawntrend.com/lawn-mower-not-cutting-low-enough/?utm_source=pinterest&utm_campaign=mower-maintenance-fo,2025-04-28,lawn health,https://lawntrend.com/lawn-mower-not-cutting-low-enough/
Troubleshooting Mower Height Issues,https://res.cloudinary.com/ddxyyzkuq/image/upload/v1745867810/pin_2_16_hxwe9r.webp,lawn-care-ideas,,"Frustrated with your mower's height settings? This post provides a comprehensive guide to troubleshooting common height adjustment problems.  Get back to mowing with confidence! #mowerheight #lawncare #troubleshooting #diy,mower height,adjustment issues,troubleshooting",https://lawntrend.com/lawn-mower-not-cutting-low-enough/?utm_source=pinterest&utm_campaign=troubleshooting-mowe,2025-04-28,lawn repair,https://lawntrend.com/lawn-mower-not-cutting-low-enough/
DIY Mower Blade Sharpening,https://res.cloudinary.com/ddxyyzkuq/image/upload/v1745867816/pin_2_17_tuut2f.webp,yard-work-ideas,,"Save money and sharpen your own lawn mower blades! This step-by-step guide shows you how to safely and effectively sharpen your blades at home.  A sharp blade is a happy blade! #diy #bladesharpening #lawncare #gardening,blade sharpening,diy repair,mower maintenance",https://lawntrend.com/lawn-mower-not-cutting-low-enough/?utm_source=pinterest&utm_campaign=diy-mower-blade-shar,2025-04-28,cost savings,https://lawntrend.com/lawn-mower-not-cutting-low-enough/
When to Call a Pro for Mower Repair,https://res.cloudinary.com/ddxyyzkuq/image/upload/v1745867823/pin_2_18_lafgqc.webp,lawn-care-ideas,,"Sometimes, it's best to leave it to the experts. Learn when to call a professional for lawn mower repair, especially for complex issues.  Protect your mower and ensure a safe and effective repair! #mowerrepair #lawncare #proservice #yardmaintenance,mower repair,professional service,complex issues",https://lawntrend.com/lawn-mower-not-cutting-low-enough/?utm_source=pinterest&utm_campaign=when-to-call-a-pro-f,2025-04-28,safety,https://lawntrend.com/lawn-mower-not-cutting-low-enough/
Mower Deck Cleaning: Step-by-Step,https://res.cloudinary.com/ddxyyzkuq/image/upload/v1745867829/pin_2_19_ul9az0.webp,lawn-care-ideas,,"A clean deck is a happy deck! Follow our step-by-step guide to thoroughly clean your mower deck and remove built-up debris.  Improve your mower's performance and extend its lifespan! #mowerdeckcleaning #lawncare #yardcleanup #diy,mower deck,cleaning,debris removal",https://lawntrend.com/lawn-mower-not-cutting-low-enough/?utm_source=pinterest&utm_campaign=mower-deck-cleaning-,2025-04-28,mower performance,https://lawntrend.com/lawn-mower-not-cutting-low-enough/
Preventing Scalping: Pro Tips,https://res.cloudinary.com/ddxyyzkuq/image/upload/v1745867835/pin_2_20_h0utfr.webp,lawn-care-ideas,,"Don't ruin your lawn with scalping! Learn our pro tips for preventing scalping and achieving a consistently even cut.  Protect your grass and enjoy a healthy, vibrant yard! #scalpingprevention #lawncare #mowingtips #grasshealth,scalping,prevention,mowing technique",https://lawntrend.com/lawn-mower-not-cutting-low-enough/?utm_source=pinterest&utm_campaign=preventing-scalping-,2025-04-28,grass health,https://lawntrend.com/lawn-mower-not-cutting-low-enough/
Choosing the Right Mower Height,https://res.cloudinary.com/ddxyyzkuq/image/upload/v1745867842/pin_2_21_d4bofx.webp,lawn-care-ideas,,"Not sure what cutting height is best for your grass type? This post provides a guide to choosing the right mower height for a healthy and beautiful lawn.  Get the perfect cut for your specific grass! #mowerheight #lawncare #grasshealth #gardening,mower height,grass type,cutting height",https://lawntrend.com/lawn-mower-not-cutting-low-enough/?utm_source=pinterest&utm_campaign=choosing-the-right-m,2025-04-28,lawn health,https://lawntrend.com/lawn-mower-not-cutting-low-enough/
Mower Belt Replacement Guide,https://res.cloudinary.com/ddxyyzkuq/image/upload/v1745867850/pin_2_22_upydvu.webp,lawn-care-ideas,,"A broken mower belt can stop you in your tracks. Learn how to safely and effectively replace your mower belt with our step-by-step guide.  Get back to mowing quickly and easily! #mowerbeltreplacement #lawncare #diy #yardwork,mower belt,replacement,diy repair",https://lawntrend.com/lawn-mower-not-cutting-low-enough/?utm_source=pinterest&utm_campaign=mower-belt-replaceme,2025-04-28,mower maintenance,https://lawntrend.com/lawn-mower-not-cutting-low-enough/
Understanding Mower Cutting Patterns,https://res.cloudinary.com/ddxyyzkuq/image/upload/v1745867856/pin_2_23_hrv0cv.webp,lawn-care-ideas,,"Did you know your mowing pattern affects your lawn's health? Learn about different mowing patterns and how to choose the best one for your yard.  Improve your lawn's appearance and promote healthy growth! #mowingpatterns #lawncare #yardwork #gardening,mowing patterns,lawn health,grass growth",https://lawntrend.com/lawn-mower-not-cutting-low-enough/?utm_source=pinterest&utm_campaign=understanding-mower-,2025-04-28,yard maintenance,https://lawntrend.com/lawn-mower-not-cutting-low-enough/
Fixing an Uneven Lawn After Mowing,https://res.cloudinary.com/ddxyyzkuq/image/upload/v1745867863/pin_2_24_xnium1.webp,lawn-care-ideas,,"Already have an uneven lawn? Learn how to fix it and restore a smooth, level surface. This post covers techniques for leveling your lawn and achieving a professional look. #unevenlawn #lawnrepair #lawncare #yardgoals,uneven lawn,lawn repair,leveling",https://lawntrend.com/lawn-mower-not-cutting-low-enough/?utm_source=pinterest&utm_campaign=fixing-an-uneven-law,2025-04-28,yard maintenance,https://lawntrend.com/lawn-mower-not-cutting-low-enough/
Mower Safety Tips for Low Cuts,https://res.cloudinary.com/ddxyyzkuq/image/upload/v1745867869/pin_2_25_bnolyj.webp,lawn-care-ideas,,"Prioritize safety when mowing! This post provides essential safety tips for achieving a low cut without risking injury.  Protect yourself and enjoy a safe and productive mowing experience! #mowersafety #lawncare #safetytips #yardwork,mower safety,safety tips,low cut",https://lawntrend.com/lawn-mower-not-cutting-low-enough/?utm_source=pinterest&utm_campaign=mower-safety-tips-fo,2025-04-28,lawn maintenance,https://lawntrend.com/lawn-mower-not-cutting-low-enough/
Title,https://res.cloudinary.com/ddxyyzkuq/image/upload/v1745867911/pin_3_1_ouol1g.webp,please-provide-the-title-and-keywords-i-need-that-information-to-suggest-a-board-name-once,,Description,https://lawntrend.com/hydrostatic-transmission-slipping-when-hot/?utm_source=pinterest&utm_campaign=title,2025-04-28,Keywords,https://lawntrend.com/hydrostatic-transmission-slipping-when-hot/
Hydrostatic Transmission Slipping? Fix It!,https://res.cloudinary.com/ddxyyzkuq/image/upload/v1745867918/pin_3_2_rgguab.webp,lawn-repair-ideas,,"Is your lawn mower losing power when it heats up? Don't let a slipping hydrostatic transmission ruin your weekend! This guide dives deep into the causes – low fluid, worn pumps, filters – and provides DIY troubleshooting steps to get you back to mowing. Learn how to diagnose the issue, check fluid levels",https://lawntrend.com/hydrostatic-transmission-slipping-when-hot/?utm_source=pinterest&utm_campaign=hydrostatic-transmis,2025-04-28,and potentially save hundreds on repair costs.  Don't suffer through frustrating stalls! Click to learn how to restore your mower's power and enjoy a perfectly manicured lawn. #HydrostaticTransmission #LawnMowerRepair #DIYRepair #MowerProblems,https://lawntrend.com/hydrostatic-transmission-slipping-when-hot/
Hydrostatic Transmission: The Ultimate Guide,https://res.cloudinary.com/ddxyyzkuq/image/upload/v1745867923/pin_3_3_njvors.webp,lawn-repair-ideas,,"Confused by your mower's hydrostatic transmission? This comprehensive guide breaks down how it works, common problems",https://lawntrend.com/hydrostatic-transmission-slipping-when-hot/?utm_source=pinterest&utm_campaign=hydrostatic-transmis,2025-04-28,and how to fix them. We cover everything from identifying slipping issues to understanding the components.  Avoid costly repairs and keep your lawn looking its best!  Learn to maintain this vital system and extend the life of your mower. Click to read now and become a lawn care pro! #Hydrostatic #TransmissionRepair #LawnCareTips #MowerMaintenance,https://lawntrend.com/hydrostatic-transmission-slipping-when-hot/
Hydrostatic Pump Problems: Solved!,https://res.cloudinary.com/ddxyyzkuq/image/upload/v1745867930/pin_3_4_lm79cy.webp,mower-repair-ideas,,"Is your hydrostatic pump failing? This pin zeroes in on pump-related issues that cause slipping. We discuss wear and tear, internal leaks",https://lawntrend.com/hydrostatic-transmission-slipping-when-hot/?utm_source=pinterest&utm_campaign=hydrostatic-pump-pro,2025-04-28,and potential replacement options.  Don't ignore the signs – a failing pump can lead to complete transmission failure.  Click to learn how to diagnose pump problems and get back to mowing! #HydrostaticPump #MowerPump #TransmissionProblems #LawnMowerIssues,https://lawntrend.com/hydrostatic-transmission-slipping-when-hot/
Filter Focus: Hydrostatic Transmission,https://res.cloudinary.com/ddxyyzkuq/image/upload/v1745867936/pin_3_5_c7mqnn.webp,lawn-mower-inspiration,,A clogged filter can wreak havoc on your hydrostatic transmission! This pin emphasizes the importance of regular filter changes.  We explain how to locate and replace your mower's hydrostatic filter,https://lawntrend.com/hydrostatic-transmission-slipping-when-hot/?utm_source=pinterest&utm_campaign=filter-focus-hydrost,2025-04-28,ensuring optimal fluid flow and preventing slipping.  A small investment in a new filter can save you big bucks down the road. Click to learn how! #HydrostaticFilter #MowerFilter #FilterChange #LawnMowerMaintenance,https://lawntrend.com/hydrostatic-transmission-slipping-when-hot/
Extend Your Mower's Life: Hydrostatic Care,https://res.cloudinary.com/ddxyyzkuq/image/upload/v1745867943/pin_3_6_avgkiq.webp,lawn-care-ideas,,"Want to keep your mower running like new for years to come? This pin highlights preventative maintenance for your hydrostatic transmission.  Regular checks, fluid changes",https://lawntrend.com/hydrostatic-transmission-slipping-when-hot/?utm_source=pinterest&utm_campaign=extend-your-mowers-l,2025-04-28,and filter replacements are key.  Protect your investment and enjoy a reliable mower season after season. Click to learn our top tips! #MowerLife #HydrostaticMaintenance #PreventativeMaintenance #LawnMowerCare,https://lawntrend.com/hydrostatic-transmission-slipping-when-hot/
