Title,Media URL,Pinterest board,Thumbnail,Description,Link,Publish date,Keywords,Source URL
Title,https://res.cloudinary.com/dbcpfy04c/image/upload/v1618237451/placeholder.jpg,home-inspiration,,Description,https://lawntrend.com/john-deere-2210-problems/?utm_source=pinterest&utm_campaign=title,2025-04-28,Keywords,https://lawntrend.com/john-deere-2210-problems/
John Deere 2210: Common Issues & Fixes,https://res.cloudinary.com/dbcpfy04c/image/upload/v1618237451/placeholder.jpg,home-inspiration,,"Is your John Deere 2210 giving you trouble? Don't let frustrating problems ruin your lawn care! This guide dives into the most common issues with the 2210, from hydraulic woes to engine hiccups. We provide clear",https://lawntrend.com/john-deere-2210-problems/?utm_source=pinterest&utm_campaign=john-deere-2210-comm,2025-04-28,step-by-step troubleshooting tips to get you back to mowing quickly. Save time & money by DIYing repairs! Click to learn how to diagnose & fix your 2210 and keep it running smoothly for years to come. Don't suffer through another season with a broken mower! #JohnDeere2210 #LawnMowerRepair #DIYRepair #TractorProblems,https://lawntrend.com/john-deere-2210-problems/
John Deere 2210 Hydraulic Problems?,https://res.cloudinary.com/dbcpfy04c/image/upload/v1618237451/placeholder.jpg,home-inspiration,,"Hydraulic issues on your John Deere 2210 can be a real headache. This pin highlights common hydraulic problems like leaks, weak lift, and unresponsive controls. We break down the causes and offer practical solutions, including checking fluid levels, inspecting hoses",https://lawntrend.com/john-deere-2210-problems/?utm_source=pinterest&utm_campaign=john-deere-2210-hydr,2025-04-28,and diagnosing pump issues.  Don't let hydraulic failures stop you! Learn how to keep your 2210's hydraulics in top shape. Click to read the full guide and get back to work! #JohnDeereHydraulics #2210Problems #TractorRepair #HydraulicPump,https://lawntrend.com/john-deere-2210-problems/
2210 Engine Not Starting? Fix It!,https://res.cloudinary.com/dbcpfy04c/image/upload/v1618237451/placeholder.jpg,home-inspiration,,"A John Deere 2210 that won't start is incredibly frustrating. This pin focuses on diagnosing engine starting problems, covering issues like fuel delivery, spark plugs",https://lawntrend.com/john-deere-2210-problems/?utm_source=pinterest&utm_campaign=2210-engine-not-star,2025-04-28,and the ignition system. We provide a checklist to help you pinpoint the cause and get your engine roaring again.  Don't get stuck with a dead tractor! Click to learn how to revive your 2210's engine. #JohnDeereEngine #2210Repair #EngineTroubleshooting #SmallEngineRepair,https://lawntrend.com/john-deere-2210-problems/
John Deere 2210: Blade Problems Solved,https://res.cloudinary.com/dbcpfy04c/image/upload/v1618237451/placeholder.jpg,home-inspiration,,"Dull or damaged blades on your John Deere 2210 can ruin your lawn's appearance. This pin addresses common blade issues, including bending, dulling, and improper installation. Learn how to sharpen, balance",https://lawntrend.com/john-deere-2210-problems/?utm_source=pinterest&utm_campaign=john-deere-2210-blad,2025-04-28,and replace your blades for a pristine cut.  Invest in a beautiful lawn! Click to discover the secrets to perfect blade maintenance. #JohnDeereBlades #LawnCareTips #MowerMaintenance #BladeSharpening,https://lawntrend.com/john-deere-2210-problems/
2210 Transmission Troubles? We Can Help,https://res.cloudinary.com/dbcpfy04c/image/upload/v1618237451/placeholder.jpg,home-inspiration,,Is your John Deere 2210's transmission slipping or shifting poorly? This pin tackles common transmission problems,https://lawntrend.com/john-deere-2210-problems/?utm_source=pinterest&utm_campaign=2210-transmission-tr,2025-04-28,offering insights into diagnosing issues and potential repair solutions.  Avoid costly repairs! Learn how to identify transmission problems early and keep your 2210 running smoothly. Click for the full guide! #JohnDeereTransmission #2210Issues #TractorTransmission #RepairGuide,https://lawntrend.com/john-deere-2210-problems/
John Deere 2210: Fuel System Fixes,https://res.cloudinary.com/dbcpfy04c/image/upload/v1618237451/placeholder.jpg,home-inspiration,,"Fuel system problems can cause a John Deere 2210 to run rough or not at all. This pin focuses on troubleshooting fuel-related issues, including clogged filters, faulty fuel pumps",https://lawntrend.com/john-deere-2210-problems/?utm_source=pinterest&utm_campaign=john-deere-2210-fuel,2025-04-28,and carburetor problems.  Keep your engine happy! Click to learn how to maintain a clean and efficient fuel system. #JohnDeereFuelSystem #2210Maintenance #CarburetorRepair #FuelFilter,https://lawntrend.com/john-deere-2210-problems/
2210 Electrical Issues? Diagnose Now!,https://res.cloudinary.com/dbcpfy04c/image/upload/v1618237451/placeholder.jpg,home-inspiration,,"Electrical problems on your John Deere 2210 can be tricky to diagnose. This pin highlights common electrical issues, such as faulty wiring, blown fuses",https://lawntrend.com/john-deere-2210-problems/?utm_source=pinterest&utm_campaign=2210-electrical-issu,2025-04-28,and a weak battery. We provide a step-by-step guide to troubleshooting and resolving these problems.  Don't get shocked by repair costs! Click to learn how to fix your 2210's electrical system. #JohnDeereElectrical #2210Wiring #TractorElectrical #FuseBox,https://lawntrend.com/john-deere-2210-problems/
John Deere 2210: Cooling System Guide,https://res.cloudinary.com/dbcpfy04c/image/upload/v1618237451/placeholder.jpg,home-inspiration,,"Overheating can severely damage your John Deere 2210's engine. This pin focuses on maintaining a healthy cooling system, covering radiator cleaning, coolant checks",https://lawntrend.com/john-deere-2210-problems/?utm_source=pinterest&utm_campaign=john-deere-2210-cool,2025-04-28,and thermostat replacement.  Protect your investment! Click to learn how to prevent overheating and keep your 2210 running cool. #JohnDeereCoolingSystem #2210Overheating #RadiatorRepair #CoolantFlush,https://lawntrend.com/john-deere-2210-problems/
2210 Steering Problems? Easy Fixes,https://res.cloudinary.com/dbcpfy04c/image/upload/v1618237451/placeholder.jpg,home-inspiration,,"Difficulty steering your John Deere 2210? This pin addresses common steering issues, including loose connections, worn components",https://lawntrend.com/john-deere-2210-problems/?utm_source=pinterest&utm_campaign=2210-steering-proble,2025-04-28,and hydraulic problems. We provide practical solutions to restore smooth and responsive steering.  Enjoy effortless mowing! Click to learn how to fix your 2210's steering. #JohnDeereSteering #2210Steering #TractorSteering #SteeringRepair,https://lawntrend.com/john-deere-2210-problems/
John Deere 2210: Belt Replacement Guide,https://res.cloudinary.com/dbcpfy04c/image/upload/v1618237451/placeholder.jpg,home-inspiration,,A broken or worn belt can bring your John Deere 2210 to a halt. This pin provides a step-by-step guide to replacing belts,https://lawntrend.com/john-deere-2210-problems/?utm_source=pinterest&utm_campaign=john-deere-2210-belt,2025-04-28,ensuring proper tension and alignment.  Save time and frustration! Click to learn how to quickly and easily replace your 2210's belts. #JohnDeereBelts #2210BeltReplacement #MowerBelts #BeltInstallation,https://lawntrend.com/john-deere-2210-problems/
2210 Won't Mow? Troubleshooting Tips,https://res.cloudinary.com/dbcpfy04c/image/upload/v1618237451/placeholder.jpg,home-inspiration,,Facing a frustrating mowing session with your John Deere 2210? This pin offers a quick troubleshooting guide to common issues that prevent mowing,https://lawntrend.com/john-deere-2210-problems/?utm_source=pinterest&utm_campaign=2210-wont-mow-troubl,2025-04-28,from blade engagement problems to deck height adjustments.  Get back to mowing today! Click for solutions to get your 2210 working again. #JohnDeereMowing #2210Troubleshooting #LawnMowerProblems #MowingTips,https://lawntrend.com/john-deere-2210-problems/
John Deere 2210: Deck Maintenance Guide,https://res.cloudinary.com/dbcpfy04c/image/upload/v1618237451/placeholder.jpg,home-inspiration,,"Keep your John Deere 2210's deck in top condition for a beautiful cut. This pin covers cleaning, leveling, and repairing the deck",https://lawntrend.com/john-deere-2210-problems/?utm_source=pinterest&utm_campaign=john-deere-2210-deck,2025-04-28,preventing rust and ensuring optimal performance.  A pristine lawn starts here! Click to learn how to maintain your 2210's deck. #JohnDeereDeck #2210DeckMaintenance #MowerDeck #LawnCare,https://lawntrend.com/john-deere-2210-problems/
2210 Safety Checklist: Before You Start,https://res.cloudinary.com/dbcpfy04c/image/upload/v1618237451/placeholder.jpg,home-inspiration,,"Safety first! This pin provides a crucial safety checklist for operating your John Deere 2210, covering pre-operation inspections, protective gear",https://lawntrend.com/john-deere-2210-problems/?utm_source=pinterest&utm_campaign=2210-safety-checklis,2025-04-28,and safe mowing practices.  Protect yourself and your property! Click to ensure a safe mowing experience. #JohnDeereSafety #2210Safety #TractorSafety #LawnMowerSafety,https://lawntrend.com/john-deere-2210-problems/
John Deere 2210: Oil Change How-To,https://res.cloudinary.com/dbcpfy04c/image/upload/v1618237451/placeholder.jpg,home-inspiration,,Regular oil changes are vital for your John Deere 2210's longevity. This pin provides a step-by-step guide to changing the oil,https://lawntrend.com/john-deere-2210-problems/?utm_source=pinterest&utm_campaign=john-deere-2210-oil-,2025-04-28,ensuring proper lubrication and engine health.  Extend your tractor's life! Click to learn how to perform an oil change. #JohnDeereOilChange #2210Maintenance #EngineOil #OilChange,https://lawntrend.com/john-deere-2210-problems/
John Deere 2210: Winter Storage Tips,https://res.cloudinary.com/dbcpfy04c/image/upload/v1618237451/placeholder.jpg,home-inspiration,,"Proper winter storage is essential for protecting your John Deere 2210 from damage. This pin offers a comprehensive guide to winterizing your tractor, including fuel stabilization, battery care",https://lawntrend.com/john-deere-2210-problems/?utm_source=pinterest&utm_campaign=john-deere-2210-wint,2025-04-28,and protective covering.  Ensure a smooth start next spring! Click for winter storage tips. #JohnDeereWinterizing #2210Storage #TractorStorage #WinterPrep,https://lawntrend.com/john-deere-2210-problems/
2210: Diagnosing a Weak Battery,https://res.cloudinary.com/dbcpfy04c/image/upload/v1618237451/placeholder.jpg,home-inspiration,,"A weak battery can leave you stranded. This pin focuses on diagnosing battery problems on your John Deere 2210, including testing voltage, checking connections",https://lawntrend.com/john-deere-2210-problems/?utm_source=pinterest&utm_campaign=2210-diagnosing-a-we,2025-04-28,and identifying potential causes.  Don't get caught with a dead battery! Click to learn how to diagnose the issue. #JohnDeereBattery #2210Battery #TractorBattery #BatteryTesting,https://lawntrend.com/john-deere-2210-problems/
2210: Understanding Your Dashboard Lights,https://res.cloudinary.com/dbcpfy04c/image/upload/v1618237451/placeholder.jpg,home-inspiration,,Confused by the lights on your John Deere 2210's dashboard? This pin decodes common warning lights,https://lawntrend.com/john-deere-2210-problems/?utm_source=pinterest&utm_campaign=2210-understanding-y,2025-04-28,helping you understand potential problems and take appropriate action.  Stay informed and prevent damage! Click to learn what your lights mean. #JohnDeereDashboard #2210Lights #TractorLights #WarningLights,https://lawntrend.com/john-deere-2210-problems/
John Deere 2210: Tire Pressure & Maintenance,https://res.cloudinary.com/dbcpfy04c/image/upload/v1618237451/placeholder.jpg,home-inspiration,,"Proper tire pressure is crucial for performance and safety. This pin covers checking and maintaining your John Deere 2210's tires, including inflation, wear patterns",https://lawntrend.com/john-deere-2210-problems/?utm_source=pinterest&utm_campaign=john-deere-2210-tire,2025-04-28,and replacement.  Improve your mowing experience! Click for tire maintenance tips. #JohnDeereTires #2210Tires #TractorTires #TirePressure,https://lawntrend.com/john-deere-2210-problems/
2210: Preventing Rust & Corrosion,https://res.cloudinary.com/dbcpfy04c/image/upload/v1618237451/placeholder.jpg,home-inspiration,,"Protect your John Deere 2210 from rust and corrosion with these preventative measures. This pin offers tips on cleaning, painting",https://lawntrend.com/john-deere-2210-problems/?utm_source=pinterest&utm_campaign=2210-preventing-rust,2025-04-28,and protecting your tractor from the elements.  Extend your tractor's lifespan! Click to learn how to prevent rust. #JohnDeereRust #2210Corrosion #TractorRust #RustPrevention,https://lawntrend.com/john-deere-2210-problems/
John Deere 2210: Finding Parts Online,https://res.cloudinary.com/dbcpfy04c/image/upload/v1618237451/placeholder.jpg,home-inspiration,,Need parts for your John Deere 2210? This pin provides resources for finding parts online,https://lawntrend.com/john-deere-2210-problems/?utm_source=pinterest&utm_campaign=john-deere-2210-find,2025-04-28,including reputable dealers and online marketplaces.  Get the parts you need quickly! Click to find parts for your 2210. #JohnDeerePartsOnline #2210Parts #TractorParts #PartsFinder,https://lawntrend.com/john-deere-2210-problems/
John Deere 2210: Common Modifications & Upgrades,https://res.cloudinary.com/dbcpfy04c/image/upload/v1618237451/placeholder.jpg,home-inspiration,,Looking to enhance your John Deere 2210? This pin explores popular modifications and upgrades,https://lawntrend.com/john-deere-2210-problems/?utm_source=pinterest&utm_campaign=john-deere-2210-comm,2025-04-28,from adding lights to improving comfort.  Customize your tractor! Click to discover upgrade ideas. #JohnDeereModifications #2210Upgrades #TractorMods #TractorUpgrades,https://lawntrend.com/john-deere-2210-problems/
Title,https://res.cloudinary.com/dbcpfy04c/image/upload/v1618237451/placeholder.jpg,home-inspiration,,Description,https://lawntrend.com/john-deere-2150-problems/?utm_source=pinterest&utm_campaign=title,2025-04-28,Keywords,https://lawntrend.com/john-deere-2150-problems/
John Deere 2150: Common Issues & Fixes,https://res.cloudinary.com/dbcpfy04c/image/upload/v1618237451/placeholder.jpg,home-inspiration,,"Is your John Deere 2150 giving you trouble? Don't let a broken tractor ruin your day! This guide dives into the most frequent problems owners face – from fuel issues to hydraulic headaches. We break down troubleshooting steps, potential causes, and even DIY repair tips to get you back in the field quickly.  Save time & money by diagnosing the problem yourself! Click to learn how to keep your 2150 running smoothly for years to come.  Don't get stuck, get fixing! #JohnDeere #2150 #TractorProblems #FarmLife,John Deere 2150,Tractor Repair,Troubleshooting",https://lawntrend.com/john-deere-2150-problems/?utm_source=pinterest&utm_campaign=john-deere-2150-comm,2025-04-28,Farm Equipment,https://lawntrend.com/john-deere-2150-problems/
2150 Fuel System Problems: Solved!,https://res.cloudinary.com/dbcpfy04c/image/upload/v1618237451/placeholder.jpg,home-inspiration,,"Struggling with fuel delivery on your John Deere 2150? A sputtering engine can be incredibly frustrating. This pin highlights common fuel system issues like clogged filters, faulty pumps, and injector problems. We provide a clear, step-by-step guide to diagnose and resolve these issues, helping you avoid costly repairs.  Get back to work with confidence! Learn how to keep your fuel system optimized. #JohnDeere2150 #FuelSystem #TractorRepair #DIY,Fuel System,John Deere,Tractor",https://lawntrend.com/john-deere-2150-problems/?utm_source=pinterest&utm_campaign=2150-fuel-system-pro,2025-04-28,Repair,https://lawntrend.com/john-deere-2150-problems/
Hydraulic Issues on Your 2150?,https://res.cloudinary.com/dbcpfy04c/image/upload/v1618237451/placeholder.jpg,home-inspiration,,"Don't let hydraulic problems slow you down! This pin focuses on diagnosing and fixing common hydraulic issues on the John Deere 2150, including leaks, low pressure, and unresponsive controls.  We cover everything from checking fluid levels to identifying worn seals.  Protect your investment and keep your tractor performing at its best. Click to learn more! #JohnDeere #Hydraulics #TractorLife #FarmMaintenance,Hydraulic System,John Deere 2150,Tractor Maintenance",https://lawntrend.com/john-deere-2150-problems/?utm_source=pinterest&utm_campaign=hydraulic-issues-on-,2025-04-28,Leaks,https://lawntrend.com/john-deere-2150-problems/
John Deere 2150: Electrical Gremlins?,https://res.cloudinary.com/dbcpfy04c/image/upload/v1618237451/placeholder.jpg,home-inspiration,,"Is your 2150 experiencing electrical issues? From faulty wiring to bad solenoids, electrical problems can be tricky to diagnose. This pin provides a comprehensive guide to troubleshooting common electrical faults, including how to use a multimeter and identify short circuits.  Don't be shocked – get the knowledge you need! #JohnDeere #ElectricalRepair #TractorProblems #DIYFix,Electrical System,John Deere,Tractor",https://lawntrend.com/john-deere-2150-problems/?utm_source=pinterest&utm_campaign=john-deere-2150-elec,2025-04-28,Wiring,https://lawntrend.com/john-deere-2150-problems/
2150 Starting Problems? We Can Help!,https://res.cloudinary.com/dbcpfy04c/image/upload/v1618237451/placeholder.jpg,home-inspiration,,"A John Deere 2150 that won't start is a farmer's worst nightmare. This pin tackles common starting issues, including battery problems, starter motor failures, and ignition system faults.  We offer practical troubleshooting tips to get your tractor roaring back to life.  Don't waste precious time – get started on the right track! #JohnDeere2150 #StartingProblems #TractorRepair #FarmLife,Starting Issues,John Deere,Tractor",https://lawntrend.com/john-deere-2150-problems/?utm_source=pinterest&utm_campaign=2150-starting-proble,2025-04-28,Battery,https://lawntrend.com/john-deere-2150-problems/
Keep Your 2150 Running Strong!,https://res.cloudinary.com/dbcpfy04c/image/upload/v1618237451/placeholder.jpg,home-inspiration,,"Preventative maintenance is key to a long-lasting John Deere 2150. This pin emphasizes the importance of regular maintenance tasks like oil changes, filter replacements, and lubrication.  Avoid costly breakdowns and maximize your tractor's performance.  Invest in your equipment – it will pay off! #JohnDeere #TractorMaintenance #PreventativeMaintenance #FarmEquipment,Maintenance,John Deere 2150,Tractor",https://lawntrend.com/john-deere-2150-problems/?utm_source=pinterest&utm_campaign=keep-your-2150-runni,2025-04-28,Oil Change,https://lawntrend.com/john-deere-2150-problems/
John Deere 2150: Overheating Issues?,https://res.cloudinary.com/dbcpfy04c/image/upload/v1618237451/placeholder.jpg,home-inspiration,,"Is your 2150 overheating? This pin dives into the causes of overheating, including radiator problems, coolant leaks, and thermostat failures.  We provide a step-by-step guide to diagnose and resolve overheating issues, protecting your engine from damage.  Don't let your tractor burn out – learn how to keep it cool! #JohnDeere #Overheating #TractorRepair #CoolingSystem,Overheating,John Deere,Tractor",https://lawntrend.com/john-deere-2150-problems/?utm_source=pinterest&utm_campaign=john-deere-2150-over,2025-04-28,Coolant,https://lawntrend.com/john-deere-2150-problems/
2150 Transmission Troubles? Fix It!,https://res.cloudinary.com/dbcpfy04c/image/upload/v1618237451/placeholder.jpg,home-inspiration,,"Transmission problems can be expensive. This pin focuses on diagnosing and fixing common transmission issues on the John Deere 2150, including slipping gears, rough shifting, and fluid leaks.  We offer practical advice to help you avoid major repairs.  Keep your tractor moving forward! #JohnDeere2150 #Transmission #TractorRepair #FarmLife,Transmission,John Deere,Tractor",https://lawntrend.com/john-deere-2150-problems/?utm_source=pinterest&utm_campaign=2150-transmission-tr,2025-04-28,Gears,https://lawntrend.com/john-deere-2150-problems/
John Deere 2150: PTO Problems?,https://res.cloudinary.com/dbcpfy04c/image/upload/v1618237451/placeholder.jpg,home-inspiration,,"Is your PTO not engaging or working properly? This pin addresses common PTO issues on the John Deere 2150, including clutch problems, linkage failures, and safety switch malfunctions.  Get your implements working efficiently again! #JohnDeere #PTO #TractorRepair #FarmEquipment,PTO,John Deere,Tractor",https://lawntrend.com/john-deere-2150-problems/?utm_source=pinterest&utm_campaign=john-deere-2150-pto-,2025-04-28,Implements,https://lawntrend.com/john-deere-2150-problems/
2150 Engine Knocking? What to Do!,https://res.cloudinary.com/dbcpfy04c/image/upload/v1618237451/placeholder.jpg,home-inspiration,,"Hearing a knocking sound from your 2150 engine? This pin explores the potential causes of engine knocking, from worn bearings to low oil pressure.  We provide guidance on diagnosing the problem and determining the best course of action.  Don't ignore the warning signs! #JohnDeere2150 #EngineKnock #TractorRepair #EngineProblems,Engine Knock,John Deere,Tractor",https://lawntrend.com/john-deere-2150-problems/?utm_source=pinterest&utm_campaign=2150-engine-knocking,2025-04-28,Engine,https://lawntrend.com/john-deere-2150-problems/
DIY John Deere 2150 Repair Guide,https://res.cloudinary.com/dbcpfy04c/image/upload/v1618237451/placeholder.jpg,home-inspiration,,"Empower yourself with the knowledge to tackle common repairs on your John Deere 2150! This pin links to a comprehensive guide covering a wide range of issues, from simple fixes to more complex repairs.  Save money and gain valuable skills.  Become your own tractor mechanic! #JohnDeere #DIYRepair #TractorLife #FarmHacks,DIY Repair,John Deere,Tractor",https://lawntrend.com/john-deere-2150-problems/?utm_source=pinterest&utm_campaign=diy-john-deere-2150-,2025-04-28,Guide,https://lawntrend.com/john-deere-2150-problems/
John Deere 2150: Common Warning Lights,https://res.cloudinary.com/dbcpfy04c/image/upload/v1618237451/placeholder.jpg,home-inspiration,,"Decoding those mysterious warning lights on your John Deere 2150! This pin explains the meaning of common warning lights and what they indicate about your tractor's condition.  Don't ignore the signals – address the issues before they escalate. #JohnDeere #WarningLights #TractorProblems #Dashboard,Warning Lights,John Deere,Tractor",https://lawntrend.com/john-deere-2150-problems/?utm_source=pinterest&utm_campaign=john-deere-2150-comm,2025-04-28,Dashboard,https://lawntrend.com/john-deere-2150-problems/
2150 Steering Issues: Troubleshooting,https://res.cloudinary.com/dbcpfy04c/image/upload/v1618237451/placeholder.jpg,home-inspiration,,"Is your John Deere 2150 steering feeling loose or unresponsive? This pin focuses on diagnosing and fixing common steering problems, including power steering pump failures, linkage issues, and worn components.  Stay in control! #JohnDeere2150 #Steering #TractorRepair #FarmLife,Steering,John Deere,Tractor",https://lawntrend.com/john-deere-2150-problems/?utm_source=pinterest&utm_campaign=2150-steering-issues,2025-04-28,Power Steering,https://lawntrend.com/john-deere-2150-problems/
John Deere 2150: Filter Replacement Guide,https://res.cloudinary.com/dbcpfy04c/image/upload/v1618237451/placeholder.jpg,home-inspiration,,"Keep your 2150 running clean and efficient with regular filter replacements! This pin provides a step-by-step guide to replacing air filters, fuel filters, and oil filters.  A little maintenance goes a long way. #JohnDeere #FilterReplacement #TractorMaintenance #FarmEquipment,Filter Replacement,John Deere,Tractor",https://lawntrend.com/john-deere-2150-problems/?utm_source=pinterest&utm_campaign=john-deere-2150-filt,2025-04-28,Maintenance,https://lawntrend.com/john-deere-2150-problems/
2150 Tire Problems & Solutions,https://res.cloudinary.com/dbcpfy04c/image/upload/v1618237451/placeholder.jpg,home-inspiration,,"Dealing with flat tires or uneven wear on your John Deere 2150? This pin addresses common tire issues and provides solutions, including proper inflation, tire repair techniques, and choosing the right tires for your needs.  Stay grounded! #JohnDeere #Tires #TractorRepair #FarmLife,Tires,John Deere,Tractor",https://lawntrend.com/john-deere-2150-problems/?utm_source=pinterest&utm_campaign=2150-tire-problems-s,2025-04-28,Wheels,https://lawntrend.com/john-deere-2150-problems/
John Deere 2150: Belt Replacement Tips,https://res.cloudinary.com/dbcpfy04c/image/upload/v1618237451/placeholder.jpg,home-inspiration,,"Broken or worn belts can bring your 2150 to a halt. This pin offers practical tips for replacing belts on your tractor, including identifying the correct belt size and tensioning it properly.  Get back to work quickly! #JohnDeere2150 #BeltReplacement #TractorRepair #DIY,Belt Replacement,John Deere,Tractor",https://lawntrend.com/john-deere-2150-problems/?utm_source=pinterest&utm_campaign=john-deere-2150-belt,2025-04-28,Drive Belt,https://lawntrend.com/john-deere-2150-problems/
