Title,Media URL,Pinterest board,Thumbnail,Description,Link,Publish date,Keywords,Source URL
DIY Window Cleaner: Save Money!,https://res.cloudinary.com/dbcpfy04c/image/upload/v1618237451/placeholder.jpg,home-inspiration,,"Ditch the expensive window cleaners! This pin shows you how to make a powerful, effective cleaning solution using ingredients you probably already have. Save money *and* get amazing results. Learn the perfect vinegar-to-water ratio and other pro tips. Click to read the full guide and start saving today! 💰 #diycleaner #windowcleaner #homemadecleaning #budgetfriendly,diy cleaning,window solution,vinegar",https://www.beacleaner.com/how-to-clean-a-double-pane-window?utm_source=pinterest&utm_campaign=diy-window-cleaner-s,2025-04-30,money saving,https://www.beacleaner.com/how-to-clean-a-double-pane-window
Double Pane Window Cleaning 101,https://res.cloudinary.com/dbcpfy04c/image/upload/v1618237451/placeholder.jpg,home-inspiration,,"Confused about cleaning double-pane windows? Don't be! This pin simplifies the process with step-by-step instructions and helpful visuals. We'll walk you through everything, from identifying window types to avoiding common mistakes. Get ready for windows so clean, you'll think they're new! ✨ Click to learn! #windowcleaningguide #doublepanewindows #cleaninghacks #easycleaning,window guide,double pane,cleaning steps",https://www.beacleaner.com/how-to-clean-a-double-pane-window?utm_source=pinterest&utm_campaign=double-pane-window-c,2025-04-30,beginner tips,https://www.beacleaner.com/how-to-clean-a-double-pane-window
The Ultimate Window Cleaning Checklist,https://res.cloudinary.com/dbcpfy04c/image/upload/v1618237451/placeholder.jpg,home-inspiration,,"Don't miss a spot! This pin provides a comprehensive checklist for cleaning your double-pane windows, ensuring a thorough and sparkling clean every time. From gathering supplies to the final polish, we've got you covered. A clean home is a happy home! 💖 Click to get the checklist! #cleaningchecklist #windowcleaning #homeorganization #cleaningroutine,cleaning checklist,window routine,home organization",https://www.beacleaner.com/how-to-clean-a-double-pane-window?utm_source=pinterest&utm_campaign=the-ultimate-window-,2025-04-30,cleaning schedule,https://www.beacleaner.com/how-to-clean-a-double-pane-window
Fix Cloudy Windows: Cleaning Tips,https://res.cloudinary.com/dbcpfy04c/image/upload/v1618237451/placeholder.jpg,home-inspiration,,"Are your double-pane windows looking cloudy? This pin tackles the problem head-on, offering solutions to restore clarity and brightness. Learn how to remove stubborn grime and prevent future cloudiness. Enjoy the view again! ☀️ Click to learn how! #cloudywindows #windowcleaning #cleaningtips #homeimprovement,cloudy windows,window restoration,cleaning solutions",https://www.beacleaner.com/how-to-clean-a-double-pane-window?utm_source=pinterest&utm_campaign=fix-cloudy-windows-c,2025-04-30,home repair,https://www.beacleaner.com/how-to-clean-a-double-pane-window
Protect Your Windows: Cleaning Guide,https://res.cloudinary.com/dbcpfy04c/image/upload/v1618237451/placeholder.jpg,home-inspiration,,"Cleaning isn't just about aesthetics – it's about protecting your investment! This pin explains how proper cleaning can extend the life of your double-pane windows. Learn the do's and don'ts to avoid damage and maintain their efficiency. Click to read the full guide! 🛡️ #windowprotection #doublepanewindows #homecare #maintenance,window care,window maintenance,double glazing",https://www.beacleaner.com/how-to-clean-a-double-pane-window?utm_source=pinterest&utm_campaign=protect-your-windows,2025-04-30,home protection,https://www.beacleaner.com/how-to-clean-a-double-pane-window
Easy Window Cleaning for Busy Bees,https://res.cloudinary.com/dbcpfy04c/image/upload/v1618237451/placeholder.jpg,home-inspiration,,"Short on time? No problem! This pin offers quick and effective window cleaning tips for busy homeowners. Learn how to get sparkling results in minutes. Don't let dirty windows stress you out – we've got you covered! 🐝 Click to learn more! #quickcleaning #windowcleaning #busymom #homehacks,quick cleaning,busy schedule,window hacks",https://www.beacleaner.com/how-to-clean-a-double-pane-window?utm_source=pinterest&utm_campaign=easy-window-cleaning,2025-04-30,time saving,https://www.beacleaner.com/how-to-clean-a-double-pane-window
Vinegar & Water: Window Cleaning Magic,https://res.cloudinary.com/dbcpfy04c/image/upload/v1618237451/placeholder.jpg,home-inspiration,,"Unlock the power of vinegar and water! This pin demonstrates how this simple, natural solution can transform your dirty double-pane windows into sparkling masterpieces. It's eco-friendly, budget-friendly, and incredibly effective. 🌿 Click to learn the recipe! #vinegarcleaning #naturalcleaning #windowcleaning #ecofriendly,vinegar,natural cleaner,eco friendly",https://www.beacleaner.com/how-to-clean-a-double-pane-window?utm_source=pinterest&utm_campaign=vinegar-water-window,2025-04-30,window solution,https://www.beacleaner.com/how-to-clean-a-double-pane-window
Say Goodbye to Hard Water Spots!,https://res.cloudinary.com/dbcpfy04c/image/upload/v1618237451/placeholder.jpg,home-inspiration,,"Hard water spots ruining your view? This pin provides targeted solutions for removing those stubborn blemishes from your double-pane windows. Learn the best techniques and products to restore clarity. Enjoy a spotless view! ✨ Click to learn more! #hardwaterspots #windowcleaning #cleaningtips #homeimprovement,hard water,window spots,cleaning solutions",https://www.beacleaner.com/how-to-clean-a-double-pane-window?utm_source=pinterest&utm_campaign=say-goodbye-to-hard-,2025-04-30,home repair,https://www.beacleaner.com/how-to-clean-a-double-pane-window
Cleaning Between the Panes: A Guide,https://res.cloudinary.com/dbcpfy04c/image/upload/v1618237451/placeholder.jpg,home-inspiration,,"Is there dirt *between* your double-pane windows? This pin explains how to address this tricky situation (and when to call a professional!). Learn about potential causes and effective cleaning methods. Don't ignore that grime! 🔍 Click to learn! #betweenpanes #windowcleaning #doublepanewindows #cleaningtips,between panes,window repair,cleaning guide",https://www.beacleaner.com/how-to-clean-a-double-pane-window?utm_source=pinterest&utm_campaign=cleaning-between-the,2025-04-30,professional cleaning,https://www.beacleaner.com/how-to-clean-a-double-pane-window
The Best Tools for Window Cleaning,https://res.cloudinary.com/dbcpfy04c/image/upload/v1618237451/placeholder.jpg,home-inspiration,,"Equip yourself for success! This pin showcases the best tools for cleaning double-pane windows, from squeegees to microfiber cloths. Learn which tools will make the job easier and more effective. Get the right tools for a sparkling finish! 🧽 Click to see our recommendations! #windowcleaningtools #cleaningtools #homecleaning #cleaninghacks,cleaning tools,squeegee,microfiber cloth",https://www.beacleaner.com/how-to-clean-a-double-pane-window?utm_source=pinterest&utm_campaign=the-best-tools-for-w,2025-04-30,window accessories,https://www.beacleaner.com/how-to-clean-a-double-pane-window
Preventing Streaks: Pro Tips,https://res.cloudinary.com/dbcpfy04c/image/upload/v1618237451/placeholder.jpg,home-inspiration,,"Stop streaks before they start! This pin shares pro tips for preventing streaks while cleaning your double-pane windows. Learn the right techniques and avoid common mistakes. Enjoy a consistently sparkling view! 🌟 Click to learn more! #streakfreewindows #windowcleaning #cleaningtips #protips,streak prevention,cleaning techniques,window care",https://www.beacleaner.com/how-to-clean-a-double-pane-window?utm_source=pinterest&utm_campaign=preventing-streaks-p,2025-04-30,professional tips,https://www.beacleaner.com/how-to-clean-a-double-pane-window
Double Pane Window Care: Long-Term,https://res.cloudinary.com/dbcpfy04c/image/upload/v1618237451/placeholder.jpg,home-inspiration,,"Keep your double-pane windows looking their best for years to come! This pin provides long-term care tips to prevent dirt buildup and maintain their clarity. A little maintenance goes a long way! 🏡 Click to learn more! #windowcare #doublepanewindows #homecare #maintenance,window maintenance,long term care,double glazing",https://www.beacleaner.com/how-to-clean-a-double-pane-window?utm_source=pinterest&utm_campaign=double-pane-window-c,2025-04-30,home improvement,https://www.beacleaner.com/how-to-clean-a-double-pane-window
Cleaning High Windows Safely,https://res.cloudinary.com/dbcpfy04c/image/upload/v1618237451/placeholder.jpg,home-inspiration,,"Don't risk a fall! This pin offers safety tips for cleaning high double-pane windows. Learn how to use the right equipment and techniques to avoid accidents. Safety first! ⚠️ Click to learn more! #windowcleaningsafety #safetytips #homecleaning #doublepanewindows,window safety,high windows,cleaning precautions",https://www.beacleaner.com/how-to-clean-a-double-pane-window?utm_source=pinterest&utm_campaign=cleaning-high-window,2025-04-30,safety equipment,https://www.beacleaner.com/how-to-clean-a-double-pane-window
Before & After: Window Cleaning Magic!,https://res.cloudinary.com/dbcpfy04c/image/upload/v1618237451/placeholder.jpg,home-inspiration,,"See the incredible difference! This pin showcases stunning before-and-after photos of double-pane windows transformed by our cleaning techniques. Get inspired and learn how to achieve similar results. ✨ Click to see the transformation! #beforeandafter #windowcleaning #cleaningresults #homeimprovement,before and after,window transformation,cleaning results",https://www.beacleaner.com/how-to-clean-a-double-pane-window?utm_source=pinterest&utm_campaign=before-after-window-,2025-04-30,visual inspiration,https://www.beacleaner.com/how-to-clean-a-double-pane-window
The Cost of Professional Window Cleaning,https://res.cloudinary.com/dbcpfy04c/image/upload/v1618237451/placeholder.jpg,home-inspiration,,"Wondering if you should hire a pro? This pin breaks down the cost of professional double-pane window cleaning, helping you decide if it's the right choice for you. Weigh the pros and cons! 💰 Click to learn more! #professionalcleaning #windowcleaning #costcomparison #homeimprovement,professional cleaning,window cost,cleaning services",https://www.beacleaner.com/how-to-clean-a-double-pane-window?utm_source=pinterest&utm_campaign=the-cost-of-professi,2025-04-30,budget comparison,https://www.beacleaner.com/how-to-clean-a-double-pane-window
Cleaning Windows in Winter: Tips,https://res.cloudinary.com/dbcpfy04c/image/upload/v1618237451/placeholder.jpg,home-inspiration,,"Don't let winter weather stop you! This pin provides tips for cleaning double-pane windows in cold temperatures. Learn how to avoid freezing and achieve sparkling results. ❄️ Click to learn more! #wintercleaning #windowcleaning #cleaningtips #coldweather,winter cleaning,cold weather,window care",https://www.beacleaner.com/how-to-clean-a-double-pane-window?utm_source=pinterest&utm_campaign=cleaning-windows-in-,2025-04-30,seasonal cleaning,https://www.beacleaner.com/how-to-clean-a-double-pane-window
Eco-Friendly Window Cleaning Solutions,https://res.cloudinary.com/dbcpfy04c/image/upload/v1618237451/placeholder.jpg,home-inspiration,,"Go green with your cleaning! This pin offers eco-friendly window cleaning solutions that are safe for your family and the environment. Learn how to clean effectively without harsh chemicals. 🌿 Click to learn more! #ecofriendlycleaning #naturalcleaning #windowcleaning #sustainableliving,eco friendly,natural solutions,sustainable cleaning",https://www.beacleaner.com/how-to-clean-a-double-pane-window?utm_source=pinterest&utm_campaign=eco-friendly-window-,2025-04-30,green cleaning,https://www.beacleaner.com/how-to-clean-a-double-pane-window
How Often Should You Clean Windows?,https://res.cloudinary.com/dbcpfy04c/image/upload/v1618237451/placeholder.jpg,home-inspiration,,"Don't guess – know! This pin provides a guide to how often you should clean your double-pane windows, based on your location and lifestyle. Maintain a consistently sparkling view! 🗓️ Click to learn more! #cleaningfrequency #windowcleaning #cleaningroutine #homecare,cleaning schedule,window routine,home maintenance",https://www.beacleaner.com/how-to-clean-a-double-pane-window?utm_source=pinterest&utm_campaign=how-often-should-you,2025-04-30,cleaning frequency,https://www.beacleaner.com/how-to-clean-a-double-pane-window
Troubleshooting Common Window Problems,https://res.cloudinary.com/dbcpfy04c/image/upload/v1618237451/placeholder.jpg,home-inspiration,,"Facing a window cleaning challenge? This pin tackles common problems like stubborn grime, water spots, and streaks, offering targeted solutions. Don't give up – we can help! 🔍 Click to learn more! #windowproblems #windowcleaning #troubleshooting #cleaningtips,window issues,cleaning solutions,problem solving",https://www.beacleaner.com/how-to-clean-a-double-pane-window?utm_source=pinterest&utm_campaign=troubleshooting-comm,2025-04-30,cleaning guide,https://www.beacleaner.com/how-to-clean-a-double-pane-window
The Benefits of Clean Windows,https://res.cloudinary.com/dbcpfy04c/image/upload/v1618237451/placeholder.jpg,home-inspiration,,"More than just aesthetics! This pin highlights the benefits of clean double-pane windows, from increased natural light to improved energy efficiency. A clean home is a healthier home! ☀️ Click to learn more! #cleanwindows #homebenefits #energyefficiency #healthyliving,window benefits,energy saving,natural light",https://www.beacleaner.com/how-to-clean-a-double-pane-window?utm_source=pinterest&utm_campaign=the-benefits-of-clea,2025-04-30,home health,https://www.beacleaner.com/how-to-clean-a-double-pane-window
DIY Window Cleaning Spray Recipe,https://res.cloudinary.com/dbcpfy04c/image/upload/v1618237451/placeholder.jpg,home-inspiration,,"Make your own powerful window cleaning spray! This pin provides a simple, effective recipe using ingredients you likely already have. Save money and enjoy sparkling results. 🍋 Click to learn more! #diyrecipe #windowcleaning #homemadecleaner #cleaninghacks,diy spray,homemade recipe,cleaning hacks",https://www.beacleaner.com/how-to-clean-a-double-pane-window?utm_source=pinterest&utm_campaign=diy-window-cleaning-,2025-04-30,window solution,https://www.beacleaner.com/how-to-clean-a-double-pane-window
Step-by-Step Window Cleaning Guide,https://res.cloudinary.com/dbcpfy04c/image/upload/v1618237451/placeholder.jpg,home-inspiration,,"Follow along with our easy-to-follow, step-by-step guide to cleaning your double-pane windows. We'll walk you through every stage, ensuring a perfect finish. Let's get cleaning! 🧼 Click to learn more! #stepbystep #windowcleaning #cleaningguide #easycleaning,step by step,cleaning guide,easy instructions",https://www.beacleaner.com/how-to-clean-a-double-pane-window?utm_source=pinterest&utm_campaign=step-by-step-window-,2025-04-30,beginner friendly,https://www.beacleaner.com/how-to-clean-a-double-pane-window
Title,https://res.cloudinary.com/dbcpfy04c/image/upload/v1618237451/placeholder.jpg,home-inspiration,,Description,https://www.beacleaner.com/how-to-clean-a-farber-ware-deep-fryer?utm_source=pinterest&utm_campaign=title,2025-04-30,Keywords,https://www.beacleaner.com/how-to-clean-a-farber-ware-deep-fryer
Deep Fryer Rescue! ✨,https://res.cloudinary.com/ddxyyzkuq/image/upload/v1746051976/pin_6_2_citvej.webp,kitchen-ideas,,"Is your Farberware deep fryer looking grimy? Don't replace it! This guide walks you through a sparkling clean, step-by-step. We cover everything from disassembly to tackling stubborn grease. Reclaim your crispy, delicious fried foods! A clean fryer means healthier, tastier meals for your family. Click to learn how to safely and effectively clean your Farberware deep fryer and extend its life! #Farberware #DeepFryer #CleaningTips #KitchenHacks,Farberware,Deep Fryer,Cleaning",https://www.beacleaner.com/how-to-clean-a-farber-ware-deep-fryer?utm_source=pinterest&utm_campaign=deep-fryer-rescue,2025-04-30,Kitchen,https://www.beacleaner.com/how-to-clean-a-farber-ware-deep-fryer
Sparkling Clean Fryer - Easy Guide!,https://res.cloudinary.com/dbcpfy04c/image/upload/v1618237451/placeholder.jpg,home-inspiration,,"Don't let a dirty deep fryer ruin your next cookout! This easy-to-follow guide shows you how to clean your Farberware deep fryer like a pro. Say goodbye to burnt oil and hello to perfectly fried goodness. We'll help you avoid common mistakes and keep your fryer in top condition.  Enjoy stress-free frying again! Click to read now and get frying! #DeepFryerCleaning #FarberwareFryer #KitchenCleaning #HomeHacks,Deep Fryer,Farberware,Cleaning Guide",https://www.beacleaner.com/how-to-clean-a-farber-ware-deep-fryer?utm_source=pinterest&utm_campaign=sparkling-clean-frye,2025-04-30,Kitchen Hacks,https://www.beacleaner.com/how-to-clean-a-farber-ware-deep-fryer
Farberware Fryer: Cleaning Secrets!,https://res.cloudinary.com/dbcpfy04c/image/upload/v1618237451/placeholder.jpg,home-inspiration,,"Unlock the secrets to a spotless Farberware deep fryer! This post reveals the best cleaning methods, including natural solutions and how to handle tough grease buildup.  Imagine enjoying perfectly crispy fries without worrying about a dirty appliance.  Don't let grime stand between you and delicious food! Click to learn more! #FarberwareCleaning #DeepFryerTips #KitchenMaintenance #CleaningMotivation,Farberware,Deep Fryer,Cleaning Secrets",https://www.beacleaner.com/how-to-clean-a-farber-ware-deep-fryer?utm_source=pinterest&utm_campaign=farberware-fryer-cle,2025-04-30,Kitchen Maintenance,https://www.beacleaner.com/how-to-clean-a-farber-ware-deep-fryer
Grease-Free Fryer in Under 30 Mins!,https://res.cloudinary.com/dbcpfy04c/image/upload/v1618237451/placeholder.jpg,home-inspiration,,"Short on time? You can still have a sparkling clean Farberware deep fryer! This guide provides a quick and effective cleaning routine that fits into your busy schedule.  Don't sacrifice flavor for cleanliness – have both!  Click to learn our time-saving tips and enjoy delicious fried food guilt-free. #QuickCleaning #DeepFryerHack #FarberwareTips #KitchenEfficiency,Deep Fryer,Quick Clean,Farberware",https://www.beacleaner.com/how-to-clean-a-farber-ware-deep-fryer?utm_source=pinterest&utm_campaign=grease-free-fryer-in,2025-04-30,Kitchen Efficiency,https://www.beacleaner.com/how-to-clean-a-farber-ware-deep-fryer
Extend Your Fryer's Life!,https://res.cloudinary.com/dbcpfy04c/image/upload/v1618237451/placeholder.jpg,home-inspiration,,"Want to keep your Farberware deep fryer working like new for years to come? Proper cleaning is key! This guide shows you how to prevent damage, avoid costly repairs, and maximize the lifespan of your appliance. Invest in your kitchen and enjoy delicious fried foods for longer! Click to learn how! #FryerMaintenance #FarberwareCare #KitchenAppliances #LongLasting,Fryer Maintenance,Farberware,Appliance Care",https://www.beacleaner.com/how-to-clean-a-farber-ware-deep-fryer?utm_source=pinterest&utm_campaign=extend-your-fryers-l,2025-04-30,Kitchen Appliances,https://www.beacleaner.com/how-to-clean-a-farber-ware-deep-fryer
DIY Deep Fryer Cleaning Solution!,https://res.cloudinary.com/dbcpfy04c/image/upload/v1618237451/placeholder.jpg,home-inspiration,,"Skip the harsh chemicals! This post shares a simple, DIY cleaning solution for your Farberware deep fryer using ingredients you probably already have.  Safe for your family and effective on grease.  Enjoy peace of mind knowing you're cleaning with natural ingredients. Click to learn the recipe! #DIYCleaning #NaturalCleaning #DeepFryer #Farberware,DIY Cleaning,Natural Cleaning,Deep Fryer",https://www.beacleaner.com/how-to-clean-a-farber-ware-deep-fryer?utm_source=pinterest&utm_campaign=diy-deep-fryer-clean,2025-04-30,Farberware,https://www.beacleaner.com/how-to-clean-a-farber-ware-deep-fryer
The Ultimate Farberware Guide!,https://res.cloudinary.com/dbcpfy04c/image/upload/v1618237451/placeholder.jpg,home-inspiration,,"Everything you need to know about cleaning your Farberware deep fryer is right here! From disassembly to reassembly, we've got you covered.  Don't be intimidated – cleaning your fryer is easier than you think!  Click to read the ultimate guide and enjoy perfectly fried food. #FarberwareGuide #DeepFryerCleaning #KitchenTips #HomeCooking,Farberware,Deep Fryer,Cleaning Guide",https://www.beacleaner.com/how-to-clean-a-farber-ware-deep-fryer?utm_source=pinterest&utm_campaign=the-ultimate-farberw,2025-04-30,Kitchen Tips,https://www.beacleaner.com/how-to-clean-a-farber-ware-deep-fryer
Say Goodbye to Burnt Oil Smell!,https://res.cloudinary.com/dbcpfy04c/image/upload/v1618237451/placeholder.jpg,home-inspiration,,"Is the smell of burnt oil lingering in your kitchen? This guide shows you how to eliminate odors and leave your Farberware deep fryer smelling fresh and clean.  Enjoy cooking without the unpleasant after-effects. Click to learn our odor-busting tips! #OdorRemoval #DeepFryerCleaning #KitchenSmells #FreshKitchen,Odor Removal,Deep Fryer,Kitchen Smells",https://www.beacleaner.com/how-to-clean-a-farber-ware-deep-fryer?utm_source=pinterest&utm_campaign=say-goodbye-to-burnt,2025-04-30,Fresh Kitchen,https://www.beacleaner.com/how-to-clean-a-farber-ware-deep-fryer
Deep Fryer Cleaning Checklist!,https://res.cloudinary.com/dbcpfy04c/image/upload/v1618237451/placeholder.jpg,home-inspiration,,"Stay organized with our handy deep fryer cleaning checklist! This printable guide ensures you never miss a step when cleaning your Farberware appliance.  A clean fryer is a happy fryer! Click to download the checklist and simplify your cleaning routine. #CleaningChecklist #DeepFryer #Farberware #KitchenOrganization,Cleaning Checklist,Deep Fryer,Farberware",https://www.beacleaner.com/how-to-clean-a-farber-ware-deep-fryer?utm_source=pinterest&utm_campaign=deep-fryer-cleaning-,2025-04-30,Kitchen Organization,https://www.beacleaner.com/how-to-clean-a-farber-ware-deep-fryer
Farberware Deep Fryer: Before & After!,https://res.cloudinary.com/dbcpfy04c/image/upload/v1618237451/placeholder.jpg,home-inspiration,,"See the amazing results! This post features stunning before-and-after photos of a thoroughly cleaned Farberware deep fryer.  Get inspired to tackle your own cleaning project and enjoy a sparkling appliance. Click to see the transformation! #BeforeAndAfter #DeepFryerCleaning #Farberware #KitchenTransformation,Before and After,Deep Fryer,Farberware",https://www.beacleaner.com/how-to-clean-a-farber-ware-deep-fryer?utm_source=pinterest&utm_campaign=farberware-deep-frye,2025-04-30,Kitchen Transformation,https://www.beacleaner.com/how-to-clean-a-farber-ware-deep-fryer
Troubleshooting Fryer Cleaning!,https://res.cloudinary.com/dbcpfy04c/image/upload/v1618237451/placeholder.jpg,home-inspiration,,"Struggling with stubborn grease or a specific cleaning issue? This post addresses common problems and provides solutions for cleaning your Farberware deep fryer.  Don't give up – we're here to help! Click to find the answer to your cleaning dilemma. #Troubleshooting #DeepFryerCleaning #FarberwareHelp #KitchenSolutions,Troubleshooting,Deep Fryer,Farberware",https://www.beacleaner.com/how-to-clean-a-farber-ware-deep-fryer?utm_source=pinterest&utm_campaign=troubleshooting-frye,2025-04-30,Kitchen Solutions,https://www.beacleaner.com/how-to-clean-a-farber-ware-deep-fryer
Safe Deep Fryer Cleaning Steps!,https://res.cloudinary.com/dbcpfy04c/image/upload/v1618237451/placeholder.jpg,home-inspiration,,"Safety first! This guide emphasizes the importance of safe cleaning practices when working with your Farberware deep fryer.  Protect yourself and your appliance with our expert advice. Click to learn how to clean safely and effectively. #SafeCleaning #DeepFryerSafety #Farberware #KitchenSafety,Safe Cleaning,Deep Fryer,Farberware",https://www.beacleaner.com/how-to-clean-a-farber-ware-deep-fryer?utm_source=pinterest&utm_campaign=safe-deep-fryer-clea,2025-04-30,Kitchen Safety,https://www.beacleaner.com/how-to-clean-a-farber-ware-deep-fryer
The Secret to a Spotless Basket!,https://res.cloudinary.com/dbcpfy04c/image/upload/v1618237451/placeholder.jpg,home-inspiration,,"Don't forget the basket! This post focuses on cleaning the often-overlooked deep fryer basket, ensuring every part of your Farberware appliance is sparkling clean.  A clean basket means cleaner food! Click to learn our basket-cleaning tips. #FryerBasket #DeepFryerCleaning #Farberware #KitchenDetails,Fryer Basket,Deep Fryer,Farberware",https://www.beacleaner.com/how-to-clean-a-farber-ware-deep-fryer?utm_source=pinterest&utm_campaign=the-secret-to-a-spot,2025-04-30,Kitchen Details,https://www.beacleaner.com/how-to-clean-a-farber-ware-deep-fryer
Preventative Cleaning for Fryers!,https://res.cloudinary.com/dbcpfy04c/image/upload/v1618237451/placeholder.jpg,home-inspiration,,"Don't wait until your Farberware deep fryer is a mess! This post outlines a preventative cleaning routine to keep your appliance in top condition.  A little maintenance goes a long way. Click to learn how to prevent grease buildup and extend your fryer's life. #PreventativeCleaning #DeepFryer #Farberware #KitchenMaintenance,Preventative Cleaning,Deep Fryer,Farberware",https://www.beacleaner.com/how-to-clean-a-farber-ware-deep-fryer?utm_source=pinterest&utm_campaign=preventative-cleanin,2025-04-30,Kitchen Maintenance,https://www.beacleaner.com/how-to-clean-a-farber-ware-deep-fryer
