Title,Media URL,Pinterest board,Thumbnail,Description,Link,Publish date,Keywords,Source URL
Indoor Doormat Deep Clean,https://res.cloudinary.com/dbcpfy04c/image/upload/v1618237451/placeholder.jpg,home-inspiration,,"Don't forget your indoor doormats! They trap just as much dirt. This guide provides gentle yet effective cleaning methods for indoor mats, protecting delicate fibers and keeping your floors spotless.  A clean home starts at the door! Click to learn how. ✨ #indoor doormat #cleaning #homemaintenance #cleanfloors,indoor,doormat,cleaning",https://www.beacleaner.com/how-to-clean-a-doormat?utm_source=pinterest&utm_campaign=indoor-doormat-deep-,2025-04-30,floors,https://www.beacleaner.com/how-to-clean-a-doormat
Outdoor Doormat Revival,https://res.cloudinary.com/dbcpfy04c/image/upload/v1618237451/placeholder.jpg,home-inspiration,,"Is your outdoor doormat covered in leaves and grime?  Give it a new lease on life with our easy cleaning guide! We cover everything from power washing to hand washing.  Make a great first impression with a welcoming entryway. Click to learn more! 🍂 #outdoor doormat #cleaning #fallcleaning #entryway,outdoor,doormat,cleaning",https://www.beacleaner.com/how-to-clean-a-doormat?utm_source=pinterest&utm_campaign=outdoor-doormat-revi,2025-04-30,fall,https://www.beacleaner.com/how-to-clean-a-doormat
DIY Doormat Cleaning Solution,https://res.cloudinary.com/dbcpfy04c/image/upload/v1618237451/placeholder.jpg,home-inspiration,,"Skip the harsh chemicals! This post shares a simple, effective DIY cleaning solution for your doormats.  Safe for your family, pets, and the environment.  Get a sparkling clean doormat without breaking the bank. Click for the recipe! 🌿 #DIYcleaning #naturalcleaning #doormat #ecofriendly,DIY,cleaning,doormat",https://www.beacleaner.com/how-to-clean-a-doormat?utm_source=pinterest&utm_campaign=diy-doormat-cleaning,2025-04-30,natural,https://www.beacleaner.com/how-to-clean-a-doormat
How Often to Clean Your Doormat?,https://res.cloudinary.com/dbcpfy04c/image/upload/v1618237451/placeholder.jpg,home-inspiration,,"Wondering how often you should clean your doormat? We break it down based on foot traffic and weather conditions.  Keep your home cleaner with a simple cleaning schedule.  Don't let dirt build up! Click to learn more. 🗓️ #cleaning schedule #doormat #home maintenance #cleaningtips,schedule,doormat,cleaning",https://www.beacleaner.com/how-to-clean-a-doormat?utm_source=pinterest&utm_campaign=how-often-to-clean-y,2025-04-30,maintenance,https://www.beacleaner.com/how-to-clean-a-doormat
Doormat Cleaning: Before & After,https://res.cloudinary.com/dbcpfy04c/image/upload/v1618237451/placeholder.jpg,home-inspiration,,"See the amazing transformation! This post features stunning before & after photos of dirty doormats brought back to life.  Get inspired to tackle your own cleaning project.  You'll be amazed at the difference! Click to see the results. ✨ #beforeandafter #doormatcleaning #cleaningmotivation #homeimprovement,before,after,doormat",https://www.beacleaner.com/how-to-clean-a-doormat?utm_source=pinterest&utm_campaign=doormat-cleaning-bef,2025-04-30,cleaning,https://www.beacleaner.com/how-to-clean-a-doormat
Extend Your Doormat's Life,https://res.cloudinary.com/dbcpfy04c/image/upload/v1618237451/placeholder.jpg,home-inspiration,,"Want to keep your doormat looking new for longer? This post shares tips on proper care and maintenance, preventing wear and tear.  Save money and enjoy a beautiful entryway for years to come. Click to learn how! ⏳ #doormat care #home maintenance #cleaningtips #longevity,care,doormat,cleaning",https://www.beacleaner.com/how-to-clean-a-doormat?utm_source=pinterest&utm_campaign=extend-your-doormats,2025-04-30,maintenance,https://www.beacleaner.com/how-to-clean-a-doormat
Cleaning a Muddy Doormat,https://res.cloudinary.com/dbcpfy04c/image/upload/v1618237451/placeholder.jpg,home-inspiration,,"Muddy paws? No problem! This guide provides specific instructions for cleaning muddy doormats, removing stubborn dirt and preventing stains.  Keep your floors clean and your doormat looking fresh. Click to learn more! 🐾 #muddydoormat #cleaning #petowners #homecleaning,mud,doormat,cleaning",https://www.beacleaner.com/how-to-clean-a-doormat?utm_source=pinterest&utm_campaign=cleaning-a-muddy-doo,2025-04-30,pets,https://www.beacleaner.com/how-to-clean-a-doormat
Quick 5-Minute Doormat Clean,https://res.cloudinary.com/dbcpfy04c/image/upload/v1618237451/placeholder.jpg,home-inspiration,,"Short on time? This post shows you how to give your doormat a quick refresh in just 5 minutes!  Perfect for busy schedules.  A little effort goes a long way. Click to learn the speedy method! ⏱️ #quickcleaning #doormat #homehacks #busylife,quick,doormat,cleaning",https://www.beacleaner.com/how-to-clean-a-doormat?utm_source=pinterest&utm_campaign=quick-5-minute-doorm,2025-04-30,hacks,https://www.beacleaner.com/how-to-clean-a-doormat
Deep Cleaning a Stinky Doormat,https://res.cloudinary.com/dbcpfy04c/image/upload/v1618237451/placeholder.jpg,home-inspiration,,"Is your doormat smelling less than fresh? This post tackles odor removal, leaving your entryway smelling clean and inviting.  Say goodbye to unpleasant smells! Click to learn the secret. 👃 #odorremoval #doormatcleaning #freshhome #cleaningtips,odor,doormat,cleaning",https://www.beacleaner.com/how-to-clean-a-doormat?utm_source=pinterest&utm_campaign=deep-cleaning-a-stin,2025-04-30,fresh,https://www.beacleaner.com/how-to-clean-a-doormat
Doormat Cleaning Tools You Need,https://res.cloudinary.com/dbcpfy04c/image/upload/v1618237451/placeholder.jpg,home-inspiration,,"Don't waste time with the wrong tools! This post lists the essential cleaning supplies for your doormat, making the job easier and more effective.  Get equipped for success! Click to see the list. 🧰 #cleaningtools #doormat #homecleaning #essentials,tools,doormat,cleaning",https://www.beacleaner.com/how-to-clean-a-doormat?utm_source=pinterest&utm_campaign=doormat-cleaning-too,2025-04-30,essentials,https://www.beacleaner.com/how-to-clean-a-doormat
Protect Your Floors: Clean Mats!,https://res.cloudinary.com/dbcpfy04c/image/upload/v1618237451/placeholder.jpg,home-inspiration,,"Dirty doormats track dirt and grime into your home. This post explains how cleaning your doormat protects your floors and keeps your home healthier.  Invest in a clean home! Click to learn more. 🏡 #floorprotection #doormat #homehealth #cleaning,floor,doormat,cleaning",https://www.beacleaner.com/how-to-clean-a-doormat?utm_source=pinterest&utm_campaign=protect-your-floors-,2025-04-30,health,https://www.beacleaner.com/how-to-clean-a-doormat
The Best Way to Dry a Doormat,https://res.cloudinary.com/dbcpfy04c/image/upload/v1618237451/placeholder.jpg,home-inspiration,,"Don't ruin your doormat by drying it incorrectly! This post shares the best methods for drying your doormat quickly and effectively, preventing mildew and damage.  Click for expert advice! ☀️ #dryingtips #doormat #homecleaning #cleaninghacks,drying,doormat,cleaning",https://www.beacleaner.com/how-to-clean-a-doormat?utm_source=pinterest&utm_campaign=the-best-way-to-dry-,2025-04-30,hacks,https://www.beacleaner.com/how-to-clean-a-doormat
Doormat Cleaning Mistakes to Avoid,https://res.cloudinary.com/dbcpfy04c/image/upload/v1618237451/placeholder.jpg,home-inspiration,,"Avoid these common doormat cleaning mistakes! This post highlights what *not* to do, protecting your mat and ensuring a thorough clean.  Learn from our mistakes! Click to read more. ⚠️ #cleaningmistakes #doormat #homecleaning #avoidthese,mistakes,doormat,cleaning",https://www.beacleaner.com/how-to-clean-a-doormat?utm_source=pinterest&utm_campaign=doormat-cleaning-mis,2025-04-30,avoid,https://www.beacleaner.com/how-to-clean-a-doormat
Cleaning a Vintage Doormat,https://res.cloudinary.com/dbcpfy04c/image/upload/v1618237451/placeholder.jpg,home-inspiration,,"Have a beautiful vintage doormat? This post provides gentle cleaning instructions for delicate vintage mats, preserving their charm and beauty.  Protect your heirloom! Click to learn more. 🕰️ #vintagedoormat #cleaning #antiques #homedecor,vintage,doormat,cleaning",https://www.beacleaner.com/how-to-clean-a-doormat?utm_source=pinterest&utm_campaign=cleaning-a-vintage-d,2025-04-30,antique,https://www.beacleaner.com/how-to-clean-a-doormat
Power Washing Your Doormat?,https://res.cloudinary.com/dbcpfy04c/image/upload/v1618237451/placeholder.jpg,home-inspiration,,"Can you power wash your doormat? This post answers that question and provides instructions for safely power washing certain types of mats.  Get a deep clean quickly! Click to learn more. 💦 #powerwashing #doormat #cleaning #deepclean,powerwash,doormat,cleaning",https://www.beacleaner.com/how-to-clean-a-doormat?utm_source=pinterest&utm_campaign=power-washing-your-d,2025-04-30,deep,https://www.beacleaner.com/how-to-clean-a-doormat
Doormat Cleaning for Allergy Sufferers,https://res.cloudinary.com/dbcpfy04c/image/upload/v1618237451/placeholder.jpg,home-inspiration,,"Allergies got you down? This post explains how cleaning your doormat can reduce allergens in your home, creating a healthier living environment.  Breathe easier! Click to learn more. 🤧 #allergies #doormat #cleaning #healthyliving,allergies,doormat,cleaning",https://www.beacleaner.com/how-to-clean-a-doormat?utm_source=pinterest&utm_campaign=doormat-cleaning-for,2025-04-30,health,https://www.beacleaner.com/how-to-clean-a-doormat
Choosing the Right Doormat Material,https://res.cloudinary.com/dbcpfy04c/image/upload/v1618237451/placeholder.jpg,home-inspiration,,"The material of your doormat impacts how you clean it. This post discusses different doormat materials and their cleaning requirements.  Make the right choice! Click to learn more. 🌿 #doormatmaterial #cleaning #homeimprovement #choosing,material,doormat,cleaning",https://www.beacleaner.com/how-to-clean-a-doormat?utm_source=pinterest&utm_campaign=choosing-the-right-d,2025-04-30,choosing,https://www.beacleaner.com/how-to-clean-a-doormat
Easy Doormat Cleaning Routine,https://res.cloudinary.com/dbcpfy04c/image/upload/v1618237451/placeholder.jpg,home-inspiration,,"Establish a simple doormat cleaning routine to keep your entryway looking its best. This post provides a step-by-step guide to regular maintenance.  Consistency is key! Click to learn more. 🗓️ #cleaningroutine #doormat #homecleaning #maintenance,routine,doormat,cleaning",https://www.beacleaner.com/how-to-clean-a-doormat?utm_source=pinterest&utm_campaign=easy-doormat-cleanin,2025-04-30,maintenance,https://www.beacleaner.com/how-to-clean-a-doormat
Doormat Cleaning: Pet Hair Removal,https://res.cloudinary.com/dbcpfy04c/image/upload/v1618237451/placeholder.jpg,home-inspiration,,"Pet hair everywhere? This post shares effective methods for removing pet hair from your doormat, keeping your home cleaner and your furry friends happy.  Say goodbye to pet hair! 🐾 #pethair #doormatcleaning #petowners #homecleaning,pet,hair,doormat",https://www.beacleaner.com/how-to-clean-a-doormat?utm_source=pinterest&utm_campaign=doormat-cleaning-pet,2025-04-30,cleaning,https://www.beacleaner.com/how-to-clean-a-doormat
Save Money: Clean,https://res.cloudinary.com/dbcpfy04c/image/upload/v1618237451/placeholder.jpg,home-inspiration,,"Don't Replace!,Why replace a dirty doormat when you can easily clean it? This post highlights the cost savings of cleaning versus replacing, and provides a comprehensive cleaning guide.  Save money and the planet! 🌎 #savemoney #doormat #cleaning #sustainableliving,save,money,doormat",https://www.beacleaner.com/how-to-clean-a-doormat?utm_source=pinterest&utm_campaign=save-money-clean,2025-04-30,sustainable,https://www.beacleaner.com/how-to-clean-a-doormat
Title,https://res.cloudinary.com/dbcpfy04c/image/upload/v1618237451/placeholder.jpg,home-inspiration,,Description,https://www.beacleaner.com/how-to-clean-a-double-glass-window?utm_source=pinterest&utm_campaign=title,2025-04-30,Keywords,https://www.beacleaner.com/how-to-clean-a-double-glass-window
Sparkling Windows: Your Guide!,https://res.cloudinary.com/dbcpfy04c/image/upload/v1618237451/placeholder.jpg,home-inspiration,,"Tired of streaks and grime on your double-glass windows? This guide breaks down the *easy* steps to achieve crystal-clear views! Learn the best cleaning solutions (vinegar & water are your friends!), the right tools",https://www.beacleaner.com/how-to-clean-a-double-glass-window?utm_source=pinterest&utm_campaign=sparkling-windows-yo,2025-04-30,and pro tips for tackling tough spots. Don't let dirty windows dim your day – reclaim your sunshine and enjoy a brighter home! Click to learn how to make your windows shine like new. ✨ #windowcleaning #doubleglazing #cleaningtips #homehacks #sparklingclean,https://www.beacleaner.com/how-to-clean-a-double-glass-window
Double Window Cleaning Secrets,https://res.cloudinary.com/dbcpfy04c/image/upload/v1618237451/placeholder.jpg,home-inspiration,,Unlock the secrets to flawlessly clean double-glass windows! This post reveals how to avoid common mistakes (like using paper towels!) and achieve a streak-free finish *every* time. We cover everything from initial cleaning to maintaining that sparkle. Imagine enjoying a beautiful,https://www.beacleaner.com/how-to-clean-a-double-glass-window?utm_source=pinterest&utm_campaign=double-window-cleani,2025-04-30,unobstructed view – it's easier than you think! Read now and say goodbye to window woes! 🏡 #windowcleaningtips #cleanhome #doublepanewindows #homeimprovement,https://www.beacleaner.com/how-to-clean-a-double-glass-window
Streak-Free Windows: The DIY Way,https://res.cloudinary.com/dbcpfy04c/image/upload/v1618237451/placeholder.jpg,home-inspiration,,"Dreaming of sparkling, streak-free windows? This guide shows you how to achieve professional-level results *without* expensive cleaners! Learn a simple DIY solution that's gentle on your windows and the environment. Plus",https://www.beacleaner.com/how-to-clean-a-double-glass-window?utm_source=pinterest&utm_campaign=streak-free-windows-,2025-04-30,discover the best techniques for cleaning between the panes. A clean view can instantly lift your mood – let's get started! ☀️ #diycleaning #windowcleaning #ecofriendlycleaning #homecleaning,https://www.beacleaner.com/how-to-clean-a-double-glass-window
Cleaning Double Windows: A Step-by-Step,https://res.cloudinary.com/dbcpfy04c/image/upload/v1618237451/placeholder.jpg,home-inspiration,,Overwhelmed by double-glass windows? Don't be! This step-by-step guide makes the process simple and manageable. We'll walk you through each stage,https://www.beacleaner.com/how-to-clean-a-double-glass-window?utm_source=pinterest&utm_campaign=cleaning-double-wind,2025-04-30,from prepping your supplies to the final polish. Enjoy the satisfaction of a spotless home and a brighter outlook. Click to read and transform your windows today! 🪟 #windowcleaningguide #stepbystepcleaning #cleanwindows #homecare,https://www.beacleaner.com/how-to-clean-a-double-glass-window
Vinegar & Water: Window Magic!,https://res.cloudinary.com/dbcpfy04c/image/upload/v1618237451/placeholder.jpg,home-inspiration,,"Did you know vinegar and water can be a window cleaning *powerhouse*? This post explains how to harness their cleaning abilities for sparkling double-glass windows. It's a budget-friendly, eco-friendly",https://www.beacleaner.com/how-to-clean-a-double-glass-window?utm_source=pinterest&utm_campaign=vinegar-water-window,2025-04-30,and effective solution! Say goodbye to harsh chemicals and hello to a naturally clean home. Learn more now! 🌿 #vinegarcleaning #naturalcleaning #windowcleaning #ecocleaning,https://www.beacleaner.com/how-to-clean-a-double-glass-window
The Ultimate Window Cleaning Checklist,https://res.cloudinary.com/dbcpfy04c/image/upload/v1618237451/placeholder.jpg,home-inspiration,,"Don't start cleaning your double-glass windows without this checklist! We've compiled everything you need – supplies, techniques, and a schedule to keep your windows sparkling year-round. A clean home is a happy home",https://www.beacleaner.com/how-to-clean-a-double-glass-window?utm_source=pinterest&utm_campaign=the-ultimate-window-,2025-04-30,and it all starts with clear windows. Download the checklist and get cleaning! ✅ #cleaningchecklist #windowcleaning #homeorganization #cleaningroutine,https://www.beacleaner.com/how-to-clean-a-double-glass-window
Pro Tips for Sparkling Windows,https://res.cloudinary.com/dbcpfy04c/image/upload/v1618237451/placeholder.jpg,home-inspiration,,"Want to clean your double-glass windows like a pro? This post shares insider tips and tricks for achieving a streak-free, sparkling finish. From the right tools to the best techniques",https://www.beacleaner.com/how-to-clean-a-double-glass-window?utm_source=pinterest&utm_campaign=pro-tips-for-sparkli,2025-04-30,we've got you covered. Impress your guests and enjoy a beautiful view! ✨ #protips #windowcleaning #cleaninghacks #homeimprovement,https://www.beacleaner.com/how-to-clean-a-double-glass-window
Double Window Cleaning: Avoid These!,https://res.cloudinary.com/dbcpfy04c/image/upload/v1618237451/placeholder.jpg,home-inspiration,,"Avoid these common mistakes when cleaning your double-glass windows! This post highlights the pitfalls that can lead to streaks, scratches, and frustration. Learn what *not* to do and achieve a flawless finish every time. Save time, money",https://www.beacleaner.com/how-to-clean-a-double-glass-window?utm_source=pinterest&utm_campaign=double-window-cleani,2025-04-30,and your sanity! 🚫 #windowcleaningmistakes #cleaningtips #doubleglazing #homecare,https://www.beacleaner.com/how-to-clean-a-double-glass-window
DIY Window Cleaner Recipes,https://res.cloudinary.com/dbcpfy04c/image/upload/v1618237451/placeholder.jpg,home-inspiration,,"Skip the store-bought cleaners and make your own! This post provides several DIY window cleaner recipes using simple, natural ingredients. They're effective, eco-friendly",https://www.beacleaner.com/how-to-clean-a-double-glass-window?utm_source=pinterest&utm_campaign=diy-window-cleaner-r,2025-04-30,and budget-friendly. Enjoy a sparkling clean home without harsh chemicals. 🍋 #diywindowcleaner #naturalcleaning #windowcleaning #homemadecleaner,https://www.beacleaner.com/how-to-clean-a-double-glass-window
The Best Tools for Window Cleaning,https://res.cloudinary.com/dbcpfy04c/image/upload/v1618237451/placeholder.jpg,home-inspiration,,Equip yourself for success! This post reviews the best tools for cleaning double-glass windows,https://www.beacleaner.com/how-to-clean-a-double-glass-window?utm_source=pinterest&utm_campaign=the-best-tools-for-w,2025-04-30,from squeegees to microfiber cloths. Invest in the right tools and make the job easier and more effective. A little investment goes a long way! 🛠️ #windowcleaningtools #cleaningessentials #homecleaning #doublepanewindows,https://www.beacleaner.com/how-to-clean-a-double-glass-window
Quick Window Cleaning Routine,https://res.cloudinary.com/dbcpfy04c/image/upload/v1618237451/placeholder.jpg,home-inspiration,,Short on time? This post provides a quick and easy window cleaning routine for busy homeowners. Maintain sparkling windows with minimal effort. A clean view can brighten your day,https://www.beacleaner.com/how-to-clean-a-double-glass-window?utm_source=pinterest&utm_campaign=quick-window-cleanin,2025-04-30,even when you're short on time! ⏱️ #quickcleaning #windowcleaning #homecleaningroutine #busylife,https://www.beacleaner.com/how-to-clean-a-double-glass-window
Cleaning After Construction,https://res.cloudinary.com/dbcpfy04c/image/upload/v1618237451/placeholder.jpg,home-inspiration,,"Just finished a renovation? This post provides a guide to cleaning double-glass windows after construction, removing dust, paint splatters",https://www.beacleaner.com/how-to-clean-a-double-glass-window?utm_source=pinterest&utm_campaign=cleaning-after-const,2025-04-30,and other debris. Restore your view and enjoy your newly renovated home! 🔨 #postconstructioncleaning #windowcleaning #homeimprovement #renovation,https://www.beacleaner.com/how-to-clean-a-double-glass-window
The Science of Streak-Free Windows,https://res.cloudinary.com/dbcpfy04c/image/upload/v1618237451/placeholder.jpg,home-inspiration,,"Ever wonder *why* some window cleaners leave streaks? This post delves into the science behind streak-free cleaning, explaining the role of water hardness, surfactants",https://www.beacleaner.com/how-to-clean-a-double-glass-window?utm_source=pinterest&utm_campaign=the-science-of-strea,2025-04-30,and techniques. Understand the science and achieve perfect results! 🧪 #windowcleaningscience #cleaningtips #doubleglazing #homehacks,https://www.beacleaner.com/how-to-clean-a-double-glass-window
Seasonal Window Cleaning Guide,https://res.cloudinary.com/dbcpfy04c/image/upload/v1618237451/placeholder.jpg,home-inspiration,,"Keep your windows sparkling year-round with this seasonal cleaning guide! This post provides tips for cleaning double-glass windows in spring, summer, fall",https://www.beacleaner.com/how-to-clean-a-double-glass-window?utm_source=pinterest&utm_campaign=seasonal-window-clea,2025-04-30,and winter. A little maintenance goes a long way! 🌸 #seasonalcleaning #windowcleaning #homecleaningroutine #doubleglazing,https://www.beacleaner.com/how-to-clean-a-double-glass-window
The Cost of Professional Window Cleaning,https://res.cloudinary.com/dbcpfy04c/image/upload/v1618237451/placeholder.jpg,home-inspiration,,Wondering if professional window cleaning is worth it? This post compares the cost of professional cleaning to DIY cleaning,https://www.beacleaner.com/how-to-clean-a-double-glass-window?utm_source=pinterest&utm_campaign=the-cost-of-professi,2025-04-30,helping you make an informed decision. Weigh the pros and cons and choose the best option for your needs. 💰 #professionalcleaning #windowcleaning #homeimprovement #costcomparison,https://www.beacleaner.com/how-to-clean-a-double-glass-window
Long-Lasting Window Shine: Tips,https://res.cloudinary.com/dbcpfy04c/image/upload/v1618237451/placeholder.jpg,home-inspiration,,Want your windows to stay clean longer? This post shares tips for maintaining a sparkling shine between cleanings. Prevent dust buildup and enjoy a clear view for weeks to come. Less cleaning,https://www.beacleaner.com/how-to-clean-a-double-glass-window?utm_source=pinterest&utm_campaign=long-lasting-window-,2025-04-30,more enjoying! ✨ #windowmaintenance #cleaningtips #doubleglazing #homecare,https://www.beacleaner.com/how-to-clean-a-double-glass-window
Eco-Friendly Window Cleaning Solutions,https://res.cloudinary.com/dbcpfy04c/image/upload/v1618237451/placeholder.jpg,home-inspiration,,"Go green with your window cleaning! This post provides a list of eco-friendly cleaning solutions that are safe for your family, your pets",https://www.beacleaner.com/how-to-clean-a-double-glass-window?utm_source=pinterest&utm_campaign=eco-friendly-window-,2025-04-30,and the environment. Enjoy a sparkling clean home without compromising your values. 🌎 #ecofriendlycleaning #naturalcleaning #windowcleaning #sustainableliving,https://www.beacleaner.com/how-to-clean-a-double-glass-window
Title,https://res.cloudinary.com/dbcpfy04c/image/upload/v1618237451/placeholder.jpg,home-inspiration,,Description,https://www.beacleaner.com/how-to-clean-a-double-pane-window?utm_source=pinterest&utm_campaign=title,2025-04-30,Keywords,https://www.beacleaner.com/how-to-clean-a-double-pane-window
Sparkling Windows: A Simple Guide,https://res.cloudinary.com/dbcpfy04c/image/upload/v1618237451/placeholder.jpg,home-inspiration,,"Tired of looking at dirty double-pane windows? This easy guide breaks down how to clean them *effectively* without streaks! Learn the best cleaning solutions (vinegar & water work wonders!), tools, and techniques for crystal-clear views. Don't let grime ruin your sunshine! Click to learn how to restore your windows and brighten your home. A little effort goes a long way for a HUGE impact. ✨ #windowcleaning #doublepanewindows #cleaningtips #homehacks,window cleaning,double pane,cleaning hacks",https://www.beacleaner.com/how-to-clean-a-double-pane-window?utm_source=pinterest&utm_campaign=sparkling-windows-a-,2025-04-30,home improvement,https://www.beacleaner.com/how-to-clean-a-double-pane-window
Streak-Free Windows: The Secret!,https://res.cloudinary.com/dbcpfy04c/image/upload/v1618237451/placeholder.jpg,home-inspiration,,"Say goodbye to frustrating streaks! This pin reveals the secrets to perfectly clean double-pane windows. We cover everything from prepping your solution to drying techniques that *guarantee* a sparkling finish. Imagine enjoying a beautiful, clear view without the annoyance of smudges. Click to learn more and reclaim your view! 🏡 #cleanwindows #windowcleaningtips #homecleaning #streakfree,cleaning tips,window care,double glazing",https://www.beacleaner.com/how-to-clean-a-double-pane-window?utm_source=pinterest&utm_campaign=streak-free-windows-,2025-04-30,home maintenance,https://www.beacleaner.com/how-to-clean-a-double-pane-window
