Title,Media URL,Pinterest board,Thumbnail,Description,Link,Publish date,Keywords,Source URL
Extend Your Mower's Life: Stop the Shake!,https://res.cloudinary.com/ddxyyzkuq/image/upload/v1745966078/pin_7_18_nmkvfl.webp,lawn-care-ideas,,"Want to keep your lawn mower running for years to come?  Addressing vibration issues is key!  This post provides a comprehensive guide to preventing and fixing shaking, extending the life of your valuable equipment. #lawnmowermaintenance #lawncare #gardening #longevity,lawn mower, shaking, maintenance",https://lawntrend.com/why-is-my-lawn-mower-shaking/?utm_source=pinterest&utm_campaign=extend-your-mowers-l,2025-04-29,longevity,https://lawntrend.com/why-is-my-lawn-mower-shaking/
Lawn Mower Shaking: Is it the Tires?,https://res.cloudinary.com/ddxyyzkuq/image/upload/v1745966083/pin_7_19_sk2xd0.webp,lawn-repair-ideas,,"Believe it or not, tire pressure and condition can contribute to lawn mower vibration.  We explore this often-overlooked factor and show you how to check and adjust your tires for a smoother ride. #lawnmower #lawncare #gardening #tires,lawn mower, tires, shaking",https://lawntrend.com/why-is-my-lawn-mower-shaking/?utm_source=pinterest&utm_campaign=lawn-mower-shaking-i,2025-04-29,pressure,https://lawntrend.com/why-is-my-lawn-mower-shaking/
The Ultimate Lawn Mower Vibration Checklist,https://res.cloudinary.com/ddxyyzkuq/image/upload/v1745966089/pin_7_20_sobgll.webp,lawn-care-ideas,,"Don't miss a thing! This comprehensive checklist covers all the potential causes of lawn mower vibration, ensuring you thoroughly inspect your mower and identify the problem.  Print it out and use it as a guide! #lawnmowerchecklist #lawncare #diyrepair #gardening,lawn mower, shaking, checklist",https://lawntrend.com/why-is-my-lawn-mower-shaking/?utm_source=pinterest&utm_campaign=the-ultimate-lawn-mo,2025-04-29,inspection,https://lawntrend.com/why-is-my-lawn-mower-shaking/
Lawn Mower Shaking: Before You Disassemble,https://res.cloudinary.com/ddxyyzkuq/image/upload/v1745966095/pin_7_21_adgspc.webp,lawn-repair-ideas,,"Before you start taking things apart, follow these crucial steps! This post emphasizes safety precautions and diagnostic techniques to help you pinpoint the source of the vibration before diving into repairs. #lawnmowersafety #lawncare #diyrepair #gardening,lawn mower, shaking, safety",https://lawntrend.com/why-is-my-lawn-mower-shaking/?utm_source=pinterest&utm_campaign=lawn-mower-shaking-b,2025-04-29,diagnosis,https://lawntrend.com/why-is-my-lawn-mower-shaking/
Lawn Mower Shaking: A Beginner's Guide,https://res.cloudinary.com/ddxyyzkuq/image/upload/v1745966100/pin_7_22_rp0ckh.webp,lawn-repair-ideas,,"New to lawn mower repair? No problem! This beginner-friendly guide breaks down the causes of shaking in simple terms, with clear instructions and helpful visuals.  You can do this! #lawnmowerrepair #lawncare #beginnersguide #gardening,lawn mower, shaking, beginner",https://lawntrend.com/why-is-my-lawn-mower-shaking/?utm_source=pinterest&utm_campaign=lawn-mower-shaking-a,2025-04-29,guide,https://lawntrend.com/why-is-my-lawn-mower-shaking/
Lawn Mower Shaking: Fuel System Check,https://res.cloudinary.com/ddxyyzkuq/image/upload/v1745966105/pin_7_23_vhenow.webp,lawn-repair-ideas,,"Could a fuel system issue be causing your mower to shake? We explore the connection between fuel delivery and engine vibration, and show you how to diagnose and address potential problems. #lawnmowerfuel #lawncare #diyrepair #gardening,lawn mower, fuel system, shaking",https://lawntrend.com/why-is-my-lawn-mower-shaking/?utm_source=pinterest&utm_campaign=lawn-mower-shaking-f,2025-04-29,repair,https://lawntrend.com/why-is-my-lawn-mower-shaking/
Lawn Mower Shaking: Belt Inspection Guide,https://res.cloudinary.com/ddxyyzkuq/image/upload/v1745966110/pin_7_24_kcfifp.webp,lawn-repair-ideas,,"A worn or loose belt can definitely cause vibration. Learn how to inspect your mower's belt for wear and tear, and how to replace it if necessary. A simple fix for a smoother mow! #lawnmowerbelt #lawncare #diyrepair #gardening,lawn mower, belt, shaking",https://lawntrend.com/why-is-my-lawn-mower-shaking/?utm_source=pinterest&utm_campaign=lawn-mower-shaking-b,2025-04-29,inspection,https://lawntrend.com/why-is-my-lawn-mower-shaking/
Lawn Mower Shaking: Don't Ignore These Signs!,https://res.cloudinary.com/ddxyyzkuq/image/upload/v1745966116/pin_7_25_bbe0ep.webp,lawn-repair-ideas,,"Don't let a small shake turn into a major breakdown! This post highlights the warning signs of lawn mower vibration and emphasizes the importance of addressing the issue promptly. Protect your investment! #lawnmowersafety #lawncare #gardening #preventativemaintenance,lawn mower, shaking, warning signs",https://lawntrend.com/why-is-my-lawn-mower-shaking/?utm_source=pinterest&utm_campaign=lawn-mower-shaking-d,2025-04-29,maintenance,https://lawntrend.com/why-is-my-lawn-mower-shaking/
Title,https://res.cloudinary.com/ddxyyzkuq/image/upload/v1745966166/pin_8_1_bwao2z.webp,please-provide-the-title-and-keywords-i-need-that-information-to-suggest-a-board-name-once,,Description,https://lawntrend.com/cub-cadet-rzt-l-54-hydrostatic-transmission-oil-change/?utm_source=pinterest&utm_campaign=title,2025-04-29,Keywords,https://lawntrend.com/cub-cadet-rzt-l-54-hydrostatic-transmission-oil-change/
Cub Cadet RZT L 54 Oil Change: DIY Guide,https://res.cloudinary.com/ddxyyzkuq/image/upload/v1745966196/pin_8_2_epygdb.webp,lawn-repair-ideas,,"Don't let a little maintenance turn into a big repair! This step-by-step guide shows you how to easily change the hydrostatic transmission oil in your Cub Cadet RZT L 54. Save money & keep your lawn looking its best.  We break down the process, tools needed, and oil type for a smooth, efficient change.  Protect your investment and enjoy years of reliable performance. Click to learn more and keep your mower running like new! #CubCadet #RZT54 #HydrostaticTransmission #OilChange,Cub Cadet,RZT L 54,Hydrostatic Oil",https://lawntrend.com/cub-cadet-rzt-l-54-hydrostatic-transmission-oil-change/?utm_source=pinterest&utm_campaign=cub-cadet-rzt-l-54-o,2025-04-29,DIY Mower Repair,https://lawntrend.com/cub-cadet-rzt-l-54-hydrostatic-transmission-oil-change/
RZT L 54: Hydro Oil Change - Save $$$!,https://res.cloudinary.com/ddxyyzkuq/image/upload/v1745966202/pin_8_3_nhxiow.webp,lawn-mower-ideas,,"Is your Cub Cadet RZT L 54 transmission acting sluggish? A simple oil change could be the solution!  This guide empowers you to tackle this maintenance task yourself, avoiding costly mechanic fees.  We cover everything from finding the drain plug to proper disposal.  A little effort now means a lot of savings and a happier lawn later.  Get the details and keep mowing! #LawnCare #CubCadetRZT #DIY #Maintenance,Cub Cadet,RZT L 54,Transmission Oil",https://lawntrend.com/cub-cadet-rzt-l-54-hydrostatic-transmission-oil-change/?utm_source=pinterest&utm_campaign=rzt-l-54-hydro-oil-c,2025-04-29,Lawn Mower,https://lawntrend.com/cub-cadet-rzt-l-54-hydrostatic-transmission-oil-change/
Extend Your Mower's Life: Oil Change Tips,https://res.cloudinary.com/ddxyyzkuq/image/upload/v1745966208/pin_8_4_god4m2.webp,lawn-care-ideas,,"Worried about the longevity of your Cub Cadet RZT L 54?  Regular hydrostatic transmission oil changes are *crucial*!  This guide provides expert tips and tricks to ensure a perfect oil change every time.  We'll help you avoid common mistakes and keep your mower running strong for years to come.  Don't wait until it's too late – learn how to protect your investment! #MowerMaintenance #CubCadet #LawnEquipment #DIYRepair,Mower Repair,Cub Cadet,Hydrostatic",https://lawntrend.com/cub-cadet-rzt-l-54-hydrostatic-transmission-oil-change/?utm_source=pinterest&utm_campaign=extend-your-mowers-l,2025-04-29,Lawn Care,https://lawntrend.com/cub-cadet-rzt-l-54-hydrostatic-transmission-oil-change/
Cub Cadet RZT L 54: Hydro Oil - What You Need,https://res.cloudinary.com/ddxyyzkuq/image/upload/v1745966213/pin_8_5_xt17z8.webp,lawn-repair-ideas,,"Confused about which oil to use for your Cub Cadet RZT L 54's hydrostatic transmission?  We've got you covered! This pin highlights the *exact* oil type recommended, plus all the tools you'll need for a successful oil change.  No more guesswork – just clear, concise information.  Click to read the full guide and get mowing! #OilType #CubCadet #RZT54 #HydrostaticOil,Oil Type,Cub Cadet,RZT L 54",https://lawntrend.com/cub-cadet-rzt-l-54-hydrostatic-transmission-oil-change/?utm_source=pinterest&utm_campaign=cub-cadet-rzt-l-54-h,2025-04-29,Hydrostatic Transmission,https://lawntrend.com/cub-cadet-rzt-l-54-hydrostatic-transmission-oil-change/
Easy RZT L 54 Hydro Oil Change - Step-by-Step,https://res.cloudinary.com/ddxyyzkuq/image/upload/v1745966221/pin_8_6_ts4zw7.webp,lawn-mower-ideas,,"Feeling intimidated by a hydrostatic transmission oil change? Don't be! This pin showcases the simplicity of the process with a clear, step-by-step visual guide.  We break down each stage, making it easy for even beginners to tackle.  Enjoy the satisfaction of DIY maintenance and a perfectly running mower! #DIYProject #CubCadet #LawnMower #EasyMaintenance,DIY,Cub Cadet,RZT L 54",https://lawntrend.com/cub-cadet-rzt-l-54-hydrostatic-transmission-oil-change/?utm_source=pinterest&utm_campaign=easy-rzt-l-54-hydro-,2025-04-29,Step-by-Step,https://lawntrend.com/cub-cadet-rzt-l-54-hydrostatic-transmission-oil-change/
RZT L 54 Transmission: Oil Change Checklist,https://res.cloudinary.com/ddxyyzkuq/image/upload/v1745966227/pin_8_7_kupvhh.webp,lawn-mower-ideas,,"Before you start your Cub Cadet RZT L 54 hydrostatic transmission oil change, make sure you have everything on this checklist!  We've compiled a comprehensive list of tools, materials, and safety precautions to ensure a smooth and successful process.  Don't get caught unprepared – download the full checklist in our blog post! #Checklist #CubCadet #RZT54 #LawnCareTips,Checklist,Cub Cadet,RZT L 54",https://lawntrend.com/cub-cadet-rzt-l-54-hydrostatic-transmission-oil-change/?utm_source=pinterest&utm_campaign=rzt-l-54-transmissio,2025-04-29,Maintenance,https://lawntrend.com/cub-cadet-rzt-l-54-hydrostatic-transmission-oil-change/
Keep Your Cub Cadet Running Smoothly!,https://res.cloudinary.com/ddxyyzkuq/image/upload/v1745966233/pin_8_8_x7dtb8.webp,lawn-mower-ideas,,"A smooth-running Cub Cadet RZT L 54 means a beautiful lawn!  Regular hydrostatic transmission oil changes are key to maintaining peak performance.  This pin emphasizes the importance of preventative maintenance and directs you to our detailed guide.  Invest a little time now and enjoy a hassle-free mowing experience. #LawnGoals #CubCadet #Maintenance #SmoothRide,Lawn Goals,Cub Cadet,Maintenance",https://lawntrend.com/cub-cadet-rzt-l-54-hydrostatic-transmission-oil-change/?utm_source=pinterest&utm_campaign=keep-your-cub-cadet-,2025-04-29,RZT L 54,https://lawntrend.com/cub-cadet-rzt-l-54-hydrostatic-transmission-oil-change/
RZT L 54: Hydro Oil Change - Avoid These Mistakes!,https://res.cloudinary.com/ddxyyzkuq/image/upload/v1745966238/pin_8_9_qwsbhg.webp,lawn-mower-ideas,,"Don't make these common mistakes when changing the hydrostatic transmission oil in your Cub Cadet RZT L 54!  We highlight potential pitfalls and provide solutions to ensure a perfect oil change every time.  Learn from our experience and save yourself time, money, and frustration. #CommonMistakes #CubCadet #DIYRepair #LawnTips,Common Mistakes,Cub Cadet,DIY Repair",https://lawntrend.com/cub-cadet-rzt-l-54-hydrostatic-transmission-oil-change/?utm_source=pinterest&utm_campaign=rzt-l-54-hydro-oil-c,2025-04-29,RZT L 54,https://lawntrend.com/cub-cadet-rzt-l-54-hydrostatic-transmission-oil-change/
Cub Cadet RZT L 54: Oil Change - Save Time!,https://res.cloudinary.com/ddxyyzkuq/image/upload/v1745966244/pin_8_10_jakq14.webp,lawn-repair-ideas,,"Time is precious! This guide shows you how to quickly and efficiently change the hydrostatic transmission oil in your Cub Cadet RZT L 54.  We streamline the process, providing clear instructions and helpful tips.  Get back to enjoying your lawn faster! #TimeSavingTips #CubCadet #LawnCare #QuickMaintenance,Time Saving,Cub Cadet,Lawn Care",https://lawntrend.com/cub-cadet-rzt-l-54-hydrostatic-transmission-oil-change/?utm_source=pinterest&utm_campaign=cub-cadet-rzt-l-54-o,2025-04-29,RZT L 54,https://lawntrend.com/cub-cadet-rzt-l-54-hydrostatic-transmission-oil-change/
Hydrostatic Transmission Oil: Why It Matters,https://res.cloudinary.com/ddxyyzkuq/image/upload/v1745966249/pin_8_11_ngmpxy.webp,lawn-repair-ideas,,"Understanding the importance of hydrostatic transmission oil is crucial for Cub Cadet RZT L 54 owners. This pin explains *why* regular oil changes are essential for maintaining performance and preventing costly repairs.  Learn how to protect your investment and keep your mower running strong. #HydrostaticOil #CubCadet #LawnEquipment #MaintenanceTips,Hydrostatic Oil,Cub Cadet,Lawn Equipment",https://lawntrend.com/cub-cadet-rzt-l-54-hydrostatic-transmission-oil-change/?utm_source=pinterest&utm_campaign=hydrostatic-transmis,2025-04-29,Maintenance,https://lawntrend.com/cub-cadet-rzt-l-54-hydrostatic-transmission-oil-change/
RZT L 54 Oil Change: Tools You'll Need (Image of tools),https://res.cloudinary.com/ddxyyzkuq/image/upload/v1745966255/pin_8_12_gx0by0.webp,lawn-mower-ideas,,"Visual learners rejoice! This pin features a clear image of all the tools required for a Cub Cadet RZT L 54 hydrostatic transmission oil change.  No more searching – everything you need is right here.  Click to see the full list and get started! #Tools #CubCadet #RZT54 #DIYTools,Tools,Cub Cadet,RZT L 54",https://lawntrend.com/cub-cadet-rzt-l-54-hydrostatic-transmission-oil-change/?utm_source=pinterest&utm_campaign=rzt-l-54-oil-change-,2025-04-29,DIY,https://lawntrend.com/cub-cadet-rzt-l-54-hydrostatic-transmission-oil-change/
Don't Ignore This! RZT L 54 Oil Change Reminder,https://res.cloudinary.com/ddxyyzkuq/image/upload/v1745966261/pin_8_13_xuax5h.webp,lawn-mower-ideas,,"Is it time for an oil change on your Cub Cadet RZT L 54?  Don't ignore this crucial maintenance task!  This pin serves as a friendly reminder and directs you to our comprehensive guide.  Protect your mower and enjoy a beautiful lawn. #Reminder #CubCadet #LawnCare #MaintenanceSchedule,Reminder,Cub Cadet,Lawn Care",https://lawntrend.com/cub-cadet-rzt-l-54-hydrostatic-transmission-oil-change/?utm_source=pinterest&utm_campaign=dont-ignore-this-rzt,2025-04-29,Maintenance,https://lawntrend.com/cub-cadet-rzt-l-54-hydrostatic-transmission-oil-change/
Cub Cadet RZT L 54: Oil Change - Before & After,https://res.cloudinary.com/ddxyyzkuq/image/upload/v1745966267/pin_8_14_yjnmka.webp,lawn-repair-ideas,,"See the difference a fresh hydrostatic transmission oil change can make! This pin showcases a ""before & after"" comparison, highlighting the improved performance of a well-maintained Cub Cadet RZT L 54.  Click to learn how to achieve these results! #BeforeAndAfter #CubCadet #LawnMower #PerformanceBoost,Before & After,Cub Cadet,Lawn Mower",https://lawntrend.com/cub-cadet-rzt-l-54-hydrostatic-transmission-oil-change/?utm_source=pinterest&utm_campaign=cub-cadet-rzt-l-54-o,2025-04-29,Performance,https://lawntrend.com/cub-cadet-rzt-l-54-hydrostatic-transmission-oil-change/
RZT L 54 Hydro Oil Change: Easy Disposal Guide,https://res.cloudinary.com/ddxyyzkuq/image/upload/v1745966273/pin_8_15_qybaoh.webp,lawn-care-ideas,,"Proper oil disposal is essential for protecting the environment. This pin provides a guide on how to safely and responsibly dispose of the used hydrostatic transmission oil from your Cub Cadet RZT L 54.  Do your part and keep our planet clean! #OilDisposal #CubCadet #EcoFriendly #ResponsibleLawnCare,Oil Disposal,Cub Cadet,Eco Friendly",https://lawntrend.com/cub-cadet-rzt-l-54-hydrostatic-transmission-oil-change/?utm_source=pinterest&utm_campaign=rzt-l-54-hydro-oil-c,2025-04-29,Lawn Care,https://lawntrend.com/cub-cadet-rzt-l-54-hydrostatic-transmission-oil-change/
Cub Cadet RZT L 54: Hydro Oil Change - FAQ,https://res.cloudinary.com/ddxyyzkuq/image/upload/v1745966279/pin_8_16_kzwkvs.webp,lawn-repair-ideas,,"Got questions about changing the hydrostatic transmission oil in your Cub Cadet RZT L 54?  This pin directs you to our FAQ section, where we answer common questions and provide helpful insights.  Get the answers you need and tackle this maintenance task with confidence! #FAQ #CubCadet #LawnCare #HelpfulTips,FAQ,Cub Cadet,Lawn Care",https://lawntrend.com/cub-cadet-rzt-l-54-hydrostatic-transmission-oil-change/?utm_source=pinterest&utm_campaign=cub-cadet-rzt-l-54-h,2025-04-29,Helpful Tips,https://lawntrend.com/cub-cadet-rzt-l-54-hydrostatic-transmission-oil-change/
RZT L 54: Hydro Oil Change - Save on Repairs!,https://res.cloudinary.com/ddxyyzkuq/image/upload/v1745966284/pin_8_17_lpjgek.webp,lawn-mower-ideas,,"Prevent costly repairs by performing regular hydrostatic transmission oil changes on your Cub Cadet RZT L 54. This pin emphasizes the long-term savings of preventative maintenance.  A little effort now can save you a lot of money later! #SaveMoney #CubCadet #LawnEquipment #PreventativeMaintenance,Save Money,Cub Cadet,Lawn Equipment",https://lawntrend.com/cub-cadet-rzt-l-54-hydrostatic-transmission-oil-change/?utm_source=pinterest&utm_campaign=rzt-l-54-hydro-oil-c,2025-04-29,Preventative Maintenance,https://lawntrend.com/cub-cadet-rzt-l-54-hydrostatic-transmission-oil-change/
DIY Cub Cadet RZT L 54 Oil Change - Feel Empowered!,https://res.cloudinary.com/ddxyyzkuq/image/upload/v1745966290/pin_8_18_o6oese.webp,lawn-care-ideas,,"Take control of your lawn equipment maintenance! This pin encourages DIYers to tackle the hydrostatic transmission oil change on their Cub Cadet RZT L 54.  Enjoy the satisfaction of a job well done and save money in the process. #DIY #Empowerment #CubCadet #LawnCare,DIY,Empowerment,Cub Cadet",https://lawntrend.com/cub-cadet-rzt-l-54-hydrostatic-transmission-oil-change/?utm_source=pinterest&utm_campaign=diy-cub-cadet-rzt-l-,2025-04-29,Lawn Care,https://lawntrend.com/cub-cadet-rzt-l-54-hydrostatic-transmission-oil-change/
RZT L 54: Hydro Oil Change - Is It Hard?,https://res.cloudinary.com/ddxyyzkuq/image/upload/v1745966296/pin_8_19_truzzg.webp,lawn-mower-ideas,,"Worried about the difficulty of changing the hydrostatic transmission oil in your Cub Cadet RZT L 54?  This pin reassures you that it's easier than you think!  We break down the process into simple steps and provide clear instructions. #EasyDIY #CubCadet #LawnMower #NoStress,Easy DIY,Cub Cadet,Lawn Mower",https://lawntrend.com/cub-cadet-rzt-l-54-hydrostatic-transmission-oil-change/?utm_source=pinterest&utm_campaign=rzt-l-54-hydro-oil-c,2025-04-29,No Stress,https://lawntrend.com/cub-cadet-rzt-l-54-hydrostatic-transmission-oil-change/
Cub Cadet RZT L 54: Oil Change - Protect Your Investment,https://res.cloudinary.com/ddxyyzkuq/image/upload/v1745966301/pin_8_20_ouwvyo.webp,lawn-repair-ideas,,"Your Cub Cadet RZT L 54 is a valuable investment. Protect it with regular hydrostatic transmission oil changes! This pin highlights the importance of maintenance for preserving the value and performance of your mower. #Investment #CubCadet #LawnCare #ProtectYourMower,Investment,Cub Cadet,Lawn Care",https://lawntrend.com/cub-cadet-rzt-l-54-hydrostatic-transmission-oil-change/?utm_source=pinterest&utm_campaign=cub-cadet-rzt-l-54-o,2025-04-29,Protect Mower,https://lawntrend.com/cub-cadet-rzt-l-54-hydrostatic-transmission-oil-change/
RZT L 54 Hydro Oil Change: Don't Skip This!,https://res.cloudinary.com/ddxyyzkuq/image/upload/v1745966308/pin_8_21_ugtb1n.webp,lawn-care-ideas,,"Don't neglect this essential maintenance task! This pin emphasizes the importance of regular hydrostatic transmission oil changes for your Cub Cadet RZT L 54.  Skipping this step can lead to costly repairs and reduced performance. #EssentialMaintenance #CubCadet #LawnCare #DontSkip,Essential Maintenance,Cub Cadet,Lawn Care",https://lawntrend.com/cub-cadet-rzt-l-54-hydrostatic-transmission-oil-change/?utm_source=pinterest&utm_campaign=rzt-l-54-hydro-oil-c,2025-04-29,Don't Skip,https://lawntrend.com/cub-cadet-rzt-l-54-hydrostatic-transmission-oil-change/
Cub Cadet RZT L 54: Oil Change - Get the Job Done Right!,https://res.cloudinary.com/ddxyyzkuq/image/upload/v1745966314/pin_8_22_ierv2g.webp,lawn-repair-ideas,,"Want to ensure a perfect hydrostatic transmission oil change on your Cub Cadet RZT L 54? This pin directs you to our detailed guide, where we provide expert tips and tricks for achieving optimal results. #GetItDoneRight #CubCadet #LawnCare #ExpertTips,Get It Done Right,Cub Cadet,Lawn Care",https://lawntrend.com/cub-cadet-rzt-l-54-hydrostatic-transmission-oil-change/?utm_source=pinterest&utm_campaign=cub-cadet-rzt-l-54-o,2025-04-29,Expert Tips,https://lawntrend.com/cub-cadet-rzt-l-54-hydrostatic-transmission-oil-change/
RZT L 54: Hydro Oil Change - A Happy Lawn Starts Here!,https://res.cloudinary.com/ddxyyzkuq/image/upload/v1745966319/pin_8_23_vslyvi.webp,lawn-mower-ideas,,"A healthy lawn starts with a well-maintained mower! This pin connects regular hydrostatic transmission oil changes on your Cub Cadet RZT L 54 to a beautiful, thriving lawn. #HappyLawn #CubCadet #LawnCare #HealthyGrass,Happy Lawn,Cub Cadet,Lawn Care",https://lawntrend.com/cub-cadet-rzt-l-54-hydrostatic-transmission-oil-change/?utm_source=pinterest&utm_campaign=rzt-l-54-hydro-oil-c,2025-04-29,Healthy Grass,https://lawntrend.com/cub-cadet-rzt-l-54-hydrostatic-transmission-oil-change/
Cub Cadet RZT L 54: Oil Change - Quick Reference Guide (Infographic),https://res.cloudinary.com/ddxyyzkuq/image/upload/v1745966325/pin_8_24_v22u4f.webp,lawn-repair-ideas,,"This pin features a visually appealing infographic summarizing the key steps for changing the hydrostatic transmission oil in your Cub Cadet RZT L 54.  A quick and easy reference for DIYers! #Infographic #CubCadet #LawnCare #QuickGuide,Infographic,Cub Cadet,Lawn Care",https://lawntrend.com/cub-cadet-rzt-l-54-hydrostatic-transmission-oil-change/?utm_source=pinterest&utm_campaign=cub-cadet-rzt-l-54-o,2025-04-29,Quick Guide,https://lawntrend.com/cub-cadet-rzt-l-54-hydrostatic-transmission-oil-change/
RZT L 54 Hydro Oil Change:  Peace of Mind!,https://res.cloudinary.com/ddxyyzkuq/image/upload/v1745966330/pin_8_25_cd26p2.webp,lawn-care-ideas,,"Enjoy peace of mind knowing your Cub Cadet RZT L 54 is properly maintained. This pin emphasizes the confidence that comes with performing regular hydrostatic transmission oil changes.  Keep your mower running smoothly and enjoy your lawn! #PeaceOfMind #CubCadet #LawnCare #ReliableMower,Peace of Mind,Cub Cadet,Lawn Care",https://lawntrend.com/cub-cadet-rzt-l-54-hydrostatic-transmission-oil-change/?utm_source=pinterest&utm_campaign=rzt-l-54-hydro-oil-c,2025-04-29,Reliable Mower,https://lawntrend.com/cub-cadet-rzt-l-54-hydrostatic-transmission-oil-change/
Title,https://res.cloudinary.com/ddxyyzkuq/image/upload/v1745966374/pin_9_1_xutchr.webp,please-provide-the-title-and-keywords-i-need-that-information-to-suggest-a-board-name-once,,Description,https://lawntrend.com/zero-turn-mower-bogs-down-when-cutting-grass/?utm_source=pinterest&utm_campaign=title,2025-04-29,Keywords,https://lawntrend.com/zero-turn-mower-bogs-down-when-cutting-grass/
Zero Turn Bogging Down? Fix It!,https://res.cloudinary.com/ddxyyzkuq/image/upload/v1745966381/pin_9_2_xhcwbc.webp,lawn-care-ideas,,"Is your zero-turn mower struggling and bogging down when cutting grass? Don't let a frustrating lawn ruin your weekend! This guide dives deep into the common causes – from dull blades to clogged decks and fuel issues. Learn simple troubleshooting steps to get back to a smooth, beautiful cut. We'll cover everything from belt tension to air filter cleaning.  Don't spend hours wrestling with your mower",https://lawntrend.com/zero-turn-mower-bogs-down-when-cutting-grass/?utm_source=pinterest&utm_campaign=zero-turn-bogging-do,2025-04-29,reclaim your free time! Click to learn how to diagnose and fix the problem. #zeroturnmower #lawncare #mowertips #lawnmaintenance,https://lawntrend.com/zero-turn-mower-bogs-down-when-cutting-grass/
Zero Turn Mower Troubleshooting,https://res.cloudinary.com/ddxyyzkuq/image/upload/v1745966387/pin_9_3_ajggcf.webp,lawn-care-ideas,,"Don't let a bogging zero-turn ruin your summer! This pin highlights the most frequent reasons why your mower loses power during cutting. We'll walk you through checking your fuel system, blade health",https://lawntrend.com/zero-turn-mower-bogs-down-when-cutting-grass/?utm_source=pinterest&utm_campaign=zero-turn-mower-trou,2025-04-29,and deck condition.  A bogged-down mower is a sign something's wrong – ignoring it can lead to expensive repairs.  Get your mower running like new again with our easy-to-follow guide! Click to read now and enjoy a perfectly manicured lawn. #zeroturn #mowerrepair #lawncare101 #diy,https://lawntrend.com/zero-turn-mower-bogs-down-when-cutting-grass/
Dull Blades = Bogging? Find Out!,https://res.cloudinary.com/ddxyyzkuq/image/upload/v1745966394/pin_9_4_oceds1.webp,lawn-care-ideas,,Are dull blades the culprit behind your zero-turn's struggles?  A surprisingly common issue! This pin focuses on the importance of sharp blades for efficient cutting and preventing bogging.  We explain how to safely sharpen or replace your blades,https://lawntrend.com/zero-turn-mower-bogs-down-when-cutting-grass/?utm_source=pinterest&utm_campaign=dull-blades-bogging-,2025-04-29,and the dramatic difference it makes.  Imagine effortlessly gliding through your grass – it's possible! Click to learn more and achieve a professional-looking lawn. #zeroturnmower #bladesharpening #lawncaretips #mowerblade,https://lawntrend.com/zero-turn-mower-bogs-down-when-cutting-grass/
