Title,Media URL,Pinterest board,Thumbnail,Description,Link,Publish date,Keywords,Source URL
Cub Cadet Tank Blade Engagement Issues,https://res.cloudinary.com/ddxyyzkuq/image/upload/v1745872129/pin_6_6_v1onjy.webp,lawn-mower-ideas,,"Struggling to engage the blades on your Cub Cadet Tank? It's frustrating! This pin directs you to a blog post that covers common causes, like a broken belt, a faulty blade engagement cable, or a malfunctioning PTO switch. We provide clear instructions and helpful diagrams to guide you through the repair process.  Get back to a beautifully cut lawn! Click to learn how. #CubCadet #BladeEngagement #LawnMowerBelt #PTO,Blade Engagement,PTO,Belt",https://lawntrend.com/cub-cadet-tank-problems/?utm_source=pinterest&utm_campaign=cub-cadet-tank-blade,2025-04-28,Cub Cadet,https://lawntrend.com/cub-cadet-tank-problems/
Cub Cadet Tank: Electrical Problems Solved,https://res.cloudinary.com/ddxyyzkuq/image/upload/v1745872134/pin_6_7_hoddpt.webp,lawn-mower-ideas,,"Electrical issues can be tricky. This pin leads to a guide covering common Cub Cadet Tank electrical problems – from blown fuses and faulty wiring to a bad ignition switch. We provide step-by-step troubleshooting tips and safety precautions. Don't risk a shock!  Get your mower safely back in action. Click to read now! #CubCadetTank #ElectricalRepair #LawnMowerWiring #DIY,Electrical,Wiring,Fuses",https://lawntrend.com/cub-cadet-tank-problems/?utm_source=pinterest&utm_campaign=cub-cadet-tank-elect,2025-04-28,Cub Cadet,https://lawntrend.com/cub-cadet-tank-problems/
Cub Cadet Tank Overheating? Find Out Why!,https://res.cloudinary.com/ddxyyzkuq/image/upload/v1745872139/pin_6_8_wsn1kk.webp,lawn-mower-ideas,,"Is your Cub Cadet Tank overheating? This could indicate a serious problem! Our guide explores potential causes, including a clogged cooling system, low oil, or a faulty thermostat. We'll help you diagnose the issue and prevent further damage. Protect your investment! Click to learn how to keep your mower cool. #CubCadet #Overheating #LawnMowerCooling #EngineRepair,Overheating,Cooling System,Engine",https://lawntrend.com/cub-cadet-tank-problems/?utm_source=pinterest&utm_campaign=cub-cadet-tank-overh,2025-04-28,Cub Cadet,https://lawntrend.com/cub-cadet-tank-problems/
Cub Cadet Tank: Belt Replacement Guide,https://res.cloudinary.com/ddxyyzkuq/image/upload/v1745872145/pin_6_9_odty7i.webp,lawn-mower-ideas,,"A worn or broken belt can bring your Cub Cadet Tank to a halt. This pin links to a detailed guide on how to replace the mower deck belt and transmission belt. We provide clear instructions and helpful visuals. Save money and get back to mowing! Click to learn how to do it yourself. #CubCadetTank #BeltReplacement #LawnMowerBelt #DIY,Belt Replacement,Mower Deck,Transmission",https://lawntrend.com/cub-cadet-tank-problems/?utm_source=pinterest&utm_campaign=cub-cadet-tank-belt-,2025-04-28,Cub Cadet,https://lawntrend.com/cub-cadet-tank-problems/
Cub Cadet Tank: Carburetor Cleaning Tips,https://res.cloudinary.com/dbcpfy04c/image/upload/v1618237451/placeholder.jpg,home-inspiration,,"A dirty carburetor can cause starting problems and poor performance. This pin directs you to a guide on how to clean your Cub Cadet Tank's carburetor. We provide step-by-step instructions and helpful tips. Breathe new life into your mower! Click to read now. #CubCadetTank #CarburetorCleaning #LawnMowerRepair #DIY,Carburetor,Cleaning,Fuel System",https://lawntrend.com/cub-cadet-tank-problems/?utm_source=pinterest&utm_campaign=cub-cadet-tank-carbu,2025-04-28,Cub Cadet,https://lawntrend.com/cub-cadet-tank-problems/
Cub Cadet Tank: Diagnosing Low Power,https://res.cloudinary.com/dbcpfy04c/image/upload/v1618237451/placeholder.jpg,home-inspiration,,"Is your Cub Cadet Tank lacking power? This pin leads to a blog post exploring potential causes, including a clogged air filter, a dirty carburetor, or a worn spark plug. We'll help you diagnose the issue and restore your mower's performance.  Get the power back! Click to learn more. #CubCadet #LowPower #LawnMowerPerformance #EngineTrouble,Low Power,Engine,Air Filter",https://lawntrend.com/cub-cadet-tank-problems/?utm_source=pinterest&utm_campaign=cub-cadet-tank-diagn,2025-04-28,Cub Cadet,https://lawntrend.com/cub-cadet-tank-problems/
Cub Cadet Tank: Battery Maintenance Guide,https://res.cloudinary.com/ddxyyzkuq/image/upload/v1745872155/pin_6_12_ntixea.webp,lawn-mower-ideas,,"Keep your Cub Cadet Tank running strong with proper battery maintenance! This pin links to a guide covering battery charging, storage, and replacement. Don't get stranded mid-mow! Click to learn how to maximize your battery's life. #CubCadetTank #BatteryMaintenance #LawnMowerBattery #DIY,Battery,Maintenance,Charging",https://lawntrend.com/cub-cadet-tank-problems/?utm_source=pinterest&utm_campaign=cub-cadet-tank-batte,2025-04-28,Cub Cadet,https://lawntrend.com/cub-cadet-tank-problems/
Cub Cadet Tank: Steering Problems? Fix It!,https://res.cloudinary.com/dbcpfy04c/image/upload/v1618237451/placeholder.jpg,home-inspiration,,"Is your Cub Cadet Tank's steering feeling loose or unresponsive? This pin directs you to a guide covering common steering issues and how to fix them.  Enjoy smooth, effortless mowing again! Click to learn more. #CubCadet #SteeringRepair #LawnMowerSteering #DIY,Steering,Repair,Hydrostatic",https://lawntrend.com/cub-cadet-tank-problems/?utm_source=pinterest&utm_campaign=cub-cadet-tank-steer,2025-04-28,Cub Cadet,https://lawntrend.com/cub-cadet-tank-problems/
Cub Cadet Tank: Oil Change How-To,https://res.cloudinary.com/dbcpfy04c/image/upload/v1618237451/placeholder.jpg,home-inspiration,,"Regular oil changes are crucial for engine health. This pin links to a step-by-step guide on how to change the oil in your Cub Cadet Tank. Protect your investment and keep your mower running smoothly! Click to learn how. #CubCadetTank #OilChange #LawnMowerMaintenance #DIY,Oil Change,Maintenance,Engine",https://lawntrend.com/cub-cadet-tank-problems/?utm_source=pinterest&utm_campaign=cub-cadet-tank-oil-c,2025-04-28,Cub Cadet,https://lawntrend.com/cub-cadet-tank-problems/
Cub Cadet Tank: Spark Plug Replacement,https://res.cloudinary.com/dbcpfy04c/image/upload/v1618237451/placeholder.jpg,home-inspiration,,"A worn spark plug can cause starting problems and poor performance. This pin directs you to a guide on how to replace the spark plug in your Cub Cadet Tank.  Easy fix, big impact! Click to read now. #CubCadetTank #SparkPlug #LawnMowerRepair #DIY,Spark Plug,Engine,Ignition",https://lawntrend.com/cub-cadet-tank-problems/?utm_source=pinterest&utm_campaign=cub-cadet-tank-spark,2025-04-28,Cub Cadet,https://lawntrend.com/cub-cadet-tank-problems/
Cub Cadet Tank: Mower Deck Maintenance,https://res.cloudinary.com/dbcpfy04c/image/upload/v1618237451/placeholder.jpg,home-inspiration,,"Keep your mower deck in top shape! This pin links to a guide covering cleaning, leveling, and blade sharpening for your Cub Cadet Tank. A well-maintained deck means a beautiful cut! Click to learn more. #CubCadetTank #MowerDeck #LawnCare #Maintenance,Mower Deck,Blade Sharpening,Leveling",https://lawntrend.com/cub-cadet-tank-problems/?utm_source=pinterest&utm_campaign=cub-cadet-tank-mower,2025-04-28,Cub Cadet,https://lawntrend.com/cub-cadet-tank-problems/
Cub Cadet Tank: Common Error Codes Explained,https://res.cloudinary.com/dbcpfy04c/image/upload/v1618237451/placeholder.jpg,home-inspiration,,"Confused by an error code on your Cub Cadet Tank? This pin directs you to a guide explaining common error codes and their meanings.  Decode the message and get mowing! Click to learn more. #CubCadetTank #ErrorCodes #LawnMowerDiagnostics #DIY,Error Codes,Diagnostics,Troubleshooting",https://lawntrend.com/cub-cadet-tank-problems/?utm_source=pinterest&utm_campaign=cub-cadet-tank-commo,2025-04-28,Cub Cadet,https://lawntrend.com/cub-cadet-tank-problems/
Cub Cadet Tank: Preventative Maintenance Checklist,https://res.cloudinary.com/dbcpfy04c/image/upload/v1618237451/placeholder.jpg,home-inspiration,,"Don't wait for problems to arise! This pin links to a preventative maintenance checklist for your Cub Cadet Tank. Keep your mower running smoothly for years to come.  Proactive care saves money! Click to read now. #CubCadetTank #PreventativeMaintenance #LawnCare #DIY,Preventative Maintenance,Maintenance,Checklist",https://lawntrend.com/cub-cadet-tank-problems/?utm_source=pinterest&utm_campaign=cub-cadet-tank-preve,2025-04-28,Cub Cadet,https://lawntrend.com/cub-cadet-tank-problems/
Cub Cadet Tank: Finding Replacement Parts,https://res.cloudinary.com/dbcpfy04c/image/upload/v1618237451/placeholder.jpg,home-inspiration,,"Need replacement parts for your Cub Cadet Tank? This pin directs you to resources for finding genuine parts and aftermarket options.  Get the right parts, the first time! Click to learn more. #CubCadetTank #ReplacementParts #LawnMowerParts #DIY,Replacement Parts,Parts,Cub Cadet",https://lawntrend.com/cub-cadet-tank-problems/?utm_source=pinterest&utm_campaign=cub-cadet-tank-findi,2025-04-28,Online Parts,https://lawntrend.com/cub-cadet-tank-problems/
Cub Cadet Tank: Winter Storage Guide,https://res.cloudinary.com/dbcpfy04c/image/upload/v1618237451/placeholder.jpg,home-inspiration,,"Preparing your Cub Cadet Tank for winter storage? This pin links to a guide covering essential steps to protect your mower during the off-season.  Ensure a smooth start next spring! Click to learn more. #CubCadetTank #WinterStorage #LawnMowerStorage #DIY,Winter Storage,Storage,Maintenance",https://lawntrend.com/cub-cadet-tank-problems/?utm_source=pinterest&utm_campaign=cub-cadet-tank-winte,2025-04-28,Cub Cadet,https://lawntrend.com/cub-cadet-tank-problems/
Cub Cadet Tank: Is it Worth Repairing?,https://res.cloudinary.com/dbcpfy04c/image/upload/v1618237451/placeholder.jpg,home-inspiration,,"Facing a major repair on your Cub Cadet Tank? This pin directs you to a guide helping you decide whether to repair or replace your mower.  Make the smart financial choice! Click to read now. #CubCadetTank #RepairOrReplace #LawnMowerCost #DIY,Repair,Replace,Cost",https://lawntrend.com/cub-cadet-tank-problems/?utm_source=pinterest&utm_campaign=cub-cadet-tank-is-it,2025-04-28,Cub Cadet,https://lawntrend.com/cub-cadet-tank-problems/
Cub Cadet Tank: Safety Tips for Repair,https://res.cloudinary.com/dbcpfy04c/image/upload/v1618237451/placeholder.jpg,home-inspiration,,"Working on your Cub Cadet Tank? Safety first! This pin links to a guide covering essential safety precautions to protect yourself during repairs.  Stay safe and get the job done right! Click to learn more. #CubCadetTank #SafetyTips #LawnMowerRepair #DIY,Safety,Repair,Precautions",https://lawntrend.com/cub-cadet-tank-problems/?utm_source=pinterest&utm_campaign=cub-cadet-tank-safet,2025-04-28,Cub Cadet,https://lawntrend.com/cub-cadet-tank-problems/
Cub Cadet Tank: Understanding Hydrostatic Drive,https://res.cloudinary.com/dbcpfy04c/image/upload/v1618237451/placeholder.jpg,home-inspiration,,"Demystifying hydrostatic drive! This pin directs you to a guide explaining how the hydrostatic drive system works on your Cub Cadet Tank.  Understand your mower better! Click to learn more. #CubCadetTank #HydrostaticDrive #LawnMowerTech #DIY,Hydrostatic,Drive,Transmission",https://lawntrend.com/cub-cadet-tank-problems/?utm_source=pinterest&utm_campaign=cub-cadet-tank-under,2025-04-28,Cub Cadet,https://lawntrend.com/cub-cadet-tank-problems/
Cub Cadet Tank: Troubleshooting Blade Wobble,https://res.cloudinary.com/dbcpfy04c/image/upload/v1618237451/placeholder.jpg,home-inspiration,,"Experiencing blade wobble on your Cub Cadet Tank? This pin links to a guide covering potential causes and how to fix them.  A smooth cut starts with stable blades! Click to learn more. #CubCadetTank #BladeWobble #LawnMowerRepair #DIY,Blade Wobble,Blades,Repair",https://lawntrend.com/cub-cadet-tank-problems/?utm_source=pinterest&utm_campaign=cub-cadet-tank-troub,2025-04-28,Cub Cadet,https://lawntrend.com/cub-cadet-tank-problems/
Cub Cadet Tank: Extending Your Mower's Life,https://res.cloudinary.com/dbcpfy04c/image/upload/v1618237451/placeholder.jpg,home-inspiration,,"Want to get the most out of your Cub Cadet Tank? This pin directs you to a guide with tips on extending your mower's lifespan.  Invest in longevity! Click to read now. #CubCadetTank #LawnMowerLife #MaintenanceTips #DIY,Longevity,Maintenance,Tips",https://lawntrend.com/cub-cadet-tank-problems/?utm_source=pinterest&utm_campaign=cub-cadet-tank-exten,2025-04-28,Cub Cadet,https://lawntrend.com/cub-cadet-tank-problems/
Title,https://res.cloudinary.com/dbcpfy04c/image/upload/v1618237451/placeholder.jpg,home-inspiration,,Description,https://lawntrend.com/kawasaki-lawn-mower-engine-hard-to-start-when-hot/?utm_source=pinterest&utm_campaign=title,2025-04-28,Keywords,https://lawntrend.com/kawasaki-lawn-mower-engine-hard-to-start-when-hot/
Kawasaki Mower Won't Start Hot?,https://res.cloudinary.com/dbcpfy04c/image/upload/v1618237451/placeholder.jpg,home-inspiration,,"Is your Kawasaki lawn mower refusing to start when the engine's warm? Don't sweat it! This guide dives deep into the common culprits – from carburetor issues to fuel pump failures – and provides easy-to-follow troubleshooting steps.  Avoid expensive repairs and get back to enjoying your perfectly manicured lawn.  We'll help you diagnose the problem and get your mower running smoothly again. Click to learn how to fix it yourself and save money!  Don't let a hot start ruin your weekend! #KawasakiMower #LawnMowerRepair #SmallEngineRepair #HotStart,Kawasaki,Lawn Mower,Engine Repair",https://lawntrend.com/kawasaki-lawn-mower-engine-hard-to-start-when-hot/?utm_source=pinterest&utm_campaign=kawasaki-mower-wont-,2025-04-28,Troubleshooting,https://lawntrend.com/kawasaki-lawn-mower-engine-hard-to-start-when-hot/
Hot Kawasaki Engine,https://res.cloudinary.com/dbcpfy04c/image/upload/v1618237451/placeholder.jpg,home-inspiration,,"No Start?,Frustrated with a Kawasaki mower that only starts cold? You're not alone! This post breaks down the reasons why your engine struggles when hot, covering everything from heat soak to faulty sensors.  We'll show you how to pinpoint the issue and offer practical solutions, even for beginners.  Imagine the satisfaction of fixing it yourself!  Get back to mowing with confidence. Read now for a step-by-step guide! #KawasakiEngine #LawnCare #DIYRepair #MowerProblems,Kawasaki Engine,Lawn Care,DIY",https://lawntrend.com/kawasaki-lawn-mower-engine-hard-to-start-when-hot/?utm_source=pinterest&utm_campaign=hot-kawasaki-engine,2025-04-28,Mower,https://lawntrend.com/kawasaki-lawn-mower-engine-hard-to-start-when-hot/
Kawasaki Mower Starting Issues?,https://res.cloudinary.com/dbcpfy04c/image/upload/v1618237451/placeholder.jpg,home-inspiration,,"Don't let a stubborn Kawasaki mower ruin your summer! This article tackles the frustrating problem of hard starting when hot. We cover fuel delivery, ignition system checks, and more.  We'll empower you to diagnose and fix the issue, saving you time and money on costly repairs.  A running mower means a beautiful lawn – let's get yours going! Click to learn more! #Kawasaki #LawnMower #EngineTrouble #FixItYourself,Kawasaki,Lawn Mower,Engine Trouble",https://lawntrend.com/kawasaki-lawn-mower-engine-hard-to-start-when-hot/?utm_source=pinterest&utm_campaign=kawasaki-mower-start,2025-04-28,Fix It,https://lawntrend.com/kawasaki-lawn-mower-engine-hard-to-start-when-hot/
Fuel Pump Fix: Kawasaki Mower,https://res.cloudinary.com/dbcpfy04c/image/upload/v1618237451/placeholder.jpg,home-inspiration,,"Is a failing fuel pump causing your Kawasaki mower's hot start problem?  This guide explains how to test your fuel pump and determine if it needs replacing.  We provide clear instructions and helpful tips to make the process easy, even if you're not a mechanic.  Don't get stuck with a useless mower – get it running again!  Read the full article now! #FuelPump #KawasakiMowerRepair #LawnEquipment #DIY,Fuel Pump,Kawasaki Mower Repair,Lawn Equipment",https://lawntrend.com/kawasaki-lawn-mower-engine-hard-to-start-when-hot/?utm_source=pinterest&utm_campaign=fuel-pump-fix-kawasa,2025-04-28,DIY,https://lawntrend.com/kawasaki-lawn-mower-engine-hard-to-start-when-hot/
Carburetor Cleaning: Kawasaki Mower,https://res.cloudinary.com/dbcpfy04c/image/upload/v1618237451/placeholder.jpg,home-inspiration,,"A dirty carburetor can be the culprit behind a Kawasaki mower that's hard to start when hot.  Learn how to properly clean your carburetor and restore optimal engine performance.  We'll walk you through each step with detailed instructions and helpful photos.  Enjoy a smooth-running mower and a beautiful lawn! Click to learn how! #Carburetor #KawasakiEngine #LawnMowerMaintenance #Cleaning,Carburetor,Kawasaki Engine,Lawn Mower Maintenance",https://lawntrend.com/kawasaki-lawn-mower-engine-hard-to-start-when-hot/?utm_source=pinterest&utm_campaign=carburetor-cleaning-,2025-04-28,Cleaning,https://lawntrend.com/kawasaki-lawn-mower-engine-hard-to-start-when-hot/
Kawasaki Mower Heat Soak Explained,https://res.cloudinary.com/dbcpfy04c/image/upload/v1618237451/placeholder.jpg,home-inspiration,,"Understand why your Kawasaki mower struggles to start after running. This post explains the phenomenon of ""heat soak"" and how it affects engine starting.  We'll provide practical tips to minimize heat soak and improve your mower's reliability.  Don't let the heat beat your mower!  Read now for expert advice. #HeatSoak #KawasakiMower #EnginePerformance #LawnTips,Heat Soak,Kawasaki Mower,Engine Performance",https://lawntrend.com/kawasaki-lawn-mower-engine-hard-to-start-when-hot/?utm_source=pinterest&utm_campaign=kawasaki-mower-heat-,2025-04-28,Lawn Tips,https://lawntrend.com/kawasaki-lawn-mower-engine-hard-to-start-when-hot/
Ignition Coil Test: Kawasaki Mower,https://res.cloudinary.com/dbcpfy04c/image/upload/v1618237451/placeholder.jpg,home-inspiration,,"Is a faulty ignition coil preventing your Kawasaki mower from starting when hot?  This guide shows you how to test your ignition coil and determine if it needs replacement.  We'll provide clear instructions and helpful diagrams.  Get your mower running reliably again! Click to learn more. #IgnitionCoil #KawasakiRepair #SmallEngine #MowerFix,Ignition Coil,Kawasaki Repair,Small Engine",https://lawntrend.com/kawasaki-lawn-mower-engine-hard-to-start-when-hot/?utm_source=pinterest&utm_campaign=ignition-coil-test-k,2025-04-28,Mower Fix,https://lawntrend.com/kawasaki-lawn-mower-engine-hard-to-start-when-hot/
Kawasaki Mower Choke Problems?,https://res.cloudinary.com/dbcpfy04c/image/upload/v1618237451/placeholder.jpg,home-inspiration,,"Is your choke malfunctioning and causing hard starting?  This article explores common choke issues in Kawasaki mowers and provides solutions.  We'll help you diagnose the problem and get your choke working properly.  A properly functioning choke is key to easy starting! Read now! #Choke #KawasakiMower #StartingProblems #LawnCareTips,Choke,Kawasaki Mower,Starting Problems",https://lawntrend.com/kawasaki-lawn-mower-engine-hard-to-start-when-hot/?utm_source=pinterest&utm_campaign=kawasaki-mower-choke,2025-04-28,Lawn Care Tips,https://lawntrend.com/kawasaki-lawn-mower-engine-hard-to-start-when-hot/
Kawasaki Mower: Float Bowl Issues?,https://res.cloudinary.com/dbcpfy04c/image/upload/v1618237451/placeholder.jpg,home-inspiration,,"Learn how a clogged or malfunctioning float bowl can cause starting problems in your Kawasaki mower, especially when hot.  We'll guide you through cleaning and adjusting the float bowl for optimal fuel delivery.  Don't let a small part cause big headaches! Click to learn more. #FloatBowl #KawasakiEngine #FuelDelivery #MowerMaintenance,Float Bowl,Kawasaki Engine,Fuel Delivery",https://lawntrend.com/kawasaki-lawn-mower-engine-hard-to-start-when-hot/?utm_source=pinterest&utm_campaign=kawasaki-mower-float,2025-04-28,Mower Maintenance,https://lawntrend.com/kawasaki-lawn-mower-engine-hard-to-start-when-hot/
Kawasaki Mower: Spark Plug Check,https://res.cloudinary.com/dbcpfy04c/image/upload/v1618237451/placeholder.jpg,home-inspiration,,"A worn or fouled spark plug can contribute to hard starting.  This post explains how to inspect and replace your Kawasaki mower's spark plug.  We'll provide recommendations for the best spark plugs for your engine.  A simple fix for a common problem! Read now. #SparkPlug #KawasakiMower #EngineTuneUp #LawnMower,Spark Plug,Kawasaki Mower,Engine Tune Up",https://lawntrend.com/kawasaki-lawn-mower-engine-hard-to-start-when-hot/?utm_source=pinterest&utm_campaign=kawasaki-mower-spark,2025-04-28,Lawn Mower,https://lawntrend.com/kawasaki-lawn-mower-engine-hard-to-start-when-hot/
Kawasaki Mower: Valve Clearance,https://res.cloudinary.com/dbcpfy04c/image/upload/v1618237451/placeholder.jpg,home-inspiration,,"Incorrect valve clearance can cause hard starting, especially when the engine is warm.  This article explains how to check and adjust the valve clearance on your Kawasaki mower.  It's a more advanced repair, but we'll guide you through it! #ValveClearance #KawasakiEngine #EngineRepair #DIY,Valve Clearance,Kawasaki Engine,Engine Repair",https://lawntrend.com/kawasaki-lawn-mower-engine-hard-to-start-when-hot/?utm_source=pinterest&utm_campaign=kawasaki-mower-valve,2025-04-28,DIY,https://lawntrend.com/kawasaki-lawn-mower-engine-hard-to-start-when-hot/
Kawasaki Mower: Air Filter Importance,https://res.cloudinary.com/dbcpfy04c/image/upload/v1618237451/placeholder.jpg,home-inspiration,,"A dirty air filter restricts airflow and can cause starting problems.  Learn how to inspect and replace your Kawasaki mower's air filter.  It's a simple maintenance task that can significantly improve engine performance.  Breathe easy knowing your mower is running optimally! #AirFilter #KawasakiMower #LawnMowerMaintenance #EasyFix,Air Filter,Kawasaki Mower,Lawn Mower Maintenance",https://lawntrend.com/kawasaki-lawn-mower-engine-hard-to-start-when-hot/?utm_source=pinterest&utm_campaign=kawasaki-mower-air-f,2025-04-28,Easy Fix,https://lawntrend.com/kawasaki-lawn-mower-engine-hard-to-start-when-hot/
Kawasaki Mower: Fuel Line Inspection,https://res.cloudinary.com/dbcpfy04c/image/upload/v1618237451/placeholder.jpg,home-inspiration,,"Cracked or clogged fuel lines can disrupt fuel delivery and cause hard starting.  This guide shows you how to inspect and replace your Kawasaki mower's fuel lines.  Prevent fuel leaks and ensure a reliable fuel supply! Click to learn more. #FuelLine #KawasakiRepair #LawnEquipment #Safety,Fuel Line,Kawasaki Repair,Lawn Equipment",https://lawntrend.com/kawasaki-lawn-mower-engine-hard-to-start-when-hot/?utm_source=pinterest&utm_campaign=kawasaki-mower-fuel-,2025-04-28,Safety,https://lawntrend.com/kawasaki-lawn-mower-engine-hard-to-start-when-hot/
Kawasaki Mower: Recoil Starter Issues?,https://res.cloudinary.com/dbcpfy04c/image/upload/v1618237451/placeholder.jpg,home-inspiration,,"Is your recoil starter failing to engage? This post covers troubleshooting and repair of the recoil starter on your Kawasaki mower.  Get your mower starting with a pull!  Don't struggle with a broken starter – fix it yourself! #RecoilStarter #KawasakiMower #StartingMechanism #DIYRepair,Recoil Starter,Kawasaki Mower,Starting Mechanism",https://lawntrend.com/kawasaki-lawn-mower-engine-hard-to-start-when-hot/?utm_source=pinterest&utm_campaign=kawasaki-mower-recoi,2025-04-28,DIY Repair,https://lawntrend.com/kawasaki-lawn-mower-engine-hard-to-start-when-hot/
Kawasaki Mower: Battery Check (Electric Start),https://res.cloudinary.com/dbcpfy04c/image/upload/v1618237451/placeholder.jpg,home-inspiration,,"If your Kawasaki mower has electric start, a weak battery can cause hard starting.  Learn how to test your battery and determine if it needs charging or replacement.  Get your mower started with the push of a button! #Battery #KawasakiMower #ElectricStart #LawnCare,Battery,Kawasaki Mower,Electric Start",https://lawntrend.com/kawasaki-lawn-mower-engine-hard-to-start-when-hot/?utm_source=pinterest&utm_campaign=kawasaki-mower-batte,2025-04-28,Lawn Care,https://lawntrend.com/kawasaki-lawn-mower-engine-hard-to-start-when-hot/
Kawasaki Mower: Governor Linkage,https://res.cloudinary.com/dbcpfy04c/image/upload/v1618237451/placeholder.jpg,home-inspiration,,"A malfunctioning governor linkage can affect engine speed and starting.  This article explains how to inspect and adjust the governor linkage on your Kawasaki mower.  Ensure smooth and reliable engine operation! #GovernorLinkage #KawasakiEngine #EngineControl #MowerRepair,Governor Linkage,Kawasaki Engine,Engine Control",https://lawntrend.com/kawasaki-lawn-mower-engine-hard-to-start-when-hot/?utm_source=pinterest&utm_campaign=kawasaki-mower-gover,2025-04-28,Mower Repair,https://lawntrend.com/kawasaki-lawn-mower-engine-hard-to-start-when-hot/
Kawasaki Mower: Ethanol Fuel Problems,https://res.cloudinary.com/dbcpfy04c/image/upload/v1618237451/placeholder.jpg,home-inspiration,,"Ethanol in fuel can cause problems with small engines.  Learn how ethanol affects your Kawasaki mower and what you can do to mitigate the issues.  Protect your engine from the harmful effects of ethanol! Read now. #Ethanol #Fuel #KawasakiMower #SmallEngine,Ethanol,Fuel,Kawasaki Mower",https://lawntrend.com/kawasaki-lawn-mower-engine-hard-to-start-when-hot/?utm_source=pinterest&utm_campaign=kawasaki-mower-ethan,2025-04-28,Small Engine,https://lawntrend.com/kawasaki-lawn-mower-engine-hard-to-start-when-hot/
