Title,Media URL,Pinterest board,Thumbnail,Description,Link,Publish date,Keywords,Source URL
Husqvarna Safety Switch: Before You Call a Pro,https://res.cloudinary.com/dbcpfy04c/image/upload/v1618237451/placeholder.jpg,home-inspiration,,Before you call a repair shop,https://lawntrend.com/husqvarna-safety-switch-problems/?utm_source=pinterest&utm_campaign=husqvarna-safety-swi,2025-04-28,try these DIY fixes! This pin links to a guide with troubleshooting steps you can do yourself.  Save money and time. Click to read and see if you can solve the problem yourself. #DIYRepair #HusqvarnaHelp #MowerTroubleshooting #SaveMoney,https://lawntrend.com/husqvarna-safety-switch-problems/
Title,https://res.cloudinary.com/dbcpfy04c/image/upload/v1618237451/placeholder.jpg,home-inspiration,,Description,https://lawntrend.com/cub-cadet-zero-turn-mower-steering-problems/?utm_source=pinterest&utm_campaign=title,2025-04-28,Keywords,https://lawntrend.com/cub-cadet-zero-turn-mower-steering-problems/
Cub Cadet Zero Turn: Steering Fixes,https://res.cloudinary.com/dbcpfy04c/image/upload/v1618237451/placeholder.jpg,home-inspiration,,"Is your Cub Cadet zero turn steering feeling off? Don't let a frustrating steering issue ruin your lawn care! This guide dives deep into common problems – from loose linkages to hydraulic woes – and provides clear, step-by-step solutions you can tackle yourself. Save time & money by diagnosing & fixing it! Learn how to restore smooth",https://lawntrend.com/cub-cadet-zero-turn-mower-steering-problems/?utm_source=pinterest&utm_campaign=cub-cadet-zero-turn-,2025-04-28,precise control and get back to enjoying your perfectly manicured lawn. Click to learn more & reclaim your weekends! #CubCadet #ZeroTurnMower #MowerRepair #SteeringProblems,https://lawntrend.com/cub-cadet-zero-turn-mower-steering-problems/
Cub Cadet Steering Issues: DIY Repair,https://res.cloudinary.com/dbcpfy04c/image/upload/v1618237451/placeholder.jpg,home-inspiration,,"Don't panic! A wobbly steering wheel on your Cub Cadet zero turn doesn't always mean a costly repair. We break down the most frequent causes of steering problems, including lap bar issues, worn components",https://lawntrend.com/cub-cadet-zero-turn-mower-steering-problems/?utm_source=pinterest&utm_campaign=cub-cadet-steering-i,2025-04-28,and hydraulic leaks.  This post empowers you to troubleshoot like a pro and potentially avoid expensive mechanic bills.  Get back to mowing with confidence! Click to read now! #ZeroTurn #CubCadetRepair #DIYMower #LawnCare,https://lawntrend.com/cub-cadet-zero-turn-mower-steering-problems/
Zero Turn Steering Won't Center?,https://res.cloudinary.com/dbcpfy04c/image/upload/v1618237451/placeholder.jpg,home-inspiration,,"Is your Cub Cadet zero turn steering drifting or not returning to center? This could indicate a serious issue, but it's often fixable! We explore the reasons behind this frustrating problem",https://lawntrend.com/cub-cadet-zero-turn-mower-steering-problems/?utm_source=pinterest&utm_campaign=zero-turn-steering-w,2025-04-28,covering everything from tire pressure to hydraulic system checks.  Don't let a misbehaving mower steal your precious free time.  Click to diagnose and fix it today! #ZeroTurnSteering #CubCadetProblems #MowerMaintenance #LawnMowing,https://lawntrend.com/cub-cadet-zero-turn-mower-steering-problems/
Cub Cadet Lap Bar Problems: Solved!,https://res.cloudinary.com/dbcpfy04c/image/upload/v1618237451/placeholder.jpg,home-inspiration,,"Experiencing issues with your Cub Cadet's lap bar? It's a common source of steering problems! This guide details how to diagnose and fix lap bar related steering issues, including adjustments, linkage checks",https://lawntrend.com/cub-cadet-zero-turn-mower-steering-problems/?utm_source=pinterest&utm_campaign=cub-cadet-lap-bar-pr,2025-04-28,and potential replacement.  A functioning lap bar is crucial for safe and efficient mowing.  Click to learn how to keep yours in top shape! #LapBar #CubCadetZeroTurn #MowerSafety #SteeringRepair,https://lawntrend.com/cub-cadet-zero-turn-mower-steering-problems/
Hydraulic Steering Issues: Cub Cadet,https://res.cloudinary.com/dbcpfy04c/image/upload/v1618237451/placeholder.jpg,home-inspiration,,"Hydraulic steering problems on your Cub Cadet zero turn can be complex, but not impossible to solve! We explain the common culprits – low fluid, leaks",https://lawntrend.com/cub-cadet-zero-turn-mower-steering-problems/?utm_source=pinterest&utm_campaign=hydraulic-steering-i,2025-04-28,and pump issues – and provide guidance on how to inspect and address them.  Don't risk damaging your mower further. Click for expert advice! #HydraulicSteering #CubCadetHydraulics #MowerProblems #ZeroTurnRepair,https://lawntrend.com/cub-cadet-zero-turn-mower-steering-problems/
Loose Steering Linkage? Fix It Now!,https://res.cloudinary.com/dbcpfy04c/image/upload/v1618237451/placeholder.jpg,home-inspiration,,"A loose steering linkage can cause erratic steering and make your Cub Cadet zero turn difficult to control.  This post shows you how to identify loose linkages, tighten them properly",https://lawntrend.com/cub-cadet-zero-turn-mower-steering-problems/?utm_source=pinterest&utm_campaign=loose-steering-linka,2025-04-28,and restore precise steering.  Safety first!  Click to learn how to keep your mower operating smoothly and safely. #SteeringLinkage #CubCadetMaintenance #MowerSafety #ZeroTurnTips,https://lawntrend.com/cub-cadet-zero-turn-mower-steering-problems/
Cub Cadet Zero Turn: Steering Feels Stiff?,https://res.cloudinary.com/dbcpfy04c/image/upload/v1618237451/placeholder.jpg,home-inspiration,,"Is your Cub Cadet steering feeling stiff or unresponsive?  Don't ignore it! This could be a sign of a more significant problem. We cover potential causes, from worn bushings to hydraulic restrictions",https://lawntrend.com/cub-cadet-zero-turn-mower-steering-problems/?utm_source=pinterest&utm_campaign=cub-cadet-zero-turn-,2025-04-28,and offer solutions to get your mower steering smoothly again. Click to read and get mowing! #StiffSteering #CubCadetIssues #MowerRepair #ZeroTurnLife,https://lawntrend.com/cub-cadet-zero-turn-mower-steering-problems/
Zero Turn Steering: Preventative Maintenance,https://res.cloudinary.com/dbcpfy04c/image/upload/v1618237451/placeholder.jpg,home-inspiration,,"Don't wait for steering problems to arise! This guide focuses on preventative maintenance steps you can take to keep your Cub Cadet zero turn steering in top condition.  Save time, money",https://lawntrend.com/cub-cadet-zero-turn-mower-steering-problems/?utm_source=pinterest&utm_campaign=zero-turn-steering-p,2025-04-28,and frustration with proactive care. Click to learn how! #PreventativeMaintenance #CubCadetCare #MowerTips #ZeroTurnLife,https://lawntrend.com/cub-cadet-zero-turn-mower-steering-problems/
Zero Turn Steering: Tire Pressure Matters,https://res.cloudinary.com/dbcpfy04c/image/upload/v1618237451/placeholder.jpg,home-inspiration,,Believe it or not,https://lawntrend.com/cub-cadet-zero-turn-mower-steering-problems/?utm_source=pinterest&utm_campaign=zero-turn-steering-t,2025-04-28,incorrect tire pressure can affect your Cub Cadet zero turn's steering! We explain how tire pressure impacts steering performance and how to ensure your tires are properly inflated.  A simple fix for smoother steering! Click to learn more. #TirePressure #CubCadetTips #MowerMaintenance #ZeroTurn,https://lawntrend.com/cub-cadet-zero-turn-mower-steering-problems/
Cub Cadet Steering: Worn Bushings?,https://res.cloudinary.com/dbcpfy04c/image/upload/v1618237451/placeholder.jpg,home-inspiration,,Worn steering bushings can cause play in the steering and make your Cub Cadet zero turn difficult to control.  This post shows you how to inspect and replace worn bushings,https://lawntrend.com/cub-cadet-zero-turn-mower-steering-problems/?utm_source=pinterest&utm_campaign=cub-cadet-steering-w,2025-04-28,restoring precise steering. Click to learn how! #SteeringBushings #CubCadetRepair #MowerParts #ZeroTurn,https://lawntrend.com/cub-cadet-zero-turn-mower-steering-problems/
Zero Turn Steering: When to Call a Pro,https://res.cloudinary.com/dbcpfy04c/image/upload/v1618237451/placeholder.jpg,home-inspiration,,Sometimes,https://lawntrend.com/cub-cadet-zero-turn-mower-steering-problems/?utm_source=pinterest&utm_campaign=zero-turn-steering-w,2025-04-28,steering problems are best left to the professionals.  This post helps you determine when it's time to call a qualified mechanic for assistance with your Cub Cadet zero turn.  Don't risk further damage! Click to read now. #MowerRepair #CubCadetService #ZeroTurnHelp #SteeringProblems,https://lawntrend.com/cub-cadet-zero-turn-mower-steering-problems/
Cub Cadet Zero Turn: Steering & Handling Tips,https://res.cloudinary.com/dbcpfy04c/image/upload/v1618237451/placeholder.jpg,home-inspiration,,"Beyond repairs, improve your Cub Cadet's steering and handling with these expert tips! Learn techniques for smoother turns, better control",https://lawntrend.com/cub-cadet-zero-turn-mower-steering-problems/?utm_source=pinterest&utm_campaign=cub-cadet-zero-turn-,2025-04-28,and a more enjoyable mowing experience. Click to learn more! #MowerHandling #CubCadetTips #ZeroTurnControl #LawnCare,https://lawntrend.com/cub-cadet-zero-turn-mower-steering-problems/
Cub Cadet Zero Turn: Steering System Overview,https://res.cloudinary.com/dbcpfy04c/image/upload/v1618237451/placeholder.jpg,home-inspiration,,Understand the components of your Cub Cadet zero turn's steering system! This post provides a detailed overview of the system,https://lawntrend.com/cub-cadet-zero-turn-mower-steering-problems/?utm_source=pinterest&utm_campaign=cub-cadet-zero-turn-,2025-04-28,helping you better diagnose and address steering issues. Click to learn more! #SteeringSystem #CubCadetParts #MowerKnowledge #ZeroTurn,https://lawntrend.com/cub-cadet-zero-turn-mower-steering-problems/
Title,https://res.cloudinary.com/dbcpfy04c/image/upload/v1618237451/placeholder.jpg,home-inspiration,,Description,https://lawntrend.com/cub-cadet-xt3-gsx-problems/?utm_source=pinterest&utm_campaign=title,2025-04-28,Keywords,https://lawntrend.com/cub-cadet-xt3-gsx-problems/
Cub Cadet XT3 GSX: Common Issues & Fixes,https://res.cloudinary.com/dbcpfy04c/image/upload/v1618237451/placeholder.jpg,home-inspiration,,Is your Cub Cadet XT3 GSX giving you trouble? Don't let lawn care be a headache! This guide dives into the most frequent problems owners face – from engine issues to blade engagement failures. We provide clear,https://lawntrend.com/cub-cadet-xt3-gsx-problems/?utm_source=pinterest&utm_campaign=cub-cadet-xt3-gsx-co,2025-04-28,step-by-step troubleshooting tips to get you back to enjoying a perfectly manicured lawn.  Save time & money by DIYing repairs!  Click to learn how to diagnose & fix your XT3 GSX.  Don't give up on your ride-on mower! #CubCadet #XT3GSX #LawnMowerRepair #DIYRepair,https://lawntrend.com/cub-cadet-xt3-gsx-problems/
Blade Engagement Problems? XT3 GSX Help,https://res.cloudinary.com/dbcpfy04c/image/upload/v1618237451/placeholder.jpg,home-inspiration,,"Struggling to engage the blades on your Cub Cadet XT3 GSX?  This pin links to a comprehensive guide covering belt issues, spindle problems",https://lawntrend.com/cub-cadet-xt3-gsx-problems/?utm_source=pinterest&utm_campaign=blade-engagement-pro,2025-04-28,and electrical faults.  Don't waste another weekend pushing a mower!  We'll show you how to diagnose and fix blade engagement issues quickly and efficiently.  Get back to effortless mowing! #CubCadet #BladeEngagement #MowerRepair #XT3,https://lawntrend.com/cub-cadet-xt3-gsx-problems/
XT3 GSX: Steering Problems & Solutions,https://res.cloudinary.com/dbcpfy04c/image/upload/v1618237451/placeholder.jpg,home-inspiration,,"Experiencing difficulty steering your Cub Cadet XT3 GSX?  This pin leads to a guide covering steering linkage adjustments, tire pressure checks",https://lawntrend.com/cub-cadet-xt3-gsx-problems/?utm_source=pinterest&utm_campaign=xt3-gsx-steering-pro,2025-04-28,and potential hydraulic issues.  Don't struggle with a mower that won't steer straight!  We'll help you regain control and enjoy a smooth ride. #SteeringRepair #CubCadet #XT3 #LawnMower,https://lawntrend.com/cub-cadet-xt3-gsx-problems/
Cub Cadet XT3 GSX: Battery Drain Issues,https://res.cloudinary.com/dbcpfy04c/image/upload/v1618237451/placeholder.jpg,home-inspiration,,"Is your XT3 GSX battery constantly dying?  This pin points to a guide on identifying parasitic drains, checking the charging system",https://lawntrend.com/cub-cadet-xt3-gsx-problems/?utm_source=pinterest&utm_campaign=cub-cadet-xt3-gsx-ba,2025-04-28,and choosing the right battery.  Don't get stranded mid-lawn!  Learn how to keep your mower powered up and ready to go. #BatteryDrain #CubCadetXT3 #ChargingSystem #MowerBattery,https://lawntrend.com/cub-cadet-xt3-gsx-problems/
XT3 GSX: Electrical Problems Explained,https://res.cloudinary.com/dbcpfy04c/image/upload/v1618237451/placeholder.jpg,home-inspiration,,"Dealing with electrical issues on your Cub Cadet XT3 GSX?  This pin leads to a guide covering fuses, wiring",https://lawntrend.com/cub-cadet-xt3-gsx-problems/?utm_source=pinterest&utm_campaign=xt3-gsx-electrical-p,2025-04-28,and safety switches.  Don't risk electrical shocks!  Learn how to diagnose and fix electrical problems safely and effectively. #ElectricalRepair #CubCadetXT3 #Wiring #SafetySwitches,https://lawntrend.com/cub-cadet-xt3-gsx-problems/
Cub Cadet XT3 GSX: Mower Deck Issues,https://res.cloudinary.com/dbcpfy04c/image/upload/v1618237451/placeholder.jpg,home-inspiration,,"Is your XT3 GSX mower deck uneven or leaving streaks?  This pin links to a guide on leveling the deck, sharpening blades",https://lawntrend.com/cub-cadet-xt3-gsx-problems/?utm_source=pinterest&utm_campaign=cub-cadet-xt3-gsx-mo,2025-04-28,and addressing deck damage.  Achieve a professional-looking lawn with a properly maintained deck! #MowerDeck #CubCadet #XT3GSX #LawnStripes,https://lawntrend.com/cub-cadet-xt3-gsx-problems/
XT3 GSX: Hydrostatic Transmission Problems,https://res.cloudinary.com/dbcpfy04c/image/upload/v1618237451/placeholder.jpg,home-inspiration,,"Experiencing issues with the hydrostatic transmission on your Cub Cadet XT3 GSX? This pin leads to a guide covering fluid levels, filter changes",https://lawntrend.com/cub-cadet-xt3-gsx-problems/?utm_source=pinterest&utm_campaign=xt3-gsx-hydrostatic-,2025-04-28,and potential pump problems. Don't let transmission issues slow you down! #HydrostaticTransmission #CubCadet #XT3 #MowerRepair,https://lawntrend.com/cub-cadet-xt3-gsx-problems/
XT3 GSX: Overheating Issues & Prevention,https://res.cloudinary.com/dbcpfy04c/image/upload/v1618237451/placeholder.jpg,home-inspiration,,"Is your Cub Cadet XT3 GSX overheating? This pin links to a guide on checking the cooling system, cleaning debris",https://lawntrend.com/cub-cadet-xt3-gsx-problems/?utm_source=pinterest&utm_campaign=xt3-gsx-overheating-,2025-04-28,and preventing future overheating.  Protect your engine and keep your mower running cool! #Overheating #CubCadet #XT3GSX #EngineCooling,https://lawntrend.com/cub-cadet-xt3-gsx-problems/
Cub Cadet XT3 GSX: Blade Sharpening Tips,https://res.cloudinary.com/dbcpfy04c/image/upload/v1618237451/placeholder.jpg,home-inspiration,,Dull blades tear grass instead of cutting it. This pin directs you to our guide on sharpening your XT3 GSX blades for a cleaner,https://lawntrend.com/cub-cadet-xt3-gsx-problems/?utm_source=pinterest&utm_campaign=cub-cadet-xt3-gsx-bl,2025-04-28,healthier lawn.  A sharp blade is a happy blade! #BladeSharpening #CubCadet #XT3 #LawnCare,https://lawntrend.com/cub-cadet-xt3-gsx-problems/
Cub Cadet XT3 GSX: Winter Storage Guide,https://res.cloudinary.com/dbcpfy04c/image/upload/v1618237451/placeholder.jpg,home-inspiration,,"Preparing your XT3 GSX for winter storage? This pin links to a guide on fuel stabilization, battery maintenance",https://lawntrend.com/cub-cadet-xt3-gsx-problems/?utm_source=pinterest&utm_campaign=cub-cadet-xt3-gsx-wi,2025-04-28,and protecting your mower from the elements.  Ensure a smooth start next spring! #WinterStorage #CubCadet #XT3GSX #LawnMowerPrep,https://lawntrend.com/cub-cadet-xt3-gsx-problems/
XT3 GSX: Scalping Issues - How to Avoid,https://res.cloudinary.com/dbcpfy04c/image/upload/v1618237451/placeholder.jpg,home-inspiration,,"Tired of scalping your lawn with your Cub Cadet XT3 GSX? This pin links to a guide on adjusting deck height, tire pressure",https://lawntrend.com/cub-cadet-xt3-gsx-problems/?utm_source=pinterest&utm_campaign=xt3-gsx-scalping-iss,2025-04-28,and mowing techniques.  Achieve a perfectly level cut! #Scalping #CubCadet #XT3 #LawnCare,https://lawntrend.com/cub-cadet-xt3-gsx-problems/
Title,https://res.cloudinary.com/dbcpfy04c/image/upload/v1618237451/placeholder.jpg,home-inspiration,,Description,https://lawntrend.com/john-deere-2025r-problems/?utm_source=pinterest&utm_campaign=title,2025-04-28,Keywords,https://lawntrend.com/john-deere-2025r-problems/
John Deere 2025R: Common Issues,https://res.cloudinary.com/dbcpfy04c/image/upload/v1618237451/placeholder.jpg,home-inspiration,,"Worried about your John Deere 2025R? Don't let unexpected problems ruin your property dreams! This guide dives deep into the most frequent issues owners face – from hydraulic woes to engine hiccups. We break down symptoms, potential causes",https://lawntrend.com/john-deere-2025r-problems/?utm_source=pinterest&utm_campaign=john-deere-2025r-com,2025-04-28,and DIY fixes (where possible!).  Protect your investment and keep your compact tractor running smoothly. Click to learn how to troubleshoot & avoid costly repairs!  Don't suffer in silence – get back to enjoying your land! #JohnDeere #2025R #CompactTractor #TractorProblems,https://lawntrend.com/john-deere-2025r-problems/
John Deere 2025R: Hydraulic Problems?,https://res.cloudinary.com/dbcpfy04c/image/upload/v1618237451/placeholder.jpg,home-inspiration,,"Is your 2025R's hydraulics acting up? Loss of power, slow lifting, or strange noises? This pin leads to a detailed breakdown of common John Deere 2025R hydraulic issues. We cover everything from low fluid levels to pump failures",https://lawntrend.com/john-deere-2025r-problems/?utm_source=pinterest&utm_campaign=john-deere-2025r-hyd,2025-04-28,offering practical advice for diagnosis and repair.  Don't let hydraulic problems stop you from getting work done!  Learn how to identify the issue and get your tractor back in action. #JohnDeere2025R #Hydraulics #TractorRepair #DIY,https://lawntrend.com/john-deere-2025r-problems/
2025R Engine Troubles: Fix It!,https://res.cloudinary.com/dbcpfy04c/image/upload/v1618237451/placeholder.jpg,home-inspiration,,"Facing engine problems with your John Deere 2025R?  This pin links to a comprehensive guide covering common engine issues like overheating, starting difficulties",https://lawntrend.com/john-deere-2025r-problems/?utm_source=pinterest&utm_campaign=2025r-engine-trouble,2025-04-28,and loss of power.  We explore potential causes – from clogged filters to fuel system problems – and provide step-by-step troubleshooting tips.  Keep your engine purring! Click to learn more and save money on repairs. #JohnDeere #EngineRepair #2025Rproblems #TractorLife,https://lawntrend.com/john-deere-2025r-problems/
John Deere 2025R: Fuel System Fixes,https://res.cloudinary.com/dbcpfy04c/image/upload/v1618237451/placeholder.jpg,home-inspiration,,"Is your 2025R struggling with fuel delivery?  This pin directs you to a guide detailing common fuel system problems in the John Deere 2025R, including clogged filters, faulty fuel pumps, and injector issues.  We provide clear instructions for diagnosis and repair",https://lawntrend.com/john-deere-2025r-problems/?utm_source=pinterest&utm_campaign=john-deere-2025r-fue,2025-04-28,helping you avoid costly downtime.  Don't let fuel problems slow you down!  Click to learn how to keep your tractor fueled and running strong. #FuelSystem #JohnDeere2025R #TractorMaintenance #Diesel,https://lawntrend.com/john-deere-2025r-problems/
2025R Transmission Issues: Solved!,https://res.cloudinary.com/dbcpfy04c/image/upload/v1618237451/placeholder.jpg,home-inspiration,,Worried about your John Deere 2025R's transmission?  This pin leads to a guide covering common transmission problems,https://lawntrend.com/john-deere-2025r-problems/?utm_source=pinterest&utm_campaign=2025r-transmission-i,2025-04-28,from slipping gears to difficulty shifting.  We explore potential causes and offer troubleshooting tips to help you diagnose and address the issue.  Keep your tractor moving smoothly! Click to learn how to maintain a healthy transmission. #JohnDeere #Transmission #2025R #Tractor,https://lawntrend.com/john-deere-2025r-problems/
John Deere 2025R: Electrical Problems,https://res.cloudinary.com/dbcpfy04c/image/upload/v1618237451/placeholder.jpg,home-inspiration,,"Dealing with electrical gremlins in your 2025R?  This pin links to a guide covering common electrical issues, including faulty wiring, blown fuses",https://lawntrend.com/john-deere-2025r-problems/?utm_source=pinterest&utm_campaign=john-deere-2025r-ele,2025-04-28,and malfunctioning sensors.  We provide troubleshooting tips and advice on how to safely diagnose and repair electrical problems.  Don't get shocked – learn how to fix it! #ElectricalRepair #JohnDeere2025R #TractorWiring #DIYrepair,https://lawntrend.com/john-deere-2025r-problems/
2025R: PTO Problems & Solutions,https://res.cloudinary.com/dbcpfy04c/image/upload/v1618237451/placeholder.jpg,home-inspiration,,"Is your PTO not engaging or working correctly on your John Deere 2025R? This pin directs you to a guide detailing common PTO issues, from slipping clutches to damaged shafts. We offer practical advice for diagnosis and repair",https://lawntrend.com/john-deere-2025r-problems/?utm_source=pinterest&utm_campaign=2025r-pto-problems-s,2025-04-28,helping you get back to work quickly.  Don't let PTO problems hold you back! #PTO #JohnDeere #2025R #TractorAttachments,https://lawntrend.com/john-deere-2025r-problems/
John Deere 2025R: Overheating Issues,https://res.cloudinary.com/dbcpfy04c/image/upload/v1618237451/placeholder.jpg,home-inspiration,,"Is your 2025R overheating? This pin leads to a guide covering common causes of overheating, including radiator problems, coolant leaks",https://lawntrend.com/john-deere-2025r-problems/?utm_source=pinterest&utm_campaign=john-deere-2025r-ove,2025-04-28,and thermostat failures. We provide troubleshooting tips and advice on how to prevent overheating and keep your engine cool.  Protect your engine! Click to learn more. #Overheating #JohnDeere2025R #CoolingSystem #TractorCare,https://lawntrend.com/john-deere-2025r-problems/
2025R: Steering Problems Explained,https://res.cloudinary.com/dbcpfy04c/image/upload/v1618237451/placeholder.jpg,home-inspiration,,Experiencing steering issues with your John Deere 2025R? This pin directs you to a guide detailing common steering problems,https://lawntrend.com/john-deere-2025r-problems/?utm_source=pinterest&utm_campaign=2025r-steering-probl,2025-04-28,from loose steering to difficulty turning. We offer practical advice for diagnosis and repair.  Stay in control! Click to learn how to fix your steering. #Steering #JohnDeere #2025R #TractorRepair,https://lawntrend.com/john-deere-2025r-problems/
John Deere 2025R: Battery Issues?,https://res.cloudinary.com/dbcpfy04c/image/upload/v1618237451/placeholder.jpg,home-inspiration,,"Is your 2025R battery draining quickly or failing to start the engine? This pin links to a guide covering common battery problems, including corrosion, sulfation",https://lawntrend.com/john-deere-2025r-problems/?utm_source=pinterest&utm_campaign=john-deere-2025r-bat,2025-04-28,and faulty charging systems. We provide troubleshooting tips and advice on how to maintain a healthy battery.  Don't get stranded! #Battery #JohnDeere2025R #TractorPower #Electrical,https://lawntrend.com/john-deere-2025r-problems/
2025R:  Diagnosing a No-Start Condition,https://res.cloudinary.com/dbcpfy04c/image/upload/v1618237451/placeholder.jpg,home-inspiration,,Can't get your 2025R to start? This pin directs you to a troubleshooting guide for no-start conditions,https://lawntrend.com/john-deere-2025r-problems/?utm_source=pinterest&utm_campaign=2025r-diagnosing-a-n,2025-04-28,covering common causes and diagnostic steps.  Get back to work! Click to learn how to diagnose the problem. #NoStart #JohnDeere2025R #TractorTroubleshooting #EngineProblems,https://lawntrend.com/john-deere-2025r-problems/
Title,https://res.cloudinary.com/dbcpfy04c/image/upload/v1618237451/placeholder.jpg,home-inspiration,,Description,https://lawntrend.com/john-deere-2010-problems/?utm_source=pinterest&utm_campaign=title,2025-04-28,Keywords,https://lawntrend.com/john-deere-2010-problems/
John Deere 2010: Common Issues,https://res.cloudinary.com/dbcpfy04c/image/upload/v1618237451/placeholder.jpg,home-inspiration,,"Don't let John Deere 2010 problems ruin your season! This pin highlights frequent issues like hydraulic failures, fuel system woes, and electrical glitches. Learn to diagnose & fix them yourself, saving time & money. We break down the most common repairs with clear explanations & resources. Is your 2010 giving you headaches? Click to troubleshoot & get back to work! Prevent costly downtime & keep your tractor running smoothly. #JohnDeere #JohnDeere2010 #TractorProblems #TractorRepair,John Deere 2010,Tractor Repair,Common Problems",https://lawntrend.com/john-deere-2010-problems/?utm_source=pinterest&utm_campaign=john-deere-2010-comm,2025-04-28,Hydraulics,https://lawntrend.com/john-deere-2010-problems/
