Title,Media URL,Pinterest board,Thumbnail,Description,Link,Publish date,Keywords,Source URL
DIY Mower Repair: Save Money!,https://res.cloudinary.com/ddxyyzkuq/image/upload/v1745965806/pin_6_6_j0isem.webp,home-repair-ideas,,"Tired of expensive repair bills? This post empowers you to fix your Briggs & Stratton lawn mower that won't turn off yourself! We provide a detailed, easy-to-follow guide with clear instructions and helpful diagrams.  Save money and gain valuable skills!  Click to learn how to diagnose and repair the issue, and enjoy a perfectly maintained lawn without breaking the bank. #diy #lawnmowerrepair #savemoney #homeimprovement,DIY repair,lawn mower,Briggs & Stratton",https://lawntrend.com/briggs-and-stratton-lawn-mower-wont-turn-off/?utm_source=pinterest&utm_campaign=diy-mower-repair-sav,2025-04-29,cost savings,https://lawntrend.com/briggs-and-stratton-lawn-mower-wont-turn-off/
Won't Shut Off? Carburetor Check!,https://res.cloudinary.com/ddxyyzkuq/image/upload/v1745965813/pin_6_7_elhqmj.webp,small-engine-ideas,,"Is a dirty carburetor causing your Briggs & Stratton mower to run endlessly? This article dives deep into carburetor issues and provides a step-by-step cleaning guide.  Restore your mower's performance and enjoy a smooth, efficient cut.  Click to learn how to clean your carburetor and get your mower running like new!  Don't let a clogged carburetor ruin your lawn care routine. #carburetor #lawnmowerrepair #diy #lawncare,carburetor,lawn mower,cleaning",https://lawntrend.com/briggs-and-stratton-lawn-mower-wont-turn-off/?utm_source=pinterest&utm_campaign=wont-shut-off-carbur,2025-04-29,Briggs & Stratton,https://lawntrend.com/briggs-and-stratton-lawn-mower-wont-turn-off/
Ignition Issues? Mower Fix!,https://res.cloudinary.com/ddxyyzkuq/image/upload/v1745965820/pin_6_8_tpicah.webp,lawn-mower-ideas,,"A faulty ignition switch can prevent your Briggs & Stratton mower from turning off. This post explains how to diagnose and potentially fix ignition problems.  We'll help you understand the ignition system and identify common failure points.  Click to learn how to test your ignition switch and restore your mower's functionality.  Get back to mowing with confidence! #ignition #lawnmowerrepair #diy #engine,ignition switch,lawn mower,repair",https://lawntrend.com/briggs-and-stratton-lawn-mower-wont-turn-off/?utm_source=pinterest&utm_campaign=ignition-issues-mowe,2025-04-29,Briggs & Stratton,https://lawntrend.com/briggs-and-stratton-lawn-mower-wont-turn-off/
Safety Switch Troubles? Solved!,https://res.cloudinary.com/ddxyyzkuq/image/upload/v1745965827/pin_6_9_fibtkd.webp,small-engine-ideas,,"The safety switch is crucial for preventing accidents. This article focuses on troubleshooting safety switch issues that might be causing your Briggs & Stratton mower to run continuously.  We'll show you how to test and potentially replace the switch.  Click to learn how to ensure your mower's safety features are functioning correctly.  Protect yourself and your loved ones! #safetyswitch #lawnmowerrepair #diy #lawncare,safety switch,lawn mower,repair",https://lawntrend.com/briggs-and-stratton-lawn-mower-wont-turn-off/?utm_source=pinterest&utm_campaign=safety-switch-troubl,2025-04-29,Briggs & Stratton,https://lawntrend.com/briggs-and-stratton-lawn-mower-wont-turn-off/
Mower Running Too Long? Help!,https://res.cloudinary.com/ddxyyzkuq/image/upload/v1745965834/pin_6_10_tjxaiu.webp,lawn-care-ideas,,"Frustrated with a Briggs & Stratton mower that just won't stop? This post offers a comprehensive guide to diagnosing and resolving the issue.  We cover everything from simple fixes to more complex repairs.  Click to read now and get your mower back under control!  Don't waste another minute struggling with a runaway mower. #lawnmowerproblems #diyrepair #lawncare #fixit,lawn mower,troubleshooting,Briggs & Stratton",https://lawntrend.com/briggs-and-stratton-lawn-mower-wont-turn-off/?utm_source=pinterest&utm_campaign=mower-running-too-lo,2025-04-29,running continuously,https://lawntrend.com/briggs-and-stratton-lawn-mower-wont-turn-off/
Briggs & Stratton: Quick Shutdown!,https://res.cloudinary.com/ddxyyzkuq/image/upload/v1745965839/pin_6_11_zilegg.webp,lawn-repair-ideas,,"Learn how to quickly and safely shut down a Briggs & Stratton lawn mower that's not responding to the normal controls. This post provides emergency procedures and troubleshooting steps.  Your safety is our priority!  Click to read and be prepared for any situation.  Don't risk an accident – know what to do! #lawnmowersafety #emergency #diy #lawncare,lawn mower safety,emergency shutdown,Briggs & Stratton",https://lawntrend.com/briggs-and-stratton-lawn-mower-wont-turn-off/?utm_source=pinterest&utm_campaign=briggs-stratton-quic,2025-04-29,troubleshooting,https://lawntrend.com/briggs-and-stratton-lawn-mower-wont-turn-off/
Choke Stuck? Mower Won't Stop!,https://res.cloudinary.com/ddxyyzkuq/image/upload/v1745965846/pin_6_12_neyqbr.webp,lawn-mower-ideas,,"A stuck choke can cause a Briggs & Stratton mower to run continuously. This article explains how to identify and resolve choke-related issues.  We provide clear instructions and helpful visuals.  Click to learn how to free a stuck choke and get your mower running smoothly.  Don't let a simple choke issue cause major headaches! #choke #lawnmowerrepair #diy #lawncare,choke,lawn mower,repair",https://lawntrend.com/briggs-and-stratton-lawn-mower-wont-turn-off/?utm_source=pinterest&utm_campaign=choke-stuck-mower-wo,2025-04-29,Briggs & Stratton,https://lawntrend.com/briggs-and-stratton-lawn-mower-wont-turn-off/
Fuel Line Issues & Mower Runaway?,https://res.cloudinary.com/ddxyyzkuq/image/upload/v1745965854/pin_6_13_lsj5ww.webp,lawn-mower-ideas,,"Could a fuel line problem be the reason your Briggs & Stratton mower won't turn off? This post explores fuel system issues and provides troubleshooting tips.  We'll help you identify leaks and blockages.  Click to learn how to inspect and repair your fuel lines.  Ensure a safe and efficient mowing experience! #fuelline #lawnmowerrepair #diy #lawncare,fuel line,lawn mower,repair",https://lawntrend.com/briggs-and-stratton-lawn-mower-wont-turn-off/?utm_source=pinterest&utm_campaign=fuel-line-issues-mow,2025-04-29,Briggs & Stratton,https://lawntrend.com/briggs-and-stratton-lawn-mower-wont-turn-off/
Mower Won't Stop? Diagnostic Flowchart!,https://res.cloudinary.com/ddxyyzkuq/image/upload/v1745965861/pin_6_14_oeyeyd.webp,lawn-mower-ideas,,"Confused about where to start? This post includes a handy diagnostic flowchart to help you pinpoint the cause of your Briggs & Stratton mower's runaway problem.  Simplify the troubleshooting process and get to the solution faster.  Click to access the flowchart and start diagnosing! #lawnmowerrepair #diy #troubleshooting #diagnostic,lawn mower,troubleshooting,diagnostic flowchart",https://lawntrend.com/briggs-and-stratton-lawn-mower-wont-turn-off/?utm_source=pinterest&utm_campaign=mower-wont-stop-diag,2025-04-29,Briggs & Stratton,https://lawntrend.com/briggs-and-stratton-lawn-mower-wont-turn-off/
Briggs & Stratton: Preventative Maintenance!,https://res.cloudinary.com/ddxyyzkuq/image/upload/v1745965866/pin_6_15_emrfrm.webp,lawn-repair-ideas,,"Don't wait for a problem to occur! This post emphasizes the importance of preventative maintenance to keep your Briggs & Stratton mower running smoothly and safely.  Learn how to avoid common issues, including the one we're addressing here.  Click to read and protect your investment! #lawnmowermaintenance #diy #lawncare #preventativecare,lawn mower maintenance,preventative care,Briggs & Stratton",https://lawntrend.com/briggs-and-stratton-lawn-mower-wont-turn-off/?utm_source=pinterest&utm_campaign=briggs-stratton-prev,2025-04-29,lawn care,https://lawntrend.com/briggs-and-stratton-lawn-mower-wont-turn-off/
Mower Running Hot? Shut Down Issues!,https://res.cloudinary.com/ddxyyzkuq/image/upload/v1745965873/pin_6_16_r9xw3s.webp,lawn-mower-ideas,,"Is your mower overheating *and* won't turn off? This post addresses the connection between overheating and shutdown problems in Briggs & Stratton mowers.  We'll help you identify the cause and take corrective action.  Click to learn how to cool down your mower and prevent further damage. #overheating #lawnmowerrepair #diy #lawncare,overheating,lawn mower,repair",https://lawntrend.com/briggs-and-stratton-lawn-mower-wont-turn-off/?utm_source=pinterest&utm_campaign=mower-running-hot-sh,2025-04-29,Briggs & Stratton,https://lawntrend.com/briggs-and-stratton-lawn-mower-wont-turn-off/
Easy Mower Fixes You Can Do!,https://res.cloudinary.com/ddxyyzkuq/image/upload/v1745965880/pin_6_17_v35q4b.webp,lawn-repair-ideas,,"Empower yourself with these simple DIY fixes for a Briggs & Stratton mower that won't turn off. This post focuses on easy-to-implement solutions that require minimal tools and experience.  Save time and money!  Click to learn how to tackle common problems yourself. #diyrepair #lawnmowerfix #easyfix #lawncare,DIY repair,lawn mower,easy fixes",https://lawntrend.com/briggs-and-stratton-lawn-mower-wont-turn-off/?utm_source=pinterest&utm_campaign=easy-mower-fixes-you,2025-04-29,Briggs & Stratton,https://lawntrend.com/briggs-and-stratton-lawn-mower-wont-turn-off/
Briggs & Stratton: Engine Basics!,https://res.cloudinary.com/ddxyyzkuq/image/upload/v1745965885/pin_6_18_xlbtje.webp,lawn-repair-ideas,,"Understand the inner workings of your Briggs & Stratton engine! This post provides a basic overview of the engine components and how they contribute to the shutdown process.  Knowledge is power!  Click to learn more about your mower's engine. #enginebasics #lawnmowerrepair #diy #lawncare,engine,lawn mower,Briggs & Stratton",https://lawntrend.com/briggs-and-stratton-lawn-mower-wont-turn-off/?utm_source=pinterest&utm_campaign=briggs-stratton-engi,2025-04-29,engine components,https://lawntrend.com/briggs-and-stratton-lawn-mower-wont-turn-off/
Mower Safety Checklist: Before You Start!,https://res.cloudinary.com/ddxyyzkuq/image/upload/v1745965892/pin_6_19_vj6xae.webp,yard-safety-ideas,,"Before you attempt any repairs, review this essential safety checklist. This post emphasizes safe handling practices and precautions to protect yourself while working on your Briggs & Stratton mower.  Your safety is paramount!  Click to read and stay safe. #lawnmowersafety #diyrepair #safetyfirst #lawncare,lawn mower safety,safety checklist,Briggs & Stratton",https://lawntrend.com/briggs-and-stratton-lawn-mower-wont-turn-off/?utm_source=pinterest&utm_campaign=mower-safety-checkli,2025-04-29,safety precautions,https://lawntrend.com/briggs-and-stratton-lawn-mower-wont-turn-off/
Troubleshooting a Runaway Mower: Video!,https://res.cloudinary.com/ddxyyzkuq/image/upload/v1745965898/pin_6_20_frnwqm.webp,auto-repair-ideas,,"Watch our step-by-step video guide on how to troubleshoot a Briggs & Stratton lawn mower that won't turn off.  Visual learners will appreciate this clear and concise demonstration.  Click to watch the video and learn from our experts! #lawnmowerrepair #diy #video #lawncare,lawn mower,video tutorial,Briggs & Stratton",https://lawntrend.com/briggs-and-stratton-lawn-mower-wont-turn-off/?utm_source=pinterest&utm_campaign=troubleshooting-a-ru,2025-04-29,troubleshooting,https://lawntrend.com/briggs-and-stratton-lawn-mower-wont-turn-off/
Briggs & Stratton: Parts You Might Need!,https://res.cloudinary.com/ddxyyzkuq/image/upload/v1745965903/pin_6_21_bpkwvo.webp,lawn-repair-ideas,,"This post lists the common parts you might need to replace when fixing a Briggs & Stratton mower that won't turn off.  Save time and effort by having the right parts on hand.  Click to see the list and find where to buy them. #lawnmowerparts #diyrepair #briggsandstratton #lawncare,lawn mower parts,replacement parts,Briggs & Stratton",https://lawntrend.com/briggs-and-stratton-lawn-mower-wont-turn-off/?utm_source=pinterest&utm_campaign=briggs-stratton-part,2025-04-29,repair,https://lawntrend.com/briggs-and-stratton-lawn-mower-wont-turn-off/
Mower Won't Stop? Ask a Pro!,https://res.cloudinary.com/ddxyyzkuq/image/upload/v1745965908/pin_6_22_uqh6z5.webp,lawn-mower-ideas,,"Not comfortable tackling the repair yourself? This post provides guidance on when to call a professional lawn mower mechanic.  Don't risk further damage or injury.  Click to learn when to seek expert help. #lawnmowerrepair #diy #prohelp #lawncare,lawn mower repair,professional help,Briggs & Stratton",https://lawntrend.com/briggs-and-stratton-lawn-mower-wont-turn-off/?utm_source=pinterest&utm_campaign=mower-wont-stop-ask-,2025-04-29,mechanic,https://lawntrend.com/briggs-and-stratton-lawn-mower-wont-turn-off/
Extend Your Mower's Life!,https://res.cloudinary.com/ddxyyzkuq/image/upload/v1745965915/pin_6_23_ah8psn.webp,lawn-care-ideas,,"Learn how to extend the life of your Briggs & Stratton lawn mower with these simple maintenance tips.  Preventative care can save you money and headaches in the long run.  Click to read and keep your mower running smoothly for years to come. #lawnmowermaintenance #diy #lawncare #longevity,lawn mower maintenance,preventative care,Briggs & Stratton",https://lawntrend.com/briggs-and-stratton-lawn-mower-wont-turn-off/?utm_source=pinterest&utm_campaign=extend-your-mowers-l,2025-04-29,lawn care,https://lawntrend.com/briggs-and-stratton-lawn-mower-wont-turn-off/
Common Mistakes to Avoid!,https://res.cloudinary.com/ddxyyzkuq/image/upload/v1745965921/pin_6_24_sfrjxs.webp,problem-solving-ideas,,"Don't make these common mistakes when troubleshooting a Briggs & Stratton mower that won't turn off. This post highlights potential pitfalls and provides guidance on how to avoid them.  Save yourself time and frustration!  Click to read and learn from our experience. #lawnmowerrepair #diy #mistakes #lawncare,lawn mower repair,common mistakes,Briggs & Stratton",https://lawntrend.com/briggs-and-stratton-lawn-mower-wont-turn-off/?utm_source=pinterest&utm_campaign=common-mistakes-to-a,2025-04-29,troubleshooting,https://lawntrend.com/briggs-and-stratton-lawn-mower-wont-turn-off/
Briggs & Stratton Resources: Links!,https://res.cloudinary.com/ddxyyzkuq/image/upload/v1745965928/pin_6_25_onylpc.webp,lawn-repair-ideas,,"Need more help? This post provides a curated list of helpful resources, including the Briggs & Stratton website, owner's manuals, and online forums.  Find the information you need to get your mower back in working order.  Click to access the resources! #lawnmowerresources #diy #briggsandstratton #lawncare,lawn mower resources,Briggs & Stratton,owner's manual",https://lawntrend.com/briggs-and-stratton-lawn-mower-wont-turn-off/?utm_source=pinterest&utm_campaign=briggs-stratton-reso,2025-04-29,online forums,https://lawntrend.com/briggs-and-stratton-lawn-mower-wont-turn-off/
Title,https://res.cloudinary.com/ddxyyzkuq/image/upload/v1745965973/pin_7_1_xnd1ur.webp,please-provide-the-title-and-keywords-i-need-that-information-to-suggest-a-board-name-once,,Description,https://lawntrend.com/why-is-my-lawn-mower-shaking/?utm_source=pinterest&utm_campaign=title,2025-04-29,Keywords,https://lawntrend.com/why-is-my-lawn-mower-shaking/
Lawn Mower Shaking? Fix It Now!,https://res.cloudinary.com/ddxyyzkuq/image/upload/v1745965980/pin_7_2_euzzrw.webp,lawn-repair-ideas,,"Is your lawn mower vibrating like crazy? Don't ignore it! Excessive shaking can lead to bigger (and expensive!) problems. This guide breaks down the most common causes – from loose blades to engine issues – and gives you simple DIY fixes to get your mower running smoothly again.  Protect your investment and enjoy a peaceful mow. Click to learn how to diagnose & repair the shake! #lawnmower #lawncare #diyrepair #gardening,lawn mower, shaking, repair",https://lawntrend.com/why-is-my-lawn-mower-shaking/?utm_source=pinterest&utm_campaign=lawn-mower-shaking-f,2025-04-29,diy,https://lawntrend.com/why-is-my-lawn-mower-shaking/
Stop the Shake! Mower Troubleshooting,https://res.cloudinary.com/ddxyyzkuq/image/upload/v1745965986/pin_7_3_wehpcn.webp,lawn-care-ideas,,"That annoying lawn mower shake isn't just irritating, it's a warning sign!  Discover the hidden reasons why your mower is vibrating, and learn how to quickly and safely address them. We cover everything from blade balance to worn bearings.  Don't let a small issue turn into a major breakdown.  Get back to enjoying your beautiful lawn! Read the full guide now. #lawnmowerrepair #lawncaretips #gardentools #homeimprovement,lawn mower, vibration, troubleshooting",https://lawntrend.com/why-is-my-lawn-mower-shaking/?utm_source=pinterest&utm_campaign=stop-the-shake-mower,2025-04-29,maintenance,https://lawntrend.com/why-is-my-lawn-mower-shaking/
Is Your Mower Trying to Tell You Something?,https://res.cloudinary.com/ddxyyzkuq/image/upload/v1745965992/pin_7_4_lsvxta.webp,lawn-care-ideas,,"A shaking lawn mower is screaming for attention! Ignoring it could mean costly repairs down the road.  This post dives deep into the reasons behind the vibration, offering clear explanations and step-by-step solutions.  We'll help you identify the problem and get your mower back in top shape.  Don't wait – fix it today! #lawnmowerproblems #lawncare101 #diyprojects #gardeninglife,lawn mower, shaking, diagnosis",https://lawntrend.com/why-is-my-lawn-mower-shaking/?utm_source=pinterest&utm_campaign=is-your-mower-trying,2025-04-29,solutions,https://lawntrend.com/why-is-my-lawn-mower-shaking/
Lawn Mower Vibration: 5 Common Causes,https://res.cloudinary.com/ddxyyzkuq/image/upload/v1745965998/pin_7_5_ya3v52.webp,lawn-care-ideas,,"Don't let a shaky lawn mower ruin your weekend!  We've pinpointed the 5 most frequent culprits behind the vibration, and provide easy-to-follow instructions for fixing them.  From loose parts to engine imbalances, we've got you covered.  Save time, money, and frustration – read our guide now!  #lawnmowerfix #lawncaretips #homeowner #gardeninghacks,lawn mower, vibration, causes",https://lawntrend.com/why-is-my-lawn-mower-shaking/?utm_source=pinterest&utm_campaign=lawn-mower-vibration,2025-04-29,fixes,https://lawntrend.com/why-is-my-lawn-mower-shaking/
DIY Lawn Mower Repair: Shake Edition,https://res.cloudinary.com/ddxyyzkuq/image/upload/v1745966005/pin_7_6_ihxodd.webp,lawn-repair-ideas,,"Feeling handy?  You can tackle that lawn mower shake yourself!  This guide provides a detailed breakdown of the repair process, with clear instructions and helpful visuals.  We'll show you how to safely diagnose the issue and get your mower running like new.  Empower yourself and save on repair costs! #diyrepair #lawnmower #gardening #homeimprovementprojects,lawn mower, diy, repair",https://lawntrend.com/why-is-my-lawn-mower-shaking/?utm_source=pinterest&utm_campaign=diy-lawn-mower-repai,2025-04-29,shaking,https://lawntrend.com/why-is-my-lawn-mower-shaking/
Blade Balance: The Key to a Smooth Mow,https://res.cloudinary.com/ddxyyzkuq/image/upload/v1745966011/pin_7_7_kiy6re.webp,lawn-care-ideas,,"Is an unbalanced blade causing your lawn mower to shake? It's a common problem! Learn how to check your blade balance and sharpen it correctly for a smooth, even cut.  A balanced blade means a happier mower and a healthier lawn.  Don't skip this crucial maintenance step! #lawnmowerblade #lawncare #gardeningtips #diy,lawn mower, blade, balance",https://lawntrend.com/why-is-my-lawn-mower-shaking/?utm_source=pinterest&utm_campaign=blade-balance-the-ke,2025-04-29,sharpening,https://lawntrend.com/why-is-my-lawn-mower-shaking/
Engine Issues & Lawn Mower Shake,https://res.cloudinary.com/ddxyyzkuq/image/upload/v1745966017/pin_7_8_qjemtv.webp,lawn-repair-ideas,,"A shaking lawn mower could signal engine trouble.  We explore the connection between engine problems and vibration, helping you identify potential issues like loose flywheel keys or worn engine mounts.  Don't ignore these warning signs – read our guide to protect your mower! #lawnmowerepair #engineproblems #lawncare #diy,lawn mower, engine, shaking",https://lawntrend.com/why-is-my-lawn-mower-shaking/?utm_source=pinterest&utm_campaign=engine-issues-lawn-m,2025-04-29,repair,https://lawntrend.com/why-is-my-lawn-mower-shaking/
Loose Parts? Stop the Lawn Mower Shake!,https://res.cloudinary.com/ddxyyzkuq/image/upload/v1745966023/pin_7_9_imx7o8.webp,outdoor-play-ideas,,"Simple as it sounds, loose bolts and parts are a major cause of lawn mower vibration.  This post walks you through a thorough inspection process, showing you where to check for looseness and how to tighten everything up.  A quick fix for a smoother mow! #lawnmower #lawncare #diyrepair #gardeningtips,lawn mower, loose parts, shaking",https://lawntrend.com/why-is-my-lawn-mower-shaking/?utm_source=pinterest&utm_campaign=loose-parts-stop-the,2025-04-29,inspection,https://lawntrend.com/why-is-my-lawn-mower-shaking/
Protect Your Lawn Mower: Prevent Shaking,https://res.cloudinary.com/ddxyyzkuq/image/upload/v1745966030/pin_7_10_d8aznw.webp,lawn-care-ideas,,"Don't wait for your lawn mower to start shaking – prevent it!  This guide focuses on proactive maintenance steps you can take to keep your mower running smoothly and avoid vibration issues.  Regular care saves you time, money, and headaches.  #lawnmowermaintenance #lawncare #preventativemaintenance #gardening,lawn mower, maintenance, prevention",https://lawntrend.com/why-is-my-lawn-mower-shaking/?utm_source=pinterest&utm_campaign=protect-your-lawn-mo,2025-04-29,shaking,https://lawntrend.com/why-is-my-lawn-mower-shaking/
Is Your Lawn Mower Shaking Violently?,https://res.cloudinary.com/ddxyyzkuq/image/upload/v1745966036/pin_7_11_s3ip4y.webp,lawn-care-ideas,,"Violent shaking is a serious sign!  This post addresses the most severe causes of lawn mower vibration, including engine damage and structural issues.  Learn how to assess the situation and determine if DIY repair is possible, or if you need professional help. #lawnmowerrepair #lawncare #safetyfirst #gardening,lawn mower, violent shaking, repair",https://lawntrend.com/why-is-my-lawn-mower-shaking/?utm_source=pinterest&utm_campaign=is-your-lawn-mower-s,2025-04-29,safety,https://lawntrend.com/why-is-my-lawn-mower-shaking/
Lawn Mower Shaking After Blade Change?,https://res.cloudinary.com/ddxyyzkuq/image/upload/v1745966042/pin_7_12_vopqud.webp,lawn-repair-ideas,,"Changed your blade and now your mower is shaking? You might not have done it correctly! This guide covers the proper blade installation process, ensuring a balanced and secure fit. Avoid vibration and get a perfect cut. #lawnmowerblade #lawncare #diyrepair #gardening,lawn mower, blade change, shaking",https://lawntrend.com/why-is-my-lawn-mower-shaking/?utm_source=pinterest&utm_campaign=lawn-mower-shaking-a,2025-04-29,installation,https://lawntrend.com/why-is-my-lawn-mower-shaking/
The Cost of Ignoring a Shaking Mower,https://res.cloudinary.com/ddxyyzkuq/image/upload/v1745966049/pin_7_13_gaqa4d.webp,lawn-repair-ideas,,"Ignoring a shaking lawn mower can lead to expensive repairs or even replacement.  We break down the potential costs of inaction and show you how a little preventative maintenance can save you big bucks in the long run.  Don't gamble with your wallet! #lawnmowerrepair #lawncare #savemoney #gardeningtips,lawn mower, shaking, cost",https://lawntrend.com/why-is-my-lawn-mower-shaking/?utm_source=pinterest&utm_campaign=the-cost-of-ignoring,2025-04-29,repair,https://lawntrend.com/why-is-my-lawn-mower-shaking/
Lawn Mower Shaking: A Step-by-Step Guide,https://res.cloudinary.com/ddxyyzkuq/image/upload/v1745966054/pin_7_14_mjbf2j.webp,lawn-repair-ideas,,"Confused about where to start? This post provides a clear, step-by-step guide to diagnosing and fixing a shaking lawn mower.  From visual inspection to component testing, we'll walk you through the process.  Get your mower back in action! #lawnmowertroubleshooting #lawncare #diy #gardening,lawn mower, shaking, step-by-step",https://lawntrend.com/why-is-my-lawn-mower-shaking/?utm_source=pinterest&utm_campaign=lawn-mower-shaking-a,2025-04-29,guide,https://lawntrend.com/why-is-my-lawn-mower-shaking/
Sharpening vs. Balancing Your Mower Blade,https://res.cloudinary.com/ddxyyzkuq/image/upload/v1745966060/pin_7_15_pe219j.webp,lawn-care-ideas,,"Do you know the difference?  Sharpening and balancing are both crucial for a smooth mow, but they address different issues.  This post explains the importance of each and shows you how to do both correctly. #lawnmowerblade #lawncare #gardeningtips #diy,lawn mower, blade, sharpening",https://lawntrend.com/why-is-my-lawn-mower-shaking/?utm_source=pinterest&utm_campaign=sharpening-vs-balanc,2025-04-29,balancing,https://lawntrend.com/why-is-my-lawn-mower-shaking/
Don't Risk It: When to Call a Pro,https://res.cloudinary.com/ddxyyzkuq/image/upload/v1745966067/pin_7_16_y9yda2.webp,home-safety-ideas,,"Sometimes, a shaking lawn mower requires professional attention.  This post helps you determine when DIY repair is beyond your skill level and when it's time to call a qualified mechanic.  Safety first! #lawnmowerrepair #lawncare #safety #gardening,lawn mower, shaking, professional repair",https://lawntrend.com/why-is-my-lawn-mower-shaking/?utm_source=pinterest&utm_campaign=dont-risk-it-when-to,2025-04-29,safety,https://lawntrend.com/why-is-my-lawn-mower-shaking/
Lawn Mower Shaking & Uneven Cut: Connected?,https://res.cloudinary.com/ddxyyzkuq/image/upload/v1745966072/pin_7_17_shrym7.webp,lawn-repair-ideas,,"Is your shaking lawn mower also leaving an uneven cut?  There's likely a connection!  We explore the relationship between vibration and cutting quality, and show you how to fix both issues simultaneously. #lawnmower #lawncare #gardening #unevencut,lawn mower, shaking, uneven cut",https://lawntrend.com/why-is-my-lawn-mower-shaking/?utm_source=pinterest&utm_campaign=lawn-mower-shaking-u,2025-04-29,repair,https://lawntrend.com/why-is-my-lawn-mower-shaking/
