Title,Media URL,Pinterest board,Thumbnail,Description,Link,Publish date,Keywords,Source URL
Troubleshooting a Slipping Transmission,https://res.cloudinary.com/ddxyyzkuq/image/upload/v1745867948/pin_3_7_lfks6f.webp,lawn-care-ideas,,"Feeling lost? This pin offers a clear, concise troubleshooting guide for a slipping hydrostatic transmission.  We break down the process into manageable steps",https://lawntrend.com/hydrostatic-transmission-slipping-when-hot/?utm_source=pinterest&utm_campaign=troubleshooting-a-sl,2025-04-28,helping you identify the problem and find the right solution.  Don't waste time and money on guesswork! Click to get started. #MowerTroubleshooting #TransmissionDiagnosis #LawnMowerHelp #FixMyMower,https://lawntrend.com/hydrostatic-transmission-slipping-when-hot/
Hydrostatic Transmission: Common Mistakes,https://res.cloudinary.com/ddxyyzkuq/image/upload/v1745867954/pin_3_8_ciz8wq.webp,lawn-repair-ideas,,"Avoid these common mistakes that can lead to a slipping hydrostatic transmission! This pin highlights pitfalls like neglecting fluid changes, using the wrong fluid",https://lawntrend.com/hydrostatic-transmission-slipping-when-hot/?utm_source=pinterest&utm_campaign=hydrostatic-transmis,2025-04-28,and ignoring warning signs.  Learn from others' errors and keep your mower running smoothly. Click to read the full article! #MowerMistakes #HydrostaticErrors #TransmissionProblems #LawnCareTips,https://lawntrend.com/hydrostatic-transmission-slipping-when-hot/
Hydrostatic Transmission: A Visual Guide,https://res.cloudinary.com/ddxyyzkuq/image/upload/v1745867960/pin_3_9_kvbenp.webp,lawn-repair-ideas,,Sometimes a picture is worth a thousand words! This pin features a detailed diagram of a hydrostatic transmission,https://lawntrend.com/hydrostatic-transmission-slipping-when-hot/?utm_source=pinterest&utm_campaign=hydrostatic-transmis,2025-04-28,labeling key components.  Understanding the anatomy of the system can help you diagnose and repair problems more effectively. Click to see the diagram! #HydrostaticDiagram #TransmissionParts #MowerComponents #LawnMowerAnatomy,https://lawntrend.com/hydrostatic-transmission-slipping-when-hot/
Hydrostatic Transmission: Cost of Repair,https://res.cloudinary.com/ddxyyzkuq/image/upload/v1745867966/pin_3_10_wbkeng.webp,lawn-repair-ideas,,Worried about the cost of fixing a slipping transmission? This pin provides a realistic estimate of repair costs,https://lawntrend.com/hydrostatic-transmission-slipping-when-hot/?utm_source=pinterest&utm_campaign=hydrostatic-transmis,2025-04-28,including parts and labor.  We also discuss DIY options to help you save money.  Be prepared and make informed decisions. Click to see the cost breakdown! #MowerRepairCost #TransmissionRepair #LawnMowerExpenses #DIYvsPro,https://lawntrend.com/hydrostatic-transmission-slipping-when-hot/
Hydrostatic Transmission: Understanding the Components,https://res.cloudinary.com/ddxyyzkuq/image/upload/v1745867971/pin_3_11_s27kbt.webp,lawn-repair-ideas,,"Dive deeper into the inner workings of your hydrostatic transmission! This pin breaks down the function of each key component – pump, motor, filter",https://lawntrend.com/hydrostatic-transmission-slipping-when-hot/?utm_source=pinterest&utm_campaign=hydrostatic-transmis,2025-04-28,fluid – helping you understand how the system operates. Click to expand your knowledge! #HydrostaticComponents #TransmissionParts #MowerMechanics #LawnMowerKnowledge,https://lawntrend.com/hydrostatic-transmission-slipping-when-hot/
Title,https://res.cloudinary.com/ddxyyzkuq/image/upload/v1745868016/pin_4_1_db9qwr.webp,please-provide-the-title-and-keywords-i-need-that-information-to-suggest-a-board-name-once,,Description,https://lawntrend.com/cub-cadet-zero-turn-pto-not-engaging/?utm_source=pinterest&utm_campaign=title,2025-04-28,Keywords,https://lawntrend.com/cub-cadet-zero-turn-pto-not-engaging/
Cub Cadet PTO Fix: Is It DIY Worth It?,https://res.cloudinary.com/ddxyyzkuq/image/upload/v1745868022/pin_4_2_cq8x7f.webp,tractor-repair-ideas,,"Don't let a disengaged PTO ruin your weekend! This guide walks you through diagnosing & fixing a Cub Cadet zero-turn PTO issue. Learn common causes, from simple belt checks to more complex solenoid problems. We break down the steps, helping you decide if it's a DIY project or time to call a pro. Save time & money, and get back to enjoying a perfectly manicured lawn! Click to learn more & avoid frustration! #CubCadet #ZeroTurn #PTO #LawnMowerRepair,Cub Cadet,PTO,Zero Turn",https://lawntrend.com/cub-cadet-zero-turn-pto-not-engaging/?utm_source=pinterest&utm_campaign=cub-cadet-pto-fix-is,2025-04-28,Repair,https://lawntrend.com/cub-cadet-zero-turn-pto-not-engaging/
Cub Cadet PTO Not Engaging? Quick Fixes!,https://res.cloudinary.com/ddxyyzkuq/image/upload/v1745868029/pin_4_3_mohsde.webp,tractor-repair-ideas,,"Is your Cub Cadet zero-turn mower refusing to engage the PTO? Before you panic, check these easy fixes! We cover everything from safety switches to blade engagement cables. Don't spend a fortune on repairs – often, it's a simple solution. Get your lawn looking its best again with our step-by-step guide. Click to read now and reclaim your weekend! #CubCadetZeroTurn #PTOProblems #LawnCare #DIYRepair,Zero Turn Mower,PTO Engagement,Cub Cadet",https://lawntrend.com/cub-cadet-zero-turn-pto-not-engaging/?utm_source=pinterest&utm_campaign=cub-cadet-pto-not-en,2025-04-28,DIY,https://lawntrend.com/cub-cadet-zero-turn-pto-not-engaging/
Troubleshooting Cub Cadet PTO Issues,https://res.cloudinary.com/ddxyyzkuq/image/upload/v1745868034/pin_4_4_bt9wpr.webp,lawn-care-ideas,,"Frustrated with a Cub Cadet PTO that won't engage? You're not alone! This post dives deep into the common culprits, including electrical issues, belt wear, and clutch problems. We provide clear explanations and helpful diagrams to guide you through the troubleshooting process.  Don't let lawn care be a headache – get the answers you need here! Click to learn more! #CubCadet #PTO #ZeroTurnMower #LawnMaintenance,PTO Troubleshooting,Cub Cadet,Zero Turn",https://lawntrend.com/cub-cadet-zero-turn-pto-not-engaging/?utm_source=pinterest&utm_campaign=troubleshooting-cub-,2025-04-28,Lawn Care,https://lawntrend.com/cub-cadet-zero-turn-pto-not-engaging/
Cub Cadet PTO: Safety First!,https://res.cloudinary.com/ddxyyzkuq/image/upload/v1745868042/pin_4_5_eryxun.webp,lawn-care-ideas,,"Working on your Cub Cadet zero-turn PTO? Safety is paramount! This guide emphasizes crucial safety precautions before you begin any repairs. Learn how to disconnect the battery, engage the parking brake, and avoid potential hazards. Protect yourself and your equipment – read our safety tips before you start! Click for a safe repair experience! #CubCadetSafety #PTORepair #ZeroTurn #LawnMower,Safety,PTO,Cub Cadet",https://lawntrend.com/cub-cadet-zero-turn-pto-not-engaging/?utm_source=pinterest&utm_campaign=cub-cadet-pto-safety,2025-04-28,Zero Turn,https://lawntrend.com/cub-cadet-zero-turn-pto-not-engaging/
DIY vs. Pro: Cub Cadet PTO Repair,https://res.cloudinary.com/ddxyyzkuq/image/upload/v1745868050/pin_4_6_q96dtg.webp,tractor-repair-ideas,,"Should you tackle a Cub Cadet PTO repair yourself, or call a professional? We weigh the pros and cons, considering your skill level, tools, and the complexity of the issue.  Make an informed decision and avoid costly mistakes.  Get back to enjoying your beautiful lawn without the stress! Click to read our expert advice! #CubCadet #PTO #DIYorPro #LawnRepair,DIY Repair,Professional Repair,Cub Cadet",https://lawntrend.com/cub-cadet-zero-turn-pto-not-engaging/?utm_source=pinterest&utm_campaign=diy-vs-pro-cub-cadet,2025-04-28,PTO,https://lawntrend.com/cub-cadet-zero-turn-pto-not-engaging/
Cub Cadet PTO Belt Replacement Guide,https://res.cloudinary.com/ddxyyzkuq/image/upload/v1745868056/pin_4_7_o7ui4e.webp,lawn-mower-ideas,,"A worn PTO belt is a common cause of engagement issues. This guide provides a detailed, step-by-step walkthrough of how to replace the PTO belt on your Cub Cadet zero-turn mower.  Save money and keep your mower running smoothly! Click to learn how! #CubCadet #PTOBelt #ZeroTurn #LawnMowerMaintenance,PTO Belt,Cub Cadet,Zero Turn",https://lawntrend.com/cub-cadet-zero-turn-pto-not-engaging/?utm_source=pinterest&utm_campaign=cub-cadet-pto-belt-r,2025-04-28,Maintenance,https://lawntrend.com/cub-cadet-zero-turn-pto-not-engaging/
Understanding Your Cub Cadet PTO System,https://res.cloudinary.com/ddxyyzkuq/image/upload/v1745868063/pin_4_8_rkctru.webp,lawn-care-ideas,,"Demystify your Cub Cadet zero-turn's PTO system! This post explains how the PTO works, its key components, and common failure points.  Knowledge is power – understand your mower better and diagnose problems more effectively. Click to learn more and become a lawn care pro! #CubCadet #PTO #ZeroTurn #LawnMower,PTO System,Cub Cadet,Zero Turn",https://lawntrend.com/cub-cadet-zero-turn-pto-not-engaging/?utm_source=pinterest&utm_campaign=understanding-your-c,2025-04-28,Lawn Mower,https://lawntrend.com/cub-cadet-zero-turn-pto-not-engaging/
Fixing a Cub Cadet PTO Solenoid,https://res.cloudinary.com/ddxyyzkuq/image/upload/v1745868071/pin_4_9_mj45ex.webp,lawn-repair-ideas,,"Is a faulty solenoid preventing your Cub Cadet PTO from engaging? This guide provides a clear explanation of how to test and replace the solenoid.  Don't let a small part cause big problems! Click to learn how to get your mower back in action. #CubCadet #PTOSolenoid #ZeroTurn #LawnRepair,PTO Solenoid,Cub Cadet,Zero Turn",https://lawntrend.com/cub-cadet-zero-turn-pto-not-engaging/?utm_source=pinterest&utm_campaign=fixing-a-cub-cadet-p,2025-04-28,Repair,https://lawntrend.com/cub-cadet-zero-turn-pto-not-engaging/
Cub Cadet PTO: Common Mistakes to Avoid,https://res.cloudinary.com/ddxyyzkuq/image/upload/v1745868076/pin_4_10_muebnn.webp,lawn-care-ideas,,"Don't make these common mistakes when troubleshooting your Cub Cadet PTO! We highlight pitfalls that can lead to further damage or wasted time. Learn from our experience and get the repair done right the first time. Click to avoid frustration and save money! #CubCadet #PTO #LawnMowerTips #ZeroTurn,Common Mistakes,PTO,Cub Cadet",https://lawntrend.com/cub-cadet-zero-turn-pto-not-engaging/?utm_source=pinterest&utm_campaign=cub-cadet-pto-common,2025-04-28,Zero Turn,https://lawntrend.com/cub-cadet-zero-turn-pto-not-engaging/
Cub Cadet Zero Turn: PTO Engagement Cable,https://res.cloudinary.com/ddxyyzkuq/image/upload/v1745868083/pin_4_11_gptttk.webp,lawn-care-ideas,,"A damaged or misadjusted PTO engagement cable can prevent proper PTO function. Learn how to inspect, adjust, and replace the cable on your Cub Cadet zero-turn mower.  Keep your blades spinning and your lawn looking sharp! Click to learn more. #CubCadet #PTOcable #ZeroTurn #LawnCare,PTO Cable,Cub Cadet,Zero Turn",https://lawntrend.com/cub-cadet-zero-turn-pto-not-engaging/?utm_source=pinterest&utm_campaign=cub-cadet-zero-turn-,2025-04-28,Lawn Care,https://lawntrend.com/cub-cadet-zero-turn-pto-not-engaging/
Diagnosing Electrical Issues in Cub Cadet PTO,https://res.cloudinary.com/ddxyyzkuq/image/upload/v1745868091/pin_4_12_verjo4.webp,lawn-mower-ideas,,"Electrical problems can be tricky. This guide helps you diagnose common electrical issues affecting your Cub Cadet PTO, including blown fuses, loose connections, and faulty wiring.  Get your mower running reliably again! Click to learn more. #CubCadet #PTO #ElectricalRepair #ZeroTurn,Electrical Issues,PTO,Cub Cadet",https://lawntrend.com/cub-cadet-zero-turn-pto-not-engaging/?utm_source=pinterest&utm_campaign=diagnosing-electrica,2025-04-28,Zero Turn,https://lawntrend.com/cub-cadet-zero-turn-pto-not-engaging/
Cub Cadet PTO: When to Call a Pro,https://res.cloudinary.com/ddxyyzkuq/image/upload/v1745868096/pin_4_13_ciccwm.webp,lawn-care-ideas,,"Sometimes, a PTO repair is best left to the professionals. Learn to recognize when the problem is beyond your skill level and when it's time to call a qualified mechanic. Protect your investment and ensure a safe, reliable repair. Click to learn more! #CubCadet #PTO #ProRepair #ZeroTurn,Professional Repair,PTO,Cub Cadet",https://lawntrend.com/cub-cadet-zero-turn-pto-not-engaging/?utm_source=pinterest&utm_campaign=cub-cadet-pto-when-t,2025-04-28,Zero Turn,https://lawntrend.com/cub-cadet-zero-turn-pto-not-engaging/
Keep Your Cub Cadet PTO Running Smoothly,https://res.cloudinary.com/ddxyyzkuq/image/upload/v1745868104/pin_4_14_vnfec0.webp,lawn-care-ideas,,"Preventative maintenance is key! This post outlines essential maintenance tasks to keep your Cub Cadet PTO running smoothly and avoid costly repairs down the road.  Protect your investment and enjoy years of reliable performance. Click to learn more! #CubCadet #PTO #Maintenance #ZeroTurn,Preventative Maintenance,PTO,Cub Cadet",https://lawntrend.com/cub-cadet-zero-turn-pto-not-engaging/?utm_source=pinterest&utm_campaign=keep-your-cub-cadet-,2025-04-28,Zero Turn,https://lawntrend.com/cub-cadet-zero-turn-pto-not-engaging/
Cub Cadet PTO: Blade Engagement Problems,https://res.cloudinary.com/ddxyyzkuq/image/upload/v1745868109/pin_4_15_ybcl4z.webp,lawn-care-ideas,,"Is your blade refusing to engage even with a functioning PTO? We explore potential causes beyond the PTO itself, including blade spindle issues and deck problems.  Get a comprehensive understanding of the system. Click to learn more! #CubCadet #PTO #BladeEngagement #ZeroTurn,Blade Engagement,PTO,Cub Cadet",https://lawntrend.com/cub-cadet-zero-turn-pto-not-engaging/?utm_source=pinterest&utm_campaign=cub-cadet-pto-blade-,2025-04-28,Zero Turn,https://lawntrend.com/cub-cadet-zero-turn-pto-not-engaging/
Cub Cadet Zero Turn: PTO Clutch Explained,https://res.cloudinary.com/ddxyyzkuq/image/upload/v1745868116/pin_4_16_rstrwl.webp,lawn-care-ideas,,"Understand the role of the PTO clutch in your Cub Cadet zero-turn mower. This post explains how it works, common failure modes, and how to diagnose potential problems.  Become a more informed mower owner! Click to learn more. #CubCadet #PTOClutch #ZeroTurn #LawnMower,PTO Clutch,Cub Cadet,Zero Turn",https://lawntrend.com/cub-cadet-zero-turn-pto-not-engaging/?utm_source=pinterest&utm_campaign=cub-cadet-zero-turn-,2025-04-28,Lawn Mower,https://lawntrend.com/cub-cadet-zero-turn-pto-not-engaging/
Cub Cadet PTO: The Cost of Repair,https://res.cloudinary.com/ddxyyzkuq/image/upload/v1745868122/pin_4_17_mnjzxx.webp,lawn-care-ideas,,"Wondering how much a Cub Cadet PTO repair will cost? We break down the potential expenses, including parts, labor, and diagnostic fees.  Get a realistic estimate and budget accordingly. Click to learn more! #CubCadet #PTO #RepairCost #ZeroTurn,Repair Cost,PTO,Cub Cadet",https://lawntrend.com/cub-cadet-zero-turn-pto-not-engaging/?utm_source=pinterest&utm_campaign=cub-cadet-pto-the-co,2025-04-28,Zero Turn,https://lawntrend.com/cub-cadet-zero-turn-pto-not-engaging/
Cub Cadet PTO: Finding the Right Parts,https://res.cloudinary.com/ddxyyzkuq/image/upload/v1745868127/pin_4_18_adkhry.webp,lawn-care-ideas,,"Need to replace a PTO component? This guide helps you find the right parts for your Cub Cadet zero-turn mower, ensuring compatibility and quality.  Avoid frustration and get the repair done right. Click to learn more! #CubCadet #PTOparts #ZeroTurn #LawnMower,PTO Parts,Cub Cadet,Zero Turn",https://lawntrend.com/cub-cadet-zero-turn-pto-not-engaging/?utm_source=pinterest&utm_campaign=cub-cadet-pto-findin,2025-04-28,Lawn Mower,https://lawntrend.com/cub-cadet-zero-turn-pto-not-engaging/
Cub Cadet PTO: Is it a Fuse Issue?,https://res.cloudinary.com/ddxyyzkuq/image/upload/v1745868133/pin_4_19_hzh8co.webp,lawn-care-ideas,,"A blown fuse can often be the culprit behind a non-engaging PTO. Learn how to quickly and easily check your Cub Cadet's fuses and replace them if necessary. A simple fix that can save you time and money! Click to learn more. #CubCadet #PTO #Fuse #ZeroTurn,Fuse,PTO,Cub Cadet",https://lawntrend.com/cub-cadet-zero-turn-pto-not-engaging/?utm_source=pinterest&utm_campaign=cub-cadet-pto-is-it-,2025-04-28,Zero Turn,https://lawntrend.com/cub-cadet-zero-turn-pto-not-engaging/
Cub Cadet Zero Turn: PTO Diagram Guide,https://res.cloudinary.com/ddxyyzkuq/image/upload/v1745868138/pin_4_20_g4ibcl.webp,lawn-care-ideas,,"Visual learners rejoice! This post includes a detailed diagram of the Cub Cadet PTO system, helping you identify key components and understand their relationships.  Simplify the troubleshooting process. Click to view the diagram! #CubCadet #PTO #Diagram #ZeroTurn,PTO Diagram,Cub Cadet,Zero Turn",https://lawntrend.com/cub-cadet-zero-turn-pto-not-engaging/?utm_source=pinterest&utm_campaign=cub-cadet-zero-turn-,2025-04-28,Visual Guide,https://lawntrend.com/cub-cadet-zero-turn-pto-not-engaging/
Cub Cadet PTO: Troubleshooting Tips & Tricks,https://res.cloudinary.com/ddxyyzkuq/image/upload/v1745868144/pin_4_21_svqmcw.webp,lawn-care-ideas,,"Unlock expert troubleshooting tips and tricks for your Cub Cadet PTO. We share insider knowledge to help you diagnose and fix problems quickly and efficiently.  Get your mower back in action with confidence! Click to learn more. #CubCadet #PTO #Troubleshooting #ZeroTurn,Troubleshooting Tips,PTO,Cub Cadet",https://lawntrend.com/cub-cadet-zero-turn-pto-not-engaging/?utm_source=pinterest&utm_campaign=cub-cadet-pto-troubl,2025-04-28,Zero Turn,https://lawntrend.com/cub-cadet-zero-turn-pto-not-engaging/
Cub Cadet PTO: Extend Its Lifespan,https://res.cloudinary.com/ddxyyzkuq/image/upload/v1745868149/pin_4_22_dherkb.webp,lawn-care-ideas,,"Want to maximize the lifespan of your Cub Cadet PTO? This post provides practical tips on how to operate and maintain your mower to prevent premature wear and tear.  Protect your investment and enjoy years of reliable service. Click to learn more! #CubCadet #PTO #Longevity #ZeroTurn,PTO Lifespan,Cub Cadet,Zero Turn",https://lawntrend.com/cub-cadet-zero-turn-pto-not-engaging/?utm_source=pinterest&utm_campaign=cub-cadet-pto-extend,2025-04-28,Maintenance,https://lawntrend.com/cub-cadet-zero-turn-pto-not-engaging/
Cub Cadet PTO: Common Warning Signs,https://res.cloudinary.com/ddxyyzkuq/image/upload/v1745868156/pin_4_23_mywlkl.webp,lawn-care-ideas,,"Don't ignore these warning signs! This post outlines the early indicators of a potential PTO problem, allowing you to address the issue before it escalates.  Prevent costly repairs and keep your mower running smoothly. Click to learn more! #CubCadet #PTO #WarningSigns #ZeroTurn,Warning Signs,PTO,Cub Cadet",https://lawntrend.com/cub-cadet-zero-turn-pto-not-engaging/?utm_source=pinterest&utm_campaign=cub-cadet-pto-common,2025-04-28,Zero Turn,https://lawntrend.com/cub-cadet-zero-turn-pto-not-engaging/
Cub Cadet Zero Turn: PTO Maintenance Schedule,https://res.cloudinary.com/ddxyyzkuq/image/upload/v1745868163/pin_4_24_yrwdbd.webp,lawn-care-ideas,,"Stay on top of your PTO maintenance with our recommended schedule. We outline the essential tasks to perform at regular intervals to ensure optimal performance and prevent breakdowns. Click to download the schedule! #CubCadet #PTO #MaintenanceSchedule #ZeroTurn,Maintenance Schedule,PTO,Cub Cadet",https://lawntrend.com/cub-cadet-zero-turn-pto-not-engaging/?utm_source=pinterest&utm_campaign=cub-cadet-zero-turn-,2025-04-28,Zero Turn,https://lawntrend.com/cub-cadet-zero-turn-pto-not-engaging/
Cub Cadet PTO: Get Back to Mowing!,https://res.cloudinary.com/ddxyyzkuq/image/upload/v1745868169/pin_4_25_oqgnej.webp,lawn-care-ideas,,"Don't let a faulty PTO keep you off your lawn! This post provides a comprehensive guide to diagnosing and fixing Cub Cadet PTO issues, empowering you to get back to enjoying a beautifully manicured yard. Click to read now! #CubCadet #PTO #LawnCare #ZeroTurn,Lawn Care,PTO,Cub Cadet",https://lawntrend.com/cub-cadet-zero-turn-pto-not-engaging/?utm_source=pinterest&utm_campaign=cub-cadet-pto-get-ba,2025-04-28,Zero Turn,https://lawntrend.com/cub-cadet-zero-turn-pto-not-engaging/
Title,https://res.cloudinary.com/ddxyyzkuq/image/upload/v1745868209/pin_5_1_zqec2c.webp,please-provide-the-title-and-keywords-i-need-that-information-to-suggest-a-board-name-once,,Description,https://lawntrend.com/cub-cadet-turn-key-nothing-happens/?utm_source=pinterest&utm_campaign=title,2025-04-28,Keywords,https://lawntrend.com/cub-cadet-turn-key-nothing-happens/
Cub Cadet: Key Turn = Silence?,https://res.cloudinary.com/ddxyyzkuq/image/upload/v1745868215/pin_5_2_ykeljb.webp,mower-repair-ideas,,"Don't panic when your Cub Cadet won't start! A silent key turn can be caused by several things. This post breaks down the most frequent culprits, including safety switches, ignition issues",https://lawntrend.com/cub-cadet-turn-key-nothing-happens/?utm_source=pinterest&utm_campaign=cub-cadet-key-turn-s,2025-04-28,and fuel problems.  We've got clear instructions and helpful visuals to guide you through each step.  Avoid expensive mechanic bills and get mowing again!  Read now and reclaim your free time! #CubCadetMower #RidingMower #Troubleshooting #LawnCare,https://lawntrend.com/cub-cadet-turn-key-nothing-happens/
Dead Battery? Cub Cadet Fix,https://res.cloudinary.com/ddxyyzkuq/image/upload/v1745868221/pin_5_3_mqazir.webp,lawn-repair-ideas,,"A dead battery is a common reason your Cub Cadet won't start. But is it *just* the battery? This article explores battery testing, charging",https://lawntrend.com/cub-cadet-turn-key-nothing-happens/?utm_source=pinterest&utm_campaign=dead-battery-cub-cad,2025-04-28,and replacement. We also cover other potential issues that mimic a dead battery.  Don't get stranded! Learn how to quickly diagnose and fix this problem. Click to read and get back to work! #CubCadetBattery #LawnMowerBattery #DIY #FixIt,https://lawntrend.com/cub-cadet-turn-key-nothing-happens/
Fuel Problems & Cub Cadet,https://res.cloudinary.com/ddxyyzkuq/image/upload/v1745868227/pin_5_4_gv85ap.webp,lawn-mower-ideas,,"Is your Cub Cadet getting fuel?  Fuel delivery issues are a frequent cause of no-start problems. This article covers fuel filters, fuel lines",https://lawntrend.com/cub-cadet-turn-key-nothing-happens/?utm_source=pinterest&utm_campaign=fuel-problems-cub-ca,2025-04-28,and carburetors.  Learn how to diagnose and fix fuel-related issues.  Get your mower running smoothly again! Click to read. #CubCadetFuelSystem #LawnMowerFuel #CarburetorRepair #DIY,https://lawntrend.com/cub-cadet-turn-key-nothing-happens/
Cub Cadet: No Crank,https://res.cloudinary.com/ddxyyzkuq/image/upload/v1745868234/pin_5_5_sxggfo.webp,lawn-repair-ideas,,"No Start?,Facing a Cub Cadet that won't even *try* to start? This guide tackles the frustrating ""no crank",https://lawntrend.com/cub-cadet-turn-key-nothing-happens/?utm_source=pinterest&utm_campaign=cub-cadet-no-crank,2025-04-28,"no start"" scenario. We cover everything from the battery to the starter and beyond.  Don't give up!  We'll help you get to the root of the problem. Click to learn! #CubCadetNoStart #LawnMowerProblems #DIYFix #Troubleshooting",https://lawntrend.com/cub-cadet-turn-key-nothing-happens/
Easy Cub Cadet Starter Checks,https://res.cloudinary.com/ddxyyzkuq/image/upload/v1745868240/pin_5_6_ampfcb.webp,lawn-care-ideas,,Quickly diagnose why your Cub Cadet won't start with these simple starter checks! This post focuses on the easiest things to inspect first,https://lawntrend.com/cub-cadet-turn-key-nothing-happens/?utm_source=pinterest&utm_campaign=easy-cub-cadet-start,2025-04-28,saving you time and frustration.  Get back to mowing faster!  Click to read and learn. #CubCadetStarter #LawnMowerMaintenance #QuickFix #DIY,https://lawntrend.com/cub-cadet-turn-key-nothing-happens/
Cub Cadet: Battery Cables Guide,https://res.cloudinary.com/ddxyyzkuq/image/upload/v1745868247/pin_5_7_axvmmr.webp,lawn-repair-ideas,,"Corroded or loose battery cables can prevent your Cub Cadet from starting. This guide shows you how to inspect, clean",https://lawntrend.com/cub-cadet-turn-key-nothing-happens/?utm_source=pinterest&utm_campaign=cub-cadet-battery-ca,2025-04-28,and tighten your battery cables.  A simple fix that can save you a lot of trouble!  Read now and keep your mower running. #CubCadetBattery #BatteryCables #LawnMowerRepair #DIY,https://lawntrend.com/cub-cadet-turn-key-nothing-happens/
Cub Cadet: When to Call a Pro,https://res.cloudinary.com/ddxyyzkuq/image/upload/v1745868253/pin_5_8_e0fyvo.webp,lawn-repair-ideas,,Sometimes,https://lawntrend.com/cub-cadet-turn-key-nothing-happens/?utm_source=pinterest&utm_campaign=cub-cadet-when-to-ca,2025-04-28,a repair is best left to the professionals. This post helps you determine when it's time to call a Cub Cadet mechanic.  Don't risk further damage! #CubCadetRepair #LawnMowerRepair #WhenToCallAPRO #DIY,https://lawntrend.com/cub-cadet-turn-key-nothing-happens/
Title,https://res.cloudinary.com/ddxyyzkuq/image/upload/v1745868295/pin_6_1_shssxg.webp,please-provide-the-title-and-keywords-i-need-that-information-to-suggest-a-board-name-once,,Description,https://lawntrend.com/toro-safety-switch-problem/?utm_source=pinterest&utm_campaign=title,2025-04-28,Keywords,https://lawntrend.com/toro-safety-switch-problem/
Toro Safety Switch Failing? Fix It!,https://res.cloudinary.com/ddxyyzkuq/image/upload/v1745868300/pin_6_2_z0vu3l.webp,lawn-repair-ideas,,"Is your Toro mower refusing to start? Don't let a faulty safety switch ruin your weekend! This guide walks you through diagnosing and fixing common Toro safety switch problems, saving you time & money. Learn how to test, replace",https://lawntrend.com/toro-safety-switch-problem/?utm_source=pinterest&utm_campaign=toro-safety-switch-f,2025-04-28,and troubleshoot – get back to a perfectly manicured lawn ASAP!  Frustrated with lawn care headaches? We've got you covered. Click to learn more and reclaim your free time! #Toromower #SafetySwitch #LawnCare #DIYRepair,https://lawntrend.com/toro-safety-switch-problem/
