Title,Media URL,Pinterest board,Thumbnail,Description,Link,Publish date,Keywords,Source URL
Fix Your John Deere 2010 Now!,https://res.cloudinary.com/dbcpfy04c/image/upload/v1618237451/placeholder.jpg,home-inspiration,,"Is your trusty John Deere 2010 tractor acting up? Don't stress! This pin focuses on quick fixes for common problems. We cover everything from starting issues to overheating.  We'll help you identify the root cause and get you back in the field fast.  Avoid expensive mechanic bills – empower yourself with DIY repair knowledge. Click to learn more and reclaim your productivity! #JohnDeere #TractorLife #DIYRepair #FarmLife,John Deere 2010,Tractor Maintenance,DIY Repair",https://lawntrend.com/john-deere-2010-problems/?utm_source=pinterest&utm_campaign=fix-your-john-deere-,2025-04-28,Starting Issues,https://lawntrend.com/john-deere-2010-problems/
John Deere 2010 Hydraulic Issues?,https://res.cloudinary.com/dbcpfy04c/image/upload/v1618237451/placeholder.jpg,home-inspiration,,"Hydraulic problems plaguing your John Deere 2010? This pin dives deep into diagnosing and resolving hydraulic failures. We cover pump issues, leaks, and cylinder problems.  Don't let a failing hydraulic system halt your work!  Learn to identify symptoms, perform basic tests, and understand repair options. Click to read our comprehensive guide and get your hydraulics working like new! #JohnDeere #Hydraulics #TractorRepair #FarmEquipment,Hydraulic Repair,John Deere 2010,Tractor Hydraulics",https://lawntrend.com/john-deere-2010-problems/?utm_source=pinterest&utm_campaign=john-deere-2010-hydr,2025-04-28,Leaks,https://lawntrend.com/john-deere-2010-problems/
2010 John Deere Fuel System Fixes,https://res.cloudinary.com/dbcpfy04c/image/upload/v1618237451/placeholder.jpg,home-inspiration,,"Fuel system problems causing your John Deere 2010 to sputter or stall? This pin tackles common fuel issues like clogged filters, faulty injectors, and fuel pump failures.  We provide step-by-step instructions for cleaning, replacing, and troubleshooting fuel system components.  Keep your engine running strong! Click to learn how to restore optimal fuel delivery. #JohnDeere #FuelSystem #TractorEngine #FarmMaintenance,Fuel System,John Deere 2010,Engine Repair",https://lawntrend.com/john-deere-2010-problems/?utm_source=pinterest&utm_campaign=2010-john-deere-fuel,2025-04-28,Fuel Filter,https://lawntrend.com/john-deere-2010-problems/
John Deere 2010 Electrical Problems,https://res.cloudinary.com/dbcpfy04c/image/upload/v1618237451/placeholder.jpg,home-inspiration,,"Dealing with electrical gremlins in your John Deere 2010? This pin addresses common electrical issues like faulty wiring, bad sensors, and starter problems.  We offer guidance on diagnosing shorts, testing components, and making safe repairs.  Don't get shocked by repair costs! Click to learn how to troubleshoot electrical issues yourself. #JohnDeere #ElectricalRepair #TractorWiring #DIY,Electrical System,John Deere 2010,Wiring",https://lawntrend.com/john-deere-2010-problems/?utm_source=pinterest&utm_campaign=john-deere-2010-elec,2025-04-28,Sensors,https://lawntrend.com/john-deere-2010-problems/
John Deere 2010: Preventative Care,https://res.cloudinary.com/dbcpfy04c/image/upload/v1618237451/placeholder.jpg,home-inspiration,,"Don't wait for problems to arise! This pin emphasizes preventative maintenance for your John Deere 2010.  We cover essential checks, fluid changes, and lubrication points to keep your tractor in top condition.  Extend the life of your investment and avoid costly repairs. Click to learn our preventative maintenance schedule! #JohnDeere #TractorMaintenance #PreventativeCare #FarmLife,Preventative Maintenance,John Deere 2010,Tractor Care",https://lawntrend.com/john-deere-2010-problems/?utm_source=pinterest&utm_campaign=john-deere-2010-prev,2025-04-28,Maintenance Schedule,https://lawntrend.com/john-deere-2010-problems/
Is Your 2010 Overheating? Find Out!,https://res.cloudinary.com/dbcpfy04c/image/upload/v1618237451/placeholder.jpg,home-inspiration,,"Overheating John Deere 2010? This pin focuses on diagnosing and resolving overheating issues. We cover radiator problems, coolant leaks, and thermostat failures.  Protect your engine from damage! Learn to identify the cause of overheating and implement effective cooling solutions. Click to read our guide and keep your tractor cool. #JohnDeere #Overheating #CoolingSystem #TractorEngine,Overheating,John Deere 2010,Cooling System",https://lawntrend.com/john-deere-2010-problems/?utm_source=pinterest&utm_campaign=is-your-2010-overhea,2025-04-28,Radiator,https://lawntrend.com/john-deere-2010-problems/
John Deere 2010 Starter Issues?,https://res.cloudinary.com/dbcpfy04c/image/upload/v1618237451/placeholder.jpg,home-inspiration,,"Struggling to start your John Deere 2010? This pin tackles common starter problems like weak batteries, faulty solenoids, and worn starter motors.  We provide troubleshooting steps and repair options to get you up and running quickly.  Don't waste time cranking! Click to learn how to fix your starter. #JohnDeere #StarterMotor #TractorStarting #DIYRepair,Starter,John Deere 2010,Starting Problems",https://lawntrend.com/john-deere-2010-problems/?utm_source=pinterest&utm_campaign=john-deere-2010-star,2025-04-28,Solenoid,https://lawntrend.com/john-deere-2010-problems/
2010 John Deere: Transmission Tips,https://res.cloudinary.com/dbcpfy04c/image/upload/v1618237451/placeholder.jpg,home-inspiration,,"Transmission troubles with your John Deere 2010? This pin explores common transmission issues and provides guidance on diagnosis and repair.  We cover fluid levels, filter changes, and potential mechanical problems.  Keep your tractor shifting smoothly! Click to learn more. #JohnDeere #Transmission #TractorRepair #FarmEquipment,Transmission Repair,John Deere 2010,Gearbox",https://lawntrend.com/john-deere-2010-problems/?utm_source=pinterest&utm_campaign=2010-john-deere-tran,2025-04-28,Fluid Change,https://lawntrend.com/john-deere-2010-problems/
John Deere 2010: PTO Problems?,https://res.cloudinary.com/dbcpfy04c/image/upload/v1618237451/placeholder.jpg,home-inspiration,,"PTO not engaging or working correctly on your John Deere 2010? This pin focuses on diagnosing and fixing PTO issues. We cover clutch problems, shaft failures, and safety interlock issues.  Get your implements working! Click to learn how to troubleshoot your PTO. #JohnDeere #PTO #TractorImplements #FarmLife,PTO Repair,John Deere 2010,Power Take Off",https://lawntrend.com/john-deere-2010-problems/?utm_source=pinterest&utm_campaign=john-deere-2010-pto-,2025-04-28,Clutch,https://lawntrend.com/john-deere-2010-problems/
Save Money: 2010 JD Repair!,https://res.cloudinary.com/dbcpfy04c/image/upload/v1618237451/placeholder.jpg,home-inspiration,,"Don't let John Deere 2010 repairs break the bank! This pin highlights cost-effective DIY repair solutions.  We show you how to diagnose problems, source parts, and perform repairs yourself.  Empower yourself and save money! Click to learn how to become your own tractor mechanic. #JohnDeere #DIYRepair #TractorSavings #FarmBudget,DIY Repair,John Deere 2010,Cost Savings",https://lawntrend.com/john-deere-2010-problems/?utm_source=pinterest&utm_campaign=save-money-2010-jd-r,2025-04-28,Tractor Mechanic,https://lawntrend.com/john-deere-2010-problems/
John Deere 2010: Warning Lights?,https://res.cloudinary.com/dbcpfy04c/image/upload/v1618237451/placeholder.jpg,home-inspiration,,"Confused by warning lights on your John Deere 2010? This pin decodes common warning lights and explains what they mean.  We help you identify the underlying problem and take appropriate action.  Don't ignore those lights! Click to learn what your tractor is trying to tell you. #JohnDeere #WarningLights #TractorDashboard #Troubleshooting,Warning Lights,John Deere 2010,Dashboard",https://lawntrend.com/john-deere-2010-problems/?utm_source=pinterest&utm_campaign=john-deere-2010-warn,2025-04-28,Troubleshooting,https://lawntrend.com/john-deere-2010-problems/
2010 John Deere: Steering Issues?,https://res.cloudinary.com/dbcpfy04c/image/upload/v1618237451/placeholder.jpg,home-inspiration,,"Steering feeling loose or unresponsive on your John Deere 2010? This pin addresses common steering problems like power steering pump failures and linkage issues.  Maintain control and safety! Click to learn how to diagnose and fix steering problems. #JohnDeere #Steering #TractorControl #FarmSafety,Steering Repair,John Deere 2010,Power Steering",https://lawntrend.com/john-deere-2010-problems/?utm_source=pinterest&utm_campaign=2010-john-deere-stee,2025-04-28,Linkage,https://lawntrend.com/john-deere-2010-problems/
John Deere 2010: Battery Care Tips,https://res.cloudinary.com/dbcpfy04c/image/upload/v1618237451/placeholder.jpg,home-inspiration,,"Keep your John Deere 2010 battery in top shape! This pin provides essential battery care tips, including charging, maintenance, and replacement.  Avoid getting stranded! Click to learn how to maximize battery life and performance. #JohnDeere #BatteryCare #TractorPower #FarmMaintenance,Battery,John Deere 2010,Battery Maintenance",https://lawntrend.com/john-deere-2010-problems/?utm_source=pinterest&utm_campaign=john-deere-2010-batt,2025-04-28,Charging,https://lawntrend.com/john-deere-2010-problems/
John Deere 2010: Filter Replacement,https://res.cloudinary.com/dbcpfy04c/image/upload/v1618237451/placeholder.jpg,home-inspiration,,"Maintaining clean filters is crucial for your John Deere 2010. This pin guides you through replacing air filters, fuel filters, and hydraulic filters.  Protect your engine and hydraulic system! Click to learn how to keep your filters clean. #JohnDeere #FilterReplacement #TractorMaintenance #EngineCare,Filters,John Deere 2010,Air Filter",https://lawntrend.com/john-deere-2010-problems/?utm_source=pinterest&utm_campaign=john-deere-2010-filt,2025-04-28,Hydraulic Filter,https://lawntrend.com/john-deere-2010-problems/
John Deere 2010: Tire Pressure Guide,https://res.cloudinary.com/dbcpfy04c/image/upload/v1618237451/placeholder.jpg,home-inspiration,,"Proper tire pressure is essential for optimal performance and safety. This pin provides a guide to determining the correct tire pressure for your John Deere 2010.  Maximize traction and efficiency! Click to learn more. #JohnDeere #TirePressure #TractorTires #FarmSafety,Tires,John Deere 2010,Tire Maintenance",https://lawntrend.com/john-deere-2010-problems/?utm_source=pinterest&utm_campaign=john-deere-2010-tire,2025-04-28,Traction,https://lawntrend.com/john-deere-2010-problems/
John Deere 2010: Oil Change Guide,https://res.cloudinary.com/dbcpfy04c/image/upload/v1618237451/placeholder.jpg,home-inspiration,,"Keep your engine running smoothly with regular oil changes. This pin provides a step-by-step guide to changing the oil in your John Deere 2010.  Protect your investment! Click to learn how to perform an oil change. #JohnDeere #OilChange #TractorEngine #EngineCare,Oil Change,John Deere 2010,Engine Oil",https://lawntrend.com/john-deere-2010-problems/?utm_source=pinterest&utm_campaign=john-deere-2010-oil-,2025-04-28,Maintenance,https://lawntrend.com/john-deere-2010-problems/
John Deere 2010: Belt Replacement,https://res.cloudinary.com/dbcpfy04c/image/upload/v1618237451/placeholder.jpg,home-inspiration,,"Broken or worn belts causing problems? This pin shows you how to replace belts on your John Deere 2010.  Restore functionality and prevent further damage! Click to learn the process. #JohnDeere #BeltReplacement #TractorRepair #DIY,Belts,John Deere 2010,Drive Belt",https://lawntrend.com/john-deere-2010-problems/?utm_source=pinterest&utm_campaign=john-deere-2010-belt,2025-04-28,Accessory Belt,https://lawntrend.com/john-deere-2010-problems/
John Deere 2010: Coolant Flush Guide,https://res.cloudinary.com/dbcpfy04c/image/upload/v1618237451/placeholder.jpg,home-inspiration,,"Flush your John Deere 2010's cooling system for optimal performance. This pin details how to properly flush and refill the coolant. Prevent overheating and corrosion! Click to learn more. #JohnDeere #CoolantFlush #CoolingSystem #TractorMaintenance,Coolant,John Deere 2010,Cooling System",https://lawntrend.com/john-deere-2010-problems/?utm_source=pinterest&utm_campaign=john-deere-2010-cool,2025-04-28,Flush,https://lawntrend.com/john-deere-2010-problems/
John Deere 2010: Grease Points Guide,https://res.cloudinary.com/dbcpfy04c/image/upload/v1618237451/placeholder.jpg,home-inspiration,,"Proper lubrication is key! This pin identifies all the grease points on your John Deere 2010.  Reduce wear and tear and extend the life of your tractor. Click to learn where to grease. #JohnDeere #GreasePoints #Lubrication #TractorCare,Grease,John Deere 2010,Lubrication Points",https://lawntrend.com/john-deere-2010-problems/?utm_source=pinterest&utm_campaign=john-deere-2010-grea,2025-04-28,Maintenance,https://lawntrend.com/john-deere-2010-problems/
John Deere 2010: Diagnose That Noise!,https://res.cloudinary.com/dbcpfy04c/image/upload/v1618237451/placeholder.jpg,home-inspiration,,"Hearing strange noises from your John Deere 2010? This pin helps you diagnose common tractor noises and identify potential problems.  Don't ignore unusual sounds! Click to learn what the noise could mean. #JohnDeere #TractorNoises #Troubleshooting #FarmSounds,Noise Diagnosis,John Deere 2010,Troubleshooting",https://lawntrend.com/john-deere-2010-problems/?utm_source=pinterest&utm_campaign=john-deere-2010-diag,2025-04-28,Sounds,https://lawntrend.com/john-deere-2010-problems/
John Deere 2010: Parts Sourcing Tips,https://res.cloudinary.com/dbcpfy04c/image/upload/v1618237451/placeholder.jpg,home-inspiration,,"Need parts for your John Deere 2010? This pin provides tips on sourcing genuine and aftermarket parts.  Save money and find the right parts for your repair. Click to learn where to look. #JohnDeere #TractorParts #PartsSourcing #DIYRepair,Parts,John Deere 2010,Aftermarket Parts",https://lawntrend.com/john-deere-2010-problems/?utm_source=pinterest&utm_campaign=john-deere-2010-part,2025-04-28,Genuine Parts,https://lawntrend.com/john-deere-2010-problems/
John Deere 2010: Safety First!,https://res.cloudinary.com/dbcpfy04c/image/upload/v1618237451/placeholder.jpg,home-inspiration,,"Working on your John Deere 2010? This pin emphasizes essential safety precautions to prevent accidents.  Protect yourself and others! Click to learn about tractor safety. #JohnDeere #TractorSafety #FarmSafety #SafetyFirst,Safety,John Deere 2010,Farm Safety",https://lawntrend.com/john-deere-2010-problems/?utm_source=pinterest&utm_campaign=john-deere-2010-safe,2025-04-28,Repair Safety,https://lawntrend.com/john-deere-2010-problems/
John Deere 2010: Extend Its Life!,https://res.cloudinary.com/dbcpfy04c/image/upload/v1618237451/placeholder.jpg,home-inspiration,,"Want to keep your John Deere 2010 running for years to come? This pin offers tips on extending the life of your tractor through proper maintenance and care.  Maximize your investment! Click to learn more. #JohnDeere #TractorLife #Longevity #FarmEquipment,Longevity,John Deere 2010,Tractor Care",https://lawntrend.com/john-deere-2010-problems/?utm_source=pinterest&utm_campaign=john-deere-2010-exte,2025-04-28,Maintenance,https://lawntrend.com/john-deere-2010-problems/
Title,https://res.cloudinary.com/dbcpfy04c/image/upload/v1618237451/placeholder.jpg,home-inspiration,,Description,https://lawntrend.com/cub-cadet-2518-problems/?utm_source=pinterest&utm_campaign=title,2025-04-28,Keywords,https://lawntrend.com/cub-cadet-2518-problems/
Cub Cadet 2518 Troubles? Fix It!,https://res.cloudinary.com/dbcpfy04c/image/upload/v1618237451/placeholder.jpg,home-inspiration,,Is your Cub Cadet 2518 giving you headaches? Don't let lawn care be a struggle! This guide dives deep into common problems – from starting issues to blade engagement failures – and provides clear,https://lawntrend.com/cub-cadet-2518-problems/?utm_source=pinterest&utm_campaign=cub-cadet-2518-troub,2025-04-28,step-by-step solutions.  We cover everything from simple fixes you can do yourself to when it's time to call a pro.  Reclaim your weekends and enjoy a perfectly manicured lawn again! Click to learn how to diagnose & repair your Cub Cadet. #CubCadet #LawnMowerRepair #DIYRepair #LawnCare,https://lawntrend.com/cub-cadet-2518-problems/
Cub Cadet 2518: Starting Problems?,https://res.cloudinary.com/dbcpfy04c/image/upload/v1618237451/placeholder.jpg,home-inspiration,,"Frustrated with a Cub Cadet 2518 that won't start? You're not alone! This pin leads to a comprehensive guide tackling common starting issues – bad gas, a clogged carburetor, weak battery",https://lawntrend.com/cub-cadet-2518-problems/?utm_source=pinterest&utm_campaign=cub-cadet-2518-start,2025-04-28,and more.  Don't waste another sunny day pulling on the starter cord!  Get back to enjoying your yard with our easy-to-follow troubleshooting tips.  Click to learn more and get mowing! #CubCadet2518 #StartingProblems #LawnMower #FixIt,https://lawntrend.com/cub-cadet-2518-problems/
Blade Engagement Issues - Solved!,https://res.cloudinary.com/dbcpfy04c/image/upload/v1618237451/placeholder.jpg,home-inspiration,,Is your Cub Cadet 2518 blade refusing to engage?  It's a common issue,https://lawntrend.com/cub-cadet-2518-problems/?utm_source=pinterest&utm_campaign=blade-engagement-iss,2025-04-28,and we've got the answers! This guide breaks down the potential causes – from belt problems to spindle issues – and shows you how to fix them.  Don't let overgrown grass ruin your curb appeal.  Click to learn how to get your blades spinning again! #CubCadet #BladeEngagement #LawnMowerProblems #DIY,https://lawntrend.com/cub-cadet-2518-problems/
Cub Cadet 2518: Fuel System Fixes,https://res.cloudinary.com/dbcpfy04c/image/upload/v1618237451/placeholder.jpg,home-inspiration,,"Fuel problems plaguing your Cub Cadet 2518?  Old gas, clogged filters, and carburetor issues are no match for our expert guide!  We'll walk you through cleaning, replacing, and troubleshooting your fuel system.  Breathe new life into your mower and enjoy a smooth",https://lawntrend.com/cub-cadet-2518-problems/?utm_source=pinterest&utm_campaign=cub-cadet-2518-fuel-,2025-04-28,powerful cut. Click to learn more! #FuelSystem #CubCadetRepair #Carburetor #LawnMower,https://lawntrend.com/cub-cadet-2518-problems/
Cub Cadet 2518: Belt Replacement Guide,https://res.cloudinary.com/dbcpfy04c/image/upload/v1618237451/placeholder.jpg,home-inspiration,,A broken or worn belt can bring your Cub Cadet 2518 to a halt.  Our guide provides a step-by-step walkthrough of belt replacement,https://lawntrend.com/cub-cadet-2518-problems/?utm_source=pinterest&utm_campaign=cub-cadet-2518-belt-,2025-04-28,complete with diagrams and helpful tips.  Save money on repair costs and get back to mowing quickly! Click to learn how. #BeltReplacement #CubCadet2518 #DIYLawnCare #MowerRepair,https://lawntrend.com/cub-cadet-2518-problems/
Diagnosing Cub Cadet 2518 Issues,https://res.cloudinary.com/dbcpfy04c/image/upload/v1618237451/placeholder.jpg,home-inspiration,,"Feeling lost when your Cub Cadet 2518 acts up?  This pin leads to a guide that teaches you how to diagnose common problems like poor performance, unusual noises",https://lawntrend.com/cub-cadet-2518-problems/?utm_source=pinterest&utm_campaign=diagnosing-cub-cadet,2025-04-28,and more.  Become your own lawn mower mechanic! Click to learn the basics. #LawnMowerDiagnosis #CubCadet #Troubleshooting #DIY,https://lawntrend.com/cub-cadet-2518-problems/
Cub Cadet 2518: Oil Change Guide,https://res.cloudinary.com/dbcpfy04c/image/upload/v1618237451/placeholder.jpg,home-inspiration,,Regular oil changes are crucial for a healthy Cub Cadet 2518 engine.  Our guide provides a step-by-step walkthrough of the oil change process,https://lawntrend.com/cub-cadet-2518-problems/?utm_source=pinterest&utm_campaign=cub-cadet-2518-oil-c,2025-04-28,ensuring optimal performance and longevity.  Keep your mower running smoothly for years to come! Click to learn how. #OilChange #CubCadet #LawnMowerMaintenance #EngineHealth,https://lawntrend.com/cub-cadet-2518-problems/
Cub Cadet 2518: Spindle Repair Tips,https://res.cloudinary.com/dbcpfy04c/image/upload/v1618237451/placeholder.jpg,home-inspiration,,A faulty spindle can cause vibrations and uneven cutting.  This pin links to a guide detailing how to diagnose and repair Cub Cadet 2518 spindle issues.  Enjoy a smooth,https://lawntrend.com/cub-cadet-2518-problems/?utm_source=pinterest&utm_campaign=cub-cadet-2518-spind,2025-04-28,professional-looking cut. Click for expert advice! #SpindleRepair #CubCadet2518 #LawnMowerFix #DIY,https://lawntrend.com/cub-cadet-2518-problems/
Cub Cadet 2518: Deck Maintenance,https://res.cloudinary.com/dbcpfy04c/image/upload/v1618237451/placeholder.jpg,home-inspiration,,"Keep your cutting deck in top shape! This guide covers cleaning, leveling",https://lawntrend.com/cub-cadet-2518-problems/?utm_source=pinterest&utm_campaign=cub-cadet-2518-deck-,2025-04-28,and repairing your Cub Cadet 2518's deck for a perfect cut every time.  Achieve a professional-looking lawn with ease. Click to learn how! #DeckMaintenance #CubCadet #LawnMower #CuttingDeck,https://lawntrend.com/cub-cadet-2518-problems/
Troubleshooting a Noisy 2518,https://res.cloudinary.com/dbcpfy04c/image/upload/v1618237451/placeholder.jpg,home-inspiration,,Is your Cub Cadet 2518 making strange noises?  Don't ignore them! This pin links to a guide that helps you identify the source of the noise and provides solutions.  From loose parts to engine issues,https://lawntrend.com/cub-cadet-2518-problems/?utm_source=pinterest&utm_campaign=troubleshooting-a-no,2025-04-28,we've got you covered. Click to learn more! #LawnMowerNoise #CubCadetRepair #Troubleshooting #DIY,https://lawntrend.com/cub-cadet-2518-problems/
Cub Cadet 2518: Winterizing Guide,https://res.cloudinary.com/dbcpfy04c/image/upload/v1618237451/placeholder.jpg,home-inspiration,,Prepare your Cub Cadet 2518 for winter storage!  This guide provides a step-by-step walkthrough of winterizing your mower,https://lawntrend.com/cub-cadet-2518-problems/?utm_source=pinterest&utm_campaign=cub-cadet-2518-winte,2025-04-28,ensuring it's ready to go when spring arrives.  Protect your investment and extend its lifespan. Click to learn how! #Winterizing #CubCadet #LawnMowerStorage #OffSeasonCare,https://lawntrend.com/cub-cadet-2518-problems/
Cub Cadet 2518: Common Mistakes,https://res.cloudinary.com/dbcpfy04c/image/upload/v1618237451/placeholder.jpg,home-inspiration,,"Avoid these common mistakes when repairing your Cub Cadet 2518!  This pin links to a guide highlighting pitfalls to avoid, saving you time, money",https://lawntrend.com/cub-cadet-2518-problems/?utm_source=pinterest&utm_campaign=cub-cadet-2518-commo,2025-04-28,and frustration.  Learn from the experts and get the job done right. Click to learn more! #LawnMowerRepair #CubCadet #DIYTips #CommonMistakes,https://lawntrend.com/cub-cadet-2518-problems/
Cub Cadet 2518: Tune-Up Checklist,https://res.cloudinary.com/dbcpfy04c/image/upload/v1618237451/placeholder.jpg,home-inspiration,,"Give your Cub Cadet 2518 a tune-up! This pin links to a comprehensive checklist to ensure optimal performance.  From spark plugs to air filters, we've got you covered. Click for a smoother",https://lawntrend.com/cub-cadet-2518-problems/?utm_source=pinterest&utm_campaign=cub-cadet-2518-tune-,2025-04-28,more efficient mow! #LawnMowerTuneUp #CubCadet #Maintenance #Performance,https://lawntrend.com/cub-cadet-2518-problems/
Cub Cadet 2518: Vibration Issues?,https://res.cloudinary.com/dbcpfy04c/image/upload/v1618237451/placeholder.jpg,home-inspiration,,Experiencing excessive vibration with your Cub Cadet 2518? This guide helps diagnose the cause – from unbalanced blades to worn bearings – and provides solutions.  Enjoy a smoother,https://lawntrend.com/cub-cadet-2518-problems/?utm_source=pinterest&utm_campaign=cub-cadet-2518-vibra,2025-04-28,more comfortable mowing experience. Click to learn more! #LawnMowerVibration #CubCadetRepair #Troubleshooting #DIY,https://lawntrend.com/cub-cadet-2518-problems/
Cub Cadet 2518: Easy Fixes You Can Do,https://res.cloudinary.com/dbcpfy04c/image/upload/v1618237451/placeholder.jpg,home-inspiration,,Don't call a pro for every little issue! This pin highlights easy fixes you can do yourself on your Cub Cadet 2518,https://lawntrend.com/cub-cadet-2518-problems/?utm_source=pinterest&utm_campaign=cub-cadet-2518-easy-,2025-04-28,saving you money and time.  Empower yourself and become a lawn care pro! Click to learn more. #DIYLawnCare #CubCadet #EasyFixes #MowerRepair,https://lawntrend.com/cub-cadet-2518-problems/
